start	end	duration	text
5680	7440	1760	.
7590	9200	1610	Immer mehr ältere Menschen überlegen sich,
9330	11120	1790	frühzeitig den Exit zu nehmen.
11310	13680	2370	Aber steigt somit nicht auch der Druck unserer Gesellschaft
13810	15440	1630	auf alte Menschen, früher zu gehen?
15590	17680	2090	Herr Merki, Sie sind 82, ist das für Sie eine Option?
17800	19480	1680	Das wäre durchaus eine Option,
19640	21520	1880	damit man gehen könnte, wenn man lebensmüde ist
21750	24080	2330	und das Gefühl hat, man habe ein gutes Leben hinter sich.
24270	27680	3410	Ich würde von dieser Option auch Gebrauch machen.
42400	46370	3970	1:1-Untertitelung
46520	50130	3610	"(Offstimme) Heute in der ""Arena"":"
50290	52330	2040	Felix Gmür, Bischof des Bistums Basel.
52430	54210	1780	Er sagt:
54390	56610	2220	Das Leben ist ein Geschenk und kostbar bis zum Schluss.
56810	59530	2720	Organisierten Suizid für gesunde Senioren sollte es nicht geben.
59770	64489.99999999999	4720	Saskia Frei, Präsidentin der Sterbehilfeorganisation Exit,
64620.00000000001	66530	1910	widerspricht:
66730	71250	4520	Die Selbstbestimmung jedes einzelnen ist zentral.
71300	73770	2470	Der Mensch darf selbst entscheiden, wann er sterben will,
73820	75530	1710	egal in welchem Alter.
75680	78010	2330	CVP-Präsident Gerhard Pfister sagt:
78110	80250	2140	Alter und schwere Krankheit
80410	83210.00000000001	2800	darf von der Gesellschaft nicht als Belastung verstanden werden.
83280	86370	3090	Niemand darf unter Druck kommen,
86480	88450	1970	seinem Leben frühzeitig ein Ende zu setzen.
88620	90890	2270	Daniel Jositsch, SP-Ständerat, findet:
91020	93770.00000000001	2750	Wir werden heute älter, als es die Natur vorsieht.
93880	97090	3210	Da muss es auch die Möglichkeit geben, das Leben zu beenden.
97210.00000000001	100530	3320	Als Expertinnen in der Sendung:
100729.99999999999	104890	4160	Die Ethikerinnen Tanja Krones und Ruth Baumann-Hölzle.
105090	108250	3160	Ausserdem diskutieren Zuschauerinnen und Zuschauer im Publikum mit.
108450	111930	3480	"Die ""Arena"", moderiert von Mario Grossniklaus."
112030	117970	5940	Ganz herzlich willkommen, vielen Dank.
118090	122650	4560	Herzlich willkommen,
122850	124650	1800	meine Damen und Herren zu Hause vor dem Fernseher,
124780	126490	1710	aber auch im Studio,
126600	129250	2650	zu einem spannenden Fernsehabend, zu einem heiklen Thema.
129350	132250	2900	Das Thema, dass wir diskutieren, ist die Sterbehilfe.
132390	135570	3180	Der Basler Bischof, Felix Gmür, hat heute Mittag gesagt:
135700	137730	2030	"""Sterbehilfe, das geht nicht."
137900	141450	3550	Sterbehilfe bei alten, aber gesunden Menschen,
141560	144210	2650	"das geht überhaupt nicht."""
144310	146970	2660	Sie haben vorher Herrn Merki gehört.
147210	150450	3240	Herr Bischof, darf er diese Option, zu gehen, wann er will, nicht haben?
150620	153170.00000000003	2550	Es geht nicht um dürfen oder verbieten, sondern darum,
153270	155970	2700	was für eine Gesellschaft wir sind, was für ein Staat.
156050	158490	2440	Ist es normal, wenn jemand findet,
158640	161210	2570	er habe genug gelebt und möchte sterben,
161380	164170.00000000003	2790	und die Menschen im Umfeld finden, das sei in Ordnung.
164270	166410	2140	Ich finde das nicht normal.
166650	171290	4640	Deshalb lanciere ich dieses Thema zusammen mit der Bischofskonferenz.
171510	174490	2980	Was haben wir für eine Gesellschaft, was wollen wir?
174670.00000000003	176730	2060	Wollen wir leben oder wollen wir sterben?
176890	179210	2320	Für Sie ist es definitiv keine Option,
179400	181010	1610	Sie sehen das bestimmt anders, Frau Frei?
181130	183450	2320	Das sehe ich anders.
183690	186970	3280	Es ist genau so, wie es einleitend gesagt wurde:
187170	189890	2720	Viele unserer über 101'000 Mitglieder
190130	191770	1640	sind bei uns Mitglied,
191930	195730	3800	nicht, weil sie auf jeden Fall mit EXIT aus dem Leben scheiden wollen,
195830	199890	4060	sondern die meisten kommen zu uns, weil sie die Option haben wollen.
200090	204170.00000000003	4080	Falls es nicht mehr anders geht, wollen sie diese Option haben.
204370	209130	4760	So wie Sie es formuliert haben, hat das locker und flockig geklungen.
209350	213090	3740	"So quasi: ""Heute reicht's mir, morgen soll sich etwas ändern."""
213170.00000000003	215130	1960	So ist es natürlich nicht.
215310	217570	2260	Wer sich jemals ernsthaft mit Menschen auseinandergesetzt hat,
217740	220530	2790	die diesen Schritt in Erwägung ziehen,
220640	222770	2130	der weiss, es braucht unendlich viel,
222880	229250	6370	bis ein Mensch aus Überzeugung sagt:
229480	233090	3610	"""Jetzt ist der Moment gekommen, jetzt möchte ich nicht mehr."""
233200	234850	1650	Das entscheidet man
235010	237570	2560	nicht leichtfertig von einem Tag auf den anderen.
237720	240650	2930	Herr Pfister, hat denn nicht jeder und jede das Recht,
240730	243010	2280	zu gehen wenn sie möchten?
243210	247760	4550	Es gibt da eine politische und eine persönliche Dimension.
247940	251160	3220	Persönlich würde ich sagen, das muss in unserer Gesellschaft
251260	254240	2980	jeder selbst entscheiden können und dürfen.
254400	257200	2800	Als Politiker aber ist auch die Frage wichtig,
257300	260279.99999999997	2980	welche Folgen dies für die ganze Gesellschaft hat.
260470.00000000003	264040	3570	Diese beiden Dimensionen muss man auseinanderhalten.
264170	266600	2430	In unsere Gesellschaft
266710	269080	2370	muss man einen solchen Entscheid respektieren.
269170	273120	3950	Ich bin überzeugt, dass sich niemand diesen Entscheid leicht macht.
273230	275720	2490	Trotzdem muss man aufpassen,
275930	280280	4350	wie die Gesellschaft mit Sterben, dem Tod und auch Alter umgeht.
280400	283840.00000000006	3440	Dort hat es eine politische Dimension, die man diskutieren muss.
283920	286080	2160	Eine politische Dimension,
286330	288040	1710	aber bestimmt auch eine gesellschaftliche.
288180	290200	2020	Daniel Jositsch,
290400	294200	3800	steigt auch einfach der Druck auf alte Menschen, zu sagen:
294210	296280	2070	"""Jetzt gehe ich."""
296450	299280	2830	Ich glaube nicht, dass es mit Druck zu tun hat.
299370	302360	2990	Dafür ist die Diskussion zu ernsthaft
302560	305320	2760	und wir leben nicht in einer Gesellschaft, in der man sagt,
305570	308320	2750	jeder, der nicht gerade im Erwerbsprozess ist,
308400	311040	2640	soll dieses Leben verlassen.
311240	313200	1960	Es wäre auch zynisch, dies anzunehmen.
313360	315280	1920	Wie bereits gesagt,
315380	318440	3060	ist es ein sehr tiefschürfender Entscheid,
318540	322120	3580	der nicht leichtfertig gefasst wird.
322210	324360	2150	Es muss gewährleistet werden,
324560	326720	2160	dass er nicht leichtfertig gefasst wird.
326840	329960	3120	Aber es muss eine Option sein, in einer modernen Gesellschaft,
330050	332120	2070	wenn Personen in Situationen kommen,
332310	335760	3450	wie eine schwere Krankheit, ein schweres Leiden,
335909.99999999994	339360	3450	dann muss das eine Option sein, die der Mensch haben muss.
339630	343080	3450	Sie sagen also, der Druck steige nicht unbedingt.
343170	346680	3510	Aber es ist eine Tatsache: Menschen werden immer älter
346880	349400	2520	und somit steigen auch die Gesundheitskosten.
349600	352480	2880	Sehen wir uns einen kurzen Film dazu an.
353320	355200	1880	Noch Anfang der 1980er Jahre
355350	357560	2210	lag in der Schweiz die Lebenserwartung bei Geburt
357650	361560	3910	durchschnittlich bei 76 Jahren. Heute bei 83 Jahren.
361750	365320	3570	Je besser die Medizin wird, desto älter werden auch die Menschen.
365530	367880	2350	Viele von ihnen können ab einem gewissen Zeitpunkt
368020	370120	2100	nicht mehr alleine zu Hause leben
370210	372800	2590	und müssen in ein Alters- oder Pflegeheim.
372970	375160	2190	Doch Pflegeheime sind teuer.
375270	378520	3250	Der Aufenthalt von Seniorinnen und Senioren in solchen Institutionen
378590	383640	5050	kostete 2014 rund 12.3 Mrd.
383800	386000	2200	Steigt damit auch der Druck auf alte Menschen,
386090	389680	3590	früher aus dem Leben zu scheiden?
389770	391880	2110	Die Diskussion nach dem Druck ist lanciert.
392170	395200	3030	Frau Frei, wie erleben Sie das bei EXIT, steigt der Druck?
395310	397440	2130	Wir leben eigentlich das Gegenteil.
397590.00000000006	402720	5130	Wir erleben sehr aufgeklärte, ältere, selbstbewusste Menschen,
402840.00000000006	405600	2760	die schon viel Zeit damit verbracht haben,
405800	411200	5400	mit den Angehörigen und sich selbst über das Thema zu sprechen,
411220	413320	2100	bevor sie zu uns kommen.
413490	415360	1870	Das ist für uns auch wichtig.
415420	417400	1980	Wir wollen die Angehörigen, wo immer möglich,
417570	419159.99999999994	1590	in diesen Entscheid einbeziehen.
419320	421080	1760	Und ich kann Ihnen sagen,
421240	423760	2520	die Kosten stehen für alte Menschen nicht im Vordergrund,
423970	426040	2070	wenn sie sich zu diesem Entscheid durchringen.
426240	429800	3560	Im Gegenteil, wir leben Menschen, die sagen,
429890	433600	3710	sie hätten ihr ganzes Leben lang
433740	435880	2140	Steuern und hohe Krankenkassenprämien bezahlt.
436080	438400	2320	Wenn das Altersheim eine Option ist, wenn sie das möchten,
438560	441240	2680	dann wählen sie diesen Schritt. Die Kosten sind kein Thema.
441260	443160	1900	Herr Bischof, wie sehen Sie das?
443280	445360	2080	Ich weiss nicht, mit welchen Personen Sie sprechen,
445450	447400	1950	ich habe vielleicht mit anderen Menschen zu tun.
447490	449160	1670	Ich merke, dass der Druck steigt.
449240	451040	1800	Vielleicht nicht der Druck
451130	453080	1950	von Kindern oder Angehörigen auf ihre Eltern,
453250	455880	2630	sondern der empfundene Druck von gewissen Leuten,
456130	461000	4870	die meinen, sie seien zu teuer, die meinen, sie seien eine Belastung
461140	463400	2260	und die denken,
463570	466400	2830	dass dies als Entlastung der Gesellschaft oder einer Familie
466510	468240	1730	eine gute Option sei.
468360	470320	1960	* Signalton *
470450	472280	1830	Wir haben bereits einen ersten Einspruch
472440	474920	2480	von unserer Medizinethikerin Tanja Krones, bitte.
475090.00000000006	478560	3470	Es wird immer gesagt, dass die Gesundheitskosten steigen,
478720	480680	1960	weil wir eine alternde Gesellschaft sind.
480890	482720	1830	Jeder stirbt nur einmal
482890	486160	3270	und man weiss gesundheitsökonomisch, dass der junge Tod viel teurer ist.
486280	488480	2200	D.h., wenn man als junger Mensch stirbt,
488590	492080	3490	wird viel mehr gemacht, als wenn man als alter Mensch stirbt.
492290	494000	1710	Diese einfache Geschichte,
494200	496440	2240	dass alte Menschen für die Gesellschaft teuer seien,
496550	498400	1850	das stimmt so nicht.
498480	500600	2120	Da sitzen jetzt natürlich zwei Medizinethikerinnen,
500690	502400	1710	und zwar aus einem Grund:
502570	504400	1830	Sie sind sich nicht immer ganz einig,
504490	506280	1790	wenn es um diese Fragen geht.
506410	508560	2150	Frau Baumann, wie sehen Sie das?
508790	511040	2250	Das mit den Gesundheitskosten stimmt natürlich,
511210	513280	2070	das teuerste Lebensjahr ist das letzte.
513370	516840.00000000006	3470	Egal ob jung oder alt.
516970	519280	2310	Die andere Frage aber ist,
519460.00000000006	521799.99999999994	2340	in was für einer Gesellschaft wir leben wollen
522010	523720	1710	und welche Rahmenbedingungen es braucht,
523909.99999999994	525880	1970	damit der Mensch überhaupt frei entscheiden kann.
526130	528800	2670	Ich bin selbst oft in Rehabilitationskliniken tätig.
528960	533320	4360	Dort setzen wir uns oft mit der Frage nach Suizidbeihilfe
533550	537160	3610	und dem Wunsch zu Sterben auseinander.
537290	539640	2350	Wenn dann plötzlich Eigenschaften aufgezählt werden,
539720	541480	1760	in denen man nicht mehr leben möchte,
541650	543520	1870	wie z.B. ins Pflegeheim zu kommen
543730	545880	2150	und die Menschen dann in einem Pflegeheim sind,
546130	549880	3750	denn wird ihre Art zu leben infrage gestellt.
550130	551840	1710	Das ist das Problem,
551990	554920	2930	es wird von aussen her eine Lebensform diskriminiert.
555170	558320	3150	Man soll nicht ins Pflegeheim, nicht ins Altersheim.
558430	563160	4730	Viele von uns kennen die Institutionen von aussen
563180	565320	2140	oder vielleicht durch einem Besuch.
565430	568160	2730	Aber wenige kennen sie von innen oder nehmen daran teil.
568210	571160	2950	Was es bedeutet, wenn man dort drinnen leben muss,
571280	573520	2240	weil es nicht anders geht
573680	576160	2480	und wenn man dann von der Gesellschaft gefragt wird,
576320	579040	2720	ob das Leben so überhaupt noch einen Sinn hat,
579120	582520	3400	wird es sehr schwierig.
582730	585320	2590	Es nimmt mich natürlich Wunder, wie das in der Praxis aussieht.
585550	587760	2210	Lucian Jost, Sie sind Pflegefachmann,
587930	589920	1990	erleben Sie das so, wie wir es eben gehört haben?
590130	594200	4070	Ich erlebe das natürlich.
594390	596760	2370	Die Lebensqualität
596940	601680	4740	wird von den Menschen ganz unterschiedlich definiert.
601820	606080	4260	Wir arbeiten nach dem Konzept der palliativ Care,
606200	609320	3120	mit der wir viel auffangen können.
609520	611840	2320	So können wir die Leute im Sterbeprozess begleiten.
612000	614920	2920	Ich fände es aber sehr wichtig, dass es eine Möglichkeit gibt,
615040	617400	2360	dass die Leute eine Abkürzung wählen können
617560	622160	4600	und sich bewusst dafür entscheiden können, den Leidensweg abzukürzen.
622360	625280	2920	Sie sind sehr nahe an diesen Leuten, wenn es ums Sterben geht.
625460	628120	2660	Sprechen wir nochmals über den Druck,
628210	631600	3390	erleben Sie den in der Realität?
631800	638080	6280	Was häufig kommt, sind Wünsche im Alltag.
638340	640040	1700	Können Sie mir nicht helfen, zu sterben?
640230	641880	1650	Können Sie mir ein Medikament geben?
641990	643800	1810	Können Sie mir etwas spritzen?
643890	645840	1950	Da gibt es ein klares Vorgehen,
646000	648920	2920	das von gewissen Organisationen vorgegeben ist.
649060	654800	5740	Wir nehmen das auf, können die Leute aber darin nicht unterstützen.
654920	657720	2800	"""Geben Sie mir ein Medikament."""
657930	662560	4630	Walter Meili, Sie sind Psychiater, ist es effektiv so,
662660	665240	2580	dass die alten Leute plötzlich denken,
665370	670560	5190	sie könnten vom Arzt etwas erhalten, um zu sterben?
670760	674920	4160	Ich habe persönlich wenig mit alten Leuten mit diesem Wunsch zu tun.
675010	677160	2150	Ich habe eher mit Menschen zu tun,
677240	679800	2560	die aus einer Depression heraus an Suizid denken.
679990	683040	3050	Was ich dem jungen Herren aber sagen kann, ist,
683240	687280	4040	dass bekannt ist, dass der Sterbewunsch sehr volatil ist.
687380	692400	5020	D.h., er kann heute hier sein und morgen wieder verschwunden sein.
692630	697520	4890	Je nach Tagesform, nach Erlebtem,
697670	700920	3250	vielleicht erlebte man eine Enttäuschung von einem Angehörigen,
701010	703520	2510	vielleicht hat man gerade Schmerzen.
703690	708480	4790	Der Sterbewunsch ist immer ein Signal, ein Hilfeschrei.
708760	711240	2480	Ich finde das sehr verkürzt, wenn man sagt,
711370	714720	3350	dass ein alter Mensch den Arzt um eine Tablette bittet,
714930	717160	2230	und ihm diese dann auch gegeben wird.
717290	719920	2630	Denn es ist viel komplexer.
720000	723000	3000	Mich macht das traurig und wütend,
723110	728240	5130	die einfache Gleichung herzustellen:
728380	730760	2380	Sterbewunsch, also will der Mensch sterben.
730960	733840	2880	Er ist schliesslich autonom, man muss es ihm ermöglichen.
734020	738720	4700	Herr Jost hat die Stirn gerunzelt, wieso?
738860	743520	4660	Ich habe es nicht ganz verstanden.
743790	748920	5130	Wenn uns jemand nach einem Medikament fragt,
749150	751880	2730	löst das bei uns auch etwas aus. Wir hinterfragen das.
752050	756640	4590	Ich bin absolut nicht der Meinung, dass wir dann Tabletten verteilt
756810	759000	2190	und wer gehen will, kann gehen.
759210	762640	3430	Sterben ist ein Prozess, ein sehr wichtiger.
762890	766240	3350	Und das darf bestimmt nicht überstürzt geschehen.
766320	768480	2160	Man braucht mehrere Gespräche,
768600	770920	2320	aber man soll sich dafür entscheiden dürfen.
771020	773800	2780	Peter Burri ist auch im Studio,
774000	779480	5480	von Pro Senectute, der Organisation für ältere Menschen.
779560	784200	4640	Sie haben viel Kontakt zu älteren Menschen. Wie erleben Sie das?
784280	787040	2760	Gibt es vielleicht doch Menschen, die finden,
787130	789240	2110	es besteht ein Druck aus der Gesellschaft?
789380	792320	2940	Oder machen sie sich den Druck vielleicht selbst?
792460	794680	2220	Grundsätzlich möchte ich festhalten,
794840	797560	2720	dass nicht alle alten Menschen im Altersheim sind.
797810	800240	2430	Das ist ein kleiner Teil der alten Menschen der Schweiz
800470	804360	3890	und wird in Zukunft proportional nicht so wachsen,
804520	808920	4400	wie der Teil von Menschen, die zu Hause alt werden und sterben.
809080	812160	3080	Da muss man grundsätzlich differenzieren.
812290	815320	3030	EXIT ist nicht gleich Altersheim.
815500	820800	5300	Wir haben 130 Beratungsstellen in der ganzen Schweiz
820960	823920	2960	und dort können wir nicht sagen, dass der Druck ansteigt.
824090	826560	2470	Aber wir merken, dass eine Verunsicherung besteht.
826650	828720	2070	Diese basiert darauf:
828890	831160	2270	Was kann ich machen? Was muss ich machen?
831220	834480	3260	Wir haben seit 2013 das neue Erwachsenenschutzgesetz.
834710	838480	3770	Da kann viel geregelt werden mit Patientenverfügungen usw.
838620	843400	4780	Da bemerken wir, dass die Leute oft auf unsere Hilfe angewiesen sind,
843510	846760	3250	dass man sie begleitet in dem, was man selbst entscheiden kann.
846920	852640	5720	Der Druck ist noch nicht latent da, aber er könnte wachsen.
852800	855000	2200	Wir merken aber eine grosse Verunsicherung.
855170	857240	2070	Der Druck könnte wachsen, sagen Sie.
857450	860160	2710	Frau Frei, es könnte ja auch ein subtiler Druck bestehen,
860240	862400	2160	von der Familie aus, dass gesagt wird:
862520	866480	3960	Papa, Mama, möchtest du nicht ...?
866730	869040	2310	Wenn Sie gestern Abend die Radiosendung gehört hätten,
869260	874840	5580	zum Thema wie Angehörige mit dem Exit ihrer Mitmenschen umgehen,
875090	877080	1990	dann hätten sie das Gegenteil gehört.
877170	879080	1910	Es ist eben nicht so,
879170	882880	3710	dass Angehörige das anders sehen oder einen subtilen Druck aufbauen.
883050	890570	7520	Sie haben recht, wenn sie sagen, dass eine Verunsicherung besteht.
890770	893890	3120	Ich merke immer wieder, dass die Leute zu wenig wissen.
894000	897700	3700	Es fehlt an Informationen,
897870	902020	4150	was man in einer Patientenverfügung schreiben darf,
902240	907700	5460	was im Vorsorgeauftrag stehen darf, was für Voraussetzungen es braucht,
907840	911420	3580	um einen Freitod in Anspruch nehmen zu  k ö n n e n.
911530	913780	2250	All diese Stichworte, die wir kennen,
914010	916140	2130	Urteilsfähigkeit, der autonome Entscheid,
916270	918380	2110	der wohlerwogene Entscheid ...
918510	920540	2030	Da möchte ich Ihnen widersprechen.
920760	925540	4780	Es ist nicht so, dass die Leute heute so und morgen anders denken.
925690	927660	1970	Natürlich gibt es die,
927770	930300	2530	aber für eine Freitodbegleitung kommen die nicht infrage.
930430	932780	2350	Es geht hier um einen konstanten Sterbewunsch,
933050	934870	1820	um einen dauerhaften Sterbewunsch,
935080	937950	2870	um Personen, die ihre Entscheidungen abgebogen haben.
938070	939910	1840	Das sind Leute,
940080	943870	3790	die überhaupt theoretisch für so ein Thema infrage kommen.
943950	947430	3480	Es geht nicht um Schnellschüsse,
947560	950710	3150	wenn es heute nicht gut geht, morgen den Schritt zu erwägen.
950810	952830	2020	Was mir ganz wichtig ist:
952990	957190	4200	Wir müssen lernen, dass wir alte Menschen nicht bevormunden.
957190	959510	2320	Auch wenn es noch so wohlgemeint ist.
959660	962310	2650	Wenn wir das Gefühl haben, wir wissen am besten,
962450	966070	3620	was die alten Menschen wollen oder sollten oder müssten,
966160	968750	2590	dann massen wir uns etwas an.
968880	970750	1870	Diese Zeiten sind vorbei,
970910	974550	3640	vielleicht durfte man das früher in der paternalistischen Medizin.
974670	976950	2280	Aber heute,
977110	979790	2680	wenn eine andere Generation ins AHV-Alter kommt,
980010	983590	3580	die 68er, die gelernt haben, selbstständig zu leben,
983690	988150	4460	selbstständig den Beruf zu wählen, selbständig den Partner zu wählen,
988240	990950	2710	selbst zu entscheiden, ob sie Kinder wollen,
991160	994270	3110	die lassen sich in der letzten Lebensphase
994270	996430	2160	diesen Entscheid nicht nehmen.
996550	998590	2040	Egal ob man sagt,
998700	1001470	2770	die Kirche sagt etwas anderes oder der Arzt macht auch nicht mit.
1001610	1004430	2820	Herr Bischof.
1004630	1007750	3120	Natürlich soll man die Leute nicht bevormunden.
1007860	1010830	2970	Aber es ist subtil.
1010970	1013230	2260	Herr Jost hat es gesagt,
1013490	1015710	2220	manchmal sind die Menschen so, manchmal anders.
1015850	1018390	2540	Es gibt Stimmungsschwankungen, es geht auf und ab.
1018560	1022150	3590	Das bedeutet, dass es nicht ein autonomer Entscheid ist.
1022330	1028390.0000000001	6060	Denn der sog. autonome Entscheid ist abhängig von Stimmungsschwankungen,
1028599.9999999999	1032839.9999999999	4240	von der Umgebung, der Gesundheit, den Gefühlen, den Erwartungen,
1032990	1035520	2530	den Hoffnungen, den Schmerzen usw.
1035609.9999999999	1037720	2110	* Signalton *
1037819.9999999999	1040560	2740	Da gibt es definitiv einen Einspruch von Frau Baumann.
1040660.0000000001	1042680.0000000001	2020	Es stellt sich die Frage,
1042849.9999999999	1046079.9999999999	3230	was wir für eine Gesellschaft und welche Rahmenbedingungen wir haben.
1046180.0000000001	1048079.9999999999	1900	Wir haben eine Gesellschaft,
1048170.0000000001	1051560	3390	die immer schneller, effizienter und immer ökonomischer wird.
1051650	1053840	2190	Wenn wir genau hinsehen,
1053950	1056360	2410	wie unabhängig wir in dieser Gesellschaft wirklich sind,
1056580	1058600	2020	um einen freien Entscheid zu treffen ...
1058820	1062560	3740	Selbsttötung ist effizient und kostensparend,
1062700	1065440	2740	von dem her also stark diesem Zeitgeist entsprechend.
1065600	1068040	2440	Die Frage ist, wie wir in dieser Gesellschaft
1068240	1072320	4080	einerseits die Freiheit garantieren, die ich auch unterstütze.
1072480	1075320	2840	Aber andererseits müssen wir Rahmenbedingungen haben,
1075440	1077640	2200	damit die Menschen, die langsam sind,
1077780	1082600	4820	die unbequem sind unter Umständen, die nicht mehr mithalten können,
1082700	1086870	4170	ein gutes Alter haben können,
1087090	1088910	1820	auch wenn sie nicht mehr mitspringen können
1089130	1091390	2260	und nicht mehr die alten, fitten Senioren sind,
1091520	1094790	3270	sondern dann halt etwas kosten.
1094940	1098590	3650	Pflegeheime z.B. kosten wirklich sehr viel Geld.
1098760	1101470	2710	Ich höre das viel, dass Menschen sagen,
1101580	1106430	4850	sie möchten nicht das Haus verkaufen müssen, um ins Pflegeheim zu gehen,
1106620	1110110	3490	weil die Kinder das Haus erben sollen.
1110240	1112950	2710	Das ist nicht einfach aus der Luft gegriffen
1113060	1117230	4170	Diese Frage müssen wir uns stellen.
1117380	1119030	1650	Wie können wir in unserer Gesellschaft
1119160	1120910	1750	Situationen schaffen,
1121070	1123270	2200	damit die Menschen wirklich frei entscheiden können.
1123450	1125590	2140	Das setzt aber auch voraus, dass wir bereit sind,
1125820	1128150	2330	die Langsamen, die Schwermütigen trotzdem mitzutragen.
1128410	1131590	3180	Das ist das Spannungsfeld und auch oft das ethische Dilemma.
1131690	1133710	2020	Gibt es aber doch einen Druck?
1133850	1135590	1740	(Saskia Frei) Das machen wir auch.
1135690	1137870	2180	Ich nehme jetzt ein Beispiel.
1137980	1141870	3890	Für unsere behinderten Mitmenschen
1141950	1144230	2280	haben wir noch nie so viele Möglichkeiten geschaffen,
1144330	1146150	1820	wie jetzt vorhanden sind.
1146380	1149070	2690	Das gab es noch nie in dieser Zeit. Das ist auch richtig so.
1149180	1151110	1930	Wir haben auch noch nie darauf geachtet,
1151220	1153430	2210	dass an dem Wohlstand, in dem wir leben,
1153570	1156310	2740	so viele wie möglich teilnehmen können.
1156490	1160750	4260	Es ging unseren älteren Menschen materiell gesehen noch nie so gut.
1160910	1167150	6240	Natürlich nicht jedem und jeder, aber der grossen Mehrheit.
1167250	1170710	3460	Das Pflegeheim ist teuer.
1170830	1174270	3440	Wenn sich jemand das nicht leisten kann,
1174340	1177990	3650	erhalten sie zu recht auch Ergänzungsleistungen,
1178180	1181150	2970	und Krankenkassenzuschüsse, das muss so sein.
1181230	1184950	3720	Als eines der reichsten Länder der Welt müssen wir
1185060	1188750	3690	einen fairen, anständigen Umgang mit allen Schwachen leisten können.
1188850	1197910	9060	Herr Pfister, Sie haben das Wort.
1198010	1202470	4460	Völlig einverstanden, aber, wir haben darüber diskutiert,
1202550	1204830	2280	ob ein gesellschaftlicher Druck existiert oder nicht.
1204970	1207110	2140	Ich denke, es gibt einen.
1207310	1211070	3760	Wie Frau Baumann richtig gesagt hat, sind wir eine Leistungsgesellschaft.
1211160	1213190	2030	Wir sind eine Gesellschaft,
1213330	1215910	2580	die v.a. jene Menschen positiv beurteilt,
1216140	1221760	5620	die ihrer Leistung erbringen können, die keine Beeinträchtigungen haben.
1221850	1226240	4390	Wir sind eine Gesellschaft, die Mühe hat im Umgang mit dem Alter.
1226270	1228600	2330	Wenn dem nicht so wäre,
1228760	1232520	3760	würden Krankenkassen nicht von schlechten Risiken sprechen.
1232660	1235720	3060	Schlechte Risiken sind aus der Sicht von Krankenkassen
1235830	1237800	1970	ökonomische Risiken,
1237980	1240920	2940	d.h. Leute, die viel kosten, wenn sie beeinträchtigt sind.
1241100	1247720	6620	Was Sie richtig sagen, jeder muss das mit sich selber ausmachen.
