start	end	duration	text
2509530	2513700	4170	Und trotzdem gibt es einfach Leute, die sagen,
2513810	2517460	3650	dass dieser Weg für Sie nicht infrage kommt.
2517660	2520100	2440	Sie wissen nicht, was sie dort sollen.
2520340	2525340	5000	Ich sage das nicht nur theoretisch, weil ich Präsidentin von EXIT bin.
2525510	2528340	2830	Ich habe meine Mutter zehn Jahre lang begleitet,
2528410	2530460	2050	sie erkrankte an Alzheimer.
2530700	2532940	2240	Sie war ein wenig älter, als ich heute bin.
2533020	2535860	2840	Es war ein langer Prozess, wir haben viel erlebt.
2536040	2540340	4300	Am Ende musste sie noch drei Jahre im Pflegeheim sein.
2540500	2544180	3680	Sie konnte nicht mehr reden, nicht mehr laufen, kannte uns nicht mehr.
2544270	2548180	3910	Sie wurde sehr gut betreut, aber sie hatte auch Glück,
2548410	2552820	4410	dass sie auch Kinder hatte, die immer wieder kamen,
2553000	2556270	3270	und zwar unregelmässig. Das sagte auch mein Bruder.
2556410	2558470	2060	Wenn man keine Angehörigen mehr hat,
2558700	2560710	2010	dann wird man je nachdem am Nachmittag
2560820	2563670	2850	nicht mehr aus dem Bett geholt, weil die Zeit nicht mehr reicht.
2563850	2566390	2540	Wenn jemand krank ist vom Personal oder ein Notfall ist,
2566510	2568670	2160	dann bleibt es nach dem Mittagsschlaf dabei,
2568770	2571760	2990	dass man im Bett bleibt. Das haben wir ein paar Mal gesehen.
2571860	2575080	3220	Es ist sehr gut, dass Sie sehr viele eigene Erfahrungen haben.
2575160	2577320	2160	Ich möchte das für mich aber nicht erleben.
2577460	2579600	2140	Frau Frei, wir haben vorhin angefangen,
2579730	2582920	3190	über Selbstbestimmung zu sprechen.
2583140	2585560	2420	Wir haben bisher sehr viel über Sterbehilfe gesprochen.
2585690	2588680	2990	Aber Sterbehilfe ist eben nicht gleich Sterbehilfe.
2590560	2592840	2280	Es gibt verschiedene Formen von Sterbehilfe.
2593060	2595920	2860	Nicht alle sind in der Schweiz gleichermassen erlaubt.
2596080	2598840	2760	Bei der aktiven Sterbehilfe wird der Tod aktiv herbeigeführt,
2598960	2600800	1840	etwa durch eine Spritze.
2601020	2603320	2300	Verabreicht beispielsweise durch einen Arzt.
2603340	2605680	2340	Das ist in der Schweiz verboten.
2605780	2607820	2040	Passive Sterbehilfe ist es,
2607970	2610460	2490	wenn lebensverlängernde Massnahmen gestoppt werden.
2610690	2613340	2650	Die Nahrungszufuhr z.B. wird unterbrochen.
2613440	2618340	4900	Dazu gibt es in der Schweiz kein Gesetz, es ist also erlaubt.
2618540	2622980	4440	Schliesslich gibt es den sog. assistierten Suizid.
2623180	2625340	2160	Hier nimmt sich eine Person selbst das Leben.
2625490	2628020	2530	Sie nimmt die tödliche Substanz selbst ein,
2628130	2630300	2170	und wird dabei oftmals
2630430	2632980	2550	durch eine Sterbehilfeorganisation wie EXIT begleitet.
2633100	2636140	3040	Auch das ist erlaubt.
2636860	2641820	4960	2014 sind 742 in der Schweiz wohnhafte Personen so gestorben,
2642020	2646100	4080	etwa jeder 100. Todesfall.
2647720	2650660	2940	Herr Pfister, Selbstbestimmung
2650820	2655580	4760	scheint ein unglaubliches Bedürfnis zu sein unserer Gesellschaft.
2655710	2657780	2070	Zu Recht. Absolut zu Recht.
2657860	2660260	2400	Noch einmal:
2660420	2663740	3320	Was man selbst für gut und richtig hält, ist das eine,
2663820	2668420	4600	was man als Politiker zulässt oder befürwortet oder reguliert,
2668560	2670820	2260	ist das andere.
2670980	2674780	3800	Ich bin der Meinung, dass die Selbstbestimmung in diesem Bereich
2674890	2678220	3330	zu schützen und hochzuhalten ist.
2678370	2681780	3410	Es ist die Frage, wer wem bei dieser Selbstbestimmung helfen darf,
2681890	2684060	2170	und unter welchen Bedingungen.
2684270	2686820	2550	Da habe ich eine andere Auffassung als Frau Frei.
2686970	2692900	5930	Ich möchte aber schon schnell auf das eingehen, was Herr Märki sagte.
2693130	2696900	3770	In diesem ausserordentlich tragischen Fall
2697000	2699820	2820	sehe ich einen Auftrag an die Gesellschaft,
2699970	2703060	3090	aber auch an die Politik, dass wir alles tun,
2703170	2707660	4490	damit ein Eintritt in ein Pflegeheim kein Grund ist,
2707820	2712780	4960	sich umbringen zu müssen - sofern ich das richtig verstanden habe.
2712960	2716580	3620	Da ist die Familie gefordert - wenn es sie noch gibt -,
2716660	2720100	3440	dass die Gesellschaft gefordert, da ist die Politik gefordert,
2720270	2724860	4590	um die Bedingungen im Pflegeheim so zu gestalten,
2725060	2727140	2080	damit so etwas nun tatsächlich kein Grund ist,
2727220	2730980	3760	um aus dem Leben treten zu müssen.
2731130	2733100	1970	D.h. der vermutlich auch, dass die Menschen dort
2733290	2735180	1890	viel zu wenig integriert sind in den Pflegeheimen.
2735350	2737140	1790	Müsste man dort konkret etwas ändern?
2737290	2740620	3330	Ich glaube, es ist eine irrsinnige Herausforderung.
2740730	2742700	1970	Wir haben genug Experten hier.
2742930	2745380	2450	Sie wissen besser, welch immense Herausforderungen das sind.
2745480	2747220	1740	In der Gesellschaft, in der Schweiz,
2747350	2749180	1830	haben wir enorme Fortschritte gemacht.
2749290	2751460	2170	Es ist eine unglaubliche Schwierigkeit,
2751640	2754140	2500	bei pflegebedürftigen, älteren Menschen,
2754330	2758260	3930	bei Personalknappheit, bei finanzieller Knappheit,
2758390	2761820	3430	dort jedem einzelnen Menschen in seiner schwierigen Situation
2761910	2763860	1950	gerecht zu werden. Das sehe ich ein.
2764090	2766540	2450	Aber ich glaube, wir müssen wirklich das Ziel haben,
2766640	2771940	5300	dass der Eintritt in ein Pflegeheim nicht alleine der Grund dafür ist,
2772100	2777420	5320	dass jemand glaubt, er müsse nicht mehr auf dieser Welt sein.
2777680	2780420	2740	(Daniel Jositsch) Das ist ein wichtiger Punkt in der Diskussion.
2780620	2782660	2040	Ich halte das für zentral.
2782740	2785900	3160	Es wurde auch schon erwähnt,
2786040	2788420	2380	und da muss ich Ihnen widersprechen, Herr Gmür.
2788650	2791620	2970	Sie sagten, wer Selbstmord machen wolle, mache Selbstmord.
2791820	2794940	3120	Es ist aber tatsächlich so, dass ein Grossteil der Menschen
2795030	2799190	4160	nicht den konstanten Wunsch hat, sich umzubringen.
2799330	2804070	4740	Deshalb glaube ich, dass es wichtig ist, dort zu schauen ...
2804270	2807390	3120	Diejenigen, die wirklich diesen Wunsch haben,
2807500	2811270	3770	und letztlich bei EXIT sind - um die habe ich auch keine Angst,
2811450	2814830	3380	denn das wird wirklich geprüft. Dort liegt nicht das Problem.
2814940	2818870	3930	Denn das Problem liegt eher bei Reflextaten,
2819020	2821190	2170	Menschen, die aus einer Situation heraus etwas tun.
2821280	2822950	1670	Und wenn Sie dann einfach sagen,
2823160	2825310	2150	dass sich diese Menschen sowieso erschiessen würden -
2825440	2827510	2070	das ist eben der Punkt, wo wir hinschauen sollten.
2827640	2829390	1750	Wir müssen uns um Leute kümmern,
2829530	2831550	2020	die vielleicht in einer verzweifelten Situation sind,
2831690	2833320	1630	die in einer Depression sind.
2833510	2836200	2690	Ich möchte aber auch daran erinnern, dass sich viele junge Menschen
2836270	2838840	2570	aufgrund irgendeiner schwierigen Situation das Leben nehmen -
2838950	2841920	2970	wegen einer enttäuschte Liebe, Pro- blemen im Studium oder in der Schule.
2842010	2843730	1720	Ich möchte doch noch erwähnen,
2843930	2845850	1920	dass man schon verschiedentlich gesagt hat -
2846050	2848530	2480	und das wird jetzt auch wieder in den USA diskutiert -,
2848620	2851250	2630	dass man die Schusswaffen aus dem Haushalt entfernen sollte.
2851400	2853610	2210	Denn die Schusswaffe ist genau so ein Instrument,
2853770	2855650	1880	mit dem man sich ohne viel zu überlegen
2855810	2858850	3040	auf relativ einfache Art und Weise das Leben nehmen kann.
2858940	2861370	2430	Das sind Punkte, auf die man achten muss.
2861570	2867210	5640	Dass man in diesem Bereich, bei diesen über 95 %,
2867320	2870730	3410	die keinen konstanten Suizidwunsch haben,
2870940	2872850	1910	dass die Gesellschaft dort eben da ist,
2873010	2876050	3040	um diese Menschen begleiten zu können und davon abzubringen.
2876210	2879050	2840	(Saskia Frei) Wenn Sie das einmal erreichen, dass in den USA
2879140	2882650	3510	die Schusswaffen nicht mehr zu Hause von jedem aufbewahrt werden können,
2882880	2885010	2130	dann haben Sie das Land dann völlig verändert.
2885110	2886850	1740	Das ist eine andere Diskussion.
2887020	2889450	2430	(Daniel Jositsch) Wir versuchen es jetzt erst in der Schweiz,
2889560	2891250	1690	das würde mir schon reichen.
2891410	2893890	2480	(Saskia Frei) Ich möchte auch noch etwas zu den Zahlen sagen.
2894020	2895810	1790	Sie haben jetzt gesehen,
2895890	2899050	3160	dass es knapp 800 assistierte Suizide im Jahr 2014 gab -
2899180	2903730	4550	in der ganzen Schweiz gibt es pro Jahr 64'000 Todesfälle.
2903880	2907330	3450	Diese Menschen sterben an einer Krankheit, wegen eines Unfalls,
2907500	2912650	5150	oder sonst etwas. Das sind also 1.5 % - eine kleine Menge.
2912740	2916210	3470	"Herr Bischof, ""nicht der Rede wert"", sagt Frau Frei."
2916380	2919170	2790	"Nein, nicht ""nicht der Rede wert"", aber die gewaltsamen Suizide,"
2919300	2921250	1950	das, was Sie genannt haben ...
2921380	2924450	3070	Es klang so, als ob es keine Rolle spielen würde,
2924590	2926450	1860	ob jemand dieses Giftmittel trinkt,
2926610	2928570	1960	sich erschiesst oder vor den Zug springt.
2928730	2930690	1960	Das ist natürlich schon nicht ganz das Gleiche.
2930780	2933610	2830	Es seien aber wenige Fallzahlen. - (Felix Gmür) Es ist immer schlimm.
2933820	2936330	2510	(Saskia Frei) Es ist immer schlimm, aber die gewaltsamen Suizide
2936450	2938330	1880	gehen in der Schweiz zurück. Und das ist positiv.
2938490	2940850	2360	(Felix Gmür) Aber es ist auch gewaltsam mit einer Spritze.
2940960	2942570	1610	Das ist eben auch gewaltsam.
2942780	2944650	1870	(Saskia Frei) Es geht eben nicht um die Spritze, es geht um ein Getränk,
2944900	2946450	1550	das man in Wasser auflöst und dann trinkt.
2946660	2948370	1710	(Felix Gmür) Ob Getränk oder Spritze, das ist egal.
2948600	2950530	1930	Das ist alles gewaltsam. - (Saskia Frei) Das sagen Sie.
2950740	2952170	1430	* Signalton *
2952300	2954290	1990	Wir haben einen Einspruch von Tanja Krones. - Gerne.
2954470	2956530	2060	"Der Herr Bischof hat ja schön gesagt: ""unwohl sein"" -"
2956710	2958330	1620	das ist auch bei mir eine Erfahrungsfrage.
2958480	2960130	1650	Jede Art von Sterbehilfe kann gut sein,
2960210	2962930	2720	aus der Sicht derer, die das oft erleben, so wie ich im Unispital.
2963140	2965490	2350	Und jede Art von Sterbehilfe, auch passive Sterbehilfe -
2965570	2968450	2880	wir haben gar nicht darüber gespro- chen, dass das die häufigste ist.
2968530	2971170	2640	Wir haben im Film auch nicht die indirekte Sterbehilfe gesehen,
2971290	2974770	3480	die massiv zugenommen hat. Die sog. palliative Sedierung.
2975000	2977010	2010	Die hat ganz stark zugenommen.
2977090	2980050	2960	Ich finde es ganz wichtig, zu sagen, dass auch passive Sterbehilfe ...
2980220	2982610	2390	Auch auf unserem Kompetenzzentrum, der Palliative Care,
2982740	2984770	2030	haben wir Situationen, wo Menschen sterben,
2984970	2988130	3160	wo ein schrecklicher Tod passiert. Und ich will das auch mal sagen.
2988210	2990370	2160	Es ist nicht so, dass wir so tun,
2990540	2992610	2070	als gäbe es eine gute Form und eine schlechte Form.
2992790	2995050	2260	Es liegt auch daran, welche Erkrankung die Menschen haben.
2995240	2996890	1650	Ich darf vielleicht kurz ein Beispiel machen:
2997080	2999410	2330	Weil es nämlich moralisch oft eine riesige Diskussion ist -
2999600	3002370	2770	das war hier gerade auch so, das eine ist schlecht, das andere gut.
3002450	3004170	1720	Das sehe ich definitiv nicht so,
3004270	3006290	2020	aus ethischer Perspektive kann man es anders sehen.
3006370	3007970	1600	Stellen Sie sich einen Menschen vor,
3008060	3010650	2590	der perspektivisch ganz klar ein unerträgliches Leiden hat.
3010820	3012730	1910	Der Todeszeitpunkt ist noch nicht absehbar.
3012830	3014610	1780	Man weiss nicht, wie lange es dauert.
3014760	3018170	3410	Der eine, mit dem gleichen Leiden, hat eine Niereninsuffizienz -
3018360	3021490	3130	die Niere funktioniert nicht, er ist in der Dialyse.
3021580	3024450	2870	Es ist überhaupt kein Problem, für diesen Menschen
3024540	3027730	3190	passive Sterbehilfe zu machen, die Dialyse einzustellen.
3027860	3030450	2590	Der Mensch kann palliativ gut begleitet sterben.
3030650	3034530	3880	Der andere, mit dem gleichen Leiden, hat diese Niereninsuffizienz nicht.
3034730	3039050	4320	Und das ist moralisch-ethisch völlig irrelevant. Er hat keine Chance.
3039250	3042010	2760	Er hat keine Chance, bei einem unerträglichen Leiden ...
3042250	3045290	3040	Und ich sage es noch mal, es ist Augenwischerei und nicht in Ordnung,
3045520	3047970	2450	immer so zu tun, als ob man mit Palliativmedizin ...
3048120	3050850	2730	Ich glaube nicht, dass irgendjemand hier gegen Palliativmedizin ist.
3051070	3053050	1980	Die Schweiz ist da definitiv nicht an erster Stelle,
3053170	3054850	1680	wir sind da hinterher.
3055050	3057370	2320	Tut mir leid, das so zu sagen, wir kommen bestimmt noch dazu.
3057530	3059170	1640	Aber nur, um das Argument noch zu beenden:
3059320	3061130	1810	Es sich hier ethisch nicht der Punkt, zu sagen,
3061210	3062890	1680	der eine hat die Chance, zu gehen,
3063050	3065010	1960	und der andere hat auch ein unerträgliches Leiden,
3065250	3066810	1560	aber man hat keine Chance, ihm zu helfen.
3067010	3068570	1560	Es ist wichtig, das auch zu erwähnen.
3068790	3070370	1580	Wobei wir überhaupt nicht
3070530	3072450	1920	über die palliative Sedierung gesprochen haben,
3072610	3075010	2400	obwohl diese viel stärker gestiegen ist aufgrund der Daten,
3075250	3077330	2080	die wir haben - viel stärker als der assistierte Suizid.
3077450	3079170	1720	Ich habe immer das Gefühl, das ist ein Stellvertreterkrieg.
3079300	3081090	1790	Da macht man alles mit, die Ökonomisierung ...
3081260	3083290	2030	So einfach ist es nicht. Die Sedierung, wir sedieren Patienten.
3083440	3085250	1810	20 % der Patienten werden schlafen gelegt.
3085350	3087490	2140	Schlafenlegen kann gut sein, es kann schlecht sein,
3087660	3090290	2630	passive Sterbehilfe kann gut sein, es kann aber auch schlecht sein.
3090450	3093250	2800	Das eine als gute Sterbehilfe zu sehen und das andere als schlechte,
3093480	3095970	2490	das stimmt einfach nicht aus der Perspektive des Patienten.
3096090	3098170	2080	Herr Gmür, gut und schlecht, schwarz und weiss?
3098180	3100290	2110	Nein, das gibt es nicht so.
3100450	3103210	2760	Aber was schlecht ist, ist,
3103390	3109330	5940	wenn der Staat den Wunsch eines Menschen zum Sterben unterstützt.
3109450	3112530	3080	Und zwar unterstützt.
3112610	3115250	2640	Es ist aber gut, wenn jemand ...
3115380	3117730	2350	Sie erwähnten den Fall des Altersheims.
3117910	3122250	4340	Eine ältere Personen möchte sterben, entsprechend isst sie nicht mehr.
3122370	3124290	1920	Dann tut sie das selbst.
3124420	3126970	2550	Aber es kann doch nicht die Aufgabe des Staates sein,
3127050	3129490	2440	es auch noch zu unterstützen und sozusagen zu fördern.
3129640	3133170	3530	Denn wenn die sog. Sterbehilfebegleiterinnen sagen,
3133310	3135930	2620	dass sie jemanden begleiten, dann sagen sie auch:
3136130	3138690	2560	"""Ich bin einverstanden, dass du stirbst."""
3138770	3141530	2760	Aber wenn jemand im Altersheim sagt, er wolle gehen,
3141640	3143610	1970	dann muss man das doch ernst nehmen.
3143720	3145770	2050	Ja, man muss es ernst nehmen.
3145940	3148410	2470	Aber der Staat hat nicht die Aufgabe, das zu unterstützen.
3148630	3150490	1860	(Saskia Frei) Der Staat unterstützt gar nichts.
3150720	3153490	2770	(Felix Gmür) Doch, Sie wollen ja eine Regelung, damit der Staat ...
3153730	3155250	1520	* Sie sprechen durcheinander. *
3155400	3157330	1930	(Daniel Jositsch) Es geht nicht um Unterstützung,
3157480	3159010	1530	schon gar keine staatliche Unterstützung.
3159190	3161210	2020	Der Staat hat wirklich überhaupt nichts damit zu tun.
3161310	3162970	1660	Aber es geht um die Frage,
3163140	3165490	2350	ob das in einer würdevollen Art und Weise passieren kann,
3165690	3169210	3520	oder ob es in einer unwürdigen Art und Weise passieren muss.
3169380	3172490	3110	Wenn ich höre, dass eine Frau sich in einem Altersheim
3172660	3179130	6470	über ein Geländer stürzen muss, um so ihren Wunsch zu erfüllen ...
3179210	3183250	4040	Und das ist z.B. nicht geklärt:
3183470	3186770	3300	Ist das jetzt spontan oder langfristig?
3186880	3188890	2010	Hätte sie zu EXIT gehen können?
3189050	3191090	2040	Hätte man mit ihr mehrere Gespräche geführt,
3191230	3193410	2180	um zu sehen, welches der Grund ist?
3193590	3196450	2860	Hätte man vielleicht geschaut, ob man evtl. etwas anderes machen könnte?
3196590	3199450	2860	Könnte man auf Palliative Care zugreifen? Braucht sie etwas anderes?
3199520	3201610	2090	Ist es einfach eine Depression über eine gewisse Zeit?
3201780	3203410	1630	Das konnte man jetzt alles nicht anschauen.
3203580	3206570	2990	Die Frau hat sich einen Stuhl geholt und ist über das Geländer gesprungen.
3206710	3208490	1780	Ich finde das unwürdig, ich finde das falsch.
3208690	3210410	1720	Das ist das Einzige, was wir beheben wollen.
3210550	3214570	4020	(Felix Gmür) Das finde ich unwürdig und falsch. Richtig.
3214690	3218930	4240	Aber ...
3219140	3222810	3670	Sie wissen nicht, ob die Frau bei EXIT Mitglied war,
3222920	3225810	2890	Sie wissen nicht, ob sie mit einer Ärztin, einem Arzt gesprochen hat,
3225970	3228410	2440	Sie wissen nicht, was an diesem Tag passiert ist.
3228610	3230730	2120	Die Frau hat sich einfach umgebracht.
3230850	3232890	2040	Aber das ist ja nicht die Frage.
3233020	3234690	1670	Natürlich ist das schlimm -
3234890	3237330	2440	jeder Mensch, der sich umbringt, jeder Suizid, ist schlimm.
3237450	3239410	1960	Aber das wird nicht damit gelöst,
3239520	3245010	5490	dass jemand zu mir kommt und sich beim Suizid begleiten lässt.
3245200	3248330	3130	Denn am Ende bringt sich die Person trotzdem um.
3248490	3250490	2000	(Daniel Jositsch) Das meinen Sie eben.
3250650	3253410	2760	Vielleicht können Sie beschreiben, wie es konkret abläuft,
3253590	3256290	2700	aber es gibt eben sehr viele, die vielleicht zu EXIT gehen,
3256410	3258610	2200	weil sie einen Grund haben, aus dem Leben zu scheiden,
3258760	3261850	3090	und aufgrund der Gespräche, aufgrund von alldem, das stattfindet,
3261970	3263810	1840	nehmen die Leute wieder Abstand.
3264000	3266690	2690	Das scheint mir eben auch ein wesentlicher Punkt zu sein.
3266850	3269410	2560	(Saskia Frei) Das ist absolut richtig. Das kommt eben zu kurz.
3269520	3271770	2250	Denn die begleiteten Suizide
3272000	3274410	2410	machen den kleinen Teil unserer Tätigkeit aus.
3274570	3278930	4360	Der allergrösste Teil besteht aus Beratungsgesprächen,
3279010	3280690	1680	die wir mit Menschen führen,
3280860	3282890	2030	die sich in schwierigen Lebenssituationen befinden,
3283020	3284610	1590	die verzweifelt sind.
3284800	3287650	2850	Mit Menschen, die verzweifelt sind, und auch selbstbestimmt handeln.
3287880	3290330	2450	Und jetzt möchte ich zu Herrn Meili gehen, unserem Psychiater.
3290450	3292250	1800	Selbstbestimmt handeln -
3292360	3295570	3210	Sie sagen, das dürfe man nicht über alles setzen.
3295760	3298010	2250	Ich möchte zuerst noch etwas anderes sagen.
3298190	3300850	2660	Frau Frei möchte den Eindruck erwecken,
3300940	3303250	2310	dass es dank EXIT und ähnlichen Organisationen
3303400	3305970	2570	weniger Suizide gibt. Aber das stimmt so nicht.
3306200	3311210	5010	Die Suizide nehmen seit 1980 kontinuierlich ab - bis 2010.
3311280	3314010	2730	Also noch lange, bevor es den begleiteten Suizid gab.
3314100	3318770	4670	(Saskia Frei) Das ist falsch. - Und jetzt flacht die Kurve ab.
3318930	3322530	3600	Es gibt immer noch weniger gewaltsame Suizide.
3322720	3326810	4090	(Daniel Jositsch) Das ist falsch. - Die begleiteten Suizide nehmen zu.
3327000	3330010	3010	Man hört es ganz laut, Herr Jositsch. Sie sagen, das sei falsch.
3330090	3331730	1640	* Sie sprechen durcheinander. *
3331890	3334170	2280	(Daniel Jositsch) Einfach, um bei den Fakten zu bleiben:
3334280	3335930	1650	Das Strafgesetzbuch hat in dieser Form
3336010	3337770	1760	bereits lange vor 2010 so existiert.
3337940	3340770	2830	Es hat sich auf der gesetzlichen Basis überhaupt nichts geändert.
3340870	3343730	2860	Seit Sie auf der Welt sind, hat sich nichts geändert.
3343960	3346490	2530	Aber die Suizide nahmen seit 1980 ab.
3346660	3349570	2910	Das ist schön, aber Sie können es nicht in den Zusammenhang bringen
3349690	3353050	3360	mit der Gesetzesänderung und mit EXIT. - Nein, eben nicht.
3353170	3355050	1880	(Felix Gmür) Er hat es mit den Organisationen
3355220	3357170	1950	in Zusammenhang gebracht, nicht mit dem Gesetz.
3357290	3359050	1760	Frau Frei sagt aber, dass es dank EXIT
3359190	3361330	2140	weniger gewaltsame Suizide gäbe. Das stimmt eben nicht.
3361490	3363050	1560	(Saskia Frei) Doch das stimmt.
3363240	3364770	1530	Denn die gewaltsamen Suizide - das ist,
3364920	3367850	2930	wenn sich jemand vor den Zug wirft, wo auch noch andere betroffen sind -
3368050	3369610	1560	aber das Thema klammern wir mal aus.
3369790	3372850	3060	Diese Menschen nehmen, gemessen an der Bevölkerungszahl der Schweiz, zu.
3373050	3375130	2080	1980 waren wir bei ca. 6,5 Mio. Einwohnern,
3375360	3379570	4210	heute haben wir gut 8 Mio. - die Zahl ist immer etwa gleich.
3379750	3382330	2580	D.h., prozentual nimmt diese Zahl ab. - Eben.
3382460	3388410	5950	Eben. Nicht zu. Eben!
3388570	3391610	3040	Herr Meili, neben all diesen Diskussionen um die Zahlen
3391790	3394250	2460	möchte ich von Ihnen wissen: Selbstbestimmung.
3394420	3397330	2910	Ein Mensch kann selbst von sich sagen, er wolle jetzt gehen.
3397570	3399970	2400	Und Sie finden, dass das nicht unbedingt der Fall ist.
3400050	3402010	1960	Natürlich kann ein Mensch das tun.
3402170	3406170	4000	Aber ich halte es für wichtig, den Sterbewunsch genauer zu untersuchen.
3406370	3408650	2280	Was steckt dahinter?
3408760	3411650	2890	Ist es einfach die Angst vor einem Autonomieverlust?
3411760	3415450	3690	Auch das ist ernst zu nehmen.
3415560	3421730	6170	Aber ist das unterstützenswert, wenn jemand einfach aus Angst davor,
3421960	3425530	3570	dass z.B. eine Pflegefachkraft einem den Hintern putzt -
3425610	3429170	3560	Entschuldigung dafür - aus diesem Grund in den Tod will?
3429390	3435650	6260	Oder ob man diesen Menschen auch unterstützen könnte.
3435850	3441410	5560	Auch wenn man hilflos wird, hilfsbedürftig,
3441590	3445290	3700	dann ist man immer noch wertvoll, und sollte Unterstützung erhalten.
3445470	3447610	2140	Darum geht es doch. - Unbedingt.
3447790	3450370	2580	Da bin ich bei jedem Wort mit Ihnen einig.
3450540	3453890	3350	Jeder Mensch hat eine Würde, einen Wert,
3453970	3456890	2920	egal, in welchem Zustand sich dieser Mensch befindet.
3456970	3459290	2320	Und es ist tatsächlich auch so -
3459470	3462730	3260	auch hilfsbedürftigste Menschen müssen sagen können:
3462830	3465130	2300	"""Ja, ich kann das annehmen."""
3465260	3468970	3710	Wenn jemand also gebadet wird,
3469190	3473370	4180	ihm geholfen wird auf dem WC oder beim Essen.
3473520	3478330	4810	Aber: Ich finde, Sie können nicht von anderen erwarten,
3478440	3481850	3410	Ihre Einstellung zu teilen.
3481930	3486970	5040	Ich erwarte nur,
3487160	3493810	6650	dass man jedem Menschen auch am Ende die Wahl lässt, wie er das wünscht.
3494000	3496010	2010	Ich respektiere Ihre Haltung absolut,
3496180	3497930	1750	aber Sie müssen meine auch akzeptieren.
3498050	3499930	1880	* Signalton *
3500010	3503400	3390	Und jetzt müssen wir die Meinung von Frau Baumann-Hölzle akzeptieren.
3503480	3506280	2800	Akzeptieren nicht, aber sich damit auseinandersetzen.
3506560	3510600	4040	Ich würde einfach sehr gerne noch mal den Blick darauf werfen,
3510760	3514880	4120	wie wir mit den medizinischen Möglichkeiten umgehen -
3515020	3518160	3140	auch im fortgeschrittenen Lebensalter.
3518330	3521800	3470	Ich bin sehr viel in den Spitälern unterwegs,
3521990	3526240	4250	auf Intensivstationen und auch in anderen Bereichen.
3526370	3528120	1750	Da stellt sich einfach die Frage:
3528250	3530280	2030	Wie gehen wir eigentlich
3530370	3533800	3430	mit dem medizinischen Fortschritt im Alter um?
3533910	3538800	4890	Und was ist möglich, und was nicht?
3538980	3541480	2500	Und da spielt eben die Ökonomisierung enorm rein.
3541690	3544250	2560	Weil man eben an den lebenserhaltenden Massnahmen
3544370	3547410	3040	sehr lange und sehr viel verdient.
3547610	3551410	3800	Auf der anderen Seite führt das dazu, dass die Auseinandersetzung
3551550	3555170	3620	mit den Grenzen dieser lebenserhaltenden Massnahmen
3555370	3558770	3400	fast nicht stattfindet.
3558990	3563370	4380	Weil immer noch die Hoffnung im Raum steht,
3563480	3565610	2130	das Leben noch einmal verlängern zu können.
3565810	3568330	2520	Herr Jositsch, Sie sagten es: Wir leben heute immer länger.
3568430	3570170	1740	Das hat u.a. auch damit zu tun,
3570350	3572650	2300	dass wir medizinisch enorm viel einsetzen.
3572770	3574850	2080	Und die ganze Debatte darüber,
3575000	3577170	2170	was ein begrenztes Leben eigentlich bedeutet,
3577310	3579170	1860	was unsere Sterblichkeit bedeutet,
3579370	3581490	2120	was ein gutes Leben und ein gutes Sterben ist -
3581630	3584730	3100	diese Diskussion sollte man führen.
3584810	3587850	3040	Nicht einfach nur, ob sich jemand töten soll oder nicht.
3588010	3589970	1960	In dieser Diskussion habe ich gemerkt,
3590200	3592250	2050	sind Sie beide sich nicht ganz einig.
3592410	3595730	3320	Frau Krones, Sie haben vorhin die Augen verdreht.
3595960	3598490	2530	Ich habe nicht die Augen verdreht wegen Frau Baumann-Hölzle,
