start	end	duration	text
1260270	1263250	2980	Das ist für jeden Klub grundsätzlich ein Horrorszenario.
1263380	1267290	3910	St.Gallen setzte damals voll auf den schnellen Wiederaufstieg.
1267430	1271370	3940	Ohne Abstriche. Mit finanziellem Risiko.
1271520	1274050	2530	Angefangen beim Kader, bei der Selektion der Spieler,
1274200	1277970	3770	beim Staff, inklusive dem ganzen Stadionmanagement -
1278080	1280210	2130	man wollte eben wenig verändern,
1280370	1284150	3780	um möglichst garantiert den Wiederaufstieg zu erzwingen.
1284380	1290030	5650	Das Risiko ging auf. Auch dank treuen Fans und Sponsoren.
1290190	1293310	3120	Auch der FC Zürich setzt sich das Ziel Wiederaufstieg.
1293460	1296630	3170	Doch ganz einfach dürfte das nicht werden.
1296840	1300070	3230	Die Challenge League wird auf keinen Fall zum Selbstläufer für den FCZ.
1300230	1303190	2960	Das ist eine spannende Liga in der kommenden Saison.
1303420	1305430	2010	Wir haben den FC Wil mit den türkischen Millionen,
1305540	1307270	1730	die wollen unbedingt nach oben.
1307420	1309830	2410	Wir haben die Romandie mit Servette und Xamax.
1309990	1312430	2440	Dann ist der FC Aarau in dieser Challenge League,
1312600	1314950	2350	das ist auch ein Klub, der wiedererstarkt ist.
1315070	1319830	4760	Die gute Nachricht: Fast immer kehren Traditionsklubs wieder zurück.
1319980	1324030	4050	Ein Wiederaufstieg ist aber ein Kraftakt - sportlich wie finanziell.
1324190	1329190	5000	Moral beweisen kann Zürich bereits am Sonntag - beim Cupfinal gegen Lugano.
1330880	1334310	3430	Ganz anders die Stimmung gestern Abend am anderen Ende der Tabelle -
1334450	1335950	1500	in Basel:
1336040	1337630	1590	Kein Geringerer als Roger Federer
1337830	1340150	2320	brachte den Meisterpokal in den St. Jakob-Park.
1340320	1343030	2710	Bereits zum siebten Mal in Folge durften die Fans des FC Basel
1343120	1346430	3310	ihre Mannschaft als Meister hochleben lassen.
1346570	1349350	2780	Das letzte Spiel gestern Abend verloren die Basler zwar mit 0:1
1349550	1354950	5400	gegen die Grasshoppers - aber das war für einmal absolut nebensächlich.
1357890	1360830	2940	Richtig gut läuft es auch den Schweizer Tennis-Assen
1360960	1362910	1950	an den French Open in Paris:
1363000	1364670	1670	Nachdem sich Stan Wawrinka gestern
1364790	1366350	1560	schon in die dritte Runde gespielt hat,
1366520	1368870	2350	ist jetzt auch Timea Bacsinszky qualifiziert.
1369050	1372750	3700	Sie schlug heute die Kanadierin Eugenie Bouchard in zwei Sätzen:
1373760	1376430	2670	Nach einer beeindruckenden Aufholjagd
1376620	1382070	5450	gewann Timea Bacsinszky den ersten Satz gegen Eugenie Bouchard mit 6:4.
1382160	1385710	3550	Die Schweizerin spielte in dieser Phase der Partie hervorragend
1385880	1389950	4070	und baute im zweiten Satz ihre Führung bis auf 5:0 aus.
1390110	1393350	3240	Mit dem Matchgewinn vor Augen musste Timea Bacsinszky ihre Gegnerin
1393550	1396630	3080	aber noch einmal auf 5:4 herankommen lassen.
1396840	1401960	5120	Sie gewann die Partie aber doch noch - in zwei Sätzen mit 6:4 und 6:4.
1404260	1407200	2940	"Und damit zu den Themen von ""10vor10 und Arthur Honegger:"
1407290	1408600	1310	Danke, Cornelia.
1408760	1410800	2040	Jetzt, nachdem auch mathematisch feststeht,
1411010	1414600	3590	dass in den USA Donald Trump Kandidat der Republikaner ist,
1414690	1417840	3150	kommt Hillary Clinton unter Druck - nicht primär wegen ihm,
1418050	1420560	2510	sondern wegen ihrer eigenen Fehler.
1420660	1422680	2020	Dann fordert ein Schweizer Ständerat,
1422860	1424840	1980	dass das Rentenalter nicht nur erhöht,
1425050	1429040	3990	sondern künftig automatisch der Lebenserwartung angepasst werden soll
1429200	1431440	2240	und sorgt damit für Zoff in Bern.
1431540	1434280	2740	Und: Das unbeliebteste Ehepaar der Schweiz -
1434460	1437360	2900	das sind zur Zeit Eliane und Ancillo Canepa.
1437510	1440700	3190	Mit dem Abstieg des FCZ zeigen wir Aufstieg und Fall der beiden.
1440840	1443540	2700	Das alles und mehr - um 10 vor 10. - Danke, Arthur.
1444500	1446620	2120	"Jetzt ""Meteo"" und danach ""DOK"" -"
1446800	1449100	2300	"heute ""Auf der Suche nach Menschlichkeit"":"
1449250	1451140	1890	über die Geschichte des Roten Kreuzes.
1451290	1453900	2610	Danke fürs Interesse und einen schönen Abend.
1454100	1458700	4600	SWISS TXT / UT-Redaktion Zürich Manuela Waldner, Corinne Kessler, Philipp Schlatter