start	end	duration	text
1060	2910	1850	.
3140	7190	4050	1:1-Untertitelung. Livepassagen können Fehler enthalten.
7690	10070	2380	Guten Abend, meine Damen und Herren.
10170	12710	2540	"Hier ist die ""Tagesschau"" und das sind die Themen heute Dienstag:"
14250	20230	5980	Die Fraktionen nehmen die SVP- Bundesratskandidaten ins Kreuzverhör.
21480	26310	4830	Für das Bundesgericht ist das Unterrichten an der Primarschule
26450	28950	2500	ein typischer Frauenberuf.
30190	35230	5040	Die deutsche Regierung beschliesst den Militäreinsatz in Syrien.
36340	39190	2850	Die Schweizer Wirtschaft stagniert -
39380	42430	3050	viele verschiedene Branchen kämpfen mit Problemen.
43650	47630	3980	Zäher Nebel im Flachland - sonst scheint überall die Sonne.
49650	51750	2100	Am Anfang waren es zwölf -
51840	55870	4030	zwölf SVP-Kandidaten für einen Bundesratssitz.
56090	59590	3500	Zwölf, die von verschiedenen Kantonen nominiert worden waren.
59730	61710	1980	Dann waren es noch neun,
61880	64989.99999999999	3110	nachdem die SVP-Findungskommission ihr Machtwort gesprochen hatte.
65129.99999999999	67190	2060	Dann drei - drei Offizielle,
67350	71590	4240	die von der SVP-Bundeshausfraktion ins Rennen geschickt wurden.
71810	75030	3220	Und diese drei, Norman Gobbi, Thomas Aeschi und Guy Parmelin
75210.00000000001	78350	3140	mussten heute zu den sog. Hearings antreten.
78480	81910	3430	Aus drei mach einen - einen Bundesrat. Christof Nufer.
83530	85590	2060	SVP-Bundesratskandidat zu sein,
85810	89310	3500	bedeutete heute kurz vor 15 Uhr v.a. Warten vor der Tür.
89530	91030	1500	Der Waadtländer Guy Parmelin
91270	95270.00000000001	4000	zeigt uns sein durchgetaktetes Hearing-Programm.
95440	101110	5670	Zuerst BDP, dann FDP, dann CVP, dann GLP.
101210.00000000001	104789.99999999999	3580	Alle 20 Min. 5 Min. Präsentation.
104979.99999999999	108910	3930	Ausser die CVP, die möchte nur 4 Min.
109039.99999999999	110990.00000000001	1950	Im Halbstundentakt
111190	116630	5440	eilen die Kandidaten zwischen 15 und 17 Uhr zu FDP, CVP, GLP und BDP.
116780	119930	3150	Um 17.30 Uhr ist der Spuk bereits vorbei.
120140	123290	3150	Bilanz des Zuger Kandidaten Thomas Aeschi:
123510	126450	2940	Es waren sehr interessante Gespräche mit diesen vier Fraktionen.
126630	129850	3220	Es wurden doch sehr kritische Fragen gestellt über politische Positionen,
130030	133410	3380	über das Berufs- und das Privatleben.
133630	135890	2260	Ich habe natürlich in allen Details Auskunft gegeben.
136030	137850	1820	Eine Fraktion hat sogar verlangt,
138020	139850	1830	das alles wörtlich protokolliert wurde.
139940	142210	2270	Konnten Sie heute punkten?
142490	144530	2040	Für mich ist es schwierig, das abschätzen zu können.
144660	146570	1910	Das müssen Sie die Parlamentarier fragen.
146730	150410	3680	17.30 Uhr - FDP-Fraktionschef Ignazio Cassis verkündet:
150530	152930	2400	Die FDP wolle erst nächsten Dienstag
153040	155450	2410	einen Kandidaten aus dem Dreierticket auswählen.
155560	157530	1970	Ein Teil der Fraktion
157760	160530	2770	zweifle an Norman Gobbis kürzlichem Wechsel zur SVP
160620	164770	4150	und Thomas Aeschis Unabhängigkeit von Mentor Blocher gab zu reden.
164880	170690	5810	Er hat behauptet, er könnte durchaus von Herrn Blocher unabhängig sein.
170920.00000000003	174290	3370	Das ist seine Behauptung und diese haben wir zur Kenntnis genommen.
174440	177730	3290	Auch bei der CVP gibt es Vorbehalte.
177910	180650	2740	Erst nächsten Dienstag werde entschieden, welchen SVP-Kandidaten
180760	185970	5210	die CVP unterstützt, weil:
186080	189130	3050	Wir sind weiterhin der Meinung, dass es wünschenswert wäre,
189290	192810	3520	dass die SVP künftig in ihren Statuten der Ausschlussklausel
192930	201530	8600	die die Wahlfreiheit des Parlaments einschränkt, einmal streicht.
201710	206370	4660	Auch die SP will nächste Woche die Kandidaten anhören.
206470	209250	2780	.
210560	212930	2370	Die drei SVP-Kandidaten wurden also von den Fraktionen angehört.
213090	214730	1640	Und die Fraktionen haben sich dazu geäussert.
214870	217210	2340	Hanspeter Forster, weiss man denn noch etwas Genaueres darüber,
217350	219690	2340	wie die drei angekommen sind?
219790	225890	6100	Wir untertiteln live:
226020	230690	4670	Das ist schwierig zu sagen.
230850	234710	3860	Die Anhörungen finden hinter verschlossenen Türen statt.
234850	239310	4460	Gestern nächsten Dienstag wird entschieden.
239480	245110	5630	Keine Partei will sich in die Karten schauen lassen.
245260	248710	3450	Alle Kandidaten wurden als wählbar taxiert.
248830	254870	6040	Es gab aber Unterschiede.
254960	258269.99999999997	3310	Die FDP und die BDP wollen einen der Kandidaten,
258390	264350	5960	der offiziellen Kandidaten werden.
264770	270670	5900	Die CVP lässt sich noch ein Hintertürchen offen.
271760	274950	3190	D.h. aber nicht, dass sie sich nicht für einen der drei Kandidaten
275070	280470	5400	entscheidet.
280610	284310	3700	Es ist ein Protest gegen den Entscheid der SVP,
284510	287750	3240	man müsse einen offiziellen Kandidaten werden.
287870	291190	3320	Die SP hatte gezögert, ob sie die Kandidaten überhaupt anhören will.
291290	294390	3100	Jetzt hat sie entschieden. Die Hearings finden kommenden Dienstag
294580	296990	2410	statt. Wie ist das zu interpretieren?
297080	302990	5910	Da würde ich nicht viel hinein lesen.
305350	308350	3000	Die SP schliesst es nicht grundsätzlich aus,
308450	313710	5260	einen offiziellen Kandidaten zu wählen.
313820	319470	5650	Sie könnte sich aber auch für einen wilden Kandidaten entscheiden.
319560	325550	5990	Es sollen von Mitte-links Bestrebungen geben,
330840	334470	3630	einen nicht offiziellen SVP- Kandidaten aufzustellen.
334650	340570	5920	Diese Chancen sind aber gleich null.
342970	346930	3960	Es wird wohl ein offizieller Kandidat sein, der gewählt wird.
349909.99999999994	351970	2060	Gobbi, Aeschi und Parmelin
352090.00000000006	354300	2210	wurden heute also auf ihre Bundesratstauglichkeit angeschaut.
354450	356659.99999999994	2210	Was passiert da bei diesen Hearings hinter verschlossenen Türen?
356840.00000000006	358580	1740	Es gibt Parlamentarier,
358750	360980	2230	"die sprechen von ""Grillieren"" oder gar ""Rösten"" der Kandidaten."
361200	362980	1780	Andere sagen, das Ganze sei halb so wild.
363080	365620	2540	Wir haben zwei Politiker gefragt, die in der Vergangenheit dabei waren,
365720	367380	1660	als Fragende und Befragte.
368590	370460	1870	Man sieht: Da geht einer einen schweren Gang.
370570	372300	1730	Sich hinter geschlossener Tür
372500	374460	1960	den kritischen Fragen der Parlamentarier zu stellen
374580	376260	1680	ist kein Zuckerschlecken.
376440	378380	1940	Doch wie wichtig sind diese Hearings überhaupt?
378460	380420	1960	Sie sind sehr wichtig.
380620	385260	4640	80 % der Parlamentarier kennen sich gegenseitig gar nicht.
385480	389260	3780	In den Hearings haben sie zum ersten Mal die Möglichkeit,
389380	392420	3040	mit diesen Kandidaten zu sprechen.
392680	397180	4500	Schon oft wurden in den Hearings die Bundesratswahlen entschieden.
397360	403780	6420	Es ist bis zum einem gewissen Grad ein Ritual, ein Schaulaufen,
403880	407180	3300	das vielleicht vielen Leuten Vergnügen bereitet,
407320	411300	3980	aber nicht entscheidend ist für die Wahl in den Bundesrat.
411440	414100	2660	Unterschiedliche Standpunkte also.
414240	416460	2220	Einig sind sich die beiden aber darin:
416560	418300	1740	Es geht ums Persönliche,
418510	420940	2430	den Eindruck, den der Kandidat als Mensch vermittelt,
421200	423340	2140	nicht primär um die politische Positionierung -
423490	426500	3010	die ist ja wohl schon bekannt.
426640	429940	3300	Man bekommt natürlich einen gewissen Eindruck von der Person,
430050	432500	2450	sofern man den noch nicht hat.
432720	435940	3220	Aber inhaltlich ist es in der Regel so,
436040	440300	4260	dass die Kandidaten ihre Positionen auch etwas anpassen.
440460	443060	2600	Vielleicht ist das sogar das Gefährlichste:
443280	446660	3380	Wenn man merkt, dass sich der Kandidat allzu fest anpasst,
446780	449660	2880	dann schadet er sich.
449860	453620	3760	Politik erfolgt immer aus dem Bauch und mit Kopf -
453720	455860	2140	beides spielt eine Rolle.
456060	459460	3400	Die persönlichen Sympathien spielen eine gewaltige Rolle.
459630	463820	4190	Und die werden in solchen, nahen Begegnungen gewonnen.
463930	466020	2090	Und wenn der Bauch mitentscheidet,
466170	469460	3290	dann können die Weichen durchaus neu gestellt werden.
469630	471980	2350	Nachdem ich gewählt worden war, habe ich erfahren,
472159.99999999994	475659.99999999994	3500	dass ich in den Hearings gewählt worden bin.
475880	478140	2260	Offenbar habe ich - ohne es zu merken -
478350	480940	2590	immer das Kollegium in den Vordergrund gestellt.
481090	483420	2330	Ich sagte, ich könne das alleine nicht entscheide,
483520	485780	2260	wichtig sei das Kollegium usw.
485910	489620	3710	Mein Gegenkandidat dagegen sagte, wie er die Welt verändern würde.
489710	492220	2510	Es gilt auch, nicht zu vergessen:
492290	496340	4050	Bundesratswahlen sind geheime Wahlen. Es kann also immer alles passieren.
497820	499820	2000	Im Bundeshaus ging es heute aber
500000	503180	3180	natürlich nicht nur um die Begut- achtung der Bundesratskandidaten -
503320	506580	3260	es wurde auch über verschiedene Geschäfte diskutiert.
506740	510260	3520	"So auch über die Volksinitiative für eine ""grünere Wirtschaft"","
510440	512900	2460	die, Nomen est Omen, von den Grünen stammt.
513120	516059.99999999994	2940	Die Initiative hat im Parlament einen schweren Stand.
517500	521900	4400	Unsere Wegwerfgesellschaft soll zu einer Kreislaufgesellschaft werden.
522120	525580	3460	"Das fordert die ""Grüne Wirtschaft""- Initiative der Grünen."
525700	527700	2000	Wie Alu, Glas, PET oder Holz
527880	530300	2420	sollen Ressourcen nicht endgültig vernichtet,
530430	533020	2590	sondern recycelt und gespart werden.
533110	536420	3310	Gut gemeint aber schlecht umgesetzt, sagen die Gegner.
536550	539740	3190	Sie fürchten zusätzliche Regulierungen der Wirtschaft.
541340	546500	5160	Die Schweizer Luftwaffe soll ab 2020 rund um die Uhr einsatzbereit sein.
546620	548420	1800	Das will der Bund schon länger.
548520	551340	2820	Heute aber präsentiert er zum ersten Mal die Kosten:
551450	554980	3530	Rund 30 Mio. Fr. im Jahr und 100 zusätzliche Stellen
555080	556940	1860	benötigen die Kampfflugzeuge.
557160	560540	3380	Dafür sollen sie dann innert 15 Min. abheben können.
562770	565980	3210	Ein Grossteil des Geldes, das im Umlauf ist,
566150	569780	3630	ist sog. Buchgeld, d.h., es wird gar nie gedruckt.
570000	572700	2700	Nur ein kleiner Teil besteht aus Noten und Münzen,
572920	576300	3380	die von der Nationalbank unter die Leute gebracht werden.
576410	578060	1650	Das elektronische Geld aber,
578210	581300	3090	das wird von Geschäftsbanken wie der UBS oder der Credit Suisse
581400	583940	2540	in Form von Krediten geschaffen.
584160	587740	3580	Die sog. Vollgeldinitiative will das nun ändern -
587930	591340	3410	heute eingereicht, mit 112'000 Unterschriften.
591550	595420	3870	In der Schweiz soll die Nationalbank künftig allein entscheiden dürfen,
595550	597820	2270	wie viel Geld im Umlauf ist.
598000	599940	1940	Der Einfluss der Geschäftsbanken auf die Geldmenge
600040	602340	2300	ist den Initianten zu gross.
602450	605660	3210	Auch elektronisches Geld müsse von der Nationalbank erzeugt werden.
605840	611540	5700	Dann seien Finanzblasen wie bei der Finanzkrise 2008 nicht mehr möglich.
613380	619020	5640	An den Primarschulen in der Schweiz arbeiten Lehrerinnen und Lehrer.
619190	621540	2350	Weil die Frauen aber klar in der Mehrheit sind,
621760	625300	3540	kommt das Bundesgericht heute zu einem bemerkenswerten Schluss.
625450	628540	3090	An einer Primarschule Unterricht zu erteilen,
628650	630740	2090	sei ein klassischer Frauenberuf.
630820	633780	2960	Das ist auch deshalb bemerkenswert,
633940	637100	3160	weil die obersten Richter damit eine Klage wegen Lohndiskriminierung
637270	641140	3870	beurteilt haben. Ein Teilsieg für die Aargauer Lehrerin, die geklagt hatte.
642400	644700	2300	Rechnen, Schreiben, Lesen.
644920	647980	3060	In der Unter- und Mittelstufe unterrichten v.a. Frauen.
648240	651860	3620	Im Kanton Aargau sind es aktuell über 80 %.
651960	655380	3420	Der Primarlehrerberuf sei deshalb ein typischer Frauenberuf.
655550	659740	4190	Das hat heute das Bundesgericht festgehalten.
659880	662860	2980	Und weil Frauen im Durchschnitt weniger verdienen als Männer,
663010	665660	2650	muss das Aargauer Verwaltungsgericht nun prüfen,
665770	668340	2570	ob eine Diskriminierung vorliegt.
668450	671180	2730	Sprich: Ob die Löhne der Primarlehrerinnen im Kanton
671270	673820	2550	kollektiv zu niedrig sind.
674020	677060	3040	Der aargauische Lehrerinnen- und Lehrerverband,
677270	681140	3870	der die Klage unterstützt hatte, freut sich über den Entscheid.
681310	683860	2550	Das bedeutet, dass eine Diskriminierung des Berufs
684000	687260	3260	nicht ausgeschlossen werden kann. Er muss neu beurteilt werden.
687430	689260	1830	Und das kann dazu führen,
689350	694300	4950	dass er attraktiver wird, und dass wir weniger Lehrermangel haben.
694400	699780	5380	Der Kanton Aargau hingegen befürchtet wegen des Urteils massive Mehrkosten:
699930	703620	3690	Details sind absolut noch nicht klar, da müssen wir abwarten.
703830	706220	2390	Aber es wird sicher Aufgaben geben für den Kanton Aargau,
706390	708180	1790	die auch finanzpolitisch schwierig werden.
708330	711700	3370	Das Bundesgerichtsurteil ist ein wegweisender Entscheid.
711880	714620	2740	Und könnte darum auch andere Kantone betreffen.
714880	717060	2180	Der Dachverband Schweizer Lehrerinnen und Lehrer
717130	720940	3810	will die Situation in jedem Kanton überprüfen.
721110	723940	2830	Das ist ein wichtiges Urteil, das wegweisend sein wird
724100	727700	3600	für künftige Lohneinstufungen der Primarlehrpersonen.
727880	730860	2980	Geschlechtsspezifische Diskriminierung wird nicht geduldet
730970	732780	1810	in unserem Land, und das ist gut so.
732940	736340	3400	Viele Kantone könnten sich also bereits in naher Zukunft
736430	740300	3870	mit Lohnforderungen von Primarlehrerinnen befassen müssen.
740350	741820	1470	Dies in einer Zeit,
742080	745140	3060	in der in vielen Kantonen Budgetkürzungen diskutiert werden.
746990	749980	2990	Nach Deutschland, wo die Regierung heute entschieden hat,
750100	752220	2120	dass man sich in Syrien aktiv
752390	755740	3350	am Kampf gegen die IS-Terroristen beteiligen will.
755840	758500	2660	Nicht direkt an Luftschlägen, wie sie von anderen Nationen
758670	761780	3110	wie Frankreich, den USA oder Russland durchgeführt werden,
761880	764820	2940	aber als Unterstützung für solche Angriffe.
766010	767980	1970	Konkret wird sich Deutschland
768200	770780	2580	mit vier bis sechs Tornado-Aufklärungsjets beteiligen
770900	773340	2440	sowie mit einem Tankflugzeug.
773550	777340	3790	Das Gerät könnte bereits nächste Woche in die Türkei verlegt werden.
777490	780140	2650	Der eigentliche Einsatz soll aber erst im Januar beginnen.
780350	782900	2550	Einsatzgebiet ist Syrien und der Irak.
783160	786500	3340	Rund 1'200 Soldaten sollen daran teilnehmen,
786660	790460	3800	auch als Stabspersonal in den Hauptquartieren,
790610	794780	4170	zur Unterstützung Frankreichs und anderer Verbündeter.
794960	797740	2780	Die deutsche Verteidigungsministerin Ursula von der Leyen
797960	800420	2460	hat das Mandat im Eiltempo durchgepaukt,
800580	804140	3560	schon am Freitag dürfte der Bundestag darüber abstimmen.
804300	806500	2200	Gegen das Vorhaben der Bundesregierung
806600	809020	2420	protestiert v.a. die Linkspartei:
809270	811700	2430	Dieses Mandat ist rechtlich auf wackligen Füssen.
811920	815300	3380	Es wird ohne eine konkrete Zielbeschreibung durchgeführt.
815470	818260	2790	Es wird letztlich die Terrorgefahr vergrössern,
818480	821140	2660	denn mit jeder Bombe auf ein ziviles Opfer
821350	824580	3230	wachsen potentiell zehn neue Attentäter heran.
824750	828660	3910	Der Einsatz wird im ersten Jahr 134 Mio. Euro kosten.
828920	832300	3380	Und allen ist klar: Es wird ein Langzeiteinsatz,
832390	836260	3870	entsprechend sind die Forderungen des Bundeswehrverbandes:
836470	838540	2070	Frau von der Leyen muss jetzt rüsten.
838630	841900	3270	Sie muss personell und materiell aufstocken, die Lücken schliessen.
842000	843620	1620	Denn wir werden noch längerfristig -
843840	847140	3300	ich gehe von mind. zehn Jahren aus - gegen den IS im Kampf stehen.
847240	850140	2900	Auch zu Wasser will Deutschland zu Hilfe eilen.
850300	853340	3040	Eine Fregatte der Bundesmarine könnte schon in wenigen Tagen
853450	856020	2570	zum Schutz des französischen Flugzeugträgers
856190	858620	2430	im östlichen Mittelmeer abkommandiert werden.
861420	865100	3680	Zugeschaltet aus Berlin ist Adrian Arnold.
865260	867820	2560	Noch muss der Syrien-Einsatz vom Bundestag,
867940	871860	3920	vom Parlament abgesegnet werden.
872040	873980	1940	Kann man von einer Formsache ausgehen
874140	878020	3880	oder ist mit richtig grossem Widerstand zu rechnen?
878120	889780	11660	Wir untertiteln live:
889910	893020	3110	Es wird eine reine Formsache.
893110	898380	5270	Die Grosse Koalition ist sich einig.
898530	901860	3330	Es wird einzig von den Grünen und den linken Widerstand geben.
901960	907860	5900	Aber diese Opposition ist zu klein.
909050	913820	4770	Die linke will juristisch dagegen vorgehen,
914040	916820	2780	mit einer Verfassungsklage gegen den Militäreinsatz.
917040	920260	3220	Nicht nur die Linke hat Zweifel, auch Völkerrechtler sprechen davon,
920520	923620	3100	dass sich dieser Einsatz rechtlich im Graubereich befinde - was ist
923760	929740	5980	denn das Heikle?
932120	934740	2620	Die Frage ist, ob es eine gesetzliche Grundlage gibt für
934880	935980	1100	diesen Militäreinsatz.
936080	939780	3700	Die deutsche Regierung sagt ja.
939880	944180	4300	Sie beruft sich auf die UNO Charta.
944350	950140	5790	Diese sieht ein Verteidigungsrecht vor.
950240	953580	3340	Angela Merkel sieht in diesem Einsatz einen Akt der Verteidigung
953680	959140	5460	gegen eine Terrormiliz,
959340	965260	5920	die einen Bündnispartner angegriffen hat, Frankreich.
965900	969180	3280	Diese Terrormiliz sei auch eine Bedrohung Europas und Deutschlands.
969340	973060	3720	Man muss sich aktiv verteidigen.
973240	976260	3020	In Frankreich hat der IS Anschläge verübt wegen des französischen
976520	979060	2540	Vorgehens in Syrien. Fürchtet man in Deutschland solche
979180	983940	4760	Vergeltungsschläge nicht?
984090	989020	4930	Doch.
989110	994180	5070	Die Angst wird in der Bevölkerung zunehmen.
994360	1000260	5900	Aber grundsätzlich hat sich die Bedrohungslage nicht verändert.
1001280	1005380	4100	Deutschland ist seit einem Jahr aktiv im Kampf gegen den IS,
1005560	1009940	4380	Wand unterstützt die Peschmerga Kämpfer.
1010080	1016140	6060	Man ist auch in Mali im Einsatz.
1016280	1019180	2900	Deshalb geht der Verfassungsschutz nicht von einer grösseren
1019270	1021700	2430	Bedrohungslage aus.
1024640.0000000001	1026540	1900	In der türkischen Metropole Istanbul
1026640.0000000001	1029420.0000000001	2780	ist am frühen Abend nahe einer U-Bahn-Station eine Bombe explodiert.
1030630.0000000001	1032540	1910	Bei der Explosion sind nach offiziellen Angaben
1032640.0000000001	1034460	1820	fünf Menschen verletzt worden.
1034680.0000000001	1036579.9999999999	1900	Beim Sprengsatz soll es sich um eine Rohrbombe handeln,
1036750	1038859.9999999999	2110	die auf einer Überführung in der Nähe einer U-Bahn-Station
1038960	1040700	1740	deponiert worden war.
1040869.9999999999	1043099.9999999999	2230	Die Explosion ereignete sich während des Berufsverkehrs
1043329.9999999999	1045900.0000000001	2570	in einem Stadtteil auf der europäischen Seite Istanbuls.
1048339.9999999999	1050660	2320	Es ist wie ein Mahnmal:
1050760	1053500	2740	Ausgerechnet zu Beginn des Klimagipfels in Paris
1053720	1058740	5020	schnürt Smog Millionen von Chinesinnen und Chinesen die Luft ab.
1058880	1062740	3860	Schuld daran sind u.a. der Verkehr und Kohlekraftwerke.
1062910	1066260	3350	Die Luft in Peking ist so schlecht, der Smog so dicht,
1066520	1069900	3380	dass Tausende von Fabriken vorüber- gehend geschlossen werden müssen.
1070120	1074220	4100	Den Einwohnern wird empfohlen, nicht nach draussen zu gehen.
1074480	1078740	4260	Die Feinstaubbelastung führt zu Herzerkrankungen und Lungenkrebs
1078920	1082980	4060	und somit längerfristig zu Tausenden von Todesopfern.
1083240	1087460	4220	In Paris selbst geht es nach den vie- len Lippenbekenntnissen von gestern
1087590	1089420	1830	nun an die Arbeit.
1089590	1092180	2590	Die Unterhändler haben damit begonnen, ein verbindliches Abkommen
1092370	1095980	3610	für das aufgeheizte globale Klima auszuarbeiten.
1097520	1100220	2700	Sie beginnen nun mit der grundlegenden Arbeit.
1100370	1104060	3690	Mit diesen Worten eröffnet Frank- reichs Aussenminister Laurent Fabius
1104160	1106300	2140	heute die Plenarsitzung.
1106480	1108140	1660	Die Unterhändler müssen nun das umsetzen,
1108360	1112580	4220	was die Staats- und Regierungschefs gestern versprochen haben.
1112920	1115500	2580	Dabei schauen ihnen viele Interessengruppen auf die Finger
1115600	1118380	2780	und äussern bereits Kritik.
1118480	1121700	3220	Was die Staatschefs gesagt haben, ist sehr schwammig.
1121830	1127940	6110	Die Unterhändler können deshalb nicht zielorientiert verhandeln.
1128040	1131180	3140	50 Seiten umfasst die Verhandlungsvorlage.
1131240	1135340	4100	Bei vielen Punkten sind Vorschläge noch völlig gegensätzlich.
1135360	1137060	1700	Dass es einfach wird,
1137220	1140980	3760	darüber macht sich auch US-Präsident Barack Obama keine Illusionen.
1141130	1145300	4170	Es wird hart, 200 Länder hinter eine Übereinkunft zu bringen.
1145460	1148940	3480	Es wird in den kommenden zwei Wochen Momente geben,
1149040	1152140	3100	in denen die Verhandlungen nicht vorwärtskommen.
1152240	1154940	2700	Dann wird es gleich heissen, wir seien verloren.
1155120	1159060	3940	Aber ich bin überzeugt: Es wird Grosses geleistet.
1159160	1161380	2220	Bis am Samstag haben die Unterhändler Zeit,
1161640	1164860	3220	dann sollen sie erste Kompromisslösungen vorlegen.
1165020	1168380	3360	Dazu SRF-Sonderkorrespondent Jürg Brunner:
1168570	1171020	2450	In den Hinterzimmern wird jetzt über Punkt und Komma
1171230	1173900	2670	eines möglichen Klimavertrages gestritten.
1174000	1176580	2580	Die Bühne in den nächsten Tagen gehört den Lobbyisten
1176740	1180620	3880	der Umweltschutzorganisationen und der Energieunternehmen.
1180830	1184980	4150	Sie versuchen, den einen oder anderen Delegierten noch zu beeinflussen.
1186360	1189060	2700	Wie man im Konsumalltag dafür sorgen kann,
1189260	1191780	2520	dass sich das Klima weniger stark erwärmt,
1192040	1196460	4420	"zeigt der ""Kassensturz"" heute um 21.05 Uhr auf SRF 1."
1198860	1203700	4840	Man kann ihn so sehen oder so, den Zustand der Schweizer Wirtschaft.
1203880	1207700	3820	Es ist wie beim berühmten halbvollen oder eben halbleeren Glas.
1207860	1211380	3520	Zum einen geht es der Schweizer Wirtschaft nicht wahnsinnig gut,
1211600	1213940	2340	zum anderen aber geht es ihr - im internationalen Vergleich gesehen -
1214090	1215820	1730	doch ganz ordentlich.
1215990	1218300	2310	Fakt ist: Im dritten Quartal dieses Jahres
1218470	1223700	5230	ist das Bruttoinlandprodukt BIP bei 0 % verharrt. Nullwachstum also.
1223870	1226820	2950	Das meldet das Staatssekretariat für Wirtschaft, SECO.
1228230	1230900	2670	Der Schweizer Wirtschaftsmotor stottert.
1231010	1236820	5810	Damit hat das SECO gerechnet.
1236950	1238700	1750	Es kommt nicht überraschend.
1238950	1241900	2950	Wir hatten schon in den Sommermonaten gewisse Anzeichen,
1242010	1243940	1930	dass die Schweizer Wirtschaft
1244100	1246860	2760	nach wie vor unter dem starken Franken leidet.
1246960	1250300	3340	Aber auch, dass sich die Weltwirtschaft etwas abgekühlt hat.
1250450	1254340	3890	Stützend wirkte das Wachstum im Schweizer Gesundheitswesen,
1254540	1258500	3960	im Versicherungssektor und in der Pharma- und Chemiebranche.
1258600	1264060	5460	Bremsspuren hinterliessen v.a. die Verlangsamung im Energiesektor,
1264190	1267740	3550	Baugewerbe und in der Finanzbranche.
1267820	1271260	3440	Auch in der Maschinenindustrie hapert es.
1271440	1278820	7380	Roland Goethe führt einen kleinen Blechverarbeitungsbetrieb in Glarus
1278970	1283340	4370	und ist Präsident des Branchenverbands Swissmechanic.
1283510	1288980	5470	Wir kommen ja von 1,60 Fr. pro Euro, sind jetzt auf 1,10 Fr.
1289100	1291340	2240	Unsere Marge ist jetzt so tief,
1291450	1294380	2930	dass die Luft irgendwann einmal draussen ist.
1294620	1296700	2080	Eric Scheidegger schildert die Konsequenzen,
1296820	1300580	3760	sollte das Nullwachstum anhalten.
1300780	1303420	2640	Wenn es nur vorübergehend ist, ist es nicht so schlimm.
1303640	1308860	5220	Aber ein anhaltendes Nullwachstum würde eine längerfristige Stagnation
1309010	1311780	2770	für die ganze Volkswirtschaft bedeuten.
1311930	1314940	3010	Das hätte sicherlich Auswirkungen auf die Beschäftigungsentwicklung,
1315040	1316980	1940	die Entwicklung der Arbeitslosigkeit.
1317080	1319980	2900	Aber auf längere Zeit hat eine längerfristige Stagnation
1320150	1322220	2070	auch Auswirkungen auf unsere Lohnentwicklung
1322350	1324220	1870	und auf unseren Wohlstand.
1324380	1327820	3440	So schnell wird der Schweizer Wirtschaftsmotor
1328040	1330140	2100	nicht aus dem Stottern herauskommen.
1330360	1335140	4780	Für 2016 rechnet das SECO nur mit einem kleinen Wachstum.
1339360	1341940	2580	Das Jahr 2015, dessen Tage schon bald gezählt sind,
1342150	1345180	3030	ist laut UNO eigentlich das internationale Jahr des Lichts.
1345290	1347660	2370	Und 2015 ist auch das Jahr,
