start	end	duration	text
1347810	1353500	5690	in dem die Abtei von St. Maurice im Wallis 1'500 Jahre alt wird.
1353600	1357260	3660	Und weil dieses Jubiläum just auf das Jahr des Lichts fällt,
1357480	1360980	3500	erstrahlt St. Maurice in besonderem Schein.
1361240	1365980	4740	Am Wochenende ist ein Fest des Lichts angesagt, mit 1'200 Kerzen,
1366150	1370420	4270	die schon seit Tagen in minutiöser Arbeit angebracht werden.
1370520	1372780	2260	Ein Kunstwerk, das vergänglich ist,
1373000	1376100	3100	das aber gleichzeitig der Beginn einer neuen Tradition sein könnte.
1376240	1379140	2900	Der Wunsch jedenfalls nach Wiederholung steht bereits im Raum,
1379360	1382980	3620	noch bevor das Fest am Samstag begonnen hat.
1384330	1388300	3970	In rund 2 Std. bei uns die nächsten Nachrichten mit Daniela Lager -
1388550	1392180	3630	und einem spannenden Gesprächspartner.
1392330	1395580	3250	Unrecht und undwürdig, sagen Parlamentarier heute,
1395720	1398300	2580	sei die Ausschlussdrohung der SVP
1398400	1401100	2700	an ihre nicht nominierten Mitglieder bei der Bundesratswahl.
1401260	1405860	4600	Die Reaktion von Parteipräsident Toni Brunner - im Interview um 10 vor 10.
1406040	1410700	4660	Dann berichten wir über die Zustände in Chinas Spielzeugfabriken -
1410780	1413540	2760	und zeigen, welche Rolle Basler Forscher spielen
1413660	1415940	2280	bei der aufgeregten Suche
1416100	1418620	2520	nach unentdeckten Schätzen im Grab Tutanchamuns.
1418720	1420070	1350	Danke, Daniela.
1421250	1422990	1740	Das war's von uns für Sie.
1423200	1425670	2470	"Weiter geht es auf SRF 1 mit ""Meteo"" und dem Krimi ""Der Kriminalist""."
1425880	1428470	2590	Einen unterhaltsamen Abend und bis bald.