start	end	duration	text
1323580	1327560	3980	Das Wunder vom Hudson kann nicht das Zentrum des Films sein.
1328250	1330680	2430	Regisseur Clint Eastwood beleuchtet in seinem jüngsten Drama darum
1331340	1335000	3660	v.a. das, was nach der Notwasserung geschah:
1335600	1337600	2000	Der gefeierte Pilot wurde von der Flugverkehrsbehörde
1338270	1339920	1650	ins Kreuzverhör genommen.
1340580	1342760	2180	Die beste Chance, die die Passagiere hatten, war der Fluss.
1343310	1344880	1570	Darauf würde ich mein Leben wetten.
1345600	1347640	2040	Das heisst: Das habe ich ja getan. Und ich würde es wieder tun.
1348290	1349440	1150	Luftfahrtingenieure mutmassen,
1350090	1352280	2190	das Erreichen einer der Landebahnen wäre möglich gewesen.
1352870	1356240	3370	Na ja, Ingenieure sind keine Piloten. Da liegen die falsch.
1356840	1359280	2440	Fakt ist: Sully musste eidesstattlich aussagen.
1359870	1362280	2410	Aber wurde das Flugverhalten des Volkshelden
1362910	1366120	3210	von der Untersuchungskommission wirklich so heftig kritisiert?
1366800	1369480	2680	Oder ist das alles bloss eine Zuspitzung Marke Hollywood?
1372700	1375760	3060	Wir haben den Film gemeinsam mit einem Mann gesehen,
1375860	1377960	2100	der sich mit dem Prozedere nach Notfällen auskennt:
1378660	1381240	2580	SWISS-Chefinstruktor Urs Baltisberger.
1381870	1384640	2770	Ist es realistisch, dass Piloten so hart angegangen werden?
1385200	1387600	2400	Ja, ich glaube, das ist realistisch.
1388240	1391440	3200	Ich denke, da sind sehr viele Interessen dahinter.
1392130	1393920	1790	Zum einen möchte der Flugzeughersteller beweisen,
1394600	1397320	2720	dass sein Flugzeug super ist für die Situation,
1397850	1400280	2430	in der er sich befindet.
1401000	1403920	2920	Zum anderen gibt es Passagiere, die finanzielle Entschädigungen wollen.
1404540	1410960	6420	Die Interessen daran, dass es der Fehler des Pilots war, sind gross.
1411590	1413400	1810	Und wenn ich das wirklich verbockt habe?
1413950	1415240	1290	(Frau) Was soll das heissen?
1415880	1418800	2920	Na ja, wenn ich mich geirrt haben sollte
1419450	1421040	1590	so kurz vor dem Ende meiner Karriere?
1421670	1425160	3490	Tom Hanks - hier in einer Drehpause neben dem echten Sully -
1425790	1429360	3570	bringt einem den berühmten Flugzeugkapitän verblüffend nahe.
1430080	1431640	1560	Ohne sein reduziertes Spiel
1432270	1436080	3810	hätte das psychologische Portrait nicht annähernd dieselbe Wirkung.
1436600	1439120	2520	Es geht um den Piloten, der sich allein im Hotelzimmer fragt:
1439750	1442600	2850	"""Warum behandeln mich plötzlich alle so komisch?"""
1443240	1446960	3720	Himmlischer Held oder Sündenbock? Die Fallhöhe ist riesig.
1447560	1450040	2480	"""Sully"" reizt das gesamte Gefühlsspektrum aus"
1450720	1454200	3480	und regt in seinen stärksten Szenen sogar zum Nachdenken an.
1454800	1456880	2080	Ich habe in meinen 40 Dienstjahren über 1 Mio. Passagiere befördert.
1457600	1460920	3320	Aber am Ende beurteilt man mich anhand von 208 Sek.
1463040	1466840	3800	Und uns beurteilen Sie anhand von 25 Min. Sendezeit -
1467470	1470760	3290	wenn Sie mitreden wollen auf Social Media zu unseren Stories heute:
1471390	1474360	2970	Unser Hashtag heisst #10vor10.
1475040	1476720	1680	"Nach ""SRF Meteo"" geht's hier gleich in die ""Arena""."
1477450	1479800	2350	Thema dort ist - na klar - das Hin und Her im Parlament
1480540	1482560	2020	zur Masseneinwanderungs-Initiative.
1483240	1485680	2440	Wir kommen dann am Montag wieder, Sie wissen schon wann.
1486410	1489440	3030	"Im Namen des Teams ""10vor10"" danke ich Ihnen fürs Zuschauen,"
1490000	1492400	2400	wünsche gute Nacht - und wunderbares Wochenende.
1493080	1497960	4880	SWISS TXT / UT-Redaktion Zürich Maria Krähenbühl, Meret Hachen Jasmin La Micela