start	end	duration	text
1480770	1482940	2170	Und wie können wir den Menschen beibringen,
1483110	1486340	3230	dass Fortschritt gut für sie ist, Arbeitsplätze schafft,
1486500	1489940	3440	Bildung und Unternehmertum demokratisiert?
1490120	1494180	4060	Wir durchleben einen Wandel, ja.
1494350	1498300	3950	Aber alles wird viel besser, als es jemals war.
1498450	1502100	3650	Es prallen Welten aufeinander in San Francisco.
1502330	1505900	3570	Jene, die befürchten, das Gute zu verlieren.
1506120	1510900	4780	Und: Jene, die das Gute gerade erst erfinden wollen.
1512980	1516340	3360	Im 2. Teil unserer Serie tauchen wir nächste Woche
1516500	1520100	3600	in die Start-up-Szene des Silicon Valley ein und zeigen:
1520310	1522900	2590	Hier mischen auch Schweizer mit.
1524350	1526420	2070	Hier gehts gleich weiter mit Roger Schawinski.
1526560	1529420	2860	Sein Gast ist der Spitzendiplomat Tim Guldimann,
1529550	1531780	2230	der im Auftrag des Bunderates
1531930	1534580	2650	zwischen der Ukraine und Russland vermittelt.
1534810	1537060	2250	Unsere nächste Sendung gibt es wieder in einer Woche.
1537270	1539660	2390	Wir freuen uns, wenn Sie auch dann dabei sind -
1539850	1542700	2850	schönen Abend und eine gute Woche.
1542930	1548050	5120	SWISS TXT / UT-Redaktion Zürich Ottavia Masserini, Sabine Näpflin