start	end	duration	text
1343520	1345570	2050	Und diese Föhnphase war natürlich wirklich dramatisch.
1346160	1348490	2330	An Niederschlag hat es der Schweiz in diesem Jahr
1349080	1350450	1370	trotz Schneemangel nicht gefehlt.
1351040	1353330	2290	Am Bodensee herrschte im Juni Alarmstimmung.
1353950	1355770	1820	Vielerorts gab es Überschwemmungen.
1356330	1359370	3040	Der Rheinfall riss Wassermengen mit sich wie seit Jahren nicht mehr.
1360080	1361770	1690	Und in den Bergen rutschten die Hänge.
1362480	1365250	2770	Es war ein sehr nasses Jahr, viel nässer als das Vorjahr.
1365900	1367490	1590	Das hat wahrscheinlich damit zu tun,
1368160	1370850	2690	dass die Wettersysteme immer mehr blockierend sind.
1371490	1374770	3280	Über Monate Trockenphasen, dann über Monate sehr nasse Phasen,
1375420	1379010	3590	wie wir das im Frühjahr erlebt haben, verbunden mit Hochwasser.
1379650	1382850	3200	Wir gehen aber davon aus, dass sich allgemein nicht sehr viel verändert.
1383480	1386130	2650	Der Durchschnitt der Jahre bleibt mehr oder weniger konstant.
1386820	1392250	5430	Am kältesten war es in diesem Jahr am 18. Januar in Buffalora am Ofenpass:
1392870	1395690	2820	-29,5 °C.
1396360	1400690	4330	Das ist kalt, aber 15 °C weniger kalt als in anderen Jahren.
1401340	1405730	4390	Den absoluten Hitzerekord verbuchte Visp im Wallis mit 35,3 °C -
1406330	1411250	4920	auch ein bescheidener Rekord im Vergleich zu den 40 °C anderer Jahre.
1411820	1413450	1630	Wir hatten in diesem Jahr sehr viel Niederschlag.
1414140	1417530	3390	Dadurch war die Temperatur gedämpft, aber auf einem sehr hohen Niveau.
1418230	1419890	1660	Schön war in diesem Jahr der Spätsommer -
1420520	1421970	1450	Badewetter bis Mitte September.
1422550	1425130	2580	Der Klimawandel schreitet voran - auch in der Schweiz.
1426460	1429170	2710	"Ein Thema der ""Rundschau"" haben wir schon angesprochen."
1429910	1431450	1540	Sandro Brotz kennt die anderen.
1432150	1433050	900	Genau, Florian.
1433670	1435730	2060	Gemeindefusionen machen wirtschaftlich kaum Sinn, wie gehört.
1436400	1437810	1410	Wir waren bei betroffenen Gemeinden.
1438460	1440210	1750	Die anderen Themen: Steh- statt Sitzplätze.
1440830	1442490	1660	Warum die neuen SBB-Doppelstockzüge
1443110	1444770	1660	nicht pünktlich auf die Schiene kommen.
1445340	1446450	1110	Und: Kurden im Visier -
1447140	1450090	2950	exklusive Reportage aus der türkischen Stadt Diyarbakir.
1450750	1452130	1380	Ab 20.55 Uhr bei uns.
1452870	1453530	660	Danke, Sandro.
1454620	1456570	1950	Das der Stand der Dinge im Moment.
1457260	1460010	2750	"Hier geht's jetzt weiter mit ""Meteo"" und dann geht's bei ""Top Secret"""
1460660	1463730	3070	wieder um finanziell mehr oder weniger lohnenswerte Briefschaften.
1464370	1466850	2480	Gute Unterhaltung und einen schönen Abend.