start	end	duration	text
1331390	1334030	2640	Was die prähistorischen Kunstwerke in der Höhle von Lascaux
1334180	1339990	5810	so einzigartig macht, ist, dass sie aus einer Hand zu stammen scheinen.
1340170	1345350	5180	Es ist ein wirklich einheitliches, homogenes Ensemble,
1345470	1347950	2480	eine Malerei von sehr hoher Qualität.
1348090	1351150	3060	Es ist ein Werk, finde ich, das man jenem eines Rembrandt,
1351440	1358790	7350	eines Vermeer oder auch Michelangelo oder Picasso gleichsetzen kann.
1358930	1363510	4580	Die prähistorischen Künstler hatten bereits einen Sinn für Perspektiven.
1363740	1368710	4970	So scheinen diese Hirsche durch einen Fluss zu schwimmen.
1368830	1371950	3120	Wir waren sehr beeindruckt.
1372120	1374350	2230	Nicht nur von den verwendeten Maltechniken,
1374540	1377470	2930	sondern insbesondere vom weit entwickelten Verständnis,
1377600	1379630	2030	Bewegung darzustellen.
1379900	1383070	3170	Z.B. mit der Vervielfachung von Beinen in verschiedenen Stellungen,
1383210	1386270	3060	um ein Rennen zu zeigen.
1386390	1388630	2240	Erkennbar wird die gemalte Bewegung
1388860	1391870	3010	an einem der interaktiven Computer der Ausstellung.
1392060	1394830	2770	Die Bilder lernten nicht erst mit Micky Maus laufen -
1394960	1399350	4390	der erste Trickfilm stammt offenbar aus dem Paläolithikum.
1399580	1402870	3290	Die Ausstellung stellt die Geschichte der Höhle dar: ihre Entdeckung,
1403060	1406350	3290	die Erkundung des Gangsystems, die Deutung der Bilderflut.
1406540	1409190	2650	Lascaux birgt noch viele Mysterien.
1409350	1412390	3040	Das Einzige, was wir sicher wissen, ist,
1412500	1414750	2250	dass die Malereien von Lascaux
1414980	1417870	2890	Emotionen, Gefühle und Gedanken vermitteln.
1417980	1420550	2570	Es ist die Geburt der Symbolik.
1420680	1422710	2030	Als der Mensch auszudrücken lernte,
1422960	1427390	4430	was er im Innern empfand und er von aussen gesehen hatte.
1428770	1433110	4340	"Und nun zu den Themen von ""10vor10"" mit Daniela Lager:"
1433270	1436750	3480	"""Wir schaffen das"", sagte Bundeskanzlerin Merkel"
1436930	1439630	2700	zu Beginn der grossen Flüchtlings- bewegung nach Deutschland.
1439810	1442830	3020	"""Wir schaffen es nicht mehr"", sagen deutsche Politiker heute."
1443060	1446030	2970	Wir zeigen im Fokus, wie Deutschland es bis jetzt schafft,
1446170	1449990	3820	und wo Behörden und Infrastruktur tatsächlich an ihre Grenzen stossen.
1450180	1453230	3050	Der Kanton Zug hat einen vielbeachteten Versuch gestartet:
1453370	1456950	3580	die KV-Lehre ganz in englischer Sprache. We have a look!
1457060	1459630	2570	Und: Wir stellen Ihnen eine Frau mit Gottvertrauen vor.
1459820	1463590	3770	Die junge Theologin aus Luzern will katholische Priesterin werden,
1463730	1466990	3260	und das noch in diesem Leben. Alles weitere um 10 vor 10.
1467110	1468310	1200	Danke, Daniela.
1469470	1471070	1600	Das wars von uns für Sie.
1471280	1473950	2670	"Weiter geht es auf SRF 1 mit ""Meteo"" und dem Quiz ""1 gegen 100""."
1474090	1476430	2340	Einen schönen Abend allerseits, bis bald!
1476650	1480630	3980	SWISS TXT / UT-Redaktion Zürich Philipp Schlatter, Roger Schmid, Selma Holenstein