start	end	duration	text
1249200	1250940	1740	Auch sonst sind an der Eröffnungszeremonie
1251660	1253060	1400	Misstöne nicht zu überhören.
1253630	1256660	3030	Buhrufe für Brasiliens Übergangspräsident Michel Temer.
1257400	1260220	2820	Er soll an der umstrittenen Amtsenthebung
1260880	1263780	2900	seiner Vorgängerin Dilma Rousseff mitgewirkt haben.
1264480	1266900	2420	Gegen Rousseff leitet das Parlament im März
1267600	1269420	1820	ein Amtsenthebungsverfahren ein.
1270120	1271980	1860	Der Vorwurf: Sie sei korrupt.
1272640	1275700	3060	Sowohl im Parlament als auch auf der Strasse gehen die Wogen hoch.
1276350	1278220	1870	Die Zeiten der Mafia sind zu Ende.
1278840	1282940	4100	Vorbei mit der Arbeiterpartei, vorbei mit Korruption!
1283640	1286700	3060	Es ist klar, dass da Verschwörer am Werk sind,
1287340	1290380	3040	die für einen bewusst herbeigeführten Staatsstreich
1291080	1292540	1460	zusammenarbeiten.
1293120	1295700	2580	Anfang Mai muss Rousseff ihren Amtssitz räumen.
1296360	1299100	2740	Ende August ist sie definitiv abgesetzt.
1299800	1303380	3580	Trotz politischer Instabilität, Angst vor dem Zika-Virus
1304050	1306100	2050	und Algen im Pool der Wasserspringer -
1306720	1308860	2140	in Erinnerung bleiben von den Spielen in Rio
1309600	1311220	1620	auch viele sportliche Höhepunkte:
1311840	1313220	1380	Der Schwimmer Michael Phelps
1313850	1316940	3090	mit seinem Allzeitrekord von 28 Olympiamedaillen.
1317600	1324500	6900	Oder Sprint-Superstar Usain Bolt mit seinem dritten Dreifachgold.
1325200	1327220	2020	Auch die Schweiz hatte Grund zum Jubeln:
1327880	1330260	2380	Insgesamt sieben Medaillen heimsten die Eidgenossen ein,
1330820	1334460	3640	so viele, wie seit Sydney im Jahr 2000 nicht mehr.
1336910	1339140	2230	(Kommentator) Die Schweizer gewinnen Gold.
1344600	1347860	3260	Wir sind unglaublich stolz. Geiles Team, geile Typen.
1350260	1352300	2040	Ich habe so viel geweint,
1353040	1355420	2380	so viele Emotionen gingen durch meinen Körper.
1365510	1369780	4270	"Und jetzt zu Arthur Honegger und den heutigen Themen von ""10vor10"":"
1370390	1371460	1070	Danke, Cornelia.
1372190	1374220	2030	Wir haben ein türkisches Ehepaar getroffen,
1374870	1376780	1910	das vor der harten Hand Erdogans in die Schweiz geflüchtet ist -
1377410	1379540	2130	ein beunruhigender Erlebnisbericht.
1380200	1383580	3380	Dann zeigen wir, wie das Gesetz ab Neujahr Scheidungskindern erlaubt,
1384270	1386380	2110	bei beiden Eltern wechselseitig aufzuwachsen -
1387030	1388740	1710	und wo die Probleme dabei liegen.
1389330	1392820	3490	Und schliesslich unsere Alpenserie: Hüttenparty mit Grölmusik.
1393400	1395220	1820	Das heisst auf Österreichisch: Ischgl.
1395880	1398100	2220	Okay, das stimmt zwar nicht, trifft die Sache aber recht genau.
1398760	1400020	1260	Schauen Sie selbst um 10 vor 10.
1400670	1401820	1150	Danke, Arthur.
1402910	1405620	2710	"Nun gleich ""Meteo"", und danach nimmt Sie mein Kollege Peter Gysling"
1406260	1408740	2480	"im Rahmen der gleichnamigen ""DOK""- Serie mit auf die Seidenstrasse."
1409480	1411340	1860	Einen schönen Abend und auf Wiedersehen.
1412120	1415420	3300	SWISS TXT / UT-Redaktion Zürich Claudia Burri, Manuela Waldner, Alexandra Duttweiler