start	end	duration	text
1228660	1232710	4050	Einer von den neuen Superreichen ist er: Chen Guangbiao.
1232870	1238110	5240	Der Unternehmer hat mit Abfall ein Vermögen gemacht. Sein Rezept:
1238270	1241510	3240	Um erfolgreich zu sein, muss man zuerst einmal wissen,
1241620	1245270	3650	wie man sein verdientes Geld ausgeben will.
1245480	1248430	2950	Und v.a. muss man sein Geschäft lieben.
1248560	1251310	2750	Stolze 3,2 Mrd. US-Dollar
1251460	1253830	2370	besitzt ein asiatischer Milliardär im Durchschnitt.
1253980	1257630	3650	Das ist zwar über 1 Mrd. weniger als ein Milliardär durchschnittlich
1257810	1262990	5180	aus Europa oder den USA besitzt, aber die Chinesen holen auf.
1264780	1267310	2530	Die chinesische Wirtschaft wird die amerikanische überholen
1267520	1270150	2630	aufgrund der Anzahl Menschen, die in dieser Gesellschaft leben.
1270330	1275630	5300	Und aufgrund der sehr hohen, durchschnittlichen Ausbildungsquote,
1275760	1277310	1550	die es in diesem Land gibt.
1277450	1279830	2380	Die meisten chinesischen Milliardäre haben ihren Reichtum
1280050	1283750	3700	selber erwirtschaftet, sind sog. Selfmade-Milliardäre.
1283830	1286630	2800	Aber der Reichtum währt nicht ewig.
1286780	1292390	5610	Es gibt ein chinesisches Sprichwort, das besagt:
1292550	1295150	2600	"""Ein Vermögen überdauert keine drei Generationen."""
1295320	1300160	4840	Mein Geld wird von den Erben verprasst werden.
1300300	1303080	2780	Aber es gibt auch viele, nicht nur in China,
1303260	1306180	2920	die ihr Geld an wohltätige Vereine spenden.
1307950	1311660	3710	Geschätzte 600'000 Kunstwerke haben die Nazis
1311750	1316460	4710	in der Zeit zwischen 1939 und 1944 ihren Besitzern weggenommen.
1316630	1319700	3070	Die Opfer waren meist Juden.
1319840	1322700	2860	"Auch sie, ""Die goldene Adele"" von Gustav Klimt,"
1322860	1326020	3160	wurde damals ihren ursprünglichen Besitzern quasi entrissen.
1326180	1330780	4600	Die rechtmässige Erbin kämpfte nach dem Krieg jahrelang um das Bild.
1330880	1335220	4340	Ein Kinofilm bringt diesen Kampf nun mit Starbesetzung auf die Leinwand.
1335470	1338660	3190	"""Woman in Gold"" startet diese Woche in den Schweizer Kinos."
1340990	1345500	4510	"""Woman in Gold"" erzählt die wahre Geschichte der Jüdin Maria Altmann."
1345590	1347740	2150	Als junge Frau floh sie
1347950	1350780	2830	aus dem von Hitler besetzten Österreich in die USA.
1350950	1353740	2790	Mit 82 Jahren will sie das Bild zurück,
1353950	1356820	2870	das die Nazis ihrer Tante geraubt haben.
1384170	1386540	2370	"Die Macher von ""Woman in Gold"" möchten zeigen,"
1386660	1388660	2000	dass auch 70 Jahre nach Kriegsende
1388830	1391940	3110	das Thema Raubkunst nicht abgeschlossen ist.
1392750	1394980	2230	Noch immer sind mind. 100'000 Kunstwerke
1395070	1397220	2150	nicht ihren Besitzern zurückgegeben worden.
1397470	1400940	3470	Das ist eine grosse Angelegenheit, über die selten berichtet wird.
1401100	1405100	4000	Sechs Jahre kämpft Maria Altmann gegen die österreichische Regierung.
1405220	1408140	2920	Diese verweigert die Rückgabe der goldenen Adele
1408250	1410420	2170	aus formalistischen Gründen.
1410600	1415820	5220	Erst das österreichische Schiedsgericht gibt ihr Recht, 1:16.
1417360	1420060	2700	Für die reale, damals 90-jährige Maria Altmann
1420140	1422380	2240	ein grosser Glücksmoment.
1422950	1424900	1950	Es ist wunderbar,
1424990	1428420	3430	dass Gerechtigkeit nach so vielen Jahren stattfinden kann.
1429080	1432660	3580	Helen Mirren spielt die couragierte Kämpferin.
1432870	1435300	2430	Der Jüdische Weltkongress hat die britische Schauspielerin
1435600	1438740	3140	für diese Rolle kürzlich ausgezeichnet.
1442650	1446460	3810	Der Film läuft übermorgen Donnerstag in den Schweizer Kinos an.
1446580	1447860	1280	"Von der ""Woman in Gold"""
1448060	1449860	1800	"zu Daniela Lager und den Themen von ""10vor10""."
1450070	1451820	1750	Die SVP lehnt die Vorschläge des Bundesrates
1452070	1455060	2990	zur Umsetzung der Massen- einwanderungsintiative ab.
1455220	1457620	2400	Genauso wie die Vorschläge der anderen Parteien.
1457710	1462020	4310	Wir haken nach beim Studiogespräch mit SVP-Parteipräsident Toni Brunner.
1462080	1465660	3580	Sepp Blatter ist fast schon gewählt für eine fünfte Amtszeit.
1465870	1468380	2510	Doch diese dürfte kein leichtfüssiges Dribbling werden.
1468550	1473100	4550	Der Klotz am Bein heisst WM 2022 in Katar.
1473330	1476860	3530	Und: In jungen Jahren hat er den Duromatic-Dampfkochtopf erfunden.
1477020	1479260	2240	Im hohen Alter von über 90
1479510	1482220	2710	lässt er zusammen mit seiner Frau Leute umbringen.
1482340	1485060	2720	Zu Besuch beim Krimi-Schriftsteller-Paar
1485160	1487620	2460	Kuhn und Kuhn in Rikon - um 10 vor 10.
1487730	1488940	1210	Danke, Daniela!
1489880	1492100	2220	Wird das Wetter endlich besser?
1492280	1494900	2620	"Da wissen gleich nach uns die Kollegen von ""Meteo"" Bescheid."
1495070	1498500	3430	"Und danach übernimmt ""Die Chefin"" mit einem neuen Mordfall."
1498590	1500660	2070	Einen schönen Abend und bis morgen!
1500920	1503300	2380	SWISS TXT / UT-Redaktion Zürich Lilian Zbinden, Nadina Derungs, Daniela Zacheo