start	end	duration	text
1294320	1296390	2070	Die kleinen Zeitreisen, die sie damit fabriziert,
1296520	1299230	2710	stossen seit Jahren weltweit auf grosse Aufmerksamkeit.
1299280	1301590	2310	Jetzt wird ihr Werk in der Schweiz gezeigt.
1301790	1304670	2880	Samira Matta hat die aktuelle Aus- stellung im Zürcher Viadukt besucht.
1306690	1310670	3980	"Gemütlicher Gitarrensong ""Look at me"" von John Lennon"
1312290	1313910	1620	Eine überraschende Zeitreise,
1314020	1317550	3530	festgehalten auf einem exakt nachgestellten Foto.
1324500	1327430	2930	Hier im Zürcher Westflügel, einer neuen Plattform für Fotografie,
1327570	1330310	2740	werden Irina Wernings Bilder gezeigt.
1330410	1336270	5860	Eine einmonatige Schau, ausgewählt von Jann Jenatsch.
1336360	1339390	3030	Irina Werning schafft es, mit ihrer Gegenüberstellung zweier Bilder,
1339590	1344110	4520	ein Vorher und Nachher, eine Zeit in der Fotografie auszudrücken,
1344300	1346710	2410	die wahnsinnig spannend ist.
1346870	1348790	1920	Und sie geht eigentlich noch viel weiter,
1348900	1351910	3010	bleibt nicht nur auf dieser Ebene, indem sie uns vor Augen führt,
1352000	1355550	3550	was es heisst, wenn wir älter werden,
1355720	1357790	2070	was es heisst, wenn wir uns verändern.
1358020	1361110	3090	Indem sie eben versucht, es gleich zu behalten.
1361230	1368030	6800	Die Fotografin nimmt alte Fotos und stellt sie Jahre später nach -
1368190	1370590	2400	mit denselben Personen, die genauso gekleidet, frisiert
1370790	1375070	4280	und positioniert sind wie das Original.
1375260	1377830	2570	Jann Jenatsch kennt die Künstlerin persönlich
1378030	1383150	5120	und hat sie in Argentinien auch schon bei ihrer Arbeit begleitet.
1383250	1384950	1700	Sie wählt ein Bild aus.
1385130	1387950	2820	Und dann sucht sie stundenlang die Requisiten auf dem Bild zusammen,
1388110	1391230	3120	weil sie nichts dem Zufall überlässt.
1391370	1394830	3460	Sie verlässt sich also nicht auf Leute, die sagen:
1394910	1397350	2440	"""Doch, doch, ich habe noch so einen Pulli."""
1397580	1399950	2370	Sondern sie bringt wirklich alles mit,
1400150	1403790	3640	um beim Fotoshooting dann wirklich genau das Gleiche machen zu können.
1403940	1407910	3970	Die Fotografin Irina Werning bei der Arbeit.
1408110	1411550	3440	Requisiten und Kleider findet sie auf Flohmärkten, in Brockenhäusern
1411680	1414230	2550	oder näht sie selber.
1414380	1420790	6410	Inzwischen gibt es Aufnahmen aus 36 Ländern.
1420970	1423870	2900	Bei diesem Bild ist interessant, dass die abgebildete Person -
1424050	1428870	4820	hier ein Junge und hier ein Mann - eigentlich fast gleich gross sind.
1429080	1432150	3070	Aber sie sind definitiv nicht gleich gross,
1432230	1434510	2280	das sieht man am Verhältnis zu der Puppe.
1434670	1437430	2760	Und man sieht z.B. auch, dass die Pflanze gewachsen ist.
1437560	1440670	3110	Die Zeit wird wirklich sichtbar.
1440840	1444510	3670	Werden die Menschen schöner oder hässlicher?
1444690	1446830	2140	Das hängt etwas von den einzelnen Personen ab,
1447070	1450870	3800	aber normalerweise finde ich, sie werden schöner.
1450990	1454430	3440	Sie haben mehr Charakter.
1454540	1456630	2090	"Vor Kurzem wurde der Fotoband ""Back to the Future"""
1456730	1460630	3900	für den PhotoBook Award nominiert.
1460720	1466230	5510	Der PhotoBook Award ist eine Art Oscar für Fotobücher.
1466300	1469310	3010	Wenn man dort nur schon auf der Liste ist,
1469440	1472430	2990	heisst das, dass man ein ganz tolles Werk geschaffen hat.
1472670	1478550	5880	"Gemütlicher Gitarrensong ""Look at me"" von John Lennon"
1492750	1495910	3160	"Die Ausstellung ""Back to the Future"" bis Ende Monat im Zürcher Westflügel,"
1496040	1497910	1870	im Viadukt Zürich.
1498140	1499950	1810	Kinderschutz oder Behördenwahn?
1500030	1501910	1880	"Die ""Arena"" debattiert nach ""Meteo"""
1502090	1504230	2140	über das neue Kinder- und Erwachsenen-schutzrecht.
1504360	1506710	2350	Ich danke fürs Zuschauen und wünsche
1506910	1511830	4920	SWISS TXT / UT-Redaktion Zürich Regina Kolb, Dana Widmer, Mirela Muminovic