start	end	duration	text
1297490	1300620	3130	Doping im Profifussball - gibt es gar nicht, und wenn doch,
1300790	1303540	2750	sind das Einzelfälle und womöglich aus Versehen.
1303800	1307460	3660	So nachsichtig klang das aus verschiedensten Ecken und jahrelang.
1307630	1310340	2710	Jetzt aber soll es - zumindest im deutschen Profifussball -
1310530	1312380	1850	zum ersten Mal Beweise geben,
1312530	1317020	4490	dass Ende 70er-, Anfang 80er-Jahre systematisch gedopt wurde.
1317160	1319700	2540	Es habe einen Plan, eine Struktur gegeben,
1319800	1322380	2580	sagt die Untersuchungskommission der Universität Freiburg,
1322530	1325820	3290	die die Doping-Vergangenheit aufarbeitet:
1326980	1329060	2080	Er spielte die zentrale Rolle:
1329230	1331980	2750	der Freiburger Sportmediziner Armin Klümper.
1332150	1334020	1870	Einst einer  d e r  Sportmediziner Deutschlands.
1334180	1336540	2360	Klümper soll neben namhaften Einzelsportlern
1336680	1338700	2020	auch den Bundesligisten VfB Stuttgart
1338800	1340860	2060	über Jahre mit Medikamenten beliefert haben.
1341000	1343900	2900	Nicht nur legale Arzneimittel - auch verbotenes Anabolikum.
1344000	1346260	2260	Mindestens 3 Lieferungen und eine Nachbestellung
1346400	1348300	1900	konnten nachgewiesen werden.
1348400	1350300	1900	Auch der damalige Zweitligist SC Freiburg
1350450	1353340	2890	soll von Klümper versorgt worden sein.
1353830	1355900	2070	Wer genau die Dopingmittel verabreicht bekam,
1356050	1358900	2850	ist von der Freiburger Kommission nicht zu erfahren.
1359000	1360660	1660	Die Akten belegen keine Namen -
1360800	1365700	4900	dafür ein Dopingsystem, finanziert und organisiert - auch durch Vereine.
1365800	1368020	2220	Da stellen sich jetzt viele Fragen:
1369360	1372340	2980	Wer war eigentlich für was verantwortlich,
1372520	1374540	2020	wer konnte was wissen,
1374800	1376500	1700	wie viele Leute haben was wissen können
1376660	1378340	1680	und wie viele Leute haben die Augen zugemacht?
1378520	1380260	1740	Die erfolgreiche Ära des VfB Stuttgart
1380390	1382260	1870	Ende 70er- Anfang 80er-Jahre.
1382430	1385940	3510	Mit Spielern von Hansi Müller über Karl Allgöwer, Karl Heinz Förster
1386060	1387980	1920	bis hin zu Dieter Hoeness.
1388160	1389980	1820	Auch wenn keine konkreten Namen genannt werden -
1390080	1392900	2820	ihre Erfolge stehen nun im Schatten des Dopingvorwurfs.
1393090	1396460	3370	Vom VfB Stuttgart nur die schriftliche Mitteilung:
1411800	1415020	3220	Wegen Verjährung hätte Klümper, der seit Jahren in Südafrika wohnt,
1415130	1416580	1450	keine Strafe zu befürchten.
1416800	1420740	3940	Die Befunde sollen aber zeigen, wie er mittels Rezeptbetrugs agierte
1420910	1424380	3470	und dies wohl nicht ohne das Wissen der damaligen Vereinsführungen.
1425750	1429620	3870	"Wir sind bei der Vorschau auf ""10vor10"" mit Daniela Lager:"
1429780	1433900	4120	Der Verlust von Arbeitsplätzen wegen des starken Frankens
1434000	1435580	1580	steht bei uns im Zentrum:
1435800	1439580	3780	Wir gehen den Fragen nach, wohin Schweizer Firmen die Jobs verlagern,
1439750	1442420	2670	und ob das jetzt einfach so weitergeht.
1442530	1447540	5010	Der Deal bei der Zweitwohnungs- Initiative, den SVP und FDP gestern
1447630	1449660	2030	mit den Initianten eingefädelt haben,
1449810	1452540	2730	ist im Nationalrat mehrheitlich gut angekommen -
1452660	1456180	3520	ganz anders tönt es in Berg- und Tourismusregionen.
1456360	1459420	3060	Und: Der IS-Vollstrecker Dschihadi John
1459640	1462180	2540	ist in guten Verhältnissen in London aufgewachsen.
1462360	1464260	1900	Unser Korrespondent in Grossbritannien
1464380	1468380	4000	hat sich auf Spurensuche gemacht bei Lehrern und Nachbarn -
1468500	1471300	2800	zu sehen um 10 vor 10.
1471380	1472700	1320	Danke, Daniela.
1473600	1475580	1980	Das der Stand der Dinge im Moment.
1475710	1478060	2350	"Hier geht es jetzt weiter mit ""Meteo"""
1478230	1479900	1670	"und dann ermittelt wieder ""Der Kriminalist"""
1480000	1481500	1500	im kriminellen Milieu.
1481650	1483380	1730	Gute Krimiunterhaltung und einen schönen Abend.
1483610	1486540	2930	SWISS TXT / UT-Redaktion Zürich Philipp Schlatter, Dana Widmer, Tanja Morana