start	end	duration	text
1371960	1375030	3070	entstand nach den Plänen von Herzog & De Meuron.
1375230	1378550	3320	Warum auf der einen Seite eine Seilbahnstation
1378710	1380750	2040	und auf der anderen Seite ein Fussballstadion?
1380850	1383150	2300	Die Auswahl erfolgt sorgfältig.
1383280	1386030	2750	Wir wollen wirklich herausfinden, was das Potenzial ist
1386160	1388550	2390	und v.a. wer dahintersteckt.
1388730	1392510	3780	Der Austausch mit der Bauherrschaft ist auch wichtig.
1392680	1396390	3710	Wir sind nicht allein im Büro und entwickeln das Projekt,
1396550	1400870	4320	sondern stehen in Austausch mit dem Ort, dem Klima und mit dem Bauherrn.
1401040	1402190	1150	Das ist sehr wichtig.
1402350	1405310	2960	Rund 400 meist junge Architekten und Spezialisten
1405460	1407630	2170	arbeiten heute in den Basler Ateliers.
1407780	1413470	5690	Vor dem ersten Londoner Tate-Projekt waren es ein paar Dutzend.
1413560	1416550	2990	Pierre De Meuron und Jaques Herzog
1416760	1418750	1990	versuchen mit ihrer Architektursprache
1418930	1423250	4320	auf die Umgebung und die Bedürfnisse der Nutzer der Gebäude einzugehen.
1423410	1428410	5000	Das Resultat sind die unterschiedlichsten Formen.
1428520	1432450	3930	Kritiker sagen, ein Herzog-De-Meuron- Gebäude erkenne man an der Qualität,
1432610	1435250	2640	nicht aber an einem spezifischen Stil.
1435350	1437930	2580	Haben die Basler keinen eigenen Stil?
1438120	1440450	2330	Für uns wäre es eigenartig,
1440670	1443770	3100	wenn wir unserem eigenen Stil treu bleiben müssten.
1443890	1446530	2640	Was ist das schon, ein eigener Stil?
1446640	1449450	2810	Ein eigener Stil ist eigentlich etwas Langweiliges,
1449560	1452530	2970	es ist eine Verzweiflung.
1452640	1454290	1650	Es ist immer das Gleiche.
1454520	1457730	3210	Man schaut es sich an: Es ist typisch Herzog resp. De Meuron.
1457830	1458970	1140	Was soll das?
1459080	1462290	3210	Wir haben uns das nie gross überlegt.
1462320	1463970	1650	Es ist so entstanden,
1464200	1465930	1730	und wir sind froh, dass wir das nicht gemacht haben.
1466120	1469530	3410	Die endgültige Backsteinfassade des Tate-Modern-Anbaus
1469690	1472210	2520	spielt virtuos mit Licht und Schatten.
1472340	1475610	3270	Bei der Planung des Baus experimentierten die Architekten
1475750	1477530	1780	monatelang mit Karton und Schaumstoff.
1477760	1479530	1770	Mit einem wesentlichen Ziel:
1479640	1482890	3250	Architektur muss den Leuten Freude und Spass machen.
1483010	1484790	1780	Dann ist sie nachhaltig.
1484890	1487790	2900	Architektur, die Freude macht.
1487930	1492910	4980	Die Tate Modern ist der lebendige Beweis dafür.
1493950	1495790	1840	Das war's von uns.
1495940	1498190	2250	Wenn Sie die Themen dieser Sendung auf Social Media diskutieren wollen:
1498310	1500310	2000	Unser Hashtag heisst 10vor10.
1500460	1504830	4370	"Nach ""Meteo"" zeigt ""ECO"", was hinter der Idee vom Helikoptergeld steckt -"
1504950	1507310	2360	gratis Geld für alle von Notenbanken.
1507450	1510870	3420	Klingt verrückt, wird unter Ökonomen aber heiss diskutiert.
1510960	1512750	1790	"Danach folgt ""Schawinski""."
1512890	1516870	3980	Wir kommen dann morgen wieder - bis dahin gute Nacht und gute Zeit.
1517080	1520150	3070	SWISS TXT / UT-Redaktion Zürich Daniel McMinn, Roman Brauchli, Sabine Näpflin