start	end	duration	text
5040	5820	780	.
6630	7740	1110	1:1-Untertitelung. Livepassagen können Fehler enthalten.
8480	9740	1260	Guten Abend, meine Damen und Herren.
10500	11740	1240	"Hier ist die ""Tagesschau"", und das sind die Themen heute Sonntag,"
12470	15020	2550	an dem die Schweiz einen neuen König, einen Schwingerkönig hat. Und es ist:
16300	20180	3880	Der 30-jährige Matthias Glarner übertrumpft die jungen Wilden.
22140	26740	4600	Am Monte-Rosa-Massiv verunglücken drei Schweizer tödlich.
29040	32500	3460	Die Kanzlerin ist im In- und Ausland isoliert -
33140	34660	1520	und verteidigt ihre Politik.
35790	40180	4390	Telefonkabinen sollen an vielen Orten verschwinden.
42370	46860	4490	Zeitweise stark bewölkt und gebietsweise Regen oder Gewitter.
48920	52430	3510	Der König ist entmachtet, es lebe der neue König.
53070	58870	5800	Matthias Sempach hat seinen Titel nicht verteidigen können.
59590	61750	2160	Es ist allerdings wieder ein Matthias - Matthias Glarner.
62520	64790.00000000001	2270	Und erneut ein Berner, der diesmal das Eidgenössische gewinnt
65519.99999999999	67270	1750	und den Königskranz aufgesetzt bekommt.
67900	69070	1170	Dank eines Sieges im Schlussgang,
69800	72390	2590	gegen einen der zahlreichen, jungen aufstrebenden Schwinger.
73200	74360	1160	Wie alle drei Jahre erhält auch Glarner
75070	78000	2930	traditionellerweise einen Muni als lebenden Hauptpreis.
78720	80320	1600	Mehr dazu, also nicht zum Muni natürlich,
81150	83240	2090	sondern zum Schwingerkönig, von Daniela Milanese.
84150	87560	3410	Der Schlussgang bot zum Abschluss des Eidgenössischen in Estavayer
88270	89680	1410	noch einmal Schwingsport vom Feinsten.
90340	91800	1460	Und mit Matthias Glarner und Armon Orlik
92600	95400	2800	standen sich zwei Schwinger gegen- über, die das Fest geprägt hatten.
96150	99160	3010	Das Duell Glarner gegen Orlik, war aber auch der erste Schlussgang
99900	103200	3300	zwischen den rivalisierenden grossen Verbänden Bern und Nordostschweiz
103880	105120	1240	seit über 30 Jahren.
105780	109160	3380	Und es war das packende Duell zwischen Routinier und Jungstar.
110910	113280	2370	Der Schlussgang beginnt
113930	118039.99999999999	4110	mit einem Feuerwerk des jungen Armon Orlik (21) in den dunklen Hosen.
126300	129639.99999999999	3340	Doch der erfahrene Matthias Glarner zeigt sich hellwach.
130310	133440	3130	In der Folge ist Matthias Glarner einen Hauch gefährlicher
134110	136120	2010	und einmal auch sehr nah am Sieg.
139110	141640	2530	Doch Armon Orlik zeigt, dass er nicht nur angreifen,
142390	144400	2010	sondern auch verteidigen kann.
145110	148520	3410	Nach etwas mehr als 13 Min. die Entscheidung.
149320	153360	4040	Matthias Glarner kontert einen Angriff und holt sich den Königstitel
154079.99999999997	160880	6800	und mit dieser extrem sportlichen Geste auch alle Sympathien.
166000	169960	3960	Die Erfahrung des 30-jährigen Berner Oberländer hat gesiegt,
170690	174520	3830	doch auch der junge Armon Orlik hat grossen Sport geboten.
175250	177960	2710	Mit sieben Siegen und einem Gestellten
178700	182560	3860	ist Matthias Glarner der verdiente Schwingerkönig 2016.
188000	190560	2560	Das erste Interview nach seinem Triumph
191240	192440	1200	nutzte der neue Schwingerkönig,
193090	195240	2150	um seinem jungen Gegner ein Kränzchen zu winden.
195960	199000	3040	Seinen eigenen Erfolg kann Matthias Glarner gar noch nicht recht fassen.
199990	201840	1850	Es ist schon noch cool.
202550	204920.00000000003	2370	Ich habe es noch gar nicht recht realisiert.
205720	208560	2840	Das wird noch kommen, aber es braucht noch etwas Zeit.
209140	210280	1140	Es ist fantastisch.
211030	215320	4290	Es ist unglaublich, was Ihr Gegner im Schlussgang gezeigt hat.
216010	219120	3110	Ein Wort zu Orlik Armon?
219880	223440	3560	Es ist schlicht fantastisch, wie er schwingt.
224180	226880	2700	Ich habe die Videos von seinen Gegnern mitverfolgt.
227620	229660	2040	Mir kamen beinahe die Tränen vor Freude.
230310	232380	2070	Es ist wahnsinnig, wie er schwingt.
233010	236860	3850	* Jubel und Applaus *
237579.99999999997	240700	3120	Er ist ein grosses Versprechen für die Zukunft.
241520	244740	3220	Wenn er dieselben Schritte wie letztes Jahr zu diesem Jahr
245520	247620	2100	weiter macht, hat er alle Fähigkeiten dazu,
248400	250300	1900	diesen Sport über längere Zeit zu dominieren.
251150	253380	2230	Die nächste Chance, Schwingerkönig zu werden,
254030	255980	1950	bietet sich Armon Orlik allerdings erst in drei Jahren.
256700	260459.99999999997	3760	Bis zum Eidgenössischen 2019 in Zug regiert nun König Glarner.
261130	264820	3690	So viel von uns für den Moment, mehr Sport gibt's später in der Sendung.
265780	268660	2880	Im Kanton Schaffhausen ist es der SP nicht gelungen,
269470	271260	1790	einen zweiten Sitz in der Regierung zu erobern.
272000	275110	3110	In der fünfköpfigen Regierung bleibt die Sitzverteilung wie gehabt.
275810	277790	1980	Alle drei Bisherigen sind wiedergewählt worden.
278550	281350	2800	Mit dem besten Resultat Ernst Landolt von der SVP.
282040	288430	6390	Danach Christian Amsler, FDP und Rosmarie Widmer Gysel, SVP.
289110	291750	2640	Neu gewählt wurden Martin Kessler, FDP,
292440	295630	3190	und Walter Vogelsanger von der SP.
296710	299310	2600	Zügig, mit Schwung,
299980	303630	3650	so präsentieren sich die zwei neuen Regierungsräte den Medien.
304410	307750	3340	Politisch dominieren in Schaffhausen unverändert SVP und FDP
308460	309590	1130	das Fünfergremium.
310240	312030	1790	Der SP-Vertreter, ein Einzelkämpfer.
312850	316310	3460	Sein Rezept, wie er linke Anliegen trotzdem durchbringen möchte:
317090	320870	3780	Man muss die Probleme mit einer gewissen Gelassenheit angehen.
321620	324670	3050	Kurzschlüsse sind immer eine schlechte Wahl.
325400	328270	2870	Überraschend deutlich hat der freisinnige Martin Kessler
328960	329670	710	den Sprung geschafft.
330370	332350	1980	Der Unternehmer gibt sich zurückhaltend zu seinen Zielen,
333080	334870	1790	setzt auf Kontinuität.
335600	337230	1630	Ich will niemandem versprechen,
337970	341030	3060	dass ich am ersten Tag in Schaff- hausen gleich die Welt verändere,
341640	343230	1590	aber grundsätzlich kann man
343950	346870	2920	mit einer soliden, bürgerlichen Regierungsarbeit rechnen.
347590.00000000006	349030	1440	Dafür will ich mich einsetzen.
349720	351870	2150	Trotz bürgerlicher Dominanz:
352550	355110	2560	In der Regierung bleibt doch nicht ganz alles wie bisher.
355890	357670	1780	SRF-Korrespondentin Brigit Weibel:
358370	361070	2700	Die SP hat heute ihre historische Chance verpasst,
361840	364910	3070	den vor 16 Jahren an die FDP verlorenen Sitz zurückzuerobern.
365660	369390	3730	Dennoch bleibt im Kanton Schaffhausen nicht alles beim Alten.
370090	373190	3100	Künftig kommen nämlich alle fünf Regierungsrate vom Land
373840	375390	1550	und kein einziger mehr aus der Stadt.
376080	378350	2270	Das könnte politisch
379030	380630	1600	in Zukunft durchaus einen gewissen Einfluss haben.
381370	383870	2500	Man darf also gespannt sein, wie die ländliche Regierung
384590	387270	2680	die Interessen der Städter vertreten wird,
388080	390470	2390	welche die Hälfte der Kantonsbevölkerung ausmachen.
391560	394470	2910	Im Machtkampf um den Automobil Club der Schweiz, den ACS,
395230	396710	1480	kommt es zu einer überraschenden Wende:
397530	400110	2580	Gestern hatte der amtierende Generaldirektor Stefan Holenstein
400790	402030	1240	seinen Rückzug bekanntgegeben.
402790	405950	3160	Heute folgt ihm FDP-Nationalrat Christian Wasserfallen nach.
406640	409510	2870	"Wasserfallen argumentiert gegenüber der ""NZZ am Sonntag"""
410130	411430	1300	genau gleich wie Holenstein:
412140	414270	2130	Er wolle, dass der Verband zur Ruhe komme.
415000	418430	3430	Wasserfallen war in einer umstrit- tenen Wahl ACS-Präsident geworden
419070	420910	1840	und hätte sich im September in einer Kampfwahl
421720	424350	2630	SVP-Nationalrat Thomas Hurter stellen müssen.
426300	429630	3330	Nach Deutschland, wo Bundeskanzlerin Angela Merkel
430410	433510	3100	wegen ihrer Flüchtlingspolitik weiterhin Kritik einstecken muss.
434250	436270	2020	Und wo die Frage, wie es denn mit ihr weitergeht,
437000	439590	2590	Medien, Politik und Öffentlichkeit seit Wochen umtreibt.
440300	443990	3690	Wird, will Merkel nächstes Jahr nochmals als Kanzlerin kandidieren?
444720	448390	3670	Diese Frage lässt sie auch heute in einem Fernsehinterview offen.
449320	453270	3950	Bundeskanzlerin Angela Merkel lässt sich nicht in ihre Agenda blicken.
453960	455350	1390	Das macht sie im ARD-Sommerinterview
456090.00000000006	458790	2700	mit den Journalisten Tina Hassel und Thomas Baumann klar.
459480	460190	710	Zu den Spekulationen
460950	464630	3680	über eine erneute Kandidatur als Kanzlerin meint sie nur so viel:
465430	467990	2560	Über die Frage, wie ich mich bezüglich
468710	471670	2960	einer weiteren Kanzlerkandidatur entscheide,
472440	475270	2830	werde ich zum gegebenen Zeitpunkt Bericht erstatten
475960	477790	1830	oder die Aussage dazu machen.
478530	480950	2420	Ich möchte nur noch mal sagen, ich nannte keinen Zeitpunkt,
481670	483350	1680	wann ich es wollte oder nicht wollte.
484170	486990	2820	Konkreter wird Merkel stattdessen bei einem anderen Thema:
487680	488830	1150	der Flüchtlingskrise.
489600	492510	2910	Sie beharrt auf dem Quoten-Verteilsystem in der EU.
493240	496390	3150	Ich glaube, dass wir eine gemeinsame Lösung finden müssen.
497040	500310	3270	Und jeder muss seinen Anteil zum gesamten Thema leisten.
501050	504350	3300	Wie die einzelnen Komponenten gewichtet werden, muss man sehen.
505050	506950	1900	Ich finde nach wie vor, dass es nicht geht,
507680	508950	1270	dass einige Länder sagen:
509690	512350	2660	"""Wir wollen generell keine Muslime in unserem Land."""
513169.99999999994	515909.99999999994	2740	Egal ob das aus humanitären Gründen notwendig ist oder nicht.
516640	518510	1870	Flüchtlingspolitik und Kanzlerkandidatur.
519200.00000000006	520590.00000000006	1390	Zwei Themen, denen sich Merkel
521309.99999999994	523750	2440	in den kommenden Wochen intensiv stellen muss.
525230	527550	2320	Merkel will zuwarten mit der Bekanntgabe,
528290	530790	2500	ob sie zu einer vierten Amtszeit antreten will oder nicht.
531550	534230	2680	Eine aktuelle Umfrage zeigt, dass eine Mehrheit der Deutschen
534880	536670	1790	gar nicht wünscht, dass sie weitermacht.
537360	540430	3070	Adrian Arnold, macht Merkel dieser fehlende Rückhalt in der Bevölkerung
541130	544550	3420	zu schaffen oder eher die Kritik aus den eigenen Reihen?
545290	547590	2300	Wir untertiteln live:
556780	561190	4410	Ich denke beides macht ihr zu schaffen.
561840	564590	2750	Aber dieses Zuwarten ein Jahr vor der Wahl ist ein deutliches Zeichen
565340	570670	5330	dafür,
571400	574070	2670	dass sie die interne Unterstützung für eine solche Kandidatur fehlt.
574790	578070	3280	Es gibt tiefe Risse zwischen ihr und der CSU
578800	584150	5350	und dem konservativen Flügel der CDU.
585120	588390	3270	Für eine erfolgreiche Kandidatur müsste sie diese Gräben schliessen.
589160	594470	5310	Und dafür bräuchte sie eine gesamteuropäische Lösung,
596080	598670	2590	wie man den Zustrom von Flüchtlingen von der Türkei her
599360	600750	1390	nach Europa verhindern kann.
601480	603870	2390	Der Türkei-Deal ist in Gefahr. Der Deal, der Europa
604610	606830	2220	in der Flüchtlingskrise weiterbringen könnte.
607590	609230	1640	Hat Angela Merkel, hat Deutschland denn einen Plan B?
616700	622630	5930	Diesen Plan gibt es tatsächlich.
623230	626910	3680	Er existiert auf dem Papier, das Blick wurde.
627660	632980	5320	Man will die EU Aussengrenzen radikal schützen.
633820	639700	5880	Vor allem auch durch den militärischen Ausbau von Frontex.
648610	653940	5330	Man will mittels Kontingenten die Flüchtlinge auf Staaten verteilen.
654690	659460	4770	Das würde sicherlich Merkels Partei gefallen.
660280	663460	3180	Damit könnte sie die Partei rein intern wieder schliessen.
664170	667180	3010	Bei einem Bergunglück sind heute drei Schweizer ums Leben gekommen.
667910	671180	3270	Sie stürzten am Monte-Rosa-Massiv an der Signalkuppe 800 m in den Tod.
672000	674700	2700	Fünf Kollegen konnten unverletzt geborgen werden.
675400	678140	2740	Ein Unglück, das in einer ganzen Reihe
678860	681220	2360	von Bergunfällen in jüngster Zeit steht. Susy Schär.
682320	684430	2110	Perfektes Wetter, herrliche Fernsicht.
685150	687630	2480	Kein Wunder, zieht es diesen August viele Menschen in die Berge.
688360	691310	2950	Allerdings gibt es allein diesen Monat 15 Bergtote zu beklagen.
692860	695270	2410	Davon elf allein im Wallis,
695960	698310	2350	zwei Bergsteiger stürzten in den Berner Alpen ab
699110	702550	3440	und auch in der Ostschweiz gab es zwei tödliche Bergunfälle.
703360	705790	2430	Für Ueli Mosimann vom Schweizer Alpen-Club
706470	708510	2040	ist diese Häufung kein Zufall.
709170	712590	3420	Seit gut zwei Wochen ist mehrheitlich gutes Wetter.
713360	716150	2790	Alpinisten und Bergsteiger aller Art sind jetzt unterwegs,
716870	720110	3240	um das nachzuholen, was sie im Juli verpasst haben.
720810	725030	4220	Das Traumwetter - heute fast 34 °C - birgt auch zusätzliche Gefahren.
725780	730310	4530	Die Nullgradgrenze stieg phasenweise auf über 4'800 m.
731030	734030	3000	Das führt dazu, dass die Steine instabil werden.
734760	737030	2270	Mit jedem Durchgang durch die Nullgradgrenze
737770	740870	3100	hat man ein Schmelzen des Eises, dann wieder ein Gefrieren.
741550	742710	1160	Das sprengt die Steine auseinander.
743510	745230	1720	Sie werden lockerer und geben sehr wenig Halt.
745920	749190	3270	Zudem fordern die weiche Schneedecke und breite Gletscherspalten
749870	751630	1760	vermehrt Vorsicht.
752380	756070	3690	Bei diesen Bedingungen ist es wich- tig, sehr früh unterwegs zu sein,
756830	758630	1800	noch nachts mit der Stirnlampe aufzubrechen
759470	761030	1560	und möglichst am Mittag zurück zu sein.
761840	763990	2150	Wer im Dunkeln aufbricht, ist sicherer unterwegs
764760	767030	2270	und wird mit einer traumhaften Sicht belohnt.
768240	771190	2950	Wann haben Sie zum letzten Mal telefoniert?
771980	774470	2490	"""Was für eine blöde Frage"", werden Sie sich nun sofort denken."
775280	777870	2590	Stimmt. Aber lassen Sie mich die Frage zu Ende stellen.
778690	780990	2300	Wann haben Sie zum letzten Mal telefoniert - und zwar ...
781680	783750	2070	... aus einer solchen Telefonkabine?
784440	786510	2070	Vielleicht erinnern Sie sich noch. Wohl eher aber nicht.
787170	789350	2180	Trotz Handys und Smartphones gibt es sie aber immer noch.
790160	791910	1750	Die Swisscom muss jeder Gemeinde, die das wünscht,
792630	795190	2560	mindestens eine Kabine zur Verfügung stellen.
795830	799910	4080	Dieser sog. Grundversorgungsauftrag wird aber wohl bald auslaufen.
800720	804150	3430	Und ein grosser Teil der Kabinen wird verschwinden. Marcel Anderwert.
805140	807590	2450	Stolz steht sie am Ufer des Sees:
808270	810630	2360	Die Telefonkabine beim Bellevue in Zürich.
811300	812710	1410	Aber benützt sie auch jemand?
813410	817910	4500	Wir machen den Test. Und beobachten, mehrere Stunden lang.
820660	825910	5250	Das Leben findet draussen statt. Die schöne Kabine interessiert niemanden.
826590	829160	2570	Der rote Hörer bleibt unberührt.
829820	834640	4820	Jedes Smartphone kann heutzutage mehr als eine Telefonkabine.
835390	838920	3530	Rund zwei Drittel der Telefonkabinen in der Grundversorgung
839610	842160	2550	sind heute nicht kostendeckend.
842820	844920	2100	Der Bedarf geht weiter zurück - um 30 % pro Jahr.
845630	846760	1130	Da stellt sich die Frage, ob es Sinn macht,
847490	849280	1790	eine Dienstleistung aufrecht- zuerhalten, die nicht genutzt wird.
850040	853280	3240	Ende der 90er-Jahre gab es noch 13'400 Telefonkabinen.
854120	855880	1760	Heute sind es nur noch 4'200.
856550	860840	4290	Ab 2018 soll die Zahl nach dem Willen der Swisscom auf gut 2'000 sinken,
861540	863480	1940	weil die restlichen nicht rentieren.
864170	869000	4830	Der Konsumentenschützerin geht dies alles etwas zu schnell.
869710	872920	3210	Ein massvoller Abbau ist gerechtfertigt.
873720	875530	1810	Er muss aber im richtigen Zeitrahmen geschehen.
876240	878850	2610	Es gibt durchaus noch Gemeinden, wo eine Telefonkabine Sinn macht.
879580	881850	2270	Dort soll die Gemeinde bestimmen können und nicht die Swisscom.
882630	885690	3060	Muss die Swisscom die Grundversorgung mit Telefonkabinen aufrechterhalten?
886480	888170	1690	Der Bund hat Gemeinden, Verbände und Parteien
888870	890450	1580	bereits um eine Stellungnahme gebeten.
891230	893650	2420	Wie es beim Bundesamt für Kommunikation auf Anfrage heisst,
894400	896890	2490	hat sich eine deutlich Mehrheit der Teilnehmer dafür ausgesprochen,
897710	900730	3020	die Telefonkabinen aus der Grundversorgung zu streichen.
901400	903170	1770	* Schnelle Rockmusik *
903810	906090	2280	Dann, nach 3 Std., passiert's doch noch.
906780	909370	2590	Aber die Familie aus Lausanne will nur wissen,
910160	912610	2450	ob's beim Öffnen der Türe noch Musik gibt.
913320	914810	1490	Es gibt keine.
917050	920730	3680	Und damit nochmals zurück zu Daniela Milanese und zu dem, was -
921550	924810	3260	abgesehen vom Eidgenössischen - sportlich los war heute.
925820	928090	2270	Es wurde insbesondere auch noch Fussball gespielt.
928770	930250	1480	Im Stadion Letzigrund trafen sich die Zürcher Grasshoppers
930950	932290	1340	und die Berner Youngs Boys zum Klassiker.
933040	935970	2930	Dabei kamen die Zürcher zu einem letztlich ungefährdeten Sieg.
936600	938370	1770	Dank grosser Kaltblütigkeit im Abschluss
939040	940970	1930	bezwangen sie YB gleich mit 4:1.
942460	945370	2910	Der spektakulärste der vier GC-Treffer
946040	948220	2180	geht auf das Konto von Ridge Munsy -
948890	953900	5010	mit einem Sprint über das ganze Feld sorgt der GC-Stürmer für die Führung.
954560	956900	2340	Sie fällt entgegen dem Spielverlauf.
959420	964300	4880	YB ist über weite Strecken besser - aber nicht effizient.
967570	972100	4530	Gegen Spielende bezahlen die Berner für den hohen betriebenen Aufwand -
972840	976660	3820	GC kontert und kommt letztlich dank seiner Kaltschnäuzigkeit
977240	980180	2940	zum dritten Saisonsieg.
980920	983900	2980	Das Schlussbouquet ist Caio vorbehalten -
984580	986660	2080	er erzielt das 4:1.
987440	991220	3780	Das Resultat sicher zu hoch in Anbetracht des Spielverlaufs.
992960	995260	2300	Zwei weitere Partien wurden heute gespielt:
995980	997580	1600	St. Gallen siegte gegen Luzern 3:0.
998400	1001260	2860	Und mit demselben Resultat gewann auch Basel in Thun.
1001910	1004780	2870	In der Tabelle können die Basler dank den Niederlagen der beiden Verfolger
1005580	1007700	2120	Luzern und YB bereits wieder davonziehen.
1008430	1011620	3190	Der Vorsprung beträgt nun bereits sechs Punkte und mehr.
1012360	1014340	1980	Dahinter alle Teams dicht beieinander.
1015070	1018020	2950	Neues Schlusslicht der Super League ist der FC Thun.
1019480	1023660	4180	Die Formel-1-Piloten standen heute in Spa im Einsatz.
1024319.9999999999	1026819.9999999999	2500	Der Grosse Preis von Belgien bot viel Spektakel
1027530	1029859.9999999999	2330	und wurde letztlich von Nico Rosberg gewonnen.
1030619.9999999999	1034020	3400	Für den Mercedes-Piloten war es der insgesamt 20. Grand-Prix-Sieg.
1034700	1038140.0000000001	3440	Mann des Rennens war allerdings sein Teamkollege Lewis Hamilton.
1038859.9999999999	1040740	1880	Dieser war aus der letzten Reihe gestartet,
1041430.0000000001	1045220	3790	beendete das Rennen nach einer perfekten Aufholjagd noch auf Rang 3.
1046810	1048620	1810	Lewis Hamilton
1049360	1051860	2500	profitierte bei seiner Aufholjagd von diversen Zwischenfällen,
1052590	1054660	2070	die das Rennen zu seinen Gunsten veränderten.
1055330	1058660	3330	Nachdem Kevin Magnussen rückwärts in einen Reifenstapel gekracht war,
1059420	1061380	1960	musste das Rennen unterbrochen werden.
1062110	1064540	2430	Hamilton war zu diesem Zeitpunkt plötzlich Fünfter
1065290	1067860	2570	und konnte in der Folge noch zwei Ränge gut machen.
1068480	1069580	1100	Damit verteidigte Lewis Hamilton
1070320	1071620	1300	seine Führung in der Weltmeisterschaft
1072310	1073860	1550	gegenüber Teamkollege Nico Rosberg.
1074470	1077700	3230	Für das Schweizer Sauber-Team gab es auch in Belgien keine Punkte.
1083500	1085820	2320	Das war's von mir an dieser Stelle.
1086510	1088380	1870	Aber sportlich geht's auch bei dir weiter, Franz.
1089580	1092460	2880	Ja, mit dem  sportliche Höhepunkt dieses Wochenendes.
1093230	1094900	1670	Wir haben zu Beginn der Sendung darüber berichtet:
1095620	1098420	2800	Die Schweiz hat einen neuen Schwingerkönig.
1099160	1100500	1340	Und ein neues Schwingfest der Rekorde.
1101240	1102660	1420	Eine geschätzte Viertelmillion Menschen
1103370	1105380	2010	besuchte das Eidgenössische in Estavayer.
1106050	1108260	2210	Die Traditionen, sie ziehen die Massen an -
1109070	1111540	2470	die Arena ist aber absolut werbefrei.
1112360	1115540	3180	Eigentlich kaum zu glauben, am grössten Sportanlass der Schweiz
1116280	1118940	2660	mit einem Budget von fast 30 Mio. Fr.
1119670	1123540	3870	Doch rund um die Arena brummt das Business.
1124240	1128540	4300	Schwingen zwischen Tradition und Kommerz. Claudio Spescha war vor Ort.
1129870	1132620	2750	Wohlverdiente Erfrischung am hölzernen Trog -
1133290	1135500	2210	bevor man mit Schlungg, Gammen oder Wyberhaken
1136190	1137700	1510	den Gegner ins Sägemehl wirft.
1138390	1140500	2110	Ehrliche Arbeit von urchigen Gladiatoren.
1141210	1143060	1850	Sie sind Volkshelden in Hosen aus Zwilch,
1143780	1147270	3490	geherzt und gefeiert im grössten Sportstadion der Schweiz.
1147940	1149590	1650	Statt der traditionellen Treichel
1150340	1152670	2330	nehmen die Schwinger mehr und mehr auch Waschmaschinen,
1153330	1155870	2540	Uhren oder gar ein Auto aus dem Gabentempel mit.
1156580	1158270	1690	Die besten Schwinger verdienen heute
1159040	1162550	3510	allerdings sechsstellige Summen pro Jahr, dank Sponsoring-Verträgen.
1163260	1166190	2930	Viel Geld wird aber auch rund um die Schwingarena verdient.
1166920	1169630	2710	Stände und Aktionen von Sponsoren auf Schritt und Tritt.
1170400	1173310	2910	Bei den Besuchern kommt das an:
1174050	1179030	4980	Den Schwingern zuschauen, das Fest, am Abend Unterhaltung.
1179760	1184190	4430	Die Stimmung ist super. Viele Leute, tipptoppes Wetter.
1184950	1188190	3240	Ich war noch nie an einem urchigen Schwingfest.
1188960	1192070	3110	Es ist tipptopp. Ich finde es gut, dass es drinnen keine Werbung hat.
1192840	1193910	1070	Draussen ist es wie an einem Festival.
1194580	1198110	3530	Swissness in allen Farben und Formen ist besonders beliebt.
1198910	1202710	3800	Doch ganz allen ist bei all dem Geschäft dann doch nicht so wohl:
1203440	1206470	3030	Jeder will etwas verdienen. Es passt nicht mehr ganz zusammen.
1207280	1210470	3190	Zwischen Brauchtum und Kommerz - ein immer grösserer Spagat,
1211080	1213270	2190	auch für die Organisatoren:
1213970	1218470	4500	Es soll hier jeder seinen Platz finden: als Besucher, als Sponsor,
1219190	1222790	3600	als Partner und als interessierter, sportbegeisterter Schwingfan.
1223480	1225190	1710	Es ist unser Fest, unsere Schweiz.
1225860	1228390	2530	Wir leben unsere Traditionen und Werte.
1229200	1230760	1560	Und dafür gab es auch dieses Jahr
1231550	1234120	2570	wieder jede Menge frenetischen Applaus.
1236660	1239600	2940	"Das war's von uns, der ""Tagesschau"" und der Sportredaktion, für Sie."
1240290	1242040	1750	"Weiter geht's auf SRF1 mit ""Meteo"","
1242790	1245040	2250	"""Tatort"" und dem ""Reporter - Das Leben danach -"
1245740	1248360	2620	"Die zweite Karriere des Kunstturners Lucas Fischer."""
1249120	1251760	2640	Uns sehen Sie, wenn Sie mögen, um 22.50 Uhr wieder
1252520	1256800	4280	"zur ""Tagesschau""-Spätausgabe. Einen unterhaltsamen Abend und bis bald."