start	end	duration	text
1340700	1343330	2630	die österreichischen Äusserungen in die Nähe des Rechtsextremismus.
1345160	1347930	2770	Der Elektro-Autobauer Tesla ist im zweiten Quartal
1348580	1350050	1470	tiefer in die roten Zahlen gerutscht.
1350750	1353850	3100	Das Unternehmen musste einen Verlust von fast 300 Mio. $ bekanntgeben.
1354570	1357370	2800	Anleger reagierten wegen Produktionsfortschritten
1358120	1361050	2930	und einer optimistischen Prognose dennoch verhalten positiv.
1364310	1367530	3220	Weil's eben so cool war, dieser Kult-Werbespot für den Haarspray,
1368280	1370570	2290	hier gleich nochmal ein Trip zurück in die 80er-Jahre -
1371350	1375530	4180	zu drei Herren und einem unverwechselbaren Soundtrack.
1376220	1378610	2390	"* Fetziger Popsong: ""Ghostbusters"" von Ray Parker Jr. *"
1390260	1392530	2270	# Ghostbusters.
1393230	1395930	2700	# If there's somethin' strange in your neighboorhood.
1396590	1399450	2860	# Who you gonna call? Ghostbusters.
1400110	1401810	1700	Die Titelmelodie ist geblieben,
1402550	1405450	2900	die Ghostbusters von heute sehen allerdings anders aus:
1406150	1409290	3140	22 Jahre nach dem ersten Film schickt Sony Pictures
1409940	1411410	1470	erstmals Damen auf Geisterjagd.
1412070	1413890	1820	Das finden nicht alle Fans okay -
1414550	1416730	2180	Cynthia Ringgenberg über die Kontroverse zur Komödie.
1418470	1420210	1740	* Geistergeschrei *
1420860	1422210	1350	Okay, power up.
1422890	1425690	2800	Vier Frauen jagen in New York Geister.
1426420	1429410	2990	Ja, vier Frauen, nicht vier Männer wie im alten Film.
1430150	1433290	3140	"Viele männliche ""Ghostbusters""-Fans alter Schule fühlten sich betrogen."
1436500	1438570	2070	Slap shot!
1439380	1441450	2070	Beschimpft wurden die Frauen im Netz mit Sätzen wie:
1442150	1444570	2420	"""Der millionste Disliker darf Melissa McCarthy erschiessen""."
1445310	1447890	2580	Für Regisseur Paul Feig gehören die bösen Bemerkungen zum Zitat:
1448620	1451570	2950	ekelhaftesten, frauenfeindlichsten Scheiss, den er je gelesen hat.
1452220	1455250	3030	Im Interview mit uns, drückt er sich etwas sanfter aus.
1455950	1457690	1740	Es war eine aufgeladene Atmosphäre.
1458300	1459970	1670	Die Erwartungen waren so hoch,
1460700	1462570	1870	dass die Leute logischerweise alles kritisieren,
1463160	1464730	1570	was wir veröffentlichen.
1465420	1466930	1510	Und dann gab es eine organisierte Aktion,
1467740	1472370	4630	die unsere Dislikes in unermessliche Höhe trieben.
1473060	1475770	2710	* Hip-Hop-Musik *
1480630	1482970	2340	"Der neue ""Ghostbusters""-Film - ein Politikum."
1483700	1485540	1840	Auf Twitter tauchte diese Fotomontage auf:
1486300	1490860	4560	Hillary Clinton als Geisterjägerin und Donald Trump als böser Geist.
1491580	1493980	2400	Viel politisches Aufsehen für einen unpolitischen Film.
1494710	1498380	3670	Und auch die Wut der Shitstorm-Männer sei übertrieben worden.
1499110	1500900	1790	Das ist nicht die Mehrheit.
1501510	1503220	1710	Es ist eine Beleidigung für die Männer zu sagen,
1504020	1508100	4080	sie seien alle verrückt und frauenfeindlich.
1508790	1510460	1670	* Fetzige Rockmusik *
1519030	1521420	2390	Rückendeckung kriegen die neuen Geisterjägerinnen
1522110	1523660	1550	von der alten Ghostbusters-Garde.
1524390	1527540	3150	Bill Murray findet die Neuverfilmung zum Schreien - im positiven Sinn.
1528280	1530220	1940	Ich habe mit Melissa und Chris gearbeitet.
1530960	1534060	3100	Es ist schwierig, diesen Film durchzuziehen.
1534700	1536500	1800	Es steht viel auf dem Spiel.
1537200	1541420	4220	Es gibt grosse Erwartungen und Danny, ich und Annie,
1542140	1548820	6680	wir haben gejubelt und geschrien als wären wir an einem Sportevent.
1549550	1552340	2790	Trotz aller Kritik in den Sozialen Medien - keine Bruchlandung.
1553060	1555500	2440	In den USA spielte die hochamüsante Geisterjagd
1556120	1559180	3060	am ersten Wochenende 46 Mio. $ ein und landete auf Platz 2.
1559840	1561420	1580	Die Angst der Filmemacher,
1562170	1563980	1810	die Menschen würden nach den Hasstiraden im Netz
1564670	1566860	2190	nicht in die Kinos gehen, ist nicht eingetreten - zum Glück.
1569910	1572140	2230	Wie hiess es in einem anderen Hollywoodfilm:
1572800	1575080	2280	Nie einen Mann schicken, um den Job einer Frau zu erledigen:
1575770	1577280	1510	"""Charlie's Angels""."
1577980	1579240	1260	"So viel ""10vor10"" für heute,"
1579990	1582440	2450	"hier geht's weiter mit ""Meteo"" und danach ""Focus - Blind Date""."
1583150	1585880	2730	Wir sind morgen wieder für Sie da, bis dahin gute Nacht und gute Zeit.
1586700	1590800	4100	SWISS TXT / UT-Redaktion Zürich Evelyne Iyer, Regina Kolb, Mirela Muminovic