start	end	duration	text
7940	8430	490	.
8690	9510	820	1:1-Untertitelung. Livepassagen können Fehler enthalten.
9710	10910	1200	Einen schönen guten Abend,
11060	13040	1980	"willkommen zur ""Tagesschau"" und diesen Sonntagsthemen:"
13480	16079.999999999998	2600	Das Olympische Komitee will russische Athleten
16190.000000000002	18360	2170	trotz Doping-Skandals in Rio starten lassen.
20570	24200	3630	Der Münchner Amokläufer bereitete seine Tat minutiös vor.
26570	30640	4070	Hotels im Mittelland steigern ihre Umsätze mit Langzeitgästen.
31810	35360	3550	Bertrand Piccard und sein Flugzeug Solar Impulse
35480	37720	2240	sind auf dem Weg nach Abu Dhabi.
39030	42080	3050	Nur da und dort ein paar Regenschauer.
44200	48040	3840	Noch zwölf Tage, 5 Std. und 29 Min.
48140	50320	2180	Lange dauert's nicht mehr
50490	52920	2430	bis zu den Olympischen Spielen in Rio de Janeiro,
53030	56720	3690	was einige Sportverbände arg ins Schwitzen bringen könnte.
56850	57800	950	Der Grund:
58010	60400	2390	Das Internationale Olympische Komitee verzichtet darauf,
60570	64640	4070	das integrale russische Team wegen Staats-Dopings auszuschliessen.
64800	67240	2440	Ob die Sportler zugelassen werden oder nicht -
67420	70760	3340	dieser Entscheid liegt nun an den einzelnen Verbänden.
70910	74600	3690	Und das wiederum wirft Fragen auf. Susy Schär berichtet.
75450	79000	3550	Das IOC hat den Entscheid an einer Telefonkonferenz gefällt.
79200	82600	3400	Präsident Thomas Bach stand nicht vor die Kamera.
82800	85200	2400	In der publizierten Medienmitteilung steht,
85360	89120	3760	Russland werde nicht total von Olympia ausgeschlossen, denn:
95759.99999999999	99880	4120	IOC-Präsident Thomas Bach - hier mit Wladimir Putin -
100050	102560	2510	hat sich damit durchgesetzt.
102759.99999999999	104680	1920	Er sagte seit Monaten,
104900	107840	2940	er wolle in Rio ein Team unter russischer Flagge dabei haben.
108050	110880	2830	Der Druck einzelner Verbände - z.B. des Ringerverbands -
110979.99999999999	113160	2180	hat also gewirkt.
113430	117160	3730	Russland war in London 2012 klar die erfolgreichste Nation.
117200	119880	2680	Hier Bronze für den Ringer.
120080	123040	2960	Auch die russischen Ringer sind im WADA-Bericht erwähnt -
123060	126160	3100	mit 28 vertuschten positiven Proben.
126310	128680	2370	Eine von vielen Enthüllungen im WADA-Bericht.
128840	130919.99999999999	2080	Russland hat seit 2011
131150	135360	4210	mind. 643 positive Dopingfälle verschwinden lassen
135520	139200	3680	und in 30 Sportarten manipuliert.
139340	142640	3300	Allein zwischen Februar und Mai 2016
142950	148079.99999999997	5130	sind zudem 739 Dopingtests in Russland verhindert worden.
148280	152880	4600	D.h. also genau in der Aufbauphase für Olympia.
152960	156920.00000000003	3960	Heute Morgen sind zehn russische Turner bereits nach Rio geflogen.
157010	158560	1550	In wenigen Tagen
158800	161960	3160	werden auch die anderen russischen Olympia-Athleten folgen.
163960	167280	3320	Kein Olympia-Aus für Russland. Kein Entscheid des IOC.
167490	171079.99999999997	3590	Das kommt bei Swiss Olympic, dem Dachverband des Schweizer Sports,
171200	173200	2000	ganz und gar nicht gut an.
173370	175720	2350	Präsident Jörg Schild braucht denn auch deutliche Worte,
175910	178240	2330	wenn er die Neuigkeit kommentiert.
179130	180800	1670	Wir sind einerseits überrascht.
180960	184160	3200	Offenbar haben nun die internationalen Verbände das Sagen
184350	187640	3290	bei der Organisation der Olympischen Spiele und nicht mehr das IOC.
187730	190840	3110	Wir sind aber auch enttäuscht.
190940	193640	2700	Das IOC lässt in unseren Augen
193730	196120	2390	jegliche Führungsverantwortung vermissen
196290	199560	3270	und gibt die Verantwortung, den Schwarzen Peter,
199640	201880	2240	weiter an die Verbände.
201990	204760	2770	Wir sind aber auch verärgert, weil wir uns betrogen fühlen.
204840	207960	3120	Wir fühlen uns betrogen, weil das NOK von Russland
208090	211320	3230	ein Teil der oft besungenen Olympic Family ist.
211460	213680	2220	Wir anderen nationalen Olympischen Komitees
213850	217200	3350	mit unseren Athleten fühlen uns echt betrogen.
217390	219720	2330	Ich frage mich, ob sich das IOC
219860	222480	2620	noch auf die Olympische Charta zurückbesinnt.
223480	225760	2280	Keine Kollektivabstrafung - andere sagen:
225930	230360	4430	ein gewagter Entscheid des IOC, den wir mit Sport-Expertin Susy Schär
230470	235280	4810	und SRF-Russland-Korrespondent David Nauer einordnen wollen:
235430	238120	2690	Susy Schär, zuerst die Frage an Sie:
238250	240840	2590	Macht der Bescheid des IOC Sinn für Sie?
240930	243240	2310	Wir untertiteln live:
251800	257760	5960	Das IOC schiebt die Verantwortung den Sommer verbänden zu.
258959.99999999997	261519.99999999997	2560	Die Faktenlage des war der Bericht des ist erdrückend.
261720.00000000003	263920	2200	Man hätte Russland sperren müssen.
264120	270080	5960	Das IOC zahlt einen hohen Preis.
272170	273640	1470	Es wird in eine Krise stürzen.
273730	274760	1030	David Nauer in Moskau,
274940	276240	1300	Russland reagiert wenig überraschend hoch erfreut.
276330	278720	2390	Ist die Sache für Moskau aber auch ausgestanden?
282320	288200	5880	Nein, ich denke nicht.
288850	293400	4550	Im Moment ist die Freude in Moskau sehr gross.
293659.99999999994	298320	4660	Aber das Thema Russland und Doping wird nicht verschwinden.
298610	302880	4270	Die russischen Athleten müssen beweisen, dass sie sauber sind,
302960	307720	4760	wenn sie nach Rio fahren wollen.
307970	312320	4350	Man kann sagen, dass das Image von Russland stark gelitten hat.
312520	318400	5880	Hier in Moskau kursiert ein Scherz.
322090	325090	3000	Früher hätten sie sich gefreut, wenn sie an Olympischen Spielen
325280	326530	1250	gewonnen hätten.
326640	326890	250	Susy Schär, nun müssen also die Verbände entscheiden -
328960	330210	1250	Susy Schär, nun müssen also die Verbände entscheiden -
331020	334530	3510	das braucht Zeit.
334730	340530	5800	Es braucht Zeit.
340760	344370	3610	Wie viele der Athleten dabei sein werden, weiss man nicht.
344690	350010	5320	Man hat aber Angst vor Repressalien.
350250	353930	3680	Man wird ein paar Athleten durch winken.
354180	358370	4190	Ich rechne mit einem grösseren russischen Team.
358720	362410	3690	Es ist ein Schlag ins Gesicht eines jeden Athleten,
362630	365050	2420	der regelmässig im Training kontrolliert worden ist.
365270	366410	1140	der regelmässig im Training kontrolliert worden ist.
368370	370910	2540	Es sind nur zwei Tage vergangen seit dem Amoklauf in München -
371130	373190	2060	und schon wieder meldet Deutschland eine Bluttat:
373300	376350	3050	In Reutlingen südlich von Stuttgart hat ein Mann am Nachmittag
376460	379110	2650	eine Frau getötet und zwei weitere Personen verletzt.
379220	381910	2690	Tatwaffe war eine Machete. Es brach Panik aus.
384170	387550	3380	Die Polizei konnte den Mann schon nach kurzer Zeit festnehmen.
387640	390830	3190	Das Motiv des 21-Jährigen ist unklar.
390920	394390	3470	Er soll sich vor dem tödlichen Macheten-Angriff
394490	396830	2340	mit dem Opfer gestritten haben, teilt die Polizei mit.
396920	398390	1470	Der Mann sei der Polizei bekannt.
399570	402190	2620	Viele Fragen sind offen, eine stellen wir Adrian Arnold in Berlin
402360	405510	3150	und zwar die nach dem Täter. Was ist das für ein Mann?
405659.99999999994	423410	17750	Wir untertiteln live:
423640	428450	4810	gemäss Polizei handelt es sich um einen Asylbewerber aus Syrien.
428680	434210	5530	Es ist bereits die zweite Tat in Deutschland,
434450	439490	5040	die von einem Mann begangen wird, der in Deutschland um Asyl bittet.
439720	445530	5810	Das ist Gift für die Debatte und eine gespaltene Gesellschaft.
447510	450690	3180	Man fragt sich, ob es richtig war, mehrere 100 tausende Flüchtlinge
450920	454890	3970	aufzunehmen.
455120	458170	3050	Damit wird der Druck politisch von aussen rechts auf Merkel massiv
458350	460810	2460	zunehmen.
461000	466890	5890	Das belegen heute erste Tweets.
472050	475250	3200	Man dankt Merkels Einheitspartei für immer mehr Mord und Todschlag.
475400	481330	5930	Merkel müsse weg.
482610	485690	3080	Damit geht mit diesem Attentat heute Abend eine traurige Woche in
485910	487810	1900	Deutschland zu Ende.
488150	492170	4020	Es waren drei schreckliche Amokläufe.
492300	494970	2670	Zurückgewährt vor allem Verunsicherung in der Gesellschaft
495200	497770	2570	bleiben.
498070	500330	2260	Vor uns steht eine aufgeheizte Debatte um Merkels
500470	501890	1420	Flüchtlingspolitik.
502930	504730	1800	Nun zum Täter von München:
504840	506690	1850	Er plante ein Jahr lang minutiös, er übte in Computerspielen,
506850	509570	2720	ging sich einen Amok-Tatort anschauen,
509730	511870	2140	und er schrieb ein Manifest - so wie es schon
512130	515429.99999999994	3300	der norwegische Amokläufer Anders Behring Breivik getan hatte.
515539.99999999994	517870	2330	Neue Einzelheiten über den 18-jährigen Todesschützen,
518030	521390	3360	welche die Staatsanwaltschaft heute veröffentlicht hat.
521530	525230	3700	Und sie präzisiert, es sei ein psychisch kranker Teenager,
525240	527270	2030	der diese Tat verantwortet.
529260	532830	3570	München am zweiten Tag nach der Bluttat, noch immer entsetzt.
533040	536430	3390	Die Zahl der Verletzten ist heute auf 35 angestiegen.
536530	539590	3060	Drei der Angeschossenen schweben noch in Lebensgefahr.
539750	542630	2880	Wild hatte der 18-Jährige hier um sich geschossen.
542760	545270	2510	Ohne bewusst auf jemanden zu zielen -
545520	547990	2470	da sind sich die Ermittler inzwischen sicher.
548210	550510	2300	Es gebe keinen politischen Hintergrund.
550730	554150	3420	Bestätigt habe sich jedoch die These, dass der Täter psychisch krank war.
554350	557630	3280	Wir haben im Rahmen der Hausdurchsuchung bei ihm
557810	560830	3020	ärztliche Behandlungsunterlagen gefunden,
561000	564920	3920	die auf eine Angststörung und auf Depressionen hindeuten.
565120	569960	4840	Er hat sich danach sowohl in einer stationären Behandlung befunden
570070	572560	2490	wie auch in ambulanter Behandlung.
572670	575360	2690	57 Schüsse habe er abgefeuert.
575540	578920	3380	Aus einer Pistole dieser Art, einer Glock 17.
579050	581560	2510	Besorgt hatte er sie sich im Darknet,
581730	584320	2590	einer schwer zugänglichen Nische des Internets.
584530	587120	2590	Die Pistole sei eine Theaterwaffe gewesen.
587290	592320	5030	Es handelt sich um eine Glock, die wohl mal so verändert wurde,
592480	596800	4320	dass sie als sog. Theaterwaffe verwendet werden konnte
596890	600480	3590	und als eigentliche Waffe unbrauchbar wurde.
600650	604440	3790	Doch dann ist sie mit entsprechenden technischen Kniffen
604580	607160	2580	wieder reaktiviert worden.
607340	610480	3140	Der 18-Jährige verbrachte viel Zeit am Computer
610600	613440	2840	mit Ballerspielen wie diesem hier.
613520	616200	2680	Das sei typisch für Amokläufer.
616370	621080	4710	Deutschland debattiert nun, ob solche Spiele nicht verboten werden müssten.
621200	623880	2680	Generell hat der Amoklauf von München
624090	626680	2590	eine Sicherheitsdebatte im Land ausgelöst.
626820	628960	2140	Bayerns Innenminister Herrmann fordert in den Medien
629140	632280	3140	Anti-Terror-Einsätze der Armee - bisher ein Tabu.
632490	635040	2550	Und über eine Verschärfung der Waffengesetze
635140	637440	2300	wird auch laut nachgedacht.
638520	640960	2440	Amokläufe wie der in München und Terroranschläge aller Art
641040	643960	2920	verändern so einiges in westlichen Köpfen.
644050	645960	1910	In nur vier Wochen
646050	649360	3310	sind bei Attentaten zusammengezählt über 600 Menschen getötet worden.
649560	653480	3920	Gefühlt ist die Welt, ist v.a. auch Europa unsicherer geworden.
653600	655960	2360	Nur: stimmt das auch?
656180	659480	3300	Oder hat sich durch Social Media und Live-Übertragungen
659610	662320	2710	einfach unsere Wahrnehmung verändert?
662510	664960	2450	Claudia Badertscher auf der Suche nach einer Antwort.
667700	669680	1980	Was ist eigentlich mit Europa los?
669850	673040	3190	Diese Frage stellen sich auf Twitter oder Facebook derzeit viele.
673240	676160	2920	Wir blicken auf tragische Wochen zurück.
676350	678760	2410	Dicht an dicht folgten sich der Terror in Nizza,
678900	681000	2100	der Putschversuch und dann der Amoklauf in München.
681240	684440	3200	Die sozialen Medien verändern unsere Wahrnehmung solcher Ereignisse stark,
684520	687960	3440	sagt Soziologe Franz Schultheis von der Universität St. Gallen.
688100	692720	4620	V.a., weil man an der Gewalt heute in Echtzeit teilhabe:
692810	695480	2670	Die Art und Weise, wie heute über diese Ereignisse berichtet wird -
695610	697360	1750	sehr zeitnah, hautnah,
697550	700200	2650	mit dem Gefühl, direkt am Geschehen zu partizipieren
700370	702680	2310	wie in einem Krimi, den man anschaut,
702890	704840	1950	aber diesmal ein reales Ereignis -
704940	706960	2020	das macht emotional sehr stark betroffen.
707240	709640	2400	Und diese Emotionalität schreibt sich dann auch dauerhaft
709840	712840	3000	in den allgemeinen Gefühlshaushalt der Leute ein.
712930	716440	3510	Der Blick auf die Terror-Weltkarte bestätigt das Gefühl:
716600	721520	4920	seit 2011 schnellt die Zahl der Terror-Toten weltweit in die Höhe.
721730	724680	2950	Allerdings: für Westeuropa stimmt das nicht.
724890	727760	2870	Hier gab es in den 1970er- und 90er-Jahren
727900	731520	3620	deutlich mehr Terror-Tote zu beklagen als heute.
731700	734520	2820	Es waren v.a. Organisationen wie die IRA,
734750	738920	4170	die baskische Untergrundorganisation ETA oder die RAF,
739060	741560	2500	die Europa mit Terror überzogen.
741810	745280	3470	Doch davon erfuhr man erst verzögert. Und:
745420	748640	3220	Sehr oft war es so, dass es politische Gruppierungen waren,
748810	752240	3430	die mit diesem Terrorismus politische Feinde direkt angriffen.
752360	755680	3320	Und dahinter wirkte das dann immer noch wie politisch rational gezielt,
755810	757360	1550	Feinde gegen Feinde.
757520	759800	2280	Heute ist der Terrorismus weitgehend blind geworden,
759920	762520	2600	schlägt überall gegen irgendwen zu,
762660	765360	2700	ohne dass dahinter konkrete Absichten wären.
765610	769000	3390	Und das macht ein anderes Gefühl der Betroffenheit bei der Bevölkerung.
769080	771640	2560	Und das nutze dem Populismus.
771750	775080	3330	Doch damit erreiche der Terrorismus letztlich genau sein Ziel -
775280	778800	3520	Europa in seinen Grundfesten zu erschüttern.
779680	783440	3760	Zu wenig Schnee im Winter, zu viel Regen im Sommer
783570	785800	2230	und obendrauf der starke Franken.
786030	789320	3290	An zu wenig Klagestoff fehlt es dem Schweizer Tourismus nicht.
789400	791720	2320	Die ausländischen Gäste werden weniger.
791950	795160	3210	In den ersten fünf Monaten ist die Zahl der Logiernächte
795320	797520	2200	um 0,7 % gesunken,
797670	800560	2890	das sind 94'000 Übernachtungen weniger
800680	803440	2760	als zur selben Zeit vor einem Jahr.
803590	807840	4250	Doch nicht überall sieht's so düster aus in der touristischen Schweiz.
808050	811480	3430	Abseits von klassischen Ferien- Destinationen entstehen neue Hotels.
811620	814320	2700	Mit neuer Zielkundschaft.
814550	817980	3430	Henriette Engbersen stellt sie vor - Hotels und Kundschaft.
819090	821700	2610	Das Hotel Aarau West in Oberentfelden,
821800	823980	2180	keine offensichtliche Traumlage.
824190	827180	2990	Aber: Der Betreiber hat genau hier erweitert.
827340	830020	2680	Dieses ganze Gebäude wurde im Mai fertiggestellt.
830170	832700	2530	Was aussieht wie ein unscheinbares Mehrfamilienhaus
832930	835900	2970	ist ein Hotel, ein erfolgreiches dazu.
836010	840460	4450	26 Zimmer hat es, keine klassischen, sondern sog. Apartmentzimmer.
840610	844140	3530	Der Betreiber Dominik Wyss zeigt uns eines.
844400	849220	4820	Wir sind hier in einem noch unmöblierten 3-Zimmer-Apartment.
849400	853020	3620	Die Küche ist schon eingebaut - mit Waschmaschine, Backofen, Kochherd.
853110	855750	2640	Das funktioniert alles bereits.
855890	858590	2700	Diese Apartments sind momentan sehr gefragt.
858800	862150	3350	Im Moment haben wir nur eines, das fertiggestellt und frei ist.
862400	864830	2430	Auch die Ein- und Zweizimmerapartments
864940	867150	2210	sind alle ausgebucht.
867320	870150	2830	Sie kosten je nach Aufenthaltsdauer 50 bis 120 Fr. die Nacht.
870370	873190	2820	Mindestens sieben Nächte müssen Gäste buchen,
873210	874790	1580	die meisten bleiben länger.
875050	877510	2460	Die neue Kundschaft heisst deshalb Langzeitgast.
877770	881070	3300	Unsere Gäste sind im Moment grösstenteils Geschäftsreisende,
881190	883510	2320	die für ein Projekt hierherkommen.
883690	886630	2940	Oder auch Mechaniker, die eine Revision durchführen.
886750	888830	2080	Es gibt auch Gäste,
889090	891950	2860	die aus familiären Gründen bei uns absteigen.
892050	894430	2380	Das Hotel Amaris.
894580	896950	2370	Neue Apartmentzimmer sind auch hier geplant.
897050	900510	3460	Bereits beim letzten Umbau setzte die Betreiberin auf Langzeitgäste.
900680	904070	3390	Alle Appartements sind aktuell ausgebucht.
904280	908550	4270	Wir haben das gemacht, weil das Bedürfnis nach Langzeitgästen stieg.
908770	912670	3900	Es kommen sehr viele Informatikleute hierher
912780	914310	1530	und Spezialisten aus dem Ausland.
914420	916630	2210	Wie lange bleiben sie?
916790	919030	2240	Das ist unterschiedlich, aber meistens drei Monate bis ein Jahr -
919110	921510	2400	oder sogar noch länger.
921690	925270	3580	Es ist eine Weiterentwicklung der heutigen Hotellerie.
925300	927550	2250	Es ist eine andere Art,
927690	930750	3060	so wie es mit Bed and Breakfast auch Alternativen gibt,
930840	932910	2070	die man früher weniger gekannt hat.
933080	935150	2070	Apartmenthotels, keine schmucken Bijous,
935340	939150	3810	aber die neue, sichere Einnahmequelle für die Hoteliers im Mittelland.
940570	942870	2300	Fussball, Triathlon, Tour de France -
943060	947590	4530	Daniela Milanese hat uns so einiges zu berichten vom Sport-Sonntag.
948490	950750	2260	Seit diesem Wochenende rollt der Ball wieder in der Super League.
950920	954110	3190	Und Meister Basel hatte heute seinen ersten Saison-Auftritt.
954210	956510	2300	Er empfing zu Hause den FC Sion.
956730	958710	1980	Die Basler gaben sich dabei keine Blösse
958840	961910	3070	und starteten standesgemäss mit einem Sieg.
962880	968230	5350	FC Basel Captain Matias Delgado ist mit zwei Toren der Mann des Spiels.
968390	971390	3000	Nach einem umstrittenen Elfmeterpfiff -
971570	974990	3420	Sions Konate hält Basels Eder Balanta etwas zurück -
975100	979910	4810	trifft Delgado in der 37. Min. zum 1:0.
980010	983230	3220	Eine Minute vor der Pause:
983390	988750	5360	Eine herrliche Kombination über Steffen, Delgado und Calla
988880	992470	3590	schliesst Seydou Doumbia zum 2:0 ab.
992680	996350	3670	Der Basler Neuzugang, einst bei YB zweimal Torschützenkönig
996540	1000030	3490	in der Super League, mit seinem ersten Tor für Basel.
1000120	1002110	1990	Seydou Doumbia.
1002250	1007350	5100	Kurz nach der Pause nochmals Matias Delgado mit dem 3:0-Endstand.
1007540	1012590	5050	Der Meister ist optimal in die neue Saison gestartet.
1014450	1016830	2380	Lausanne ist nach zwei Jahren in der Unterklassigkeit
1016920	1018910	1990	zurück in der höchsten Liga.
1019140	1020990	1850	Und der erste Auftritt in der Super League
1021200	1023630	2430	führte die Waadtländer heute nach Zürich.
1023730	1026430.0000000001	2700	Gegen die Grasshoppers blieben sie im Stadion Letzigrund
1026640.0000000001	1028470	1830	allerdings erfolglos.
1029339.9999999999	1033869.9999999999	4530	Die Lausanner in den orangen Leibchen geraten nach 24 Min. in Rückstand.
1034060	1038950	4890	Caio erzielt das sehenswerte 1:0 für die Grasshoppers.
1041790	1045950	4160	Der Brasilianer schiesst in der zweiten Halbzeit auch das 2:0,
1046069.9999999999	1048950	2880	wieder mit einem Weitschuss.
1049180	1054590	5410	Dank ihm gewinnen die Grasshoppers gegen den Aufsteiger mit 2:0.
1055930	1059270	3340	Lange Gesichter nach der Partie beim FC Thun.
1059450	1062310	2860	Die Berner Oberländer, das klar bessere Team,
1062510	1065960	3450	mit der Führung nach bereits 2 Min.
1066140	1069880	3740	Simone Rapp, erster Thun-Torschütze der Saison.
1070020	1075040	5020	Alles deutet auf einen Sieg des FC Thun hin - bis zur 91. Min.
1075240	1078360	3120	Da schafft Vaduz doch noch den Ausgleich.
1078450	1081280	2830	Ali Messaoud sorgt für ein - aus Vaduzer Sicht -
1081360	1084720	3360	sehr schmeichelhaftes Unentschieden.
1086840	1090680	3840	3,8 km schwimmen, 180 km auf dem Rad
1090920	1093640	2720	und - zu guter Letzt - einen Marathon laufen.
1093780	1095880	2100	Das ist Ironman.
1095990	1099520	3530	Fest in Schweizer Hand war heute die 20. Ausgabe des Ironmans Zürich.
1099700	1103120	3420	Besonders eindrücklich war der Auftritt von Daniela Ryf.
1103230	1106520	3290	Nur eine Woche nach ihrem letzten Ironman-Sieg
1106720	1109960	3240	liess sie auch diesmal der Konkurrenz nicht den Hauch einer Chance.
1112900	1115320	2420	Es war eine weitere eindrückliche Machtdemonstration
1115440	1117480	2040	der Ironman-Weltmeisterin.
1117650	1121040	3390	Die grosse Differenz schuf die 29-Jährige Daniela Ryf
1121140	1123120	1980	einmal mehr auf dem Rad.
1123340	1127760	4420	Über die 180 km holte sie einen Vorsprung von rund 21 Min. heraus.
1127950	1134240	6290	Keine Spur von Nachlassen auch auf dem abschliessenden Marathon.
1134330	1140120	5790	Bei den Männern geht der Sieg einmal mehr an Ronnie Schildknecht.
1140320	1143760	3440	In einem umkämpften Rennen macht er den Unterschied auf der Laufstrecke.
1143990	1148520	4530	Ronnie Schildknecht gewinnt damit den Ironman Zürich zum 9. Mal.
1151310	1153680	2370	Vor wenigen Minuten endete die Tour de France
1153790	1157480	3690	nach drei Rennwochen traditionell auf der Champs-Elysees in Paris.
1157680	1160440	2760	Christopher Froome stand als Sieger bereits fest.
1160530	1162560	2030	Denn auch das hat Tradition.
1162680	1165440	2760	Der Leader wird am letzten Tag nicht mehr angegriffen.
1165620	1169400	3780	Und so wurde die heutige Etappe für den Briten zur Triumphfahrt.
1169650	1172520	2870	So konnte Froome bereits vor der Ankunft in Paris
1172680	1175880	3200	mit seinen Teamkollegen auf seinen dritten Tour-Sieg anstossen.
1175980	1180240	4260	Nicht wie gewöhnlich mit Champagner, sondern mit Bier!
1180370	1184000	3630	Und auch einen Tagessieger gab es zu feiern.
1184240	1186760	2520	Gewonnen wurde die letzte Etappe im Sprint
1186990	1190160	3170	von Andre Greipel aus Deutschland.
1195720	1198320	2600	Das war's vom Sport an dieser Stelle.
1199320	1200760	1440	Danke, Daniela!
1201010	1204480	3470	Wobei: ganz unsportlich ist auch unsere letzte Geschichte nicht.
1204590	1207360	2770	Eine, die fast anderthalb Jahre dauert
1207560	1209840	2280	und nun in schnellen Zügen zu Ende geht.
1209920	1212040	2120	Die Weltumrundung der Solar Impulse
1212240	1215320	3080	ist auf ihrer letzten Etappe mit Bertrand Piccard im Cockpit.
1215480	1218760	3280	Letzte Nacht ist er aufgebrochen vom Flughafen Kairo in Ägypten.
1218960	1221720	2760	Im Moment befindet er sich über der arabischen Halbinsel.
1221890	1226680	4790	Und - läuft alles nach Plan - landet er übermorgen Dienstag in Abu Dhabi.
1228200	1231800	3600	Es ist so weit, Bertrand Piccard bricht zum Endspurt auf.
1231880	1234040	2160	Was einst eine kühne Vision war,
1234160	1237840	3680	soll in weniger als 48 Std. Realität werden:
1237990	1239920	1930	die Weltumrundung in einem Flugobjekt,
1240090	1243120	3030	das durch reine Sonnenenergie betrieben wird.
1243200	1244920	1720	Doch die letzte Etappe hat es in sich.
1245160	1248480	3320	Die grösste Herausforderung wird die Hitze:
1248690	1251360	2670	Dieser Flug wird sehr schwierig,
1251470	1255600	4130	denn die Temperaturen sind extrem, Thermik und Wolken sind sehr hoch.
1255760	1259040	3280	D.h., ich muss lange Zeit auf der maximalen Höhe fliegen
1259220	1263850	4630	und die Sauerstoffmaske viel länger tragen.
1264030	1267530	3500	Das bringt Material und Pilot an ihre Grenzen.
1267790	1271650	3860	17'000 Solarzellen treiben die Solar Impulse 2 an.
1271820	1275930	4110	Die Spannweite der Flügel ist grösser als die einer Boeing 747,
1276090	1280250	4160	dabei wiegt der Solarflieger gerade mal so viel wie ein Minivan.
1280350	1284090	3740	Zwei Tage und zwei Nächte lang dauert der letzte Flug.
1284260	1287130	2870	Wenn alles nach Plan läuft, landet Piccard dort,
1287270	1290010	2740	wo sein Abenteuer letztes Jahr im März begonnen hat -
1290090	1293050	2960	5am Flughafen von Abu Dhabi.
1293980	1297130	3150	Er: ein altes Haus. Lebt ihn ihm, dem alten Haus.
1297320	1301690	4370	Und mit der neu entfachten Jugend- liebe kämpft er gegen dessen Abriss
1301800	1304170	2370	im Schweizer Film um 20 Uhr.
1304250	1307170	2920	Ich wünsche gute Unterhaltung und einen schönen Abend.
1307360	1312290	4930	SWISS TXT / UT - Redaktion Zürich Claudia Burri, Roman Brauchli, Sabine Näpflin