start	end	duration	text
1311260	1314610	3350	Freud verbrachte seinen Lebensabend im Londoner Exil.
1314760	1318810	4050	Dort verstarb er vor genau 75 Jahren an einer Überdosis Morphium.
1320060	1323850	3790	In diesem schmucken Haus im Londoner Hampstead-Quartier steht es:
1324020	1328090	4070	das berühmteste Sofa der Weltgeschichte.
1328730	1331530	2800	Sigmund Freuds Couch - d a s  Symbol der Psychoanalyse.
1331650	1333570	1920	Hier empfing der weltberühmte Denker
1333780	1335970	2190	bis kurz vor seinem Tod noch Patienten.
1336090	1337610	1520	In einem Arbeitszimmer,
1337750	1340530	2780	das er haargenau eingerichtet hatte wie jenes in Wien.
1340680	1345930	5250	1938, als 82-Jähriger, hatte Freud seine Heimat verlassen müssen.
1346150	1348330	2180	Vertrieben von den Nazis.
1350210	1354170	3960	Als er nach England kam, war er schon ein alter Mann,
1354340	1356330	1990	er war ziemlich krank.
1356460	1359210	2750	Freiwillig hätte er diesen Umzug sicher nicht mehr auf sich genommen.
1359450	1363970	4520	Aber er fühlte: Sein Leben und jenes seiner Familie war in Gefahr.
1364120	1366810	2690	Sein Ruf als skandalumwitterter Seelendoktor
1367020	1369450	2430	eilte Freud damals voraus.
1370120	1372770	2650	Die Presse war ziemlich feindselig ihm gegenüber.
1372980	1378250	5270	Er sei ein Mann voller komischer Ideen und besessen vom Thema Sex.
1378340	1382330	3990	Er sei so gar nicht britisch, hiess es.
1382530	1385250	2720	Aber man zeigte auch Respekt vor ihm.
1385330	1387770	2440	Er hatte stets hochkarätige Gäste:
1388000	1396290	8290	H. G. Wells, Virginia Woolf oder Salvador Dali kamen zu Besuch.
1396500	1402690	6190	Freuds Psychoanalyse als Behandlung seelischer Probleme,
1402850	1406650	3800	seine Theorien zum Unbewussten, sie sind bis heute umstritten.
1406770	1412290	5520	Was bleibt von ihm?
1412370	1415250	2880	Er war revolutionär mit seinen Ideen, seinen Schriften.
1415390	1417410	2020	Er hatte sehr grossen Einfluss darauf,
1417500	1421970	4470	wie die Menschen im 20. und 21. Jh. über sich selber denken.
1422060	1425690	3630	1939 verstirbt der schwerkranke Freud
1425840	1429770	3930	an einer von ihm selbst bestimmten Überdosis Morphin.
1429870	1433730	3860	Seine letzte Wohn- und Wirkungsstätte ist heute ein Museum.
1435640	1438010	2370	"Und nun zu Stephan Klapproth und den Themen von ""10vor10""."
1439520	1441130	1610	Die Luftschlacht des Barack Obama:
1441270	1443850	2580	Wird der oft zögernde US-Oberbefehlshaber
1444010	1446570	2560	seinen Krieg gegen die IS-Mörder gewinnen?
1446660	1448890	2230	Dies im Fokus bei uns heute.
1448980	1450730	1750	Schwestern, zurück an die Front!
1450880	1452890	2010	Gegen die Personalnot im Gesundheitswesen
1453020	1454690	1670	könnte die Schweiz im Prinzip
1454780	1457410	2630	Zigtausende ehemalige Krankenschwestern mobilisieren.
1457530	1458770	1240	Im Prinzip.
1458950	1462250	3300	Wir zeigen, wie schwer der Rückweg in die Hightech-Medizin ist.
1462380	1463970	1590	Und: Flimmern tut es immern.
1464170	1466210	2040	Eine schöne Ausstellung in Basel zeigt,
1466400	1470530	4130	wie Fernsehen früher war und warum es schnell so mächtig wurde.
1470680	1471930	1250	Danke, Stephan.
1472810	1474330	1520	Danke für Ihr Interesse.
1474510	1476970	2460	"Weiter gehts auf SRF 1 mit ""Meteo"" und dem Krimi ""Die Chefin""."
1477140	1479490	2350	Einen unterhaltsamen Abend und bis bald.
1479700	1481970	2270	SWISS TXT / UT-Redaktion Zürich Claudia Burri, Philipp Schlatter, Daniela Zacheo