start	end	duration	text
1323060	1326890	3830	und London sozusagen der Katalysator dieses Gefühls.
1327700	1330650	2950	1976 brodelt es in der britischen Jugend.
1331310	1333650	2340	Die Arbeitslosigkeit ist auf einem Höchststand,
1334340	1336890	2550	die Wirtschaft am Ende und die Wut auf Politiker
1337570	1340050	2480	und Establishment gross.
1340730	1343490	2760	Da taucht die Band Sex Pistols auf
1344300	1346690	2390	und singt sich diese Wut von der Seele.
1347340	1350050	2710	Anarchy in the UK ist ihr Schlachtruf.
1350740	1352850	2110	Anarchie und Pöbelei als Rezept
1353550	1356010	2460	gegen die verkrustete britische Gesellschaft.
1356750	1359770	3020	Gründungsmitglied Glen Matlock erinnert sich.
1363200	1368170	4970	Zu jener Zeit trugen alle Schlaghosen und lange Haare.
1368840	1371170	2330	So wollten wir nicht aussehen,
1371900	1373690	1790	deshalb haben wir unsere Hosen und Haare abgeschnitten.
1374440	1376420	1980	Plötzlich fanden das alle schockierend.
1377210	1378820	1610	Wir hatten kein Geld, aber viel Selbstvertrauen.
1379550	1381510	1960	Klar, wir waren irgendwie arrogante Gockel,
1382280	1384270	1990	aber nicht einfach nur Krawallbrüder.
1385020	1386270	1250	Es ging darum, das zu tun, was wir wollten,
1386970	1388670	1700	uns nichts vorschreiben zu lassen.
1389410	1391790	2380	Diese Selbstbestimmung war Teil des Anarchie-Gedankens.
1396180	1398710	2530	40 Jahre später ist Punk massentauglich geworden,
1399410	1401870	2460	wie der Erfolg des einstigen Bürgerschrecks
1402500	1405030	2530	Vivian Westwood beweist.
1405690	1408670	2980	London feierte 2016 die ehemalige Skandalbewegung
1409330	1411510	2180	in zahlreichen Ausstellungen.
1412290	1414270	1980	Eine davon ist den Bildern von Jill Furmanovsky gewidmet.
1415060	1417190	2130	Die Britin war mit ihrer Kamera
1418010	1420430	2420	sozusagen die fotografische Geburtshelferin des Punk.
1422930	1424670	1740	Die Botschaft war klar:
1425400	1428670	3270	Du musst nicht auf die Älteren hören, nicht das respektieren,
1429380	1430710	1330	was früher war.
1431530	1433470	1940	Du musst keine gute Schule besucht haben
1434170	1436510	2340	oder dein Instrument beherrschen,
1437220	1439150	1930	um in einer Rockband spielen zu können,
1439980	1443910	3930	um wichtig zu sein, um etwas zu sagen zu haben.
1444660	1448510	3850	Im Touristenviertel Camden lebt die Bewegung weiter.
1449260	1452170	2910	Nietengürtel und Springerstiefel lassen die Kassen klingeln.
1452850	1455170	2320	Punk ist zum Geschäft geworden.
1455890	1458450	2560	Die einst antikapitalistische Kultur wurde längst vom Kapital eingeholt.
1462600	1466970	4370	Mir tun die jungen Leute von heute Leid,
1467660	1470170	2510	denn jeden Trend gab es schon mal.
1471010	1473130	2120	Die Welt sieht heute zwar hipper aus, sie ist aber weit langweiliger,
1473880	1476370	2490	konventioneller als früher.
1477090	1480490	3400	Und doch gibt es sie noch, die Punks alter Schule.
1481130	1483810	2680	Die sich auch heute noch nicht anpassen wollen.
1486260	1488970	2710	Punk ist für mich ein Lebensstil, nicht nur Musik.
1489720	1495010	5290	Ich bin jetzt 55 und bin Punker, seit ich 18 war.
1495780	1498770	2990	Eine lange Zeit.
1499520	1501970	2450	So schnell wird der Punk also nicht verschwinden,
1502680	1504610	1930	ganz entgegen seines einstigen Mottos No Future.
1508280	1511690	3410	Das war's von uns.
1512460	1515290	2830	Wenn Sie die Themen dieser Sendung auf Social Media diskutieren wollen:
1516040	1518130	2090	Unser Hashtag heisst 10vor10.
1518960	1520970	2010	Ich danke fürs Zuschauen und wünsche einen schönen Abend.
1521590	1523650	2060	Bis morgen, ich freu mich auf Sie.
1524420	1527490	3070	SWISS TXT / UT-Redaktion Zürich Evelyne Iyer, Sabine Näpflin, Lilian Zbinden