start	end	duration	text
1739720	1741120	1400	Merkt man das auch im Parlament?
1741850	1743120	1270	Hatten die Anschläge dort einen Einfluss?
1743820	1749210	5390	Auf die Debatte nicht so sehr.
1751010	1752890	1880	Wenn die Debatte war noch letzten Winter.
1753610	1755570	1960	Damals war man unter Einfluss der Anschläge in Paris.
1756280	1760930	4650	Aber es hatte einen Einfluss auf die Kampagne.
1761660	1763490	1830	Die Befürworter haben sehr emotional argumentiert.
1764140	1769610	5470	Das hier wurde gestaltet.
1772240	1778090	5850	Glück ist eine Frage der Sicherheit, schrieb man da.
1778770	1780650	1880	Das wurde also instrumentalisiert.
1781370	1783540	2170	Es gab ziemlich viele kritische Stimmen in den Medien zum
1784220	1786260	2040	Nachrichtendienstgesetz.
1786940	1792140	5200	Man machte eine kleine Aktion.
1792870	1798220	5350	Man weitere Beispiele, wie der französische Geheimdienst
1800960	1806900	5940	einen Anschlag vereiteln konnten.
1807650	1811220	3570	Die Kampagne war also durchaus emotional geladen.
1811870	1813500	1630	Aber nicht die Debatte.
1814220	1819540	5320	Vielen Dank.
1828250	1831420	3170	Es ist 13:00 Uhr, es ist Zeit für unsere erste Hochrechnung, Claude
1832160	1837580	5420	Longchamp macht sich zu mir auf den Weg.
1854440	1857780	3340	Claude Longchamp, bei den Trends sie mir noch im Ungefähren, bei den
1858440	1859820	1380	Hochrechnungen werden wir etwas präziser.
1860600	1865900	5300	und wenn ich mir das so anschaue, wird es doch ziemlich genau U.
1869900	1872140	2240	Hier haben wir noch einen kleinen Fehlerbereich
1872790	1878220	5430	von plus oder minus drei.
1880780	1883580	2800	Also 40:60 ist in etwa die Ausgangslage, davon gehen wir den
1884360	1885660	1300	ganzen Nachmittag aus.
1886410	1888620	2210	Das ist doch ein recht deutliches Ergebnis.
1889320	1894620	5300	Das ist aber auch das klassische Schicksal einer linken Initiative.
1898700	1901940	3240	Es ist etwas mehr als eine linke Initiative, normalerweise geben wir
1902640	1908020	5380	denn nur 30-35 %.
1910350	1913380	3030	Wenn es aber noch eine bestimmte Zielgruppe gibt, dann gibt es
1913970	1915860	1890	vielleicht noch mehr Zustimmung,
1916700	1919100	2400	in der Westschweiz zeichnet sich hier zum Beispiel ein deutlich
1919770	1921100	1330	besseres Ergebnis ab,
1921780	1924540	2760	der Kanton Genf, Tessin und Jura nehmen die Initiative wahrscheinlich
1925220	1926820	1600	an.
1927530	1930260	2730	Der Kanton Waadt könnte sie auch annehmen, nicht ganz der klassische
1930940	1932380	1440	Röstigraben, aber in diese Richtung.
1933040	1938340	5300	Könnte man auch sagen, ein Achtungserfolg für die Initiative?
1948290	1951460	3170	Sie wurde vor allem in den Städten angenommen, da gibt es eher die
1952240	1955140	2900	Tendenz für die Unterstützung, dort gibt es aber auch mehr linke Stimmen
1955750	1957860	2110	üblicherweise.
1958610	1963940	5330	Auf dem Land ist aber die Ablehnung massiv.
1969110	1971820	2710	Also Stadt-Land und Röstigraben könnten ein Thema sein.
1972490	1977860	5370	Wir gehen ins Resultate Studio.
1980400	1983460	3060	Das aufzählen geht offensichtlich etwas schneller als auch schon,
1984170	1986940	2770	Klaus hatten wir schon, jetzt haben auch Aargau ungeteilten Resultate
1987580	1992580	5000	geschickt.
1993330	1995460	2130	In der ersten Vorlage geht es darum, ob die laufenden und
1996200	1999670	3470	künftigen AHV-Renten um 10 % erhöht werden sollen.
2000380	2005750	5370	Die nitiative hat einen schwierigen Stand.
2010300	2016190	5890	Der Kanton Nidwalden sagt deutlich nein mit 73 % auf.
2019700	2022310	2610	Das sind bisher drei Kantone, die Nein gesagt haben zur
2023030	2028470	5440	AHVplus-Initiative.
2029560	2032350	2790	Eindringen in Computer und abhören von Telefonen, das neue
2033110	2035070	1960	Nachrichtendienstgesetz will mehr Kompetenzen für den
2035700	2037990	2290	Nachrichtendienst.
2038700	2040470	1770	Gemäss dem Kanton Aargau solle das auch erhalten.
2041190	2046270	5080	Das Resultat aus dem Kanter Nidwalden noch deutlicher.
2047030	2049030.0000000002	2000	Damit sagen alle drei ausgesetzten Kantone Ja zum neuen
2049739.9999999998	2053190	3450	Nachrichtendienstgesetz.
2053929.9999999998	2059310	5380	Der ökologische Fussabdruck soll verkleinert werden.
2060370	2063630	3260	Dass die Forderung der Initiative zur Grüne Wirtschaft, da gibt es
2064300.0000000002	2066590.0000000002	2290	aber erst einmal Ablehnung,
2067239.9999999998	2069429.9999999998	2190	im Kanton Aargau fast 70 %.
2070179.9999999998	2075550.0000000002	5370	Noch höher ist der Nein Anteil im Kanton Nidwalden.
2085420	2088389.9999999998	2970	Das was für den Moment, sie bleiben aktuell informiert, auch auf
2089070.0000000002	2094469.9999999998	5400	unserer Website.
2096860.0000000002	2099830	2970	Wenn es mit dem Auszählen so weitergeht, gibt es die nächsten