start	end	duration	text
1283100	1287020	3920	Und dieses Jahr mitten drin - eine kleine Schweizer Insel.
1287170	1289300	2130	Mode Suisse präsentiert dem Londoner Fachpublikum
1289400	1293820	4420	erstmals 10 junge Modetalente und deren Arbeit.
1299830	1302140	2310	z.B. Julian Zigerli.
1302290	1305900	3610	Der 29-Jährige gilt als Shootingstar der Szene.
1306090	1309420	3330	Als erster Schweizer Designer überhaupt durfte er seine Models
1309570	1312900	3330	kürzlich in Mailand über den Laufsteg schicken.
1313140	1315860	2720	Eingeladen von Giorgio Armani persönlich.
1316010	1319460	3450	Eine Garantie für finanziellen Erfol ist das aber noch nicht.
1319540	1323300	3760	Wie schwierig ist es denn, im Modebusiness Fuss zu fassen?
1324880	1327340	2460	Sehr schwierig.
1327540	1329420	1880	Ich bin auch schon seit 3 Jahren dabei und es läuft gut,
1329660	1331980	2320	aber noch nicht so gut, dass man davon leben könnte.
1332210	1334420	2210	Es geht wirklich ziemlich lange und es braucht viel Kraft
1334620	1340380	5760	und viel Arbeit, um irgendwann Fuss fassen zu können
1340620	1342700	2080	In London zu Hause ist Ginny Litscher.
1342800	1346020	3220	Die ausgebildete Illustratorin designt Seidenschals.
1346210	1348620	2410	Nach Praktika bei berühmten britischen Designern
1348850	1351260	2410	wie Vivienne Westwood oder Alexander McQueen
1351370	1354860	3490	hat sich Litscher vor rund 2 Jahren selbstständig gemacht.
1355090	1357540	2450	Mit einer kleinen aber feinen Kollektion,
1357710	1362020	4310	welche sie auch an der prestige- trächtigen Regent's Street verkauft.
1362140	1364420	2280	Und damit - im Gegensatz zu vielen anderen Jungdesignern -
1364500	1367060	2560	sogar Geld verdient.
1370720	1372900	2180	Das ist etwas sehr Schweizerisches von mir: Ich bin sehr vorsichtig.
1373010	1375260	2250	Ich gehe keine grossen Risiken ein.
1375360	1378660	3300	Ich lieferte immer nur auf Bestel- lung und die Leute bezahlten gleich
1378830	1382900	4070	Ich hatte keine Ausgaben, die darüber hinaus gingen,
1383050	1385420	2370	denn so gehen viele Leute pleite.
1386220	1389580	3360	Die Konkurrenz auf dem inter- nationalen Modeparkett ist riesig.
1389660	1393260	3600	Jährlich werden neue Designer auf den Markt geschwemmt.
1393430	1396300	2870	Kein einfaches Umfeld für die Schweizer Talente.
1396380	1400900	4520	Doch sie seien gut gerüstet, so der Kurator des Londoner Showrooms.
1403030	1407420	4390	Sie sind toll. Es ist viel farbiger als noch vor 10 Jahren,
1407660	1411020	3360	als alles noch sehr schlicht und wahnsinnig gut genäht war.
1411220	1416020	4800	Es fehlte vielleicht etwas an Fun. Der ist heute sicher da.
1416240	1419620	3380	Fazit: Die Schweizer Fashionbranche lebt.
1419800	1423740	3940	Und muss sich auch im trendigen London nicht verstecken
1423930	1427260	3330	Im Showroom zumindest stösst die Arbeit der Jungdesigner
1427330	1428820	1490	auf Interesse.
1428940	1431700	2760	Das Wichtigste: Man hat auf sich aufmerksam machen können.
1431890	1433900	2010	Ein erster kleiner Schritt in die grosse Modewelt.
1438380	1442860	4480	Zum Schluss noch einmal ein Blick au die dramatische Lage in der Ukraine.
1443050	1447020	3970	Nach dem Sturm der Sicherheitskräfte auf dem Unabhängigkeitsplatz
1447180	1452700	5520	in Kiew berichten die Agenturen inzwischen von 13 Todesopfern.
1452920	1457340	4420	7 Demonstranten und 6 Polizisten sollen ihr Leben verloren haben.
1457460	1458780	1320	Die weitere Entwicklung ist,
1458890	1460780	1890	wie unser Korrespondent in dieser Sendung sagte,
1460870	1462820	1950	völlig offen und ungewiss.
1462990	1471620	8630	Weitere Informationen auf dem Internet.
1471740	1474060	2320	Was tun, wenn das Wohl eines Kindes in Gefahr ist?
1474210	1476780	2570	"Der Konflikt zwischen Betroffenen und Behörden ist das Thema im ""Club"""
1476970	1479300	2330	"mit Mona Vetsch gleich im Anschluss an ""Meteo""."
1479470	1481860	2390	Danke fürs Zuschauen und einen schönen Abend.