start	end	duration	text
1283300	1285700	2400	Der Plan geht auf.
1285870	1288860	2990	2013 gewinnt Bencic das Juniorinnen-Turnier der French Open
1289060	1292340	3280	und genau wie ihr grosses Vorbild danach auch noch Wimbledon.
1292460	1295540	3080	Als erst 4. Spielerin schafft sie dieses Double.
1300220	1303660	3440	Und heute - nur ein Jahr später - schafft die 17-Jährige
1303860	1308380	4520	den Vorstoss an die absolute Weltspitze im Frauentennis.
1308460	1310140	1680	In der Weltrangliste
1310290	1313340	3050	katapultiert sie sich damit bereits auf Rang 33.
1313450	1317020	3570	Belinda Bencic: der neue Stern am Tennishimmel.
1320060	1322740	2680	Zum Schluss nach Venedig, zum Filmfestival,
1322840	1324500	1660	wo es gestern eine Weltpremiere gab.
1324640	1326620	1980	"""The Cut"" heisst der Film,"
1326820	1328980	2160	und er sorgte schon vor seiner Aufführung für Furore.
1329160	1331300	2140	Nicht aus cineastischen, sondern aus politischen Gründen.
1331390	1332780	1390	"Denn in ""The Cut"""
1332970	1335780	2810	thematisiert der deutsch-türkische Regisseur Fatih Akin
1335920	1338740	2820	den Völkermord an den Armeniern durch die Türken.
1338860	1340940	2080	Selim Petersen berichtet.
1342780	1345260	2480	Türklopfen Armenier, öffnet die Tür!
1345410	1348900	3490	So wie dieser Familie erging es 1915 vielen Armeniern.
1349100	1352540	3440	Über Nacht wurden sie vom türkischen Komitee für Einheit und Fortschritt
1352650	1354860	2210	quasi zu Sklaven degradiert.
1354950	1357500	2550	1,5 Mio. Menschen starben.
1357670	1360300	2630	Der erste Spielfilm zum Thema löst Emotionen aus,
1360440	1362660	2220	auch bei den armenischen Darstellern.
1362750	1367660	4910	Das ist der Film, auf den die Armenier gewartet haben.
1367840	1370820	2980	Türkische Nationalisten halten den Genozid
1370930	1373300	2370	für eine politisch motivierte Lüge.
1373480	1376540	3060	"Für sie ist ""The Cut"" darum ein rotes Tuch."
1376710	1380300	3590	Von den Ultranationalisten erhielt Regisseur Fatih Akin
1380410	1382180	1770	gar eine Todesdrohung.
1382240	1385420	3180	Einschüchtern lässt er sich davon aber nicht.
1385570	1388460	2890	Für die Kunst lohnt es sich zu sterben.
1388700	1391020	2320	Macht bitte keine grosse Sache daraus!
1391110	1393540	2430	Es handelt sich nur um eine kleine Gruppe,
1393740	1396620	2880	die sehr laut um Aufmerksamkeit schreit.
1396820	1398860	2040	"""The Cut"" offenbart, wie stark die Türkei"
1399050	1402140	3090	nach wie vor mit ihrer Vergangenheit ringt.
1402260	1404500	2240	Doch auch Fortschritte sind zu vermelden:
1404650	1407700	3050	Ende April bezeichnete Präsident Recep Erdogan
1407930	1411140	3210	"die Ereignisse von 1915 erstmals als ""unmenschlich""."
1411330	1414260	2930	Ist die Türkei also doch bereit für das heikle Thema?
1414500	1417140	2640	Es ist halt emotional sehr aufgeladen.
1417370	1420260	2890	Aber ich glaube, es gibt das Bedürfnis nach einer Katharsis,
1420340	1426020	5680	auch auf der Seite von Leuten, die so etwas eher als Gegner sehen.
1426200	1429580	3380	"""The Cut"" ist ein wuchtiger und wichtiger Film."
1429670	1430820	1150	Allerdings einer,
1431020	1434060	3040	den das türkische Publikum vielleicht nie zu sehen kriegt.
1434200	1436540	2340	Die Nationalisten wollen alles tun,
1436740	1439500	2760	"damit ""The Cut"" nicht in die türkischen Kinos kommt."
1442610	1444780	2170	"In die Schweizer Kinos kommt ""The Cut"" hingegen garantiert."
1444970	1448300	3330	Der brisante Film startet bei uns Mitte Oktober.
1449480	1453260	3780	"Und jetzt zu Andrea Vetsch und den Themen von ""10vor10"":"
1453410	1457460	4050	Neben der Debatte über die deutschen Waffen im Kampf gegen den IS
1457550	1460140	2590	zeigen wir, wie schwierig es für Mitglieder ist,
1460340	1461980	1640	sich von der Truppe zu lösen. Der Bericht über IS-Deserteure.
1462070	1465020	2950	Lukrativ, aber heikel:
1465220	1470420	5200	In der Schweiz, inzwischen grösster Rohstoffhandelsplatz der Welt,
1470590	1474380	3790	soll eine neue Aufsicht den Firmen genauer auf die Finger schauen,
1474560	1478100	3540	so fordert es die Erklärung von Bern. Macht das Sinn?
1478260	1482020	3760	Und: Belinda Bencic ist am US Open auf den Spuren von Martina Hingis.
1482100	1486300	4200	Hinter den beiden Tennisassen steht dieselbe Frau: Melanie Molitor.
1486440	1488980	2540	Sie spricht bei uns über Charakter und Potenzial
1489160	1492060	2900	der jüngsten Schweizer Tennishoffnung.
1492140	1494980	2840	Danke, Andrea.
1495930	1498420	2490	Das war es von uns für Sie.
1498650	1500780	2130	"Weiter geht es auf SRF 1 mit ""Meteo"" und dem Quiz ""1 gegen 100""."
1500880	1502260	1380	Einen schönen Abend allerseits.
1502350	1505740	3390	SWISS TXT / UT-Redaktion Zürich Marcel Hasler, Sabine Näpflin, Alexandra Duttweiler