start	end	duration	text
2940	5560	2620	.
5720	10160	4440	1:1-Untertitelung. Livepassagen können Fehler enthalten.
14840	18080	3240	"Guten Abend zu ""Schweiz aktuell"" - heute mit diesen Themen:"
20590	22920	2330	Das Wallis versucht den Imageschaden
23050	25360	2310	wegen der Vorwürfe um gepantschten Wein zu reparieren.
25500	27520	2020	Die Regierung will die Kontrolle verbessern.
30370	34360	3990	Bei Rapperswil/BE will man umstrit- tene Bohrungen nach Erdgas machen.
34580	37480	2900	Die Grünen haben Widerstand angekündigt.
40460	44080	3620	Solidaritätsfest für die Flutopfer in Südosteuropa heute Abend in Zürich.
44180	46480	2300	Eine Gruppe junger Leute im Einsatz
46640	49760	3120	aus der neuen Heimat für die alte Heimat.
51260	55120	3860	Eine Serie von Brandstiftungen gab es heute Morgen in Arlesheim/BL.
55140	57400	2260	Die Feuerwehr stand im Grosseinsatz.
57500	61120	3620	Innert kürzester Zeit brannte es gerade an 3 Orten.
62690	66540	3850	Andy Scheiwiller schaut sich den Ort an, wo es heute Morgen brannte.
66760	69700	2940	Die Kleider und noch viele andere Dinge in seinem Sportgeschäft
69820	71860	2040	sind nicht mehr zu gebrauchen.
72010	75580	3570	Der Schaden in seinem Geschäft ist gross.
75680	78300	2620	Ich war im Büro.
78460.00000000001	82260	3800	"Plötzlich schreien unsere Frauen hier vorne: ""Feuer, Feuer."""
82460.00000000001	85020	2560	Ich rannte sogleich nach vorne.
85260	90380	5120	Ich sah schon eine riesen Stich- flamme, die bis an die Decke ging.
90539.99999999999	93900	3360	Zum Glück haben wir einen Feuerlöscher.
93979.99999999999	97660	3680	Dank dem gemeinsamen Einsatz der Angestellten und einem Kind
97860	100700	2840	geschah nicht noch mehr, bis die Feuerwehr eintraf.
100870	103220	2350	Der Laden bleibt aber vorerst geschlossen.
103380	106420	3040	Es brannte auch bei einem Detail- händler nicht weit entfernt von ihm,
106570	108979.99999999999	2410	auch dort in der Kleiderabteilung.
109090	112700	3610	Die Polizei ist sich bei der Brandursache sicher.
112780	115060	2280	Wir wissen, dass es keine technische Ursache war,
115210.00000000001	117500	2290	eine Person ist dafür verantwortlich.
117620	121430	3810	Es war Brandstiftung. Wer genau das tat, wissen wir nicht.
121620	124570	2950	3 Personen wurden wegen Rauchverdachtsvergiftung untersucht,
124740	127290	2550	eine Person musste ins Spital gebracht werden.
129210.00000000001	133210	4000	Seit vor ein paar Wochen die Affäre um Dominique Giroud und andere Winzer
133370	137690	4320	im Kanton Wallis bekannt wurde, leidet das Image des Walliser Weins.
137800	141170.00000000003	3370	Dominique Giroud soll Wein gepanscht und Steuern hinterzogen haben.
141329.99999999997	144010	2680	Schluss jetzt, findet die Regierung des Kanton Wallis.
144120	147210	3090	Sie setzte eine Arbeitsgruppe ein, die untersuchen soll,
147370	150250	2880	wie man die Kontrolle der Weinbranche im Wallis verbessern kann.
152340	154970	2630	Die neue Regierungsgruppe soll u.a. herausfinden,
155120	157770	2650	wo die Probleme bei der Kontrolle liegen,
157930	160490	2560	die bereits durchgeführt werden.
160620	162850	2230	Wir hatten vorher keine Kenntnisse.
163050	165570	2520	Wir hatten das Gefühl, das System habe sich bewährt.
165740	169170.00000000003	3430	Aufgrund der Vorkommnisse stellte man fest, dass es Fehler
169350	173210	3860	und Systemschwächen geben kann, die wir nun offensiv aufdecken werden.
173400	176890	3490	Wir werden schauen, wo die Probleme liegen.
177010	179690	2680	Rückblick: Der Wein aus dem Wallis geriet wegen den Geschäften
179840	182970	3130	des Weinhändlers Dominique Giroud in die Kritik.
183180	186810	3630	Vor wenigen Wochen wurde bekannt, das er seinen Wein jahrelang
186900	190370	3470	mit billigerem Wein gestreckt haben soll.
190620	192930	2310	Ausserdem soll er Steuern hinterzogen haben.
193110	195650	2540	In einem Bericht der Bundesverwaltung steht,
195740	198100	2360	er habe bei einer Einvernahme ausgesagt,
198270	200900	2630	dass er mit anderen Weinlieferanten zusammenarbeitete.
201090	203220	2130	Sie sollen ihm ihr Briefpapier gegeben haben,
203329.99999999997	205660	2330	damit er Rechnungen fälschen konnte.
205750	209780	4030	Dominique Giroud gab zu Protokoll, dass das im Wallis so üblich sei.
209940	215980	6040	Im Moment finden im Wallis die Tage der offenen Weinkeller statt.
216200	220579.99999999997	4380	Auch hier ist die Affäre Giroud ein Thema,
220780	225540	4760	weshalb die neue Arbeitsgruppe der Regierung begrüsst wird.
225650	230740	5090	Das ist eine sehr gute Sache.
230900	234660	3760	Die Kontrollen garantieren uns die Echtheit unserer Weine.
234829.99999999997	237820	2990	Wir hoffen darum, dass sie konsequent durchgezogen werden,
237990	241260	3270	damit man Übeltäter unseres Berufs eliminieren kann
241400	250140	8740	und wirklich sagen kann, dass Schweizer Weine echte Weine sind.
251900	255180	3280	Es gibt zwar ein gerichtliches Verfahren,
255370	261980.00000000003	6610	das wird beurteilt, aber das Wichtige sind die guten Produkte,
262089.99999999997	265860	3770	die wir im Moment im Wallis haben.
266010	268660	2650	Das Image des Walliser Weins litt zwar durch die Affäre Giroud,
268760	270780	2020	aber es soll wieder gestärkt werden.
270950	273340.00000000006	2390	Ein erster Schritt in diese Richtung machte heute die Kantonsregierung.
276120	279380	3260	Aus dem Wallis zugeschaltet ist unsere Korrespondentin
279460	281500	2040	Ruth Seelholzer.
281659.99999999994	284420	2760	Wie beurteilen Sie die Stimmung in der Weinbranche im Wallis?
284540	287580	3040	Wir untertiteln live:
291890	293860	1970	ich bin überrascht,
297640	300100	2460	ich war den ganzen Nachmittag hier bei den kleinen Kellereien.
300230	301900	1670	Die Stimmung ist ziemlich positiv.
301990	303940	1950	Das muss man sagen.
308840	311380	2540	Das sind kleinere Kellereien, < diejenigen von Dominique Giroud.
315440	318220	2780	Jeder sagte mir, dass sie für die Qualität ihrer Weine die Hand ins
318300	319020	720	Feuer legen würden.
319130	321060	1930	Man hat Stammkundschaft.
325270	327980	2710	Man beliefert keine Grossverteiler sie haben persönliche Kontakte zu
328130	330020	1890	den Kunden.
332460	334860	2400	Sie haben nichts gemerkt, sagten sie, dass sich diese Affäre
334970	337020	2050	schlecht ausgewirkt habe.
337800	339700	1900	Der Verkauf sei nicht eingebrochen.
344480	346420	1940	Man verdrängt es leicht, habe ich das Gefühl.
346620	349380	2760	Was für Konsequenzen hat die Affäre Giroud für das Wallis?
358880	360910	2030	Eigentlich ist das noch gar nicht absehbar zurzeit.
365250	368030	2780	Bleibt es bei der Affäre Giroud oder wird es eine Affäre der Walliser
368140	369510	1370	Weine.
369640	371590	1950	Die Unschuldsvermutung gilt für Dominique Giroud,
371940	373870	1930	er ist noch nicht verurteilt.
376340	378830	2490	Die Enthüllungen von letzter Woche des westschweizer Fernsehens
380650	382590	1940	haben massive Reaktionen ausgelöst.
385090	387430	2340	Der Branchenverband wollte alle Fakten auf den Tisch bringen.
389440	391430	1990	Heute hat der Kanton Wallis nachgezogen.
393450	395390	1940	Man fürchtet sich um den Ruf des Walliser Weine.
399470	401790	2320	Man möchte zumindest die Kontrolle der Qualität verbessern.
402220	404030	1810	Das ist kein schlechter Weg.
404020	405909.99999999994	1890	Ruth Seeholzer aus Les Illes.
407010	410070	3060	Die Schweiz ist kein Rohstoffland. Trotzdem gibts immer wieder Versuche,
410220	412190	1970	an wertvolle Bodenschätze heranzukommen.
412360	415510	3150	Diese Woche kamen Pläne heraus, schweizerisches Erdgas zu gewinnen.
415670	421110	5440	Geplant ist eine Serie von neuen Probebohrungen bis 3'000 m Tiefe.
421210	425190	3980	Man will herausfinden, ob es in dieser Tiefe Erdgasfelder gibt.
425340	428750	3410	Das Brisante an dem Projekt: Bei einem Abbau von Erdgas
428970	432950	3980	könnte später auch eine umstrittene Methode, die Risse ins Gestein macht,
433070	435030	1960	eingesetzt werden.
435180	438270	3090	Neben 4 Standorten im Kanton Waadt soll auch in Ruppoldsried
438480	441400	2920	bei Rapperswil/BE ein Bohrturm aufgestellt werden.
441670	444920	3250	Die Grüne Partei hat Widerstand angekündigt.
446830	449000	2170	Mitten in der Landwirtschaftszone von Ruppoldsried
449150	451920	2770	in der Gemeinde Rapperswil soll schon im Januar 2015
452110	454560	2450	nach Erdgas gebohrt werden.
454690	456600	1910	Die Bewilligungen fehlen zwar noch,
456710	459240	2530	trotzdem hat die Firma Seag diese Woche informiert.
459380	461640	2260	Im Moment gehts erst um eine Probebohrung.
461840.00000000006	465320	3480	Später aber könnte man auch das sog. Fracking einsetzen,
465430	467880	2450	das sehr umstritten ist.
468040	470520	2480	Fracking heisst aufreissen oder aufbrechen.
470690	474680	3990	In 3'000 m Tiefe will man solche Gesteinsschichten anzapfen,
474780	477040	2260	die reich an Erdgas sind.
477130	480000	2870	Dafür presst man eine Mischung aus Wasser, Sand und Chemikalien
480070	482440	2370	mit hohem Druck in Stein.
482590	485640	3050	Der Stein bricht und das Erdgas wird freigesetzt.
485740	488560	2820	Das ganze Gemisch wird dann wieder an die Oberfläche gepumpt,
488730	494920	6190	an der man das Gas der z.T. giftigen Frackingflüssigkeit wieder trennt.
495040	499360	4320	Verantwortlich fürs Projekt ist Patrick Lahusen von der Seag,
499560	502200	2640	der AG für schweizerisches Erdöl.
502360	506400	4040	Er sagt, dass es heute Fracking gäbe, das keine Chemie braucht.
506490	508960	2470	Man ist sogar soweit, dass man eine ganz neue Methode hat,
509180	511280	2100	die man jetzt noch prüfen muss.
511370	513360	1990	Die kommt auch ohne Wasser aus -
513510	515600	2090	also ein Fracking ohne Chemikalien und ohne Wasser.
515760	517840.00000000006	2080	Das sind die beiden Sachen, die immer kritisiert werden.
517950.00000000006	520120	2170	Wenn man das nicht mehr hat, also nichts Giftiges mehr hat,
520400	522240	1840	kann man etwas Gutes für die Umwelt tun
522460.00000000006	524480	2020	und ich finde, dann sollte man es auch anwenden können.
524580	526440	1860	Ganz anders sieht das Regula Tschanz,
526640	528800	2160	die Geschäftsführerin der Grünen Partei des Kantons Bern.
528940	531200	2260	Sie will den Leuten aufzeigen,
531380	533800	2420	was ein Bohrturm auf der grünen Wiese bedeuten würde
534020	537640	3620	und ist entsetzt über die Pläne für eine Probebohrung.
537840	540280	2440	Politisch ist klar, dass das Fracking in Bern keine Chance hat.
540370	542760	2390	Der Grosse Rat, das Kantonale Parlament,
542910	546720	3810	hat mit 93 zu 47 ein Fracking-Verbot beschlossen.
546820	549120	2300	Diesem Verbot haben auch
549280	552160	2880	PolitikerInnen von der BDP und der FDP zugestimmt.
552310	555160	2850	Es ist deshalb keineswegs ein grünes oder ökologisches Anliegen.
555330	558920	3590	Dass man zu diesem Zeitpunkt denkt, man könne so ein Projekt starten,
558980	563320	4340	finde ich arrogant und ein Frechheit von der Erdölindustrie.
563480	566160	2680	Der Entscheid des Parlaments ist erst eine Willensbekundung,
566350	569840	3490	das entsprechende Gesetz anpassen, wolle man erst später.
570100	573720	3620	Und jetzt dieses Projekt. Informiert hat die Seag diese Woche per Brief.
573880	576600	2720	Die Wirtin der Dorfbeiz kann aber noch nicht recht abschätzen,
576760	580760	4000	was solch eine Bohrung für Risiken mit sich bringt.
580860	583120	2260	Es gibt noch viele Fragen, die offen sind.
583280	585520	2240	Ich will nicht grundsätzlich sagen, dass ich dagegen bin,
585650	588520	2870	obschon mich Gas eher zurückschreckt,
588650	593560	4910	aber ich kann es auch nicht voll unterstützen.
593670	596280	2610	Ich muss mich noch mehr informieren.
596520	600720	4200	Res Josts Land liegt direkt neben dem Feld, an dem der Bohrturm hinkäme.
600920	603240	2320	Es ist ihm darum ein wenig mulmig zumute,
603330	607200	3870	wenn er sich vorstellt, was bei so einer Bohrung alles passieren könnte.
607350	610280	2930	Das eine ist sicher das Wasser, das Grundwasser,
610380	612880	2500	weil wenn man so tief hineinbohrt.
612980	615440	2460	Und dann wenn man auf Gas stösst,
615660	619570	3910	ist die Frage, ob das Erdbeben auslösen könnte.
619670	622970	3300	Wenn man die Hohlräume ...
623030	626210	3180	Ich weiss es selber nicht.
626380	629170	2790	Es könnte sein, dass man eine Explosion auslöst
629340	633850	4510	oder etwas im grösseren Stil, etwas an was man nicht gerade denkt.
634010	636050	2040	Um die Leute noch besser zu informieren,
636280	639570	3290	hat Patrick Lahusen von der Seag einen Informationsanlass geplant.
639720	644130	4410	Neben den Risiken hat das Projekt ja auch Vorteile:
644280	646690	2410	Wenn wir fündig werden würden und produzieren könnten,
646840	648890	2050	dann wären wir bereit,
649130	651330	2200	eine Produktionsgesellschaft in Rapperswil zu domizilieren.
651560	653570	2010	Das gäbe dann auch Steuern - auch für die Gemeinde.
653700	656210	2510	Und Arbeitsplätze. Und Arbeitsplätze.
656360	658450	2090	Bleibt die Wiese eine Wiese
658590	660810	2220	oder steht hier ab nächstem Jahr ein Bohrturm?
660970	663650	2680	Der Gemeinderat von Rapperswil hat noch nicht übers Projekt beraten.
663780	665770	1990	Das letzte Wort hat der Kanton Bern,
666010	668050	2040	der so eine Probebohrung bewilligen muss.
669960	672730	2770	Ein schlimmes Hochwasser hat Teile von Serbien, Bosnien
672900	675450	2550	und Kroatien vorletzte Woche unter Wasser gesetzt.
675660	678090	2430	Die Leute vor Ort kämpfen noch heute mit den Folgen.
678290	682490	4200	Häuser sind zerstört, viele wohnen noch in Notunterkünften
682700	685370	2670	und es fehlt an allen Ecken und Enden,
685520	687850	2330	v.a. in Bosnien, wo der Staat schwach ist
687960	691170	3210	und die Narben des Bürgerkriegs noch immer schmerzen.
691380	694490	3110	Rund Hunderttausende Ex-Jugoslawen leben allein im Kanton Zürich.
694740	697970	3230	Mit viel Herzblut haben sie für ihre Landsleute gesammelt.
698150	701250	3100	"""Schweiz aktuell"" hat darüber berichtet."
701340	704810	3470	Am Wochenende haben sie eine riesige Ladung nach Bosnien gebracht.
704990	708250	3260	Aber die Solidaritätswelle geht weiter.
709330	713570	4240	In einer Bar in Zürich ist nun meine Kollegin Catherine Thommen.
713680	715930	2250	Wir untertiteln live:
716630	718690	2060	Ich bin im Kreis 3,
720990	723010	2020	ausserhalb der Highlanderbar.
724490	726330	1840	diese wird von einem Bosnier geführt.
728390	730290	1900	Man trifft sich und verbringt Zeit zusammen.
731190	733170	1980	Hier hat die Spendenaktion begonnen.
736010	738330	2320	Man bereitet sich auf ein Benefizkonzert vor heute Abend.
741580	743370	1790	Vanja Crnojevic, sie haben die Aktion gestartet.
745370	747250	1880	Sie waren unten und hatten Güter gebracht.
747500	749370	1870	Was haben Sie erlebt?
750610	752610	2000	Ich war selber dort.
755340	756410	1070	Wir haben viel Elend gesehen.
756570	758530	1960	Es ist schlimmer als in Kriegszeiten.
761320	763810	2490	Was wir erlebten, war sehr traurig, aber wir haben es geschafft,
763930	765890	1960	den Leuten zu helfen.
767410	769450	2040	Sie mussten kämpfen, die Güter verteilen zu können.
770430	772330	1900	Wir haben sie mit einer Kamera begleitet.
772300	774650	2350	Die Stadt Maglaj in Bosnien vor einer Woche.
774820	777050	2230	Das Wasser des Flusses ging wieder zurück.
777160	780650	3490	Es bleiben Zerstörung, Schmutz und kaputte Existenzen zurück.
784660	786650	1990	Hier den Überblick zu behalten ist schwierig.
786880	789170	2290	Im Lager sind Hunderte von Kisten mit Kleider,
789280	791770	2490	Lebensmittel und dem Nötigsten,
791930	797050	5120	alles Spenden, die Zürich nach Maglaj gebracht wurden.
797240	799650	2410	Das Problem ist, wir brauchen jetzt trotzdem Bewilligungen
799760	804010	4250	von der Gemeinde.
804210	807090	2880	Jetzt gehen wir in die Gemeinde, um zu fragen, wo das steckenblieb.
807240	809730	2490	Wir haben eigentlich heute morgen alles Mündliche bekommen.
809810	811170	1360	Wir sprachen mit den Leuten des Roten Kreuzes.
811350	813090	1740	Und plötzlich heisst es, wir dürfen nichts rausnehmen.
813200	814810	1610	Bürokratie?
814950	816970	2020	Genau! Jetzt gehen wir uns erkundigen, wer verantwortlich ist
817140	818650	1510	und warum Leute hungern müssen.
818800	820810	2010	Es ist ein Hin und ein Her zwischen der Gemeindeverwaltung
820830	822490	1660	und den Helfern.
822740	824570	1830	Auch hier sind die Zustände chaotisch.
824730	827650	2920	Aber dann hat sich das Kämpfen gelohnt.
829770	831970	2200	Die Bewilligung ist da, sie dürfen die Hilfsgüter verteilen.
832140	834410	2270	Sie spricht Bosnisch.
834640	837210	2570	Und endlich kommen die Spenden an ihrem Ziel an.
837350	840650	3300	Bei jenen Leuten, die sie so dringend nötig haben.
843440	848290	4850	Aus Zürich, Catherine Thommen.
851250	853370	2120	Ich habe gesehen, sie mussten mit der Bürokratie kämpfen.
854020	855890	1870	Das war sehr frustrierend.
857260	859170	1910	Uns wurden Steine in die Wege geleitet.
860030	861970	1940	Aber meine Kollegen und ich haben gekämpft.
865090	867330	2240	Die Frauen haben den Männern gezeigt, wer die Hosen trägt.
868230	870250	2020	Wir hatten die Bewilligung bekommen.
872410	874370	1960	Das Spenden sammeln geht weiter.
878020	879970	1950	Warum geht das sammeln weiter?
883410	885370	1960	Es geht um die Nachhaltigkeit.
885860	887850	1990	Darum sammeln wir weiter.
889290	891170	1880	Die Leute dort unten haben alles verloren.
892130	894090	1960	Was braucht es jetzt dringend?
895020	897050	2030	Die Häuser müssen renoviert werden.
899640	901760	2120	Zudem brauchen Sie Möbel und Rollstühle für Invalide.
904730	906680	1950	Wir brauchen eine Notfallwagen und Autos und Benzin.
911660	913840	2180	Die Hilfsgüter müssen persönlich verteilt werden an die
913970	914560	590	notbedürftigen.
914670	916640	1970	Vielen Dank.
923410	926000	2590	Diese Barwert von einem Bosnier geführt, ich habe es gesagt, aber
926090	927640	1550	Leute aus dem ganzen Balkan treffen sich.
927780	929730	1950	Das ist symptomatisch für die Bar.
934120	936530	2410	Sie haben eine Gesellschaft gegründet, die sich für Migranten
936630	937610	980	und Secondos einsetzt.
937700	939610	1910	Ist diese Solidarität neu?
942180	943980	1800	Solidarität hatte schon immer gegeben.
944190	946140	1950	Auch von den Leuten, die ausgewandert sind.
952870	955660	2790	Ich beobachte, dass solche Länder und Regionen und ethnienübergreifend
955760	956420	660	ist.
956630	958540	1910	Die Jugendlichen haben sich stark dafür eingesetzt.
959410	961420	2010	Das ist neu, kann man sagen.
963230	965180	1950	Es ist auch eine Schanze.
969470	971500	2030	können alte Wunden heilen?
973360	975380	2020	Kann man die Zukunft wieder zusammen gestalten?
976750	978700	1950	Ich hoffe es sehr.
979850	982340	2490	Es gibt verschiedene Bewegungen, die in diese Richtung zeigen.
985640	987940	2300	Hoffentlich können wir jedes Mal einen Schritt weiter tun.
990460	992740	2280	Das verbindende bleibt, das treibt die jungen Menschen an.
995540	997460	1920	Gemeinsam aus der Not heraus.
997840	999780	1940	Das verbindet.
1005890	1007860	1970	Man testet erst den Ton für heute Abend,
1007950	1009900	1950	aber es läuft schon viel.
1010670	1012580	1910	Es gibt auch eine Kunstversteigerung.
1016880	1019580	2700	Die Jugendlichen wollen wirklich etwas bewegen, dass es den Menschen
1019750	1021660	1910	in der Heimat Lieder besser geht.
1022160	1024060	1900	Auch die Glückskette sammelt für die Menschen,
1024210	1025819.9999999999	1610	die vom Hochwasser auf dem Balkan betroffen sind.
1025980	1027579.9999999999	1600	"Spenden können mit dem Vermerk ""Unwetter Balkan"""
1027740	1030740	3000	auf das Postkonto 10-15000-6 überwiesen werden.
1032260	1034260	2000	Die Bewohner des illegalen Wagenplatzes in Basel
1034470	1036579.9999999999	2110	haben sich zu stark ausgebreitet. Wir berichteten darüber.
1036780	1039339.9999999999	2560	Noch bis übermorgen haben sie Zeit, sich um die Hälfte zurückzuziehen,
1039440	1041180.0000000001	1740	sonst kommt die Polizei.
1041359.9999999999	1043619.9999999999	2260	Heute Nachmittag übergaben Sympathisanten der Wagenleute aber
1043829.9999999999	1047220	3390	dem Regierungsrat eine Petition mit über 3'000 Unterschriften,
1047470	1050660	3190	mit der Bitte, das Ultimatum erneut zu überdenken.
1052610	1055540	2930	Mit ihrer Petition fordern sie, dass erneut Gespräche geführt werden
1055700	1059260	3560	zwischen dem Kanton, den Leuten des Wagenplatzes
1059430	1061260	1830	und den anderen Zwischennutzern.
1061350	1063660	2310	Zu jenen gehört auch eine Kunstmesse, die Anfang nächste
1063760	1065780	2020	Woche mit dem Aufbau beginnen möchte.
1065870	1068300	2430	Diese bräuchte genau den Platz, wo die Wagenleute im Moment sind.
1068550	1071940	3390	Sie wollen sich aber weiterhin nicht auf die Fläche zurückziehen,
1072030	1074740	2710	die die Regierung ihnen geben möchte.
1077100	1081060	3960	In den Bodensee liefen geringe Mengen des giftigen Stoffes Arsen.
1081140	1083580	2440	Das bestätigten deutsche Behörden nach einem Bericht
1083700	1086580	2880	des Bayrischen Rundfunks.
1086790	1089420	2630	Das Gift stammt aus dem Grundwasser unter dem Bahnhof
1089630	1091500	1870	des deutschen Lindau.
1091660	1093460	1800	Wegen der grossen Verdünnung im See sei das Gift
1093610	1095580	1970	für die Trinkwasserversorgung aber kein Problem.
1097390	1100860	3470	Montreux gilt - auch international - als  d i e  Musikstadt.
1101040	1104700	3660	Nicht zuletzt wegen Queen und Freddie Mercury,
1104790	1107220	2430	der ein paar Jahre am Genfersee gelebt hat.
1107430	1110460	3030	Daran erinnert noch heute eine Freddie-Mercury-Statue,
1110630	1114340	3710	mit Anlehnung an das legendäre Konzert im Wembley-Stadion.
1117130	1119740	2610	Applaus und Jubel
1119860	1122020	2160	rockige Musik
1122160	1125500	3340	Es war eines der grössten Rockkonzerte des 20. Jahrhunderts.
1125600	1128760	3160	Queen im Wembley-Stadion 1986.
1128870	1132240	3370	Freddie Mercury elektrisierte 70'000 Fans.
1132410	1138080	5670	# Eo. Eo. Dee do dee do eo. Das Publikum singt ihm nach.
1138240	1141200	2960	Der begnadete Moment in der Musik- geschichte steht in Bronze gegossen
1141320	1143200	1880	am Seeufer in Montreux.
1143380	1145960	2580	Auch heute noch erweisen Tausende Fans aus der ganzen Welt
1146100	1151120	5020	dem grossen Freddie Mercury ihre Referenz.
1151390	1157000	5610	Das ist genau das Bild, das ich von ihm habe, diese Pose.
1157140	1162240	5100	Hier ganz in der Nähe war das Haus, in dem er geschrieben hat.
1162350	1165840	3490	Das ist interessant.
1166110	1168800	2690	Die Liebesgeschichte zwischen Freddie Mercury und Montreux
1168910	1171760	2850	fängt 1978 an, im Studio von David Richards,
1171900	1176810	4910	dem von den besten Rockgruppen vergötterten Toningenieur.
1177000	1180250	3250	Um ehrlich zu sein, am Anfang hats Freddie Mercury in Montreux
1180460	1183730	3270	gar nicht gefallen. Es war ihm viel zu ruhig hier.
1183950	1186170	2220	In dieser Stadt ist nichts los, ihm wäre es in New York, in London
1186300	1188370	2070	oder so wohler gewesen.
1188630	1193050	4420	Trotzdem kauft Queen 2 Jahre später David Richards' Tonstudio.
1193230	1195010	1780	Und weil er nicht so Party machen kann,
1195190	1197330	2140	arbeitet Freddie Mercury halt wie ein Besessener.
1197610	1200210	2600	Hier, mit der Aussicht auf den See, komponiert er zahlreiche Stücke.
1200390	1205330	4940	Insgesamt entstehen 6 Queen-Alben.
1205470	1208210	2740	Das letzte Album, das Freddie Mercury eingespielt hat,
1208430	1210570	2140	"war ""Made in Heaven""."
1210780	1213530	2750	Montreux kommt darin prominent vor, er beschreibt die Schwäne,
1213660	1216850	3190	die Möwen, die Berge und den See.
1216920	1219650	2730	Ein paar Schritte von der Statue entfernt, ist das alte Tonstudio.
1219880	1222570	2690	Die Mauern sind übersät von Sprüchen der Fans.
1222670	1224610	1940	Kaum grösser als eine 2-Zimmerwohnung,
1224740	1226450	1710	ist es heute ein Museum,
1226660	1229090	2430	ein Tribut an den grössten Rocksänger aller Zeiten.
1232040	1234810	2770	"""Under Pressure"" wurde hier aufgenommen."
1235010	1237650	2640	Es fing an mit dem Bass von John Deacon.
1237790	1241490	3700	Er macht den Bass nach.
1241660	1246490	4830	# Under pressure Applaus und Jubel
1246640	1249450	2810	Freddie Mercury, schon schwer krank,
1249600	1251530	1930	verbringt seine letzten Momente am Genfersee.
1251740	1254250	2510	Nach seinem Tod 1991 schenken die Bandmitglieder der Stadt
1254390	1256570	2180	die Bronzestatue.
1256680	1258810	2130	Ihre Art, die ewige Verbundenheit ihres Frontmannes
1259020	1261010	1990	mit Montreux zu ehren.
1262420	1265330	2910	"Das wars. Hier gehts weiter mit ""SRF Börse"" und der ""Tagesschau""."
1265540	1267450	1910	Ich wünsche Ihnen ein schönes Wochenende.