start	end	duration	text
1259450	1261440	1990	ist so ein riesiger begehbarer Tresor
1261610	1264160	2550	wie hier im alten Hauptsitz im Keller.
1264320	1266930	2610	Der ist jetzt zwar nur noch gefüllt mit staubigen Akten,
1267070	1269850	2780	früher war das aber noch anders.
1269930	1274010	4080	Bis ca. vor 10 Jahren hatten wir hier Bargeld,
1274150	1279050	4900	weil wir oben einen Schalter hatten für unsere Mitarbeitenden,
1279150	1281730	2580	die ein Personalkassenkonto haben.
1281910	1284610	2700	Sie konnten effektiv hier Geld beziehen wie auf einer Bank.
1284880	1287930	3050	Der SBB-Hauptsitz mit seiner geschichtsträchtigen Vergangenheit:
1288090	1291090	3000	Jetzt entstehen hier neue Räumlichkeiten für die Uni.
1291210	1292770	1560	Einmal umgebaut,
1292950	1296370	3420	können dann also bald Studenten die Aussicht über die Stadt geniessen.
1298590	1302850	4260	"So viel von uns. Hier folgt ""SRF Börse"" und die ""Tagesschau""."
1303050	1305730	2680	Ihnen einen schönen Abend, auf Wiedersehen.
1305820	1309450	3630	SWISS TXT / UT-Redaktion Zürich Evelyne Iyer, Barbara Jäggi