start	end	duration	text
1298200	1302310	4110	und geisselt ihr Verhalten, kritisiert Luxussucht und Filz.
1302480	1304830	2350	Die Liste der Ankündigungen und Projekte ist lang.
1305030	1310510	5480	Viele Hoffnungen ruhen auf den Schultern des 78-Jährigen. Zu viele?
1310970	1312870	1900	Er hat die Hoffnungen selber geschürt -
1313000	1315030	2030	allein dadurch, dass er sich Franziskus genannt hat,
1315150	1317350	2200	durch die Dinge, die er getan, die er geändert hat.
1317520	1319590	2070	Auf der anderen Seite braucht das natürlich Zeit.
1319690	1323470	3780	Die wahre Franziskus-Reform liegt in der Weltkirche, vor Ort.
1323570	1326550	2980	Da dauert es viel länger, bis das angekommen ist,
1326800	1329270	2470	bis diese missionarisch freudige, verkündende Kirche,
1329450	1332990	3540	die Franziskus will, wirklich unten angekommen ist.
1333160	1337110	3950	Dort, wo er selbst bereits tätig ist: an den Rändern der Gesellschaft.
1337280	1341750	4470	Seine Vorgänger hatten noch Priester statt Häftlinge gewaschen.
1343420	1346390	2970	Um die katholische Kirche auf neue Füsse zu stellen,
1346550	1349030	2480	wird Franziskus aber noch viel Unterstützung brauchen.
1350480	1352510	2030	Das der Stand der Dinge im Moment.
1352670	1355270	2600	"Hier geht es jetzt weiter mit ""Meteo"" und dann geht es ab ins Sägemehl"
1355490	1359230	3740	mit dem Internationalen Zirkusfestival Monte Carlo.
1359440	1362790	3350	Wenn die Manege wieder frei ist, melden wir uns um 22 Uhr wieder.
1362940	1365070	2130	Bis dann, einen schönen Abend.
1365280	1368510	3230	SWISS TXT / UT-Redaktion Zürich Jasmin La Micela, Claudia Burri, Tanja Morana