start	end	duration	text
1255190	1257440	2250	Diese Aufführung ist speziell für mich.
1257600	1261360	3760	Zuerst kommt die Eigenkreation mei- nes Ballettmeisters Julio Arozarena.
1261500	1264960	3460	Das muss ich sehen. Danach tanze ich aber selber.
1265180	1268240	3060	Und nachher will ich mir meine Choreografie im Saal anschauen,
1268340	1270720	2380	damit ich meine Tänzer korrigieren kann.
1270880	1273920	3040	Das ist ziemlich stressig, aber es geht.
1276590	1280040	3450	* Spannende Musik *
1280730	1283560	2830	Alle Vorstellungen diese Woche im Theatre de Beaulieu in Lausanne
1283730	1285400	1670	sind bereits ausverkauft.
1285530	1287240	1710	Die 38 Tänzerinnen und Tänzer
1287410	1290880	3470	treten im Dezember wieder vor eigenem Publikum auf.
1291100	1293360	2260	Und in einem Jahr kommt die renommierte Balletttruppe
1293490	1295680	2190	dann nach Zürich.
1297330	1299080	1750	Apropos Tanzen -
1299260	1303600	4340	Tanzende an einem ganz anderen Ort sind in der Politik angestossen.
1303820	1307000	3180	Diese archaischen Figuren, die an der Gotthard-Eröffnung
1307140	1311280	4140	vergangene Woche rumwirbelten, wollten einer SVP-Nationalrätin
1311450	1313720	2270	so gar nicht ins Bild der Schweiz passen.
1313840	1317200	3360	Und sie trug ihren Ärger direkt in den Bundesrat,
1317360	1319320	1960	was wiederum für einigen Wirbel sorgte.
1321470	1323520	2050	Ekstatisch herumwirbelnde Strohbündel
1323660	1326160	2500	inmitten anderer dämonischer Gestalten.
1326310	1328720	2410	Zu fremd, um schweizerisch zu sein?
1328860	1330880	2020	SVP-Nationalrätin Sylvia Flückiger
1331020	1334120	3100	macht ihrer Empörung bei der Landesregierung Luft.
1345660	1347760	2100	Und das sind Derwische.
1347850	1350000	2150	Mitglieder einer islamischen Ordensgemeinschaft,
1350100	1352400	2300	die beten - im Tanz.
1352560	1356320	3760	Für die besorgte Nationalrätin zu ähnlich zum Gotthard-Spektakel.
1356420	1358760	2340	Der Bundesrat beschwichtigt.
1367270	1369480	2210	Derwische oder Heuhaufen?
1369620	1372560	2940	Die Causa ist inzwischen ein Hit in den sozialen Medien.
1372800	1377560	4760	Dort geht es fast so hitzig zu und her wie auf Volker Hesses Bühne.
1377570	1380600	3030	Was meint dieser zum Heuhaufen-Gate?
1380800	1383680	2880	"""Derwische sehen könne man, müsse aber nicht."""
1387020	1390800	3780	In rund 2 Std. die nächsten Nachrichten mit Arthur Honegger.
1390910	1392080	1170	Danke, Franz.
1392300	1397560	5260	Bei uns steht die TV-Debatte zum Brexit im Zentrum.
1397690	1399720	2030	Wir schalten uns live ein ins britische Fernsehen
1399840	1401720	1880	und analysieren erste Voten
1401800	1403840	2040	mit unserem Britannien- Korrespondenten Urs Gredig -
1403920	1405720	1800	heute Gast im Studio.
1405800	1408880	3080	Dann stand heute ja der Pendlerverkehr in Zürich still,
1409020	1411360	2340	wegen eines Brandanschlags -
1411500	1415160	3660	und der hat auffällige Ähnlichkeit mit Vorfällen in Berlin.
1415380	1418640	3260	Und auch den Massnahmen der EU gehen wir auf den Grund.
1418780	1421000	2220	sie will Milliarden nach Afrika schicken,
1421090	1423160	2070	damit weniger Flüchtlinge nach Europa kommen.
1423310	1425960	2650	Wie das funktionieren soll, zeigen wir um 10 vor 10.
1426060	1427000	940	Danke, Arthur.
1427750	1429440	1690	Das war's von uns für Sie.
1429560	1432280	2720	"Weiter geht's auf SRF 1 mit ""Meteo"" und mit ""Ein Fall für zwei""."
1432540	1435480	2940	Einen unterhaltsamen Abend weiterhin und bis bald.
1435660	1439520	3860	SWISS TXT / UT-Redaktion Zürich Romina Leichtle, Roman Brauchli, Daniela Zacheo