start	end	duration	text
1298950	1302560	3610	wird Anfang November aber vom Hohen Gericht in London zurückgebunden.
1303210	1305960	2750	Auch das Parlament soll noch ein Wörtchen mitzureden haben.
1307110	1308880	1770	Geschafft!
1309510	1313280	3770	Nach knapp 510 Std. und mehr als 40'000 km
1313890	1317720	3830	landet die Schweizer Solar Impulse 2 Ende Juli in Abu Dhabi.
1318360	1319920	1560	Zum ersten Mal in der Geschichte der Luftfahrt
1320520	1322880	2360	hat ein Flugzeug ohne Treibstoff, nur mit Solarenergie betrieben,
1323520	1325200	1680	die Welt umrundet.
1325850	1329920	4070	Ich wollte mich nur auf das Flugzeug konzentrieren
1330650	1332760	2110	und darauf, eine perfekte Landung zu machen.
1333380	1335920	2540	Ich wollte nicht daran denken, dass es das Ende dieses Abenteuers ist.
1336560	1338280	1720	Sonst hätte ich Tränen in den Augen gehabt
1338880	1340560	1680	und ich hätte die Piste nicht sehen können.
1342090	1345000	2910	Zu den ersten Gratulanten gehören Fürst Albert von Monaco
1345630	1348640	3010	und Bundesrätin Doris Leuthard.
1349280	1350800	1520	Insgesamt 17 Etappen
1351530	1354440	2910	hat die Solar Impulse 2 rund um den Globus benötigt -
1355090	1357240	2150	eine Pionierleistung,
1357880	1360720	2840	an der vor wenigen Jahren noch viele gezweifelt haben.
1362120	1365480	3360	2016 war gespickt mit einigen Ereignissen,
1366050	1367560	1510	die noch lange nachwirken dürften.
1368290	1371360	3070	"Zurück zu heute: Arthur Honegger ist hier mit den Themen von ""10vor10"":"
1372010	1372480	470	Danke, Cornelia.
1373170	1375480	2310	Die extreme Trockenheit in den Bergen derzeit
1376130	1377720	1590	führt zu Waldbränden im Süden -
1378360	1380560	2200	und auch auf der Alpennordseite wächst die Besorgnis.
1381220	1382400	1180	Dann unser Fokus-Thema:
1383050	1383920	870	Drei Tage noch,
1384590	1387400	2810	dann ist das Schweizer Bankgeheimnis gegenüber dem Ausland Geschichte.
1388050	1391640	3590	Ein Land aber macht nicht mit beim automatischen Informationsaustausch -
1392280	1395800	3520	und genau dort liegt eine Menge Geld von Schweizer Steuerzahlern.
1396390	1400000	3610	Und: wundervolle Bergtäler, in denen niemand mehr wohnen will.
1400600	1403800	3200	Unsere Alpenserie ist im gespenstisch-schönen Rimella
1404450	1405600	1150	im Piemont angekommen.
1406200	1407200	1000	Das alles und mehr um 10 vor 10.
1407940	1408960	1020	Danke, Arthur.
1409960	1412640	2680	"Hier geht es jetzt gleich weiter mit ""Meteo"" und ""Top Secret""."
1413360	1417440	4080	Nur so viel: Wünschen Sie mir Glück! Einen schönen Abend und bis morgen.
1418140	1421640	3500	SWISS TXT / UT-Redaktion Zürich Claudia Burri, Manuela Waldner, Alexandra Duttweiler