start	end	duration	text
1990	6640	4650	1:1-Untertitelung. Livepassagen können Fehler enthalten.
7230	10040	2810	"Die ""Tagesschau"", meine Damen und Herren, guten Abend."
10730	13120	2390	Und das sind die Themen von heute Mittwoch:
14050	19520	5470	Die Waldbrände im Misox und in der Leventina sind eingedämmt.
21110	25720	4610	Das gesteht die Chefin der russischen Anti-Doping-Behörde.
26390	29000	2610	Das offizielle Russland krebst aber zurück.
30410	35720	5310	Politiker fordern eine Lockerung der Arbeitszeiterfassung.
36890	41520	4630	In den Bergen von früh bis spät sonnig.
43810	46960	3150	Seit Wochen viel zu trockene Böden in der Schweiz -
47690	49800	2110	da brauchte es nicht viel, bis Wälder brennen.
50460	52960	2500	Die Flammen sind unterdessen weitgehend eingedämmt,
53650	55200	1550	aber noch nicht unter Kontrolle.
55840	58160	2320	Zum einen brennt es im Kanton Graubünden.
58740	60280	1540	Zwischen Mesocco und Soazza
60940	63120	2180	steht ein mehrere Hektar grosses Waldstück in Flammen.
63680	68600	4920	Und auch 30 km Luftlinie entfernt brennt es in der Leventina im Tessin.
69250	73320	4070	Dort lodern die Flammen im Gebiet von Monti di Doro bei Chironico.
73870	76120	2250	Verletzte gab es bislang nicht,
76850	79320	2470	doch mussten zahlreiche Personen in Sicherheit gebracht werden.
80740	86640	5900	Die Brände im Gebiet Monti di Doro bei Chironico gestern Nacht.
87210.00000000001	89360	2150	Innerhalb weniger Stunden
89920	94920	5000	hatten sich die Flammen weit ins unwegsame Gelände gefressen.
95570	99280	3710	Mit mehreren Helikoptern
99940	103479.99999999999	3540	mussten 29 Menschen vorsorglich aus dem Gefahrengebiet evakuiert werden,
104080	105520.00000000001	1440	verletzt wurde niemand.
106090	108800	2710	Auch bei der Bekämpfung des Brandes mussten Helikopter eingesetzt werden.
109490.00000000001	111160	1670	Die Brandursache ist Fahrlässigkeit.
111770.00000000001	112920	1150	Laut Angaben der Tessiner Behörden
113550	115360	1810	haben vier Minderjährige im Freien ein Feuer entfacht.
116050	119000	2950	Mittlerweile ist der Brand unter Kontrolle, aber nicht gelöscht.
119729.99999999999	121720	1990	Die Arbeiten sollen morgen früh wieder aufgenommen werden.
122390	124760	2370	Auch im Misox hatten die Flammen gestern Abend leichtes Spiel.
125430	126800	1370	Der Boden ist trocken wie Zunder.
127490	130039.99999999999	2550	Das letzte Mal regnete es hier im Bündner Südtal vor einem Monat.
130600	134560	3960	Die Löscharbeiten werden durch starken Nordföhn erschwert.
135130	139040	3910	Mit Windgeschwindigkeiten von 60 km/h facht er die Flammen immer wieder an.
139660	143079.99999999997	3420	Trotz der Brände rollt der Verkehr im Misox wieder.
143720	145880	2160	Sowohl die A13 als auch die Hauptstrasse
146510	148520	2010	wurden für den Verkehr freigegeben.
149290	152000	2710	Die Brände sind laut SRF-Reporter Joel Baumann zwar eingedämmt,
152620	154440	1820	aber nicht unter Kontrolle:
155150	157280	2130	Jetzt, das es dunkel ist,
157860	159320	1460	können die Helikopter nicht mehr fliegen,
159900	162320	2420	sie können kein Löschwasser mehr über die Brandherde schütten.
162900	164600	1700	Es gibt einzelne Brandherde, die wieder aufflackern.
165280	167920.00000000003	2640	Das ist die grosse Angst der Einsatzkräfte vor Ort,
168640	170960	2320	dass nämlich das Feuer, da man nicht mehr fliegen und löschen kann,
171620	173320	1700	jetzt über Nacht wieder an Fläche gewinnt.
174890	177800	2910	Dass die Wälder brennen, kommt wie gesagt wenig überraschend.
178490	179880	1390	Im Süden und im Osten der Schweiz
180530	183160	2630	herrscht schon seit rund einer Woche erhebliche Waldbrandgefahr.
183850	186800	2950	Nach den Bränden im Misox und der Leventina haben die Behörden
187460	191160	3700	die Gefahrenstufe in einigen Regionen deshalb noch weiter angehoben.
192490	195040	2550	Der Boden staubig, das Laub trocken.
195770	198040	2270	Viele Regionen der Schweiz haben seit fast sechs Wochen
198670.00000000003	199960	1290	keinen Niederschlag mehr gesehen
200620	203079.99999999997	2460	und erleben den trockensten Dezember seit Messbeginn.
203720	206040	2320	Entsprechend steigt die Waldbrandgefahr.
206680	211200	4520	So gilt im Tessin und in Teilen Graubündens
211850	213160	1310	ab sofort grosse Waldbrandgefahr.
213790	216840	3050	Das heisst, Feuermachen im Freien ist generell verboten.
217410	218720	1310	Noch stärker als der Süden
219380	221640	2260	ist die Deutschschweiz von der aktuellen Trockenheit betroffen.
222260	223840	1580	Dennoch stuft der Bund hier
224460	226720	2260	die Waldbrandgefahr allgemein als geringer ein.
227310	230720	3410	Es kommt darauf an, wie exponiert die Lage ist.
231360	235360	4000	Grundsätzlich ist aber die Luft- feuchtigkeit auf der Alpennordseite
236090	237520	1430	u.a. auch wegen dem Nebel höher.
238100	240480	2380	Bis zum Jahreswechsel entschärft sich die Situation nicht.
241050	244160	3110	Was bedeutet das für Feuerwerk in der Silvesternacht?
244850	247520	2670	Generell ist immer Vorsicht geboten,
248150	250290	2140	wenn man im Freien mit Feuer hantiert.
250840	254090	3250	Es ist wichtig, dass man die Anweisungen der lokalen Behörden,
254720	258209.99999999997	3490	also v.a. auch der Gemeinde befolgt und sich an diese hält.
258839.99999999997	260490	1650	Hinsichtlich Silvester
261149.99999999997	263850	2700	haben die Kantone Basel-Stadt und Baselland bereits reagiert.
264500	267130	2630	Sie haben Feuerwerk in der Nähe von Wäldern verboten.
269650	274690	5040	War es ein Geständnis? Oder doch ein Missverständnis?
275340.00000000006	276930	1590	"Gegenüber der ""New York Times"""
277580	279370	1790	sagte die Chefin der russischen Anti-Doping-Behörde,
280000	283450	3450	es stimme, Russland habe seine Sportler über Jahre hinweg
284170	286730	2560	mit leistungssteigernden Mitteln versorgt.
287340.00000000006	289730	2390	Damit bestätigt sie eigentlich den sog. McLaren-Bericht,
290380	293090.00000000006	2710	der Russland systematisches Doping vorwirft.
293730	295409.99999999994	1680	Kaum ist der Bericht erschienen,
296070	299330	3260	kommt aus Moskau aber das Dementi, die Dame sei falsch zitiert worden.
300680	303570	2890	"In der ""New York Times"" ist das Geständnis zu lesen."
304210	307010	2800	Beim russischen Doping handle es sich um eine institutionelle Verschwörung.
307640	309010	1370	Also um systematisches Doping.
309670	313170	3500	"Die Aussagen stammen laut ""Times"" von ihr, Anna Anzeljowitsch,"
313850	316330	2480	der Chefin der russischen Anti-Doping-Agentur.
316970	320130	3160	Susy Schär, die SRF-Dopingspezialistin,
320810	322530	1720	verfolgt die Szene seit 30 Jahren.
323210	324810	1600	Sie sagt, diese Aussagen seien glaubwürdig,
325440	327170	1730	sie kämen nicht von ungefähr:
327840	329530	1690	Man gibt im Doping höchstens so viel zu,
330210	331450	1240	wie absolut bewiesen werden kann.
332090.00000000006	334470	2380	Die McLaren-Berichte haben es hieb- und stichfest bewiesen.
335170	338150	2980	Die Frage ist, ob dies Russlands Flucht nach vorn ist,
338700	343070	4370	um weitere Sanktionen zu umgehen oder ob nun Einsicht vorhanden ist.
343720	347270	3550	"""Einsicht"" könnte eine Kehrtwende bedeuten."
347920	350590.00000000006	2670	Denn aktuell gerät Russlands Sportszene ins Abseits:
351280	354350	3070	Anfangs Dezember der zweite McLaren-Bericht.
354980	357110	2130	Es ist von systematischem staatlich verordneten Doping die Rede.
357810	358950	1140	Die Beweise sind erdrückend.
359610	363230	3620	Mitte Dezember: Russland darf die Bob-WM nicht austragen.
363820	365670	1850	Der Verband verlegt die WM nach Deutschland.
366340	367950	1610	Insgesamt sieben Sportveranstaltungen
368530	370990	2460	finden 2017 nicht mehr in Russland statt.
371650	372590	940	Kurz vor Weihnachten:
373280	376310	3030	Weitere Doping-Untersuchungen gegen 28 russische Sportler,
376870	379430	2560	angeordnet vom Internationalen Olympischen Komitee.
380130	381190	1060	Die russische Sportszene
381850	385750	3900	wird international immer mehr auf die Zuschauertribüne verbannt.
386410	388350	1940	Für Russland gibt es laut Susy Schär nur ein Gegenmittel:
388920	390870	1950	Namen und Daten offenlegen und beweisen,
391570	394190	2620	dass man wirklich etwas ändern will.
394930	397030	2100	Bis jetzt fehlte dieser Beweis total.
397659.99999999994	399430	1770	Aktuell sieht es nicht nach Offenlegung aus.
400130	402909.99999999994	2780	"Das Geständnis in der ""New York Times"" wurde dementiert."
403570	405350	1780	Der Kreml will die Aussagen überprüfen.
407400	410350	2950	Zuerst also das Geständnis, nur kurz darauf das Dementi.
411010	413230	2220	David Nauer in Moskau, was ist das für eine Kommunikation?
413920	414750	830	Wir untertiteln live:
424000	426990	2990	Wir wissen nicht, was die Chefin der Anti-Doping-Agentur
427640	430830	3190	"der ""New York Times"" wirklich erzählt hat."
431420	436910	5490	Mir scheint es, dass dieses Hin und her passt
437480	441630	4150	zur russischen Verteidigungsstrategie.
442300	445070	2770	Man bestreitet die Vorwürfe.
445700	451120	5420	Gleichzeitig verspricht man Verbesserungen.
452130	455360	3230	Diese Pirouetten um diesen Artikel in der Zeitung passen in diese
455970	457400	1430	Taktik, in dieses Bild.
458050	460680	2630	Die oberste Regierung sei nicht involviert, beteuert die Leiterin
461320	464159.99999999994	2840	der Anti-Doping-Behörde. Kann es wirklich sein, dass Präsident Putin
464740	468520	3780	nichts gewusst hat?
469150	474240	5090	Wir müssen etwas im Nebel stochern.
474930	477159.99999999994	2230	Einerseits ist es schwer vorstellbar, dass der Kreml keine
477800	482920	5120	Ahnung hatte.
483630	488640	5010	Spitzensport ist in Russland Chefsache.
489330	491840	2510	Andererseits gibt es die Tradition, das untere Hierarchiestufen
492460	494360	1900	tricksen.
495010	498320	3310	Das würde heissen, dass Sportfunktionäre zu Doping greifen,
498960	501920	2960	weil Putin Medaillen gewinnen will.
502600	504960	2360	Im Moment haben wir noch zu wenig Informationen.
508480	510880	2400	Der türkische Aussenminister erklärt heute,
511460	512280	820	man habe sich mit Russland
512820.00000000006	514240	1420	auf eine landesweite Waffenruhe für Syrien geeinigt.
514860	516080.00000000006	1220	Und laut staatlichen türkischen Medien
516770	518159.99999999994	1390	könnte diese bereits heute um Mitternacht in Kraft treten.
518820.00000000006	520640	1820	Moskau hingegen hält sich in der Angelegenheit bedeckt.
521309.99999999994	523480	2170	Man sei in stetigem Kontakt mit den türkischen Kollegen.
524150	526960	2810	Mehr Informationen gibt der Kreml derzeit nicht preis.
528490	530760	2270	Russische Soldaten in Aleppo.
531470	533800	2330	Ohne Zustimmung ihres Oberbefehlshabers Wladimir Putin
534410	537160	2750	ist eine Waffenruhe für ganz Syrien kaum vorstellbar.
537750	541120	3370	Syrische Regierungssoldaten in Aleppo.
541760	544360	2600	Auch von ihrem Oberbefehlshaber, Baschar al-Assad,
544970	547480	2510	gibt es noch keine Reaktion auf die mögliche Waffenruhe,
548150	549120	970	die laut der Türkei aber
549800	551880	2080	Terrororganisationen aussen vor lassen soll.
552490	555360	2870	Eine Waffenruhe ist aber mitnichten ausgeschlossen.
556090	557640	1550	Immerhin sollen ja im Januar in Kasachstan
558280	559480	1200	Friedensgespräche für Syrien
560170	563280	3110	zwischen Russland, der Türkei und dem Iran stattfinden.
563860	567160	3300	Eine von diesen Ländern ausgehandelte Waffenruhe
567720	571000	3280	würde auch solche Gespräche zusätzlich legitimieren.
572320	576280	3960	In Berlin ist ein möglicher Komplize des Weihnachtsmarkt-Attentäters
576940	577920	980	festgenommen worden.
578560	579840	1280	Laut Bundesanwaltschaft könnte der 40-Jährige -
580530	582640	2110	ebenfalls ein Tunesier - in den Anschlag involviert gewesen sein.
583430	585840	2410	Auf die Spur des Mannes ist man gelangt,
586400	588160	1760	weil der mutmassliche Attentäter in seinem Handy
588850	591480	2630	die Telefonnummer seines Landsmannes gespeichert hatte.
592170	594520	2350	Wie Medien zudem berichten, hat ein automatisches Bremssystem
595280	598040	2760	die Fahrt des Berliner Anschlags-Lkw gestoppt
598580	600920	2340	und somit Schlimmeres verhindert.
601760	605440	3680	US-Aussenminister John Kerry hat in Washington in einer Grundsatzrede
606020	609400	3380	zum Nahostkonflikt zwischen Israeli und Palästinensern erklärt,
610130	612600	2470	dass die angestrebte Zweistaaten- lösung auf dem Spiel stehe.
613280	616880	3600	Deshalb hätten die USA die UNO-Resolution nicht verhindert,
617520	620000	2480	die ein Ende der israelischen Siedlungspolitik fordert.
620650	622520	1870	Zwei unabhängige Staaten, Israel und Palästina,
623270	625720	2450	seien die einzig erfolgversprechende Lösung.
628250	632280	4030	Seit es sie gibt, gibt es keine Ausreden mehr:
632890	635520	2630	Die Stempeluhr weiss genau, wer wann wie viel arbeitet.
636240	637920	1680	Eingeführt im Industriezeitalter
638460	640640	2180	zum Schutz für Arbeitnehmende vor unbezahlter Überzeit -
641300	642560	1260	und zugleich für Arbeitgeber,
643240	645120	1880	damit die Angestellten auch pünktlich erscheinen.
645780	649240	3460	Heute wird die Arbeitszeit, obwohl eigentlich gesetzlich vorgeschrieben,
649800	651000	1200	nicht mehr immer erfasst.
651640	653720	2080	Laut einer repräsentativen Studie von Travail.Suisse
654400	657280	2880	verzichtet rund ein Drittel aller Arbeitnehmer in der Schweiz darauf.
657820	660600	2780	Seit einem Jahr erlaubt das Gesetz Ausnahmen.
661320	663840	2520	Doch das geht einigen Politikern noch zu wenig weit.
664570	665920	1350	Fabian von Allmen.
666850	668680	1830	Die Bankenbranche,
669240	671320	2080	jahrelang Sorgenkind punkto Arbeitszeiterfassung.
671970	673720	1750	Ihr kommt die Ausnahmeregelung entgegen:
674450	676080	1630	Wer mehr als 120'000 Fr. verdient
676630	678760	2130	und in einem Unternehmen mit Gesamtarbeitsvertrag arbeitet,
679420	682280	2860	muss seine Überstunden seit Januar nicht mehr ausweisen.
682950	687160	4210	Rund 100 Banken und etwa drei Viertel der Bankmitarbeitenden in der Schweiz
687700	690720	3020	machen davon Gebrauch, wie der Arbeitgeberverband der Banken
691380	693480	2100	"auf Nachfrage der ""Tagesschau"" mitteilt."
694130	696600	2470	Doch ihm sind diese Ausnahmen nicht genug.
697280	698440	1160	Ständerat Konrad Graber
699020	701920	2900	will die Arbeitszeiterfassung noch weiter liberalisieren.
702690	705320	2630	Man stellt einfach fest, dass sich das Arbeitsgesetz
705970	708800	2830	heute nicht mehr an der wirt- schaftlichen Realität orientiert.
709530	711920	2390	Viele Leute wollen die Möglichkeit haben,
712590	716520	3930	flexibel zu arbeiten und ihre Zeit flexibel einzuteilen.
717240	719800	2560	Das verhindert heute das Arbeitsgesetz.
720490	723880	3390	Die Gewerkschaften wehren sich gegen weitere Liberalisierungen.
724500	726000	1500	Das hat zur Folge,
726680	729160	2480	dass in Zukunft im grossen Stil Gratisarbeit geleistet wird.
729820	734480	4660	In der Schweiz werden 200 Mio. Überstunden pro Jahr geleistet.
735050	738720	3670	Wenn diese Arbeitszeit nicht erfasst wird, ist das Gratisarbeit.
739360	742840	3480	Die Räte werden sich im nächsten Jahr mit den Vorstössen befassen.
743480	744440	960	Dann wird sich zeigen,
745170	747560	2390	welche Rolle die Stempeluhr in Zukunft noch spielen wird.
749440	751520	2080	Und nun zum Wichtigsten vom Sport.
752200	754720	2520	Zuerst zum Riesenslalom im Schneegestöber von Semmering,
755410	757960	2550	wo Mikaela Shiffrin auch heute nicht zu schlagen war:
759320	761800	2480	Mikaela Shiffrin gewinnt
762470	764840	2370	ein von Schnee, Wind und Nebel geprägtes Rennen
765570	769080	3510	mit vielen Unterbrüchen und feierte den zweiten Sieg innert 24 Std.
769720	772800	3080	Lara Gut verpasst das Podest
773460	775800	2340	bei schwierigen, mitunter gefährlichen Bedingungen.
776490	778960	2470	Sie wird als beste Schweizerin Sechste.
781210	784280	3070	Zweiter Sieg im zweiten Spiel für den HC Lugano.
784910	787480	2570	Am Spengler Cup in Davos besiegen die Tessiner
788240	791520	3280	das tschechische Team Mountfield mit 4:3.
792090	795920	3830	Hier das vorentscheidende 4:1 durch Ryan Vesce.
796600	798880	2280	Damit steht die Halbfinal- Qualifikation für Lugano fest.
801870	805200	3330	2016 ist das Jahr der politischen Überraschungen -
805890	810800	4910	Überraschungen wie der Brexit, der Austritt Grossbritanniens aus der EU.
811440	816080	4640	2016 war aber auch das Jahr der vielen Todesfälle von Prominenten.
816780	820080	3300	Im heutigen Teil der Jahreschronik von Beat Giger und Noemi Abraham
820680	823040	2360	macht aber König Fussball den Anfang,
823670	825880	2210	weil die Fussball-Europameisterschaft in Frankeich
826520	828120	1600	den Juni und den Juli dominierte.
829310	831960	2650	* Melancholische Musik *
832650	837080	4430	Am Ende ist doch alles nur ein Spiel, mag dieser portugiesische Knirps
837740	840240	2500	zum enttäuschten französischen Fan gesagt haben.
840930	843600	2670	Die Szene, kurz nach dem Europameisterschaftsfinal im Juli,
844170	846440	2270	bleibt als eine der berührendsten in Erinnerung.
847170	850520	3350	Ansonsten bietet die EM kein fussballerisches Feuerwerk.
851210	853840	2630	Der neue Europameister Portugal vermochte während des Turniers
854500	856280	1780	nur wenig zu überzeugen.
856930	857520	590	Im Finalspiel
858180	860800	2620	scheidet sogar Superstar Ronaldo verletzungsbedingt aus.
861450	865120	3670	Die Entscheidung bringt Eder in der Nachspielzeit.
865770	868920	3150	Für Ronaldo gibt's damit doch noch ein Happy End.
869560	871400	1840	Ich bin sehr, sehr glücklich.
872080	874600	2520	Ich wartete auf diesen Moment seit dem Endspiel 2004
875260	879560	4300	und danke Gott für diese zweite Chance.
880190	882160	1970	Der erste Europameistertitel
882820	886120	3300	versetzt Portugal in einen kollektiven Freudentaumel.
886890	889360	2470	Der Konvoi durch Lissabon - ein Triumphzug.
890090	893120	3030	Europameister der Herzen sind aber die kampflustigen Isländer
893780	895880	2100	und ihr Reporter:
896450	900120	3670	* Enthusiastische Jubelschreie *
900810	903680	2870	Weniger Begeisterung entfachen die russischen und englischen Fans.
904410	906640	2230	Hooligans liefern sich in Marseille regelrechte Schlachten.
907330	908840	1510	Die Polizei ist völlig überfordert.
909410	911640	2230	Eine neue Dimension der Gewalt.
912210	914320	2110	Für die Schweiz ist einmal mehr bei einem grossen Turnier
914980	916600	1620	im Achtelfinal Endstation.
917320	919960	2640	Immerhin: Bei der Nati kommen nicht nur jene auf die Kosten,
920620	923080	2460	die sich für das Spiel auf dem Rasen interessieren.
923640	927000	3360	# I'm too sexy for my shirt.
927640	929280	1640	Grund für die mehrfache Entblössung:
929940	932280	2340	ein Materialfehler beim Leibchenhersteller Puma.
932920	935720	2800	Aber nicht nur der Preis für das beste Waschbrettbauch-Schaulaufen
936350	939880	3530	geht an die Eidgenossen, auch jener für das schönste EM-Tor.
940420	944480	4060	Shaqiri ... Jaaaaaaaaa! Jaaaaaaaaa!
945150	949520	4370	Xherdan Shaqiris Fallrückzieher: ein magischer Fussballmoment.
954910	958120	3210	Für die einen Vision, für die anderen Illusion.
958780	961440	2660	Anfang Juni stimmt die Schweizer Bevölkerung über die Initiative
962170	965680	3510	für ein bedingungsloses, staatlich garantiertes Grundeinkommen ab.
966320	969120	2800	Ein Volksbegehren, das weltweit einmalig ist.
969780	971960	2180	Die Stimmenden bleiben aber skeptisch.
972600	977040	4440	Mit 76,9 % schicken sie die Idee klar und deutlich bachab.
978760	980800	2040	I am the greatest.
981420	983840	2420	Bescheidenheit zeichnete ihn nicht gerade aus.
984490	985960	1470	Aber Muhammad Ali war tatsächlich
986690	989240	2550	eine der bedeutendsten Persönlichkeiten der Sportgeschichte.
989920	995080	5160	Anfang Juni stirbt die US-Boxlegende im Alter von 74 Jahren an Parkinson.
999210	1000960	1750	1960 wird er Olympiasieger,
1001610	1003920	2310	vier Jahre später Weltmeister im Schwergewicht -
1004560	1007000	2440	danach gibt's kein Halten mehr. Auch verbal.
1016280	1019080	2800	Aber Muhammad Ali war nie nur Boxchampion.
1019710	1022320	2610	Geboren in ärmsten Verhältnissen, Enkel eines Sklaven,
1022910	1027240	4330	konvertiert er 22-jährig zur radikalen Nation of Islam.
1027849.9999999999	1030000	2150	Im Vietnamkrieg verweigert er den Wehrdienst.
1030730	1033160.0000000001	2430	Ein Gericht verurteilt ihn daraufhin zu fünf Jahren Haft.
1033810	1035400.0000000001	1590	Im Berufungsverfahren gewinnt Ali jedoch,
1036069.9999999999	1038920.0000000001	2850	was ihn endgültig zum Symbol der Bürgerrechtsbewegung,
1039560	1042400.0000000001	2840	zum Idol einer ganzen Generation macht.
1045720	1049280	3560	* Traurige Musik *
1049840	1053240	3400	Orlando im US-Bundesstaat Florida
1053810	1055760	1950	ganz im Zeichen des Regenbogensymbols
1056360	1058560	2200	der Schwulen- und Lesbenbewegung.
1059180	1061080	1900	* Traurige Musik *
1061640	1063200	1560	Es bedeutet mir viel,
1063810	1066600	2790	hier zu sein und unsere Gemeinschaft zu unterstützen.
1067250	1069360	2110	Denn ich erinnere mich noch, dass es vor ein paar Jahren
1069990	1074680	4690	wohl kaum jemand gewagt hätte, für uns auf die Strasse zu gehen.
1075380	1077200	1820	Grund für die grosse Solidaritätswelle
1077890	1080760	2870	ist das gravierendste, gezielt auf Homosexuelle gerichtete Attentat
1081450	1083200	1750	in der Geschichte der USA.
1083830	1087320	3490	Am 12. Juni schiesst ein 29-jähriger Amerikaner afghanischer Herkunft
1088010	1091720	3710	im Schwulenclub Pulse wild um sich und tötet 49 Personen.
1092350	1093440	1090	Per Notruf
1094090	1096720	2630	bekennt sich der Attentäter zur Terrormiliz Islamischer Staat.
1097430	1101280	3850	Eine Verbindung, die Ermittler später aber nicht nachweisen können.
1101960	1105880	3920	Trotzdem: Das Attentat von Orlando ist der schlimmste Terroranschlag
1106520	1110600	4080	auf US-Boden seit dem 11. September 2001.
1112360	1114960	2600	Politischer Stillstand in Spanien.
1115530	1117240	1710	Ende Juni wird ein neues Parlament gewählt.
1117880	1119520	1640	Zum zweiten Mal in nur sechs Monaten.
1120160	1122160	2000	Doch die Wahlen enden erneut mit einem Patt.
1122770	1124240	1470	Monatelang basteln die Parteien
1124890	1126640	1750	erfolglos an einer Regierungsbildung herum.
1127320	1130160	2840	Ende Oktober lenken die Sozialisten nach einem Richtungsstreit ein
1130810	1131840	1030	und beschliessen,
1132470	1134320	1850	eine Minderheitsregierung der Konservativen zu dulden.
1134980	1137280	2300	Der neue Ministerpräsident heisst deshalb gleich wie der alte:
1138010	1139880	1870	Mariano Rajoy.
1141090	1145920	4830	Bleiben oder gehen?
1146570	1148680	2110	# Should I stay or should I go now?
1149320	1150880	1560	Dass es knapp werden würde,
1151420	1153720	2300	war schon während der wochenlangen Kampagne klar.
1154370	1158880	4510	Dass es am Schluss so ausgehen würde, kam dann doch überraschend.
1159570	1162160	2590	Well, at twenty minutes to five we can now say,
1162840	1166880	4040	the decision taken in 1975 by this country to join the common market
1167410	1172960	5550	has been reversed by this referendum to leave the EU.
1173530	1175480	1950	Ein Tag für die Geschichtsbücher:
1176050	1179720	3670	Grossbritannien stimmt mit 52 % für den Austritt aus der EU.
1180360	1182360	2000	Jubel im Lager der Sieger:
1182960	1189040	6080	Der 23. Juni soll zum britischen Unabhängigkeitstag erklärt werden.
1189690	1194160	4470	Konsternation bei all jenen, die in der EU verbleiben wollten.
1194810	1198360	3550	Noch im Februar rang Premier Cameron Brüssel Zugeständnisse ab.
1198940	1201840	2900	Er hat hoch gepokert und alles verloren.
1202490	1205680	3190	Das britische Volk hat eine sehr klare Entscheidung getroffen,
1206280	1208720	2440	nämlich, einen anderen Weg zu gehen.
1209360	1212960	3600	Darum denke ich, das Land braucht eine neue Führung.
1213650	1215640	1990	Der Brexit ist ein heftiger Schlag für die EU.
1216290	1219200	2910	Bereits im April sagte das niederländische Volk Nein
1219870	1222240	2370	zu einem Assoziierungsabkommen mit der Ukraine.
1222970	1225120	2150	Die EU-Kritiker verspüren Rückenwind.
1225780	1228440	2660	Heute ist der Anfang vom Ende der Europäischen Union,
1229000	1231800	2800	v.a. aber ist es der Anfang von etwas,
1232360	1234400	2040	das ich immer den patriotischen Frühling nenne,
1234970	1238080	3110	das Revival der Nationalstaaten in Europa.
1238670	1239840	1170	Die Botschaft an Brüssel:
1240570	1242560	1990	Einfach so weiter machen wie bis jetzt geht nicht.
1243190	1244960	1770	Dort gibt man sich trotzdem kämpferisch:
1245580	1248160	2580	Schon mein Vater hat gesagt:
1248770	1253240	4470	"""Was dich nicht umbringt, macht dich stark."""
1253890	1255840	1950	Wir werden sicherstellen, dass die Verhandlungen
1256470	1259160	2690	nicht nach dem Prinzip der Rosinenpickerei geführt werden.
1259730	1262400	2670	Es muss und es wird einen spürbaren Unterschied machen,
1262950	1266200	3250	ob ein Land Mitglied der Familie der Europäischen Union sein möchte
1266800	1267720	920	oder nicht.
1268370	1269240	870	Einige Monate später
1269840	1272880	3040	gibt der EU-Kommissionspräsident aber erstmals offen zu:
1273530	1275760	2230	Einiges lässt vermuten, dass wir es in Teilen
1276490	1281680	5190	mit einer existenziellen Krise der Europäischen Union zu tun haben.
1282340	1284280	1940	Erleichterung derweil bei David Cameron:
1284850	1287080	2230	* Er summt. *
1287670	1290320	2650	Er muss die Scheidungsverhandlungen mit der EU nicht mehr führen
1290960	1292520	1560	und gibt die Schlüssel der 10 Downing Street
1293090	1295400	2310	bereits Mitte Juli an seine Nachfolgerin Theresa May weiter.
1296060	1298280	2220	May möchte den Brexit-Austritt schnell in die Wege leiten,
