start	end	duration	text
1314430	1316960	2530	so viele Menschen aus dem Pazifik aufzunehmen wie möglich.
1317100	1319360	2260	Aber wer wird das bezahlen? Wir sehen es in Alaska:
1319550	1323320	3770	Die Umsiedlung eines kleinen Dorfes kostet 10 Mio. $.
1323420	1325320	1900	Die Politiker und Wissenschaftler hier in Fidschi
1325470	1327800	2330	verweisen auf die Probleme, die es in Europa gibt -
1327980	1330200	2220	mit Flüchtlingen aus der Syrien-Krise.
1330380	1334000	3620	Eine Massenmigration im Pazifik müsse verhindert werden.
1334250	1339600	5350	Die 2-Grad-Grenze, die an der UNO-Klimakonferenz angestrebt wird,
1339860	1343000	3140	sei für den Pazifik schlicht nicht gut genug.
1344530	1348520	3990	Kollege Florian Inhauser vertieft die Klimafrage auf den Fidschi-Inseln
1348770	1351720	2950	"heute Abend im Auslandjournal ""#SRF global""."
1351850	1359080	7230	Ab 20 Uhr im Netz auf www.srf.ch und um 23.25 Uhr hier auf SRF 1.
1361650	1365200	3550	1 Fr. für die A-Post, 85 Rp. für die B-Post:
1365420	1368920	3500	So viel bezahlen jene von uns, die heute noch Briefe schreiben.
1369100	1371360	2260	Das ist nichts im Vergleich zu dem,
1371580	1374200	2620	was heute das berühmte Basler Dybli kostet.
1374330	1376080	1750	170 Jahre alt ist es
1376180	1379160	2980	und hat mittlerweile einen Gegenwert von 100'000 Fr.
1379380	1383160	3780	Ein Wiler Auktionshaus stellt gleich mehrere Exemplare aus.
1385460	1387400	1940	Das Sicherheitspersonal ist stets dabei,
1387630	1392040	4410	wenn Auktionatorin Marianne Rapp mit wertvollen Marken kommt.
1392130	1393760	1630	Das Basler Dybli.
1393910	1400160	6250	Dieser Brief erzielte bei der Auktion letzten Herbst rekordhohe 103'700 Fr.
1400380	1404680	4300	Weil Marke und Brief aus dem Jahr 1847 bestens erhalten sind
1404830	1408440	3610	und weil mehrere Bieter sie unbedingt wollten.
1409960	1413600	3640	Es sind Sammlerinvestoren, die eigentlich beides verfolgen:
1413710	1415680	1970	sammeln und investieren.
1415830	1419970	4140	Sie wollen teure, seltene Stücke zur Vermögensabsicherung kaufen.
1420090	1423250	3160	Das hat letztlich dazu geführt,
1423450	1425650	2200	dass wir im Moment gerade für solche Paradestücke
1425800	1428330	2530	derart hohe Preise auf dem Markt haben.
1428490	1432930	4440	Zwar sank die Zahl registrierter Briefmarkensammler in der Schweiz
1433060	1436570	3510	innert zehn Jahren fast um die Hälfte auf 6'000.
1436800	1440090	3290	Dank Anlegern wie dem Unternehmer Rolf Dätwyler aber
1440230	1447090	6860	erleben Topmarken wie das Basler Dybli einen regelrechten Boom.
1447300	1450610	3310	In den letzten Jahren waren Briefmarken
1450780	1453410	2630	die sichersten und die wertbeständigsten Anlagen.
1453650	1455850	2200	Gold und Diamanten gehen rauf und runter.
1456000	1459330	3330	Einzig Immobilien sind auch relativ stabil.
1459510	1462010	2500	Aber man spricht von einer Immobilienblase.
1462250	1464850	2600	Von einer Briefmarkenblase habe ich noch nie gehört.
1465070	1468890	3820	Noch bis zum 27. November wird die Sammlung in Wil gezeigt.
1469070	1473530	4460	Nachmittags. Nachts werden die teuren Stücke wieder im Tresor verstaut.
1477140	1480690	3550	"Und jetzt zu Arthur Honegger mit den Themen von ""10vor10"":"
1480840	1484170	3330	Danke, Connie. Auch bei uns sind die Folgen der Anschläge in Paris
1484370	1488330	3960	das grosse Thema: Wir zeigen, wie Europas Metropolen jetzt aufrüsten.
1488470	1491770	3300	Wie es weitergeht im Kampf gegen die Terrorbande namens IS,
1491920	1495010	3090	das fragen wir den Nahostexperten Erich Gysling im Studio.
1495150	1499090	3940	Weiter haben unsere Reporter jene Schweizer Adresse ausfindig gemacht,
1499290	1502330	3040	wo am meisten Briefkastenfirmen gemeldet sind -
1502440	1505250	2810	und nein, sie liegt nicht im Kanton Zug.
1505530	1508250	2720	Am Schluss reden wir noch übers Essen:
1508460	1512170	3710	Auf Weizenprodukte zu verzichten, ist für Menschen mit Zöliakie ein Muss.
1512450	1515890	3440	Gleichzeitig wird glutenfreie Ernährung auch zur Trendsetterdiät.
1516020	1517810	1790	Warum, zeigen wir um 10 vor 10.
1517930	1518850	920	Danke, Arthur.
1519750	1522970	3220	"Und hier geht's jetzt weiter mit ""Grüner Sosse"" -"
1523070	1524770	1700	"bei ""Ein Fall für zwei""."
1524950	1527010	2060	Danke fürs Interesse und auf Wiedersehen.
1527240	1529930	2690	SWISS TXT / UT-Redaktion Zürich Lilian Zbinden, Tanja Morana, Daniela Zacheo