start	end	duration	text
3020	6360	3340	.
6980	14520	7540	1:1-Untertitelung
15230	17960	2730	"Guten Abend miteinander und herzlich willkommen zu ""Schweiz aktuell""."
18700	22440	3740	Heute sind die Abenteurer am Gotthard in der Zukunft unterwegs.
23150	25320	2170	Aber zuerst schauen wir auf die Tagesaktualität:
26430	28520	2090	Das Attentat von Nizza,
29200	31280	2080	wo ein Lastwagenfahrer mitten in eine Menschenmenge fuhr,
31990	33800	1810	wirft einen Schatten auf das Lake Festival in Genf.
34510	35890	1380	Die Genfer Behörden sorgen darum vor.
36550	38250	1700	Während des Festes reduzieren sie
38890	40330	1440	den Verkehr an der Seepromenade stark.
41050	43210	2160	Auf den Quais stellten sie imposante Betonblöcke hin.
43990	47210	3220	Alexandra Gubser zeigt, wie die Leute darauf reagieren.
48900	52610	3710	Seit heute Morgen ist es noch mühsamer als sonst,
53300	54810	1510	dem See entlang nach Genf hinein zu fahren.
55460	57050	1590	Die Betonelemente zwingen die Autofahrer
57790	59090	1300	zu einer langsamen Slalomfahrt.
59780	62490	2710	Nicht alle kommen sofort damit klar.
63220	65050	1830	Es ist verwirrend, man versteht nicht wirklich,
65660	67210	1550	wo man durchfahren muss.
67940	70330	2390	Sinn und Zweck dieser Beton-Schikane ist,
71100	72890	1790	Lastwagen und Cars die nächsten zehn Tage lang
73620	76250	2630	von den Quais rund um das Seebecken zu verbannen.
76990	79250	2260	Autofahrer können aber gut darum herum zirkeln.
80070	82610	2540	Das stört mich nicht, damit müssen wir nun eben leben.
83340	86210.00000000001	2870	Mit allem, was in Frankreich ge- schehen ist, dem Attentat in Nizza,
86890	90410	3520	braucht es solche Massnahmen, wir müssen uns schützen.
91140	94410	3270	Gestern wurden 40 solche 2 t schwere Betonblöcke
95190	97170	1980	auf den verschiedenen Zufahrtsachsen aufgestellt.
97950	101130	3180	An Wochenenden werden die Quais sogar für den ganzen Verkehr abgeriegelt.
101780	104250	2470	Es entspricht einem grossen Bedürfnis der Bevölkerung.
104950	107090	2140	Die Leute sehen, was alles in Europa geschieht,
107789.99999999999	111210.00000000001	3420	und erwarten von der Polizei Massnahmen.
111950	114450	2500	Für die Polizei gilt Genf als potenziell gefährdete Stadt,
115190	116970	1780	konkrete Hinweise liegen aber keine vor.
117710.00000000001	121490	3780	Doch während des Geneva Lake Festival erwarten wir 1,2 Mio. Besucher,
122180	123930	1750	darunter auch eine grosse Zahl Touristen,
124650	133290	8640	die das Sicherheitsdispositiv und die sichtbarere Polizeipräsenz schätzen.
135060	136970	1910	Der Terrorismus ist überall.
137640	138850	1210	Egal in welchem Land, in welcher Stadt,
139530	140770	1240	ob gross oder klein.
141490	143130	1640	Man kann einen Einzelnen oder viele Leute umbringen.
143850	146010	2160	Es ist fast lebensnotwendig, sich hier sicher zu fühlen.
146750	149090	2340	Die Sicherheit ist auch wichtig, dass man nicht paranoid wird,
149810	152210	2400	damit man die Menschen um einen herum nicht ängstlich
152950	154329.99999999997	1380	oder misstrauisch anschaut.
155020	161250	6230	Wenn man sich sicher fühlt, wirft man nicht alle in einen Topf.
162030	164650	2620	Kaum jemand hält die Sicherheits- massnahmen für übertrieben,
165270	168730	3460	auch wenn der motorisierte Verkehr in Genf bis am 14. August
169450	171610	2160	noch etwas langsamer rollt als üblich.
174160	177570	3410	Auch in der Stadt Zürich steht ein Grossanlass auf dem Terminkalender:
178220	179690	1470	die Street Parade am Samstag in einer Woche.
180430	185730	5300	Die wird zum 25. Mal durchgeführt und zieht 1 Mio. Raverinnen und Raver an.
186400	189970	3570	Mitten in der Menschenmenge fahren die Lovemobile.
190710	192610	1900	Das sind Lastwagen, auf denen DJs Musik machen.
193310	195580	2270	Nach dem Attentat von Nizza stehen deshalb in Zürich
196260	197900	1640	auch die Chauffeure dieser Wagen im Fokus.
200290	204020	3730	Street Parade Zürich, das heisst:
204670.00000000003	209420.00000000003	4750	30 Love Mobile mitten in Hunderttausend tanzenden Ravern.
210230	213780	3550	Würde einer der Chauffeure durchdrehen, käme es zur Katastrophe.
214520	219380	4860	Hier sieht der Chef dieser Techno- party aber absolut keine Gefahr.
220110	222660	2550	Für unsere Chauffeure würde ich jederzeit die Hand ins Feuer legen.
223390	225460	2070	Das ist für mich absolut ausgeschlossen.
226180	231980	5800	Wir haben seit 20 Jahren Security, die links und rechts stehen.
232780	236420.00000000003	3640	Diese geben den Lastwagenfahrern Anweisungen.
237250	239340	2090	Diese Chauffeure seien seit Jahren im Einsatz
240030	241900	1870	und die Besten von grossen Transportunternehmen.
242620	244380	1760	Neue würden auf Herz und Niere geprüft werden -
245070	246500	1430	auch von der Polizei.
247190	249300	2110	Diese rüstet sich nach Nizza und anderen Attentaten besonders
250020	253780	3760	und offenbar auch mit mehr Personal als auch schon.
254490	256180	1690	Selbstverständlich wurde das Aufgebot
256870	259100.00000000003	2230	auf die aktuelle Bedrohungslage angepasst.
259829.99999999997	262340	2510	Wir möchten die Zahl aber nicht in den Medien verbreiten.
263070	267500	4430	Aber es sind viele uniformierte und zivile Polizisten im Einsatz.
268300	269780	1480	So bedeckt sich Polizei und Veranstalter
270480	271940	1460	zu den Sicherheitsmassnahmen geben,
272650	276340.00000000006	3690	so klar ist die Botschaft der Street Parade.
277070	279060	1990	Die Street Parade ist bis heute eine Demonstration
279780	281340.00000000006	1560	für Liebe, Freiheit, Frieden und Toleranz.
281950	283620	1670	Das ist unser Inhalt.
284300	285940	1640	Es geht darum, dies zu transportieren
286610	287980	1370	und den Leuten in Erinnerung zu rufen,
288700	290260	1560	dass sie friedlich miteinander umgehen sollen.
291010	292580	1570	... und hofft, dass dieses Motto auch alle Raver
293340.00000000006	295780	2440	übernächstes Wochenende nach Zürich mitbringen.
298630	300580	1950	In den Flumserbergen im Kanton St. Gallen
301310	304060	2750	griff ein Wolf auf einer Weide sechs Lämmer an.
304800	306660	1860	Nur gerade eines von ihnen hat den Angriff überlebt.
308230	311500	3270	Die Tiere lagen gestern am Flumser Kleinberg auf einer Weide.
312190	315820	3630	Drei Tiere waren tot, zwei musste man von ihrem Leid erlösen.
316590	318140	1550	Mit einer DNA-Probe wird jetzt geprüft,
318870	321660	2790	ob der Wolf zum Calanda-Rudel gehört.
322370	324420	2050	Es war der erste Wolfriss im Kanton St. Gallen dieses Jahr.
326570	329660	3090	Im Kanton Aargau gibt es so viel leere Wohnungen wie noch nie -
330340	332780	2440	Mitte Jahr standen 6'687 leer.
333500	335780	2280	Gegenüber dem Vorjahr sind das fast 12 % mehr.
336510	338420	1910	Jedes zehnte Objekt ist ein Einfamilienhaus.
339150	340620	1470	Von den 213 Gemeinden im Aargau
341320	344540	3220	gibt es gibt es gerade noch in acht Gemeinden keine leeren Wohnungen.
346290	348500	2210	Das war's von unserer Seite.
349230	351140	1910	Jetzt geht's wieder zu den Kollegen am Gotthard.
351760	354340.00000000006	2580	Sie befassen sich, nach all den Reisen durch Schluchten und Felsen,
355130	358580	3450	mit der Flachbahn, dem modernen Basistunnel. Viel Vergnügen!
359280	361780	2500	SWISS TXT / UT-Redaktion Zürich Evelyne Iyer, Mirela Muminovic