start	end	duration	text
28380	30340	1960	MIT TELETEXT-UNTERTITELUNG
31740	33100	1360	"Guten Abend und herzlich willkommen. ""Einstein"" heute ohne Fussball."
37090	40420	3330	Er gilt als intelligent, als Freund des Menschen,
40630	44580	3950	und auch der Mensch sucht immer wieder die Nähe des Delfins.
44790	47180	2390	Kaum ein anderes Tier löst so viele Emotionen,
47370	48140	770	aber auch falsche Vorstellungen aus wie der Delfin,
50310	52220	1910	"nicht zuletzt seit ""Flipper""."
52910	56180	3270	Nicole Ulrich auf der Suche nach Delfinen.
57450	59180	1730	Mit einer Schweizer Forscherin
59340	62100	2760	taucht sie ab in die Tiefen des Roten Meers.
63920	65580	1660	Rasante, dramatische Musik
69500	73460.00000000001	3960	Gelingt der Versuch, mit freilebenden Delfinen zu schwimmen?
79230	81260	2030	Was machen wir jetzt?
82700	86140	3440	Wenn man die Delfine nicht jagen möchte, muss man viel schwimmen.
88140	92020.00000000001	3880	Was weiss Angela Ziltener über das Leben der Meeressäuger?
93590	97500	3910	Was liest sie aus den Spuren der Delfine?
101140	103580	2440	"""Einstein"" hat diese Wissenschaftlerin"
103700	107860	4160	beim Leben mit den Delfinen im Roten Meer bei Hurghada begleitet.
109640	112740.00000000001	3100	Im nördlichen Roten Meer, vor der Küste Ägyptens,
112850	114660	1810	liegt die Strasse von Gubal
114860	117620	2760	mit ihren von Korallenriffen geprägten Inselgruppen.
118190	120180	1990	Hotelanlagen in Hurghada.
120260	122220	1960	Das ehemalige Fischerdorf
122380	123140	760	hat sich zur grössten ägyptischen Feriendestination
125810	128460.00000000001	2650	mit Zehntausenden von Touristen entwickelt.
129190	132940	3750	Diese kommen nicht zuletzt wegen der freilebenden Delfine.
133150	138180	5030	Schnorcheltouren mit Delfingarantie sind der Renner unter den Angeboten
138370	142820	4450	und arten bisweilen in regelrechte Delfinjagden aus.
143780	146700	2920	Schon seit über 10 Jahren begleitet und dokumentiert
146950	149940	2990	der deutsche Tauchinstruktor Michael Stadermann
150130	153260	3130	das Leben der Delfine in den Riffen von Hurghada.
156740	160540	3800	Auch Angela Ziltener, die Schweizer Verhaltensbiologin,
160630	163140	2510	hat sich dieser Gruppe angeschlossen.
163420.00000000003	166180	2760	Sie erforscht die Delfinpopulationen des Roten Meers
166390	168180	1790	mit wissenschaftlichen Methoden.
172250	175579.99999999997	3330	So ist eine umfangreiche Datenbank entstanden.
176300	180260	3960	Ihr Fachwissen kann Angela Ziltener auch aktiv bei ihrer Arbeit
180420	183180	2760	für die ägyptische Umwelt- schutzorganisation HEPCA einsetzen.
189000	191940	2940	Wild lebende Delfine vor der Küste Ägyptens.
192060	193860	1800	Diese Indopazifischen Tümmler
194110	198180	4070	ruhen sich am Shaab-El-Erg-Riff und um Fanous West aus.
199380	202420.00000000003	3040	Sie machen Pause, bevor sie in der Nacht auf die Jagd gehen
202610	204740	2130	und in die Tiefen des Meeres abtauchen,
204900	207500	2600	wohin Menschen ihnen nicht folgen können.
208820	210780	1960	Ruhige, dunkle Musik
221440	225980	4540	Die Al-Mashrabiya-Tauchbasis in Hurgadha im letzten Dezember.
226220	228220	2000	Wir begleiten Angela Ziltener und ihre Gruppe
229020	230700	1680	an Bord der Dolfin Dancer.
230860	233740	2880	3 Tage lang soll das Tauchboot unsere Heimat sein
233920.00000000003	236980	3060	auf der Suche nach den freilebenden Delfinen.
241580	243300	1720	Hier beginnt unsere Geschichte - mit einem Klimawechsel sozusagen.
245830	249140	3310	Sobald das Boot die geschützte Hafenlagune verlässt,
249190	251380	2190	kämpfen wir mit schwerem Seegang.
251540	255580	4040	Auf der offenen See bekommt man den kalten Winter hautnah zu spüren.
255700	257940	2240	Es sind die tiefsten Temperaturen,
258170.00000000003	258300	130	die in Ägypten seit 112 Jahren gemessen wurden,
261250	263180	1930	sagen die Meteorologen.
263360	265740	2380	Meeresrauschen übertönt das Gespräch.
269260	271540	2280	Dick eingepackt macht sich Nicole Ulrich
271720	273220	1500	schon mal mit dem Tauchgerät vertraut.
274220	276180	1960	Sie wird tauchtechnisch
276360	279940	3580	vom erfahrenen Instruktor Michael Stadermann beraten und unterstützt.
280120	282780	2660	Er taucht seit 30 Jahren in diesem Gebiet.
288340.00000000006	291420	3080	Jetzt gilt es, nach Delfinflossen Ausschau zu halten.
291630	294620	2990	Nicht immer sind sie an den gleichen Plätzen anzutreffen.
294870	299020	4150	Manchmal bleiben sie tagelang wie vom Erdboden verschluckt.
302790	303300	510	Wir laufen verschiedene Riffe an,
305110	308300	3190	bei denen Delfine ihre traditionellen Ruheplätze haben,
308470	310220	1750	aber heute sind sie unsichtbar.
310340	313260	2920	Bis Sonnenuntergang ist keine Flosse in Sicht.
319070	320980	1910	Für die erfahrenen Taucher
321240	323980	2740	ist das jedoch keine ungewöhnliche Situation.
324890	327460	2570	Delfine haben ein grosses Gebiet.
327690	331980	4290	Man braucht sehr viel Glück und gute Bedingungen.
332110	333260	1150	Im Moment ist es halt nicht so ...
334570	339340.00000000006	4770	Es ist windig. Da sieht man auch die Rückenflossen weniger gut.
339500	344060	4560	Aber wir geben unser Bestes und hoffen, dass wir sie finden.
344880	347500	2620	Vor gut 10 Jahren wurde der Grundstein dafür gelegt,
347750	348260	510	dass wir heute hier sein können. Wie lief das damals?
351950	353820	1870	Ich war mit der Tauchschule
353980	356940	2960	mit einer Gruppe an einem Riff im Norden unterwegs.
357170	360020	2850	Als wir dort ankamen, sahen wir einen Delfin.
361660	363260	1600	Dieser Delfin erschien uns von Anfang an seltsam.
364750	368700	3950	Der bewegte sich nur ganz minimal am Riff in und her.
368810	371180	2370	Als wir zum Tauchen ins Wasser gingen,
371430	375380	3950	kam er in unsere Nähe, und wir sahen, dass er verletzt war.
375470	377820	2350	An der Rückenflosse oben fehlte eine Ecke
378050	378260	210	und es war eine tiefe Wunde auf der linken Seite des Rückens,
381860	385140	3280	die noch wirklich blutig war. Fleischfetzen hingen raus.
385310	388900	3590	Wir betreuten ihn sozusagen den Tag über.
388990	391500	2510	Wir blieben dort, gingen abwechselnd ins Wasser,
391660	393260	1600	auch über die Mittagspause, sodass immer jemand im Wasser war.
395120	398340.00000000006	3220	Er kam dann auch bis ans Heck des Bootes mit, an die Plattform.
398500	401900	3400	Als wir abends losfuhren, wir mussten ja irgendwann nach Hause,
401980	403780	1800	schwamm er hinter dem Boot her.
404030	406980	2950	Als das Wasser richtig tief wurde, drehte er um.
407110	408260	1150	Er schwamm weg.
408980	411510	2530	Am nächsten Tag ging das Boot wieder an den Platz,
411630	413310	1680	und er war wieder dort.
413350	415909.99999999994	2560	Wir entdeckten ihn über Tage hinweg immer wieder,
416000	417590.00000000006	1590	auch in anderen Tauchgebieten.
417800	420550	2750	Er kam dort hin und blieb bei den Tauchern.
420630	422750	2120	So konnten wir ihn immer schön beobachten.
422910	423390	480	Er genas auch. Die Wunde wurde besser.
426040	430350	4310	Tauchlehrer Michael Stadermann besorgte sich eine Unterwasserkamera,
430600	434270	3670	und dokumentierte damit die Entwicklung Ferdinands.
436270	438310	2040	Ferdinands Bisswunde, der übrigens ein Weibchen ist,
439730	441670	1940	wie sich später herausstellt,
441840	445750	3910	stammt vermutlich vom spitzen Maul eines Makohais.
448160	451150	2990	Ferdinand überlebte ja, nicht? Er wurde gesund.
451270	453310	2040	Wie ging das weiter?
454780	456390	1610	Wir trafen ihn immer wieder.
456600	459470	2870	Das wurde ein richtig freundschaftliches Verhältnis.
459590.00000000006	462590.00000000006	3000	Anfangs waren wir enttäuscht, weil er immer allein war.
462750	465030	2280	Wir dachten schon, er wäre ein Einzelgänger.
465240	468310	3070	Aber nach etwa 6 Wochen kam er dann plötzlich mit einer ganzen Horde an.
469970	473150	3180	Alle Delfine kamen wie er so mit uns.
474200	475750	1550	Sie blieben bei den Tauchern.
475909.99999999994	479110	3200	Die Jahre davor, ich bin schon fast 30 Jahre hier,
479340.00000000006	481670	2330	hatte man nur kurze Delfinbegegnungen.
481830	483310	1480	Aber nachdem wir diese Verbindung zu Ferdinand hatten,
485430	487670	2240	kamen die Delfine und blieben bei uns,
487900	492150	4250	als ob sie wüssten, dass Vertrauen da ist und ihnen keiner was tut.
492310	494670	2360	Wir machten ganze Tauchgänge zusammen.
494890	496750	1860	Ein Stunde oder länger.
498750	501750	3000	Wir achteten immer darauf, sie nicht anzufassen.
501910	505950	4040	Viele gehen ins Wasser und versuchen sofort, die Delfine anzufassen.
506160	510030	3870	Unsere Tümmler mögen das nicht so. Die weichen sofort zurück.
510230	512789.99999999994	2560	Es ist selten, dass sich einer berühren lässt.
512900	513350	450	Da wir das gar nicht machen,
515000	517390	2390	hat sich ein Vertrauensverhältnis aufgebaut.
517470	519710.00000000006	2240	Sie kommen manchmal und berühren uns.
520750	523150	2400	Am nächsten Morgen ist Angela Ziltener
523340.00000000006	526030	2690	schon in aller Frühe auf dem Beobachtungsposten.
526150	528430	2280	Und das frühe Aufstehen lohnt sich.
528670	530590	1920	Eine grösserer Verband von Delfinen
530780	533670	2890	taucht hinter dem Riff auf und steuert in die Lagune.
533830	536230	2400	Höchste Zeit für einen Antrittsbesuch.
538160	540150	1990	Nicole Ulrich will die Wissenschaftlerin
540240	542550	2310	und den Tauchinstruktor
542640	543430	790	zur soeben aufgetauchten Delfingruppe begleiten.
546430	548870	2440	Minimalistische, rhythmische Klänge
550390	553070	2680	Ganz nach vorne gehen, an die Bootskante!
560270	564150	3880	Bei Nicole läuft das Abtauchen noch nicht ganz so flott.
569520	572150	2630	Doch wohin sind die Delfine entschwunden?
576750	581350	4600	Verhaltensbiologin Angela Ziltener und Nicole Ulrich halten Ausschau.
582240	585990	3750	Da taucht die Gruppe kurz auf, zieht aber sogleich weiter.
589430	593570	4140	Nicole Ulrich hat Mühe, das Tempo der Delfine mitzugehen.
593710	597730	4020	Wenn man die Delfine nicht wie die anderen mit dem Boot jagen möchte,
597850	599730	1880	muss man viel schwimmen. Ja.
600670	603390	2720	Aber du hast sie ja kurz gesehen. Ja, einfach beim Vorbeiziehen.
604950	608230	3280	Ich versuchte gar nicht erst, hinterherzuschwimmen.
608350	610230	1880	Bei meinem Tempo ...
612590	616750	4160	Etwas enttäuscht steigt die Moderatorin aus dem Wasser.
616870	618430	1560	Sie war so nahe dran.
620560	622830	2270	Was machen wir jetzt? Einfach warten?
622950	624910	1960	Ist Sina noch unterwegs?
625840	629190	3350	Ja, wir haben sie im offenen ... Wir sind wirklich ...
629390	633390	4000	Wir haben das Riff verlassen und sind schon ziemlich im offenen Meer.
633900	636110	2210	Wir checken mal die Lage.
637870	640830	2960	Wir schauen, wie ihr Tagesplan jetzt aussieht.
641560	644830	3270	Ob Jagd angesagt ist, spielen usw.
644990	647310	2320	Bis jetzt waren sie ja in der Lagune.
647430	648400	970	Sie haben dort geschlafen, geruht.
649830	653880	4050	Aber auch sozialisiert, Petting, immer mit den Flippers.
654150	658440	4290	Jetzt schauen wir mal, ob sie hier bleiben oder jagen gehen.
659180	662640	3460	Ja, es ist ... Sie haben wahrscheinlich langsam Hunger.
664400	668040	3640	Auch Touristenboote tauchen heute nur wenige am Riff auf.
668250	671000	2750	Die angespannte politische Lage in Ägypten
671210	673600	2390	und der kalte Winter hinterlassen Spuren.
673800	677600	3800	Kurz darauf entdeckt die Mannschaft die Delfine wieder.
677780	678520	740	Sie schwimmen direkt unter unserem Boot.
679910	682320	2410	Diese Gelegenheit gilt es zu nutzen.
690310	692560	2250	Diesmal hat Nicole Ulrich Glück.
692710	693440	730	Die Tümmler tauchen direkt vor ihrer Nase auf,
695880	698880	3000	kommen neugierig näher und scannen die Taucher.
699640	701720	2080	Ruhige, arabisch klingende Musik
740210	742170	1960	Für die Delfinforschung
742320	745020	2700	ist das Küstengebiet des Roten Meers ein Glücksfall,
745230	748620	3390	denn hier ist die Sicht im glasklaren Wasser optimal.
748740	751180	2440	Der hohe Salzgehalt des Roten Meeres
751250	753460	2210	verhindert das Planktonwachstum weitgehend.
753920	757620	3700	Wenig Plankton heisst ungetrübte Sicht auf die Delfine.
763760	766420	2660	Die Rückenflosse mit ihren Schrammen und Kerben
766600	768540	1940	ist das beste Unterscheidungsmerkmal.
769140	773340	4200	Damit tragen die Tiere ihren Fingerabdruck quasi auf dem Rücken.
775470	780060	4590	Das Alter der Delfine erkennt man an der Anzahl Flecken auf ihrem Bauch.
780250	782220	1970	Je mehr Flecken, desto älter.
782290	783500	1210	Das lässt sich wie das Geschlecht nur mit einem Blick von unten erkennen.
788610	791300	2690	Doch auch die traditionelle Beobachtung vom Boot aus
791410	793580	2170	wird noch angewandt.
793680	796580	2900	Für Angela Ziltener und Kollegin Sina Kreicker
796740	798500	1760	das kleine Einmaleins der Delfinbeobachtung, sozusagen.
802190	805220	3030	Ihr habt bis jetzt über 200 Individuen einen Namen gegeben
805280	808780	3500	und sie registriert, damit ihr wisst, welches Tier wo ist.
808890	810860	1970	Das ist sehr wichtig.
811000	813500	2500	Wir wollen ja auch wissen, wie gross die Habitate sind.
814400	816980	2580	Durch die Rückenflosse können wir genau sehen:
817190	821060	3870	"""Dieses Individuum war gestern im Norden, heute ist es hier."""
821270	824100	2830	So können wir auch die Wanderrouten bestimmen.
824280	828500	4220	Wie viel legt so ein Delfin überhaupt pro Tag zurück?
828840	831380	2540	Natürlich wollen wir auch die Freundschaften sehen.
831470	833940	2470	Wer ist mit wem zusammen?
834030	837380	3350	Bei den Weibchen sieht man, dass sie flexibler sind.
837460	839460	2000	Mal sieht man Eva mit Aisha,
839660	842180	2520	am nächsten Tag mit einer anderen Freundin,
842300	843500	1200	tags darauf sind die 3 auseinander.
844690	847860	3170	So sieht man die Flexibilität der Freundschaften
847960	850780	2820	und des sozialen Netzwerks. Wie ist das aufgebaut?
851020	855060	4040	Es nicht einfach ein Schwarm und sie bleiben für immer zusammen,
855280	857180	1900	sondern sie wechseln.
857320	858500	1180	Wenn einer keine Lust mehr hat, geht er zu einer anderen Gruppe.
860870	863180	2310	Das ist eine Fission-Fusion-Society.
863400	867340	3940	Es ist ein Kommen und Gehen, wie bei uns Menschen.
867440	870140	2700	Wir gehen an eine Party mit einer Freundin,
870300	872620	2320	am nächsten Tag sind wir wieder weg.
872880	873540	660	Also auch das ist sehr ähnlich wie bei uns Menschen.
876920	879580	2660	So eine Gesellschaft gibt es eigentlich nur
879720	883380	3660	bei Delfinen, Menschen und Schimpansen.
885640	888580	2940	Die männlichen Delfine hingegen haben ein ganz anderes Verhalten.
889720	892300	2580	Sie pflegen klassische Männerfreundschaften
892310	894460	2150	und sind meist zu viert unterwegs.
894650	899460	4810	Diese Junggesellenverbände bilden die Männchen schon im jugendlichen Alter.
900700	902780	2080	Die haben Freundschaften fürs Leben.
902920	903620	700	Sie bleiben wirklich ... Hier hat man v.a. 4er-Gruppen.
906800	909060	2260	Wenn diese 4er-Gruppen unterwegs sind,
909250	911660	2410	wenn sie die grössere Gruppe verlassen,
911850	914140	2290	sind sie am nächsten Tag wieder zusammen.
914150	915900	1750	Also zu viert.
916040	918540	2500	An anderen Orten der Welt, z.B. im Shark Bay, Westaustralien,
920120	924380	4260	sind es immer nur 3 Männchen, die zusammen sind.
924470	926380	1910	Das ist sehr spannend für uns.
926570	930970	4400	Wir schauen, wieso die Sozialstruk- tur hier anders ist als anderswo.
931120	932970	1850	Weiss man, warum?
933170	933540	370	Oder gibt es Mutmassungen, warum das so ist?
936160	939020	2860	Warum Männer offenbar diese engen Freundschaften brauchen
939120	941060	1940	und die Weibchen nicht?
941200	943900	2700	Die Männchen und Weibchen der Indopazifischen Tümmler
944040	945620	1580	sind gleich gross.
945880	948580	2700	D.h., ein einzelnes Männchen schafft es nicht so leicht,
948920	950700	1780	sich mit einem Weibchen zu paaren.
950890	955620	4730	Es ist eine Theorie, dass die Männ- chen Freundschaften bilden müssen,
955840	958580	2740	Allianzen bilden müssen, um die Weibchen zu bekommen.
958730	960660	1930	Spannend.
960920	963540	2620	Wenn das Weibchen gerade nicht wirklich will,
964160	966900	2740	ist es einfacher, wenn man zu viert ist ...
967120	971500	4380	... sie in die Enge zu treiben und so eine Chance zu bekommen.
973040	977300	4260	Man spricht jetzt sogar von Vergewaltigungen unter den ...
977440	978660	1220	Also ein Weibchen wird wirklich gekidnappt
980240	985100	4860	und man paart sich dann über mehrere Tage mit ihr.
985220	987100	1880	Was ist das Spezielle hier?
987280	990660	3380	Es ist weltweit einzigartig, dass man mit den Delfinen schwimmen
990880	993260	2380	und Unterwasserforschung betreiben kann.
993320	993580	260	Warum klappt das hier und sonst offenbar nirgends?
996040	999700	3660	Die Delfine hier, besonders in Hurghada, sind habituiert.
999810	1001460	1650	Sie sind an Taucher gewöhnt.
1001610	1003900	2290	Wir warten aber auf den bestimmten Moment,
1004130	1006620	2490	wenn sie wieder ihr eigenes Ding machen.
1006790	1008580	1790	Das ist das, was uns interessiert: Was ist der Alltag eines Delfins?
1011200	1015140	3940	Was macht er, wenn er nicht schläft? Wie sieht das aus?
1015250	1018580	3330	Wir konnten schon einiges entdecken,
1018720	1021860	3140	das bisher noch nie publiziert wurde.
1024369.9999999999	1026300	1930	Diese Buschgorgonie z.B.
1026560	1030420.0000000001	3860	hat für die Indopazifischen Tümmler eine spezielle Bedeutung.
1030640.0000000001	1034060	3420	Die Delfine schwimmen systematisch durch die Weichkorallen
1034270	1038020	3750	und reiben sich mit dem Bauch und beiden Rückenseiten daran.
1038200	1038619.9999999999	420	Dem Zweck dieses Verhaltens will Angela Ziltener auf die Spur kommen.
1042240	1046300	4060	Möglicherweise enthält die Koralle antibakterielle Substanzen.
1052750	1053620	870	Auch Delfinkot kann den Wissenschaftlern wichtige Hinweise
1056330	1059780	3450	auf die Lebensgewohnheiten und das Verhalten der Delfine geben.
1062320	1066500	4180	Darum sammeln die tauchenden Wissenschaftler fleissig Exkremente.
1069880	1072780	2900	Auch Nicole Ulrich möchte ihren Teil dazu beitragen,
1072970	1076670	3700	muss aber feststellen, dass dies gar nicht so einfach ist.
1081060	1083630	2570	Doch wo ein Wille ist, ist auch ein Weg.
1090940	1093510	2570	Die Auswertung erfolgt dann im Trockenen.
1096880	1098630	1750	Was kann uns denn Delfinkot erzählen?
1099470	1101400	1930	Es ist einzigartig,
1101630	1104160	2530	dass man von wilden Delfinen Kotproben nehmen kann.
1104330	1106880	2550	Normalerweise ... Das kann man natürlich,
1107000	1109240	2240	wenn man mit ihnen unterwegs ist.
1109400	1113720	4320	Für uns ist es sehr spannend - auch zu sehen, von wem der Kot ist.
1114400	1117400	3000	Dass wir sagen können ...
1117580	1121640	4060	Diese Probe von heute ist z.B. von Malik.
1121760	1124160	2400	Sie wird jetzt in Alkohol eingelegt.
1124290	1128640	4350	Es ist ein längerer Prozess, bis man Ergebnisse hat.
1129320	1133320	4000	Aber spannend für die Zukunft ist:
1133450	1136560	3110	Vielleicht können wir sogar DNA-Analysen machen -
1136740	1139760	3020	eine Art Verwandtschaftsanalyse anhand des Kots.
1139880	1142320	2440	Das ist aber sehr aufwendig.
1143320	1143680	360	Was ihr nebst dem Kot auch sammelt, ist das Erbrochene der Delfine.
1148890	1149880	990	Ja.
1149970	1154120	4150	Ich habe nicht gewusst, dass Delfine so oft erbrechen.
1154210	1157080	2870	Sie können vieles nicht verdauen. Gräten z.B.
1157170	1158680	1510	Das ist von Ferdinand.
1161640	1164600	2960	Diesen Fisch müssen wir aber noch analysieren.
1164680	1166440	1760	Da kommen grosse Brocken raus.
1167130	1169200	2070	Es ist eine gute Technik,
1169330	1173720	4390	um zu sehen, was sie gegessen und gejagt haben.
1174490	1177040	2550	Wir haben auf unserer Ausfahrt ja gesehen,
1177280	1181200	3920	wie sie runtergetaucht sind und gejagt haben.
1181360	1183880	2520	Wir Taucher können da nicht mehr folgen.
1184050	1188080	4030	Wenn sie 50 oder 100 m runter- tauchen, haben wir keine Chance.
1188250	1188760	510	Und so hat man trotzdem einen Anhaltspunkt, was sie jagen. Ja.
1194010	1197640	3630	Kurz darauf wieder an Land. Ohne Angela Ziltener.
1198130	1199880	1750	Ein Taxifahrer erzählt uns,
1200130	1203720	3590	es gebe draussen in der Wüste eine Art Delfinarium im Rohbau.
1204540	1206640	2100	Tatsächlich: In der prallen Wüstensonne
1206850	1211680	4830	schwimmen 2 apathische Delfine in einem ungedeckten Bassin.
1214130	1218040	3910	Den Touristen wird angeboten, mit den Delfinen zu schwimmen.
1219780	1224960	5180	5 Min. kosten 35 $ gemäss der handgeschriebenen Preisliste.
1227830	1231680	3850	Den Tourismusbehörden ist dieses Angebot auf Anfrage nicht bekannt.
1231910	1233720	1810	Es scheint ein inoffizieller Geheimtipp zu sein,
1235050	1237520	2470	der v.a. russische Touristen anlockt.
1242010	1245160	3150	Wir besuchen Angela Ziltener an ihrem Arbeitsplatz
1245280	1247840	2560	bei der Umweltschutzorganisation HEPCA.
1247920	1248720	800	Sie hat schon viele Gerüchte von diesem Delfinarium gehört,
1251720	1254880	3160	sieht jetzt aber erstmals Bilder davon.
1256610	1260160	3550	Weil die Verhaltensbiologin die natürlichen Lebensbedingungen
1260200	1262280	2080	der Delfine besonders gut kennt,
1262570	1263720	1150	leidet sie beim Betrachten unserer Aufnahmen.
1266520	1268240	1720	Oh Mann!
1270130	1272040	1910	Die Tiere tun mir leid.
1273690	1278720	5030	Sie sind eingesperrt. Man achtet nicht auf ihre Bedürfnisse -
1281550	1286320	4770	sei es nach Kratzen oder freiwilliges Fressen bei Hunger.
1287040	1290440	3400	Denn sie werden ja von Hand gefüttert.
1291130	1293160	2030	Auch der Platz, natürlich.
1293320	1293720	400	Auf freier Wildbahn tauchen sie viel tiefer.
1296260	1299640	3380	Und die Weite. Pro Tag können sie 100 km zurücklegen.
1300080	1302000	1920	Das können wir beobachten.
1303640	1305520	1880	Das haben wir registriert.
1305760	1308720	2960	Wenn man dann so etwas sieht, tut es weh. Es geht tief.
1312600	1317160	4560	Rechtlich kann Angela Ziltener gegen diese Zustände nicht vorgehen,
1317240	1319000	1760	das weiss sie.
1319090	1321400	2310	Umso mehr verwendet sie all ihre Energie
1321560	1323760	2200	für den Schutz von freilebenden Delfinen.
1330840	1333320	2480	2 Tage später nimmt uns Angela Ziltener
1333450	1336280	2830	wieder zu einem Tauchgang mit aufs Rote Meer.
1337320	1338760	1440	Diesmal wollen wir ein beliebtes
1339210	1342040	2830	und vielfrequentiertes Tauchgebiet besuchen.
1342280	1345160	2880	Die Wetterbedingungen werden langsam besser.
1345280	1348320	3040	Und schon bald erscheint die erste Delfinschule.
1348630	1351880	3250	Angela Ziltener und Nicole Ulrich begeben sich auf Tauchstation
1352000	1353760	1760	und werden von den Delfinen begrüsst.
1363350	1365880	2530	Während sie in aller Ruhe das Verhalten der Delfine
1366130	1368760	2630	unter Wasser beobachten können, ist es weiter oben mit der Ruhe vorbei.
1372280	1374120	1840	Das Auftauchen der Delfine
1374280	1378120	3840	verbreitet sich wie ein Lauffeuer unter den Touristenbooten.
1379600	1381520	1920	Die Boote sind für Taucher gefährlich,
1381640	1383800	2160	denn unter Wasser hört man nicht,
1384300	1386960	2660	aus welcher Richtung die Motorengeräusche kommen.
1387180	1390840	3660	Weil sich Schallwellen im Wasser viel schneller ausbreiten
1391000	1394080	3080	und praktisch gleichzeitig bei beiden Ohren ankommen,
1394240	1398360	4120	kann unser Gehirn nicht mehr heraus- finden, woher das Geräusch kommt.
1398480	1398880	400	Mit garantierten Delfin-Erlebnissen wollen die Ägypter
1402090	1405320	3230	die einst so zahlreichen Urlauber zurückgewinnen.
1406780	1408840	2060	Denn seit den politischen Unruhen
1409000	1411410	2410	ist der Tourismus dramatisch eingebrochen.
1411570	1413810	2240	Es kommen fast nur noch Besucher aus Russland nach Hurghada.
1426500	1428810	2310	Jedes Touristenboot will seinen Kunden
1429010	1431450	2440	den besten Blick auf die Delfine bieten
1431570	1433610	2040	und die ungeübten Schnorchler
1433770	1436370	2600	möglichst nahe bei den Delfinen absetzen.
1436490	1438730	2240	Doch das wäre eigentlich verboten.
1439450	1442130	2680	Denn für Schnorchler, Taucher und Touristenboote
1442260	1443850	1590	gibt es staatliche Vorschriften
1444180	1446530	2350	für das Verhalten in der Nähe von Delfinen.
1447500	1449890	2390	Für Boote ist es z.B. streng verboten,
1450040	1452530	2490	sich den Delfinen von vorne zu nähern
1452620	1455410	2790	Auch verfolgen dürfen sie die Delfine nicht.
1455930	1458810	2880	Erlaubt ist einzig eine langsame Fahrt parallel zu den Delfinen,
1460180	1463290	3110	wenn ein Mindestabstand von 30 m eingehalten wird.
1465500	1469130	3630	Auch Schlauchboote dürfen nicht in Delfinschulen hineinfahren.
1469290	1472970	3680	Und das Berühren oder Füttern von Delfinen ist streng verboten.
1475460	1477690	2230	Diese Regeln hat der ägyptische Staat
1477850	1481970	4120	auf Druck der Umweltschutz- organisation HEPCA in Kraft gesetzt.
1485100	1488170	3070	Angela Ziltener kontrolliert im Auftrag der HEPCA,
1488390	1488850	460	ob diese Regeln auch eingehalten werden.
1493290	1496610	3320	Doch als nichtstaatliche Organisation kann die HEPCA
1496770	1501210	4440	Sünder nicht direkt bestrafen, sondern nur den Behörden melden.
1501930	1503850	1920	Werden diese Verhaltensregeln wirklich eingehalten?
1504900	1507510	2610	Man kennt die Regeln. Man ist informiert.
1507630	1509710	2080	Wenn aber kein HEPCA-Boot da ist,
1509930	1514110	4180	wenn wir mit anderen Booten rausfahren, als normale Gäste,
1514250	1518870	4620	sehen wir, dass die Regeln oft missachtet werden.
1519930	1522350	2420	Aber zumindest wächst das Bewusstsein,
1522570	1524430	1860	auch bei der Bevölkerung.
