start	end	duration	text
1257960	1260930	2970	ist heute das grösste und wichtigste Filmfestival
1261010	1263370	2360	im deutschsprachigen Raum eröffnet worden.
1263530	1268490	4960	Bei der Berlinale in Berlin treffen Altstars wie Jeff Goldblum
1268570	1273250	4680	oder Willem Dafoe auf Newcomer.
1273940	1277170	3230	Mondäne Hollywoodgrössen wie Tilda Swinton posieren
1277300	1280890	3590	mit fröhlich aufgeregten Schauspiel- kolleginnen um die Wette.
1281090	1283650	2560	Und Oscar-Preisträger und Jurymitglied Christoph Waltz
1283820	1287570	3750	ist der lebende Beweis für die Durchlässigkeit der Branche,
1287730	1291130	3400	Herkunft oder Hautfarbe spielen auf dem roten Teppich keine Rolle,
1291360	1295570	4210	alle zelebrieren Seite an Seite das grosse Filmfest.
1296490	1300090	3600	Viele Wettbewerbsbeiträge rücken dann aber kulturelle Begegnungen
1300250	1303250	3000	in den Mittelpunkt, die nicht so locker vonstatten gehen.
1303400	1306610	3210	Menschen unterschiedlicher Herkunft, Religionen und Weltanschauungen
1306760	1310330	3570	ringen auf der Leinwand um Toleranz und einen Weg für ein Miteinander.
1310440	1312490	2050	Selim Petersen.
1313860	1317290	3430	Kann ein Atheist im Iran mit 4 Mullahs in einer WG leben?
1317470	1320570	3100	"Diese Frage stellt die Doku ""Iranien"","
1320760	1323970	3210	einer von vielen Berlinale-Filmen über kulturelle Unterschiede.
1324090	1326210	2120	Die Idee: ein Selbstversuch.
1326450	1329250	2800	Der iranisch-französische Regisseur Mehran Tamadon glaubt nicht an Gott,
1329370	1331850	2480	aber an Toleranz.
1332080	1335130	3050	Im Iran sucht er den Dialog mit religiösen Landsleuten.
1349810	1352410	2600	Produziert wurde das kühne Dokumentarfilm-Experiment
1352510	1355450	2940	von dieser Schweizerin: Elena Tatti.
1355550	1358130	2580	Das friedliche Zusammenleben verschiedener Kulturen
1358390	1362210	3820	ist für sie ein hohes Ziel, für das es sich zu kämpfen lohnt.
1362330	1366290	3960	Doch ist ein liberaler Iran keine allzu naive Utopie?
1366400	1370570	4170	Ein Stück Naivität ist da schon dabei.
1370770	1373130	2360	Doch gleichzeitig ist das ganze Projekt
1373290	1376490	3200	angesichts der derzeitigen Lage im Iran auch sehr mutig.
1376730	1378890	2160	Unser Regisseur glaubt ehrlich daran,
1379050	1383730	4680	dass der Iran eines Tages wieder toleranter und offener wird.
1386930	1390410	3480	Das Ringen um Toleranz
1390600	1394250	3650	"ist in Berlin nicht nur in der Doku ""Iranien"" zentral."
1394410	1397210	2800	Gleich in mehreren Spielfilmen des Publikums-Festivals
1397220	1400130	2910	treffen fremde Kulturen aufeinander.
1400250	1404370	4120	Berlinale-Direktor Dieter Kosslick nennt die wichtigsten 3:
1405460	1407690	2230	Naja, wir haben mehrerer Filme,
1407770	1410250	2480	"einmal den österreichischen Wettbewerbsbeitrag ""Macondo"","
1410430	1412810	2380	wo es um tschetschenische Flüchtlinge in Österreich geht.
1413070	1415810	2740	Und v.a. geht es da ja auch immer um Kinder.
1416010	1418770	2760	"Dann haben wir ""Two Men in Town"" von Bouchareb."
1418850	1421930	3080	Eine neue Verfilmung eines Häftlings, der in der Haft
1422130	1426090	3960	im Mittelland von Texas plötzlich zum Mohammedaner wird.
1426190	1429610	3420	Und diese Religionen, diese Auffassungen und diese Bigotterie,
1429770	1434330	4560	die dort herrschen, prallen da wirklich hart gegeneinander.
1434390	1435650	1260	Aaaaaaaaaaah!
1437450	1440730	3280	"Dann haben wir noch ""Zwischen Welten"","
1440930	1444090	3160	wo es um deutsche Soldaten in Afghanistan geht.
1444290	1447930	3640	Und auch dort sehen wir 2 völlig unterschiedliche Kulturen.
1448040	1450170	2130	Man sieht den Konflikt der Soldaten
1450280	1452370	2090	Man sieht aber auch genau dieses Zusammenleben
1452500	1455450	2950	zwischen Afghanen und Deutschen.
1455530	1461650	6120	Die neuen Berlinale-Filme erzählen also eher vom Zusammenleben
1461730	1465850	4120	als vom Zusammenprall der Kulturen.
1467880	1470730	2850	Ein wichtiger Unterschied,
1472780	1475610	2830	Was mir Angst macht, ist, dass immer mehr Gesellschaften
1475810	1479850	4040	auf Angst aufgebaut sind. Auf der Angst vor dem anderen.
1483390	1486370	2980	Die Berlinale beweist mit ihrer Selektion Haltung:
1486480	1490770	4290	Die Filme - ein Plädoyer für den interkulturellen Dialog.
1493100	1495450	2350	Dranbleiben,
1495650	1498490	2840	nach einem schweren Schicksalsschlag oder auf dem Weg zu einem Lebensziel
1498630	1500690	2060	"darüber erzählen heute die Gäste bei ""Aeschbacher"""
1500770	1502570	1800	"im Anschluss an ""Meteo""."
1502840	1505290	2450	Gute Unterhaltung, schönen Abend noc und auf Wiedersehen.