[
    {
        "id": "ff969c14-c5a7-44ab-ab72-14d4c9e427a9",
        "title": "Tagesschau",
        "lead": "Die «Tagesschau» berichtet über Themen aus Politik, Wirtschaft, Kultur, Sport, Gesellschaft und Wissenschaft aus dem In- und Ausland.",
        "description": "Die «Tagesschau» berichtet über Themen aus Politik, Wirtschaft, Kultur, Sport, Gesellschaft und Wissenschaft aus dem In- und Ausland. Die «Tagesschau» informiert um 12.45 Uhr, 18 Uhr, 19.30 Uhr und kurz vor Mitternacht über das aktuelle Tagesgeschehen und liefert dazu Hintergrundinformationen, Einschätzungen und Analysen der SRF-Experten und Korrespondenten.",
        "image": "http://ws.srf.ch/asset/image/audio/07679fac-5905-400b-8b35-49151ba0be81/WEBVISUAL/1405324799000.jpg",
        "episodes": [
            {
                "id": "39ef7b10-944e-4449-a476-bffc820f3e93",
                "title": "Tagesschau vom 10.09.2014, 19:30",
                "publishedDate": "2014-09-10T17:30:00.000Z",
                "transcript": "transcripts/simple/39ef7b10-944e-4449-a476-bffc820f3e93.tsv",
                "image": "http://ws.srf.ch/asset/image/audio/02128131-a021-4933-86cb-135ff0289093/EPISODE_IMAGE/1410409512000.png"
            },
            {
                "id": "de2da191-5b72-4e49-8254-c0ab113f7394",
                "title": "Tagesschau vom 09.09.2014, 19:30",
                "publishedDate": "2014-09-09T17:30:00.000Z",
                "transcript": "transcripts/simple/de2da191-5b72-4e49-8254-c0ab113f7394.tsv",
                "image": "http://ws.srf.ch/asset/image/audio/017350c7-e6fc-44e0-a7ef-7f3516ae262a/EPISODE_IMAGE/1410322943000.png"
            },
            {
                "id": "adadef15-8a0c-444b-88e5-290296bf019c",
                "title": "Tagesschau vom 08.09.2014, 19:30",
                "publishedDate": "2014-09-08T17:30:00.000Z",
                "transcript": "transcripts/simple/adadef15-8a0c-444b-88e5-290296bf019c.tsv",
                "image": "http://ws.srf.ch/asset/image/audio/acf7a527-b358-4d48-ac54-179b1a231bb7/EPISODE_IMAGE/1410220078000.png"
            },
            {
                "id": "b79fa0dc-d62e-4955-ae0e-3cfebb2f93bc",
                "title": "Tagesschau vom 07.09.2014, 19:30",
                "publishedDate": "2014-09-07T17:30:00.000Z",
                "transcript": "transcripts/simple/b79fa0dc-d62e-4955-ae0e-3cfebb2f93bc.tsv",
                "image": "http://ws.srf.ch/asset/image/audio/c54da146-3a9c-4233-99ba-73902e8d1c61/EPISODE_IMAGE/1410131049000.png"
            },
            {
                "id": "a9901a25-370d-48dd-8c9a-20873cb8d923",
                "title": "Tagesschau vom 06.09.2014, 19:30",
                "publishedDate": "2014-09-06T17:30:00.000Z",
                "transcript": "transcripts/simple/a9901a25-370d-48dd-8c9a-20873cb8d923.tsv",
                "image": "http://ws.srf.ch/asset/image/audio/82022877-a398-480e-b77c-14adf73477ac/EPISODE_IMAGE/1410064224000.png"
            },
            {
                "id": "8f27f912-c2cc-4e46-a38f-b457a88a6e3b",
                "title": "Tagesschau vom 05.09.2014, 19:30",
                "publishedDate": "2014-09-05T17:30:00.000Z",
                "transcript": "transcripts/simple/8f27f912-c2cc-4e46-a38f-b457a88a6e3b.tsv",
                "image": "http://ws.srf.ch/asset/image/audio/0f5a36ac-e4e3-4b0a-a633-2338b70f802b/EPISODE_IMAGE/1409982075000.png"
            },
            {
                "id": "b12afea1-68c9-4544-871a-0884f1163015",
                "title": "Tagesschau vom 04.09.2014, 19:30",
                "publishedDate": "2014-09-04T17:30:00.000Z",
                "transcript": "transcripts/simple/b12afea1-68c9-4544-871a-0884f1163015.tsv",
                "image": "http://ws.srf.ch/asset/image/audio/9fe4a5c2-86c7-42a0-b766-137679273054/EPISODE_IMAGE/1409865589000.png"
            },
            {
                "id": "8277618d-3ee2-418c-8fe7-e09b172b7d4a",
                "title": "Tagesschau vom 03.09.2014, 19:30",
                "publishedDate": "2014-09-03T17:30:00.000Z",
                "transcript": "transcripts/simple/8277618d-3ee2-418c-8fe7-e09b172b7d4a.tsv",
                "image": "http://ws.srf.ch/asset/image/audio/d24d57e3-e4d5-4ca5-b8e0-cd82c5066654/EPISODE_IMAGE/1409818957000.png"
            },
            {
                "id": "c496a6c6-e7b8-4b81-aab1-49485eeea965",
                "title": "Tagesschau vom 02.09.2014, 19:30",
                "publishedDate": "2014-09-02T17:30:00.000Z",
                "transcript": "transcripts/simple/c496a6c6-e7b8-4b81-aab1-49485eeea965.tsv",
                "image": "http://ws.srf.ch/asset/image/audio/ebe8c1e9-8dbc-46d3-ad31-f0dc0c81cfa8/EPISODE_IMAGE/1409818945000.png"
            },
            {
                "id": "afd45216-0c6a-42a4-a207-12990997ade3",
                "title": "Tagesschau vom 01.09.2014, 19:30",
                "publishedDate": "2014-09-01T17:30:00.000Z",
                "transcript": "transcripts/simple/afd45216-0c6a-42a4-a207-12990997ade3.tsv",
                "image": "http://ws.srf.ch/asset/image/audio/75ea8460-5906-43bd-aac5-3edf9e035dad/EPISODE_IMAGE/1409818954000.png"
            },
            {
                "id": "34421822-7754-4813-b8e7-3eed7b276d67",
                "title": "Tagesschau vom 31.08.2014, 19:30",
                "publishedDate": "2014-08-31T17:30:00.000Z",
                "transcript": "transcripts/simple/34421822-7754-4813-b8e7-3eed7b276d67.tsv",
                "image": "http://ws.srf.ch/asset/image/audio/dcc2fa00-e38f-4a7c-869d-7896def56f10/EPISODE_IMAGE/1409552945000.png"
            },
            {
                "id": "66186c70-9327-4a6f-80e9-33def65a9719",
                "title": "Tagesschau vom 30.08.2014, 19:30",
                "publishedDate": "2014-08-30T17:30:00.000Z",
                "transcript": "transcripts/simple/66186c70-9327-4a6f-80e9-33def65a9719.tsv",
                "image": "http://ws.srf.ch/asset/image/audio/053bc0f3-93ab-4d99-b6ff-1d789b2db982/EPISODE_IMAGE/1409462336000.png"
            },
            {
                "id": "68878cd7-0af9-42d5-9e2a-5f43a57e75bf",
                "title": "Tagesschau vom 29.08.2014, 19:30",
                "publishedDate": "2014-08-29T17:30:00.000Z",
                "transcript": "transcripts/simple/68878cd7-0af9-42d5-9e2a-5f43a57e75bf.tsv",
                "image": "http://ws.srf.ch/asset/image/audio/d978e3fd-2841-4b9d-8fed-053c6682ad04/EPISODE_IMAGE/1409370937000.png"
            },
            {
                "id": "58a1c535-a4a8-4223-b467-03cbedf0acfb",
                "title": "Tagesschau vom 28.08.2014, 19:30",
                "publishedDate": "2014-08-28T17:30:00.000Z",
                "transcript": "transcripts/simple/58a1c535-a4a8-4223-b467-03cbedf0acfb.tsv",
                "image": "http://ws.srf.ch/asset/image/audio/b90592b4-11ef-40a5-9ec5-ab1bdef3c106/EPISODE_IMAGE/1409280151000.png"
            },
            {
                "id": "7d535f9a-1ec0-4e40-a57d-a1f8bb139f13",
                "title": "Tagesschau vom 27.08.2014, 19:30",
                "publishedDate": "2014-08-27T17:30:00.000Z",
                "transcript": "transcripts/simple/7d535f9a-1ec0-4e40-a57d-a1f8bb139f13.tsv",
                "image": "http://ws.srf.ch/asset/image/audio/6763bc66-a36a-4117-b9a7-09e16465c3a7/EPISODE_IMAGE/1409190338000.png"
            },
            {
                "id": "0d8c2303-7124-4d23-a83a-377eda1ced4b",
                "title": "Tagesschau vom 26.08.2014, 19:30",
                "publishedDate": "2014-08-26T17:30:00.000Z",
                "transcript": "transcripts/simple/0d8c2303-7124-4d23-a83a-377eda1ced4b.tsv",
                "image": "http://ws.srf.ch/asset/image/audio/057bdcf4-022c-4df3-aed5-ffd75684755c/EPISODE_IMAGE/1409100668000.png"
            },
            {
                "id": "f0ad6b39-2911-4e25-996e-2e9f27e9b931",
                "title": "Tagesschau vom 25.08.2014, 19:30",
                "publishedDate": "2014-08-25T17:30:00.000Z",
                "transcript": "transcripts/simple/f0ad6b39-2911-4e25-996e-2e9f27e9b931.tsv",
                "image": "http://ws.srf.ch/asset/image/audio/7dec05bc-f892-4e71-b7b0-66963a133fea/EPISODE_IMAGE/1409011364000.png"
            },
            {
                "id": "f3903be5-c5f1-45c9-9ebb-aa4986fff311",
                "title": "Tagesschau vom 24.08.2014, 19:30",
                "publishedDate": "2014-08-24T17:30:00.000Z",
                "transcript": "transcripts/simple/f3903be5-c5f1-45c9-9ebb-aa4986fff311.tsv",
                "image": "http://ws.srf.ch/asset/image/audio/8470cb8c-e5c0-47e8-ad91-8334a75c8613/EPISODE_IMAGE/1408949913000.png"
            },
            {
                "id": "89b77b1a-931e-4143-b545-889c12ff0620",
                "title": "Tagesschau vom 23.08.2014, 19:30",
                "publishedDate": "2014-08-23T17:30:00.000Z",
                "transcript": "transcripts/simple/89b77b1a-931e-4143-b545-889c12ff0620.tsv",
                "image": "http://ws.srf.ch/asset/image/audio/ff16bdcd-5559-4d04-82f6-2278fc5a5563/EPISODE_IMAGE/1408855457000.png"
            },
            {
                "id": "cf8c32fe-58bb-4508-a45a-11e2b57eeb5d",
                "title": "Tagesschau vom 22.08.2014, 19:30",
                "publishedDate": "2014-08-22T17:30:00.000Z",
                "transcript": "transcripts/simple/cf8c32fe-58bb-4508-a45a-11e2b57eeb5d.tsv",
                "image": "http://ws.srf.ch/asset/image/audio/2df3ba79-2163-4ef3-84e5-52a73fbe4fd1/EPISODE_IMAGE/1408744235000.png"
            },
            {
                "id": "c989f530-bf96-46fc-a7c4-6ea8761ddcfb",
                "title": "Tagesschau vom 21.08.2014, 19:30",
                "publishedDate": "2014-08-21T17:30:00.000Z",
                "transcript": "transcripts/simple/c989f530-bf96-46fc-a7c4-6ea8761ddcfb.tsv",
                "image": "http://ws.srf.ch/asset/image/audio/b86a9aef-e54c-4a8f-99ab-3aa56fd885bc/EPISODE_IMAGE/1408682637000.png"
            },
            {
                "id": "2481620a-916d-489b-8074-9b748565a607",
                "title": "Tagesschau vom 20.08.2014, 19:30",
                "publishedDate": "2014-08-20T17:30:00.000Z",
                "transcript": "transcripts/simple/2481620a-916d-489b-8074-9b748565a607.tsv",
                "image": "http://ws.srf.ch/asset/image/audio/531e0f07-92c0-4527-8ea8-6c5549a366aa/EPISODE_IMAGE/1408565384000.png"
            },
            {
                "id": "c3dfc316-75ef-4a34-ae6d-e233d3114664",
                "title": "Tagesschau vom 19.08.2014, 19:30",
                "publishedDate": "2014-08-19T17:30:00.000Z",
                "transcript": "transcripts/simple/c3dfc316-75ef-4a34-ae6d-e233d3114664.tsv",
                "image": "http://ws.srf.ch/asset/image/audio/e7476635-98fa-4e9c-99fc-f86bd931252b/EPISODE_IMAGE/1408475515000.png"
            },
            {
                "id": "e2dfce03-608a-40b7-97cf-560d4d58dcad",
                "title": "Tagesschau vom 18.08.2014, 19:30",
                "publishedDate": "2014-08-18T17:30:00.000Z",
                "transcript": "transcripts/simple/e2dfce03-608a-40b7-97cf-560d4d58dcad.tsv",
                "image": "http://ws.srf.ch/asset/image/audio/49bb642f-b6ec-4631-98a5-e2d5342e90a0/EPISODE_IMAGE/1408430552000.png"
            },
            {
                "id": "387b15e7-555d-464a-bace-9cf2bb3ec657",
                "title": "Tagesschau vom 17.08.2014, 19:30",
                "publishedDate": "2014-08-17T17:30:00.000Z",
                "transcript": "transcripts/simple/387b15e7-555d-464a-bace-9cf2bb3ec657.tsv",
                "image": "http://ws.srf.ch/asset/image/audio/44f1e8dc-2134-40c3-944d-cd2b1afd1b4b/EPISODE_IMAGE/1408340854000.png"
            },
            {
                "id": "9a5509e9-2c01-451a-aa91-b1d498d7bb60",
                "title": "Tagesschau vom 16.08.2014, 19:30",
                "publishedDate": "2014-08-16T17:30:00.000Z",
                "transcript": "transcripts/simple/9a5509e9-2c01-451a-aa91-b1d498d7bb60.tsv",
                "image": "http://ws.srf.ch/asset/image/audio/c6cbf5bd-6ead-46b4-9dcb-93a3c2564d9b/EPISODE_IMAGE/1408256981000.png"
            },
            {
                "id": "5201e5b0-e0a2-4f43-80ec-697627d81f99",
                "title": "Tagesschau vom 15.08.2014, 19:30",
                "publishedDate": "2014-08-15T17:30:00.000Z",
                "transcript": "transcripts/simple/5201e5b0-e0a2-4f43-80ec-697627d81f99.tsv",
                "image": "http://ws.srf.ch/asset/image/audio/d35d03b4-f221-4331-bb56-be9dd96c1896/EPISODE_IMAGE/1408162762000.png"
            },
            {
                "id": "3df3e41d-d54a-417a-8eba-11e302ba53a8",
                "title": "Tagesschau vom 14.08.2014, 19:30",
                "publishedDate": "2014-08-14T17:30:00.000Z",
                "transcript": "transcripts/simple/3df3e41d-d54a-417a-8eba-11e302ba53a8.tsv",
                "image": "http://ws.srf.ch/asset/image/audio/938bb3ea-5625-47a0-b553-f24a2cf119d9/EPISODE_IMAGE/1408071191000.png"
            },
            {
                "id": "b866c652-548c-4060-93e2-5ff8328b3c5b",
                "title": "Tagesschau vom 13.08.2014, 19:30",
                "publishedDate": "2014-08-13T17:30:00.000Z",
                "transcript": "transcripts/simple/b866c652-548c-4060-93e2-5ff8328b3c5b.tsv",
                "image": "http://ws.srf.ch/asset/image/audio/6ee864c1-c25d-4310-bf45-6fdb5b78e2e7/EPISODE_IMAGE/1407981409000.png"
            },
            {
                "id": "1ca30b3e-3bbe-4c7d-9d55-4356744500f5",
                "title": "Tagesschau vom 12.08.2014, 19:30",
                "publishedDate": "2014-08-12T17:30:00.000Z",
                "transcript": "transcripts/simple/1ca30b3e-3bbe-4c7d-9d55-4356744500f5.tsv",
                "image": "http://ws.srf.ch/asset/image/audio/0b2a7a3f-b314-429c-9536-3bd5615b0b64/EPISODE_IMAGE/1407892011000.png"
            },
            {
                "id": "86a8a989-8bd1-4f79-9d5f-a7860d3ce65a",
                "title": "Tagesschau vom 11.08.2014, 19:30",
                "publishedDate": "2014-08-11T17:30:00.000Z",
                "transcript": "transcripts/simple/86a8a989-8bd1-4f79-9d5f-a7860d3ce65a.tsv",
                "image": "http://ws.srf.ch/asset/image/audio/0dc40815-2090-44a1-bd2f-8e8c694a0ceb/EPISODE_IMAGE/1407802559000.png"
            },
            {
                "id": "92a24f8a-a8e2-42b9-9476-9000d3c98b9e",
                "title": "Tagesschau vom 10.08.2014, 19:30",
                "publishedDate": "2014-08-10T17:30:00.000Z",
                "transcript": "transcripts/simple/92a24f8a-a8e2-42b9-9476-9000d3c98b9e.tsv",
                "image": "http://ws.srf.ch/asset/image/audio/ffef5900-bece-424c-b10d-ba0cc88c4022/EPISODE_IMAGE/1407712938000.png"
            },
            {
                "id": "11809ec7-5bdf-44bc-b680-4a0794452f41",
                "title": "Tagesschau vom 08.08.2014, 19:30",
                "publishedDate": "2014-08-08T17:30:00.000Z",
                "transcript": "transcripts/simple/11809ec7-5bdf-44bc-b680-4a0794452f41.tsv",
                "image": "http://ws.srf.ch/asset/image/audio/dca79f0f-90d0-40b5-80ec-399d1e7cae3f/EPISODE_IMAGE/1407558732000.png"
            },
            {
                "id": "413bd074-d9cb-4f28-b3b8-33dd88baa2b9",
                "title": "Tagesschau vom 07.08.2014, 19:30",
                "publishedDate": "2014-08-07T17:30:00.000Z",
                "transcript": "transcripts/simple/413bd074-d9cb-4f28-b3b8-33dd88baa2b9.tsv",
                "image": "http://ws.srf.ch/asset/image/audio/a6642d9b-8c26-439a-9afb-1321699446eb/EPISODE_IMAGE/1407443819000.png"
            },
            {
                "id": "bfbcccb9-1bdb-4b71-8dab-5e820f83a0c9",
                "title": "Tagesschau vom 06.08.2014, 19:30",
                "publishedDate": "2014-08-06T17:30:00.000Z",
                "transcript": "transcripts/simple/bfbcccb9-1bdb-4b71-8dab-5e820f83a0c9.tsv",
                "image": "http://ws.srf.ch/asset/image/audio/343bc753-e9c2-4435-8662-ee4e6bfa7489/EPISODE_IMAGE/1407354327000.png"
            },
            {
                "id": "85e377c1-298f-484b-9d70-92ae9a8015ee",
                "title": "Tagesschau vom 05.08.2014, 19:30",
                "publishedDate": "2014-08-05T17:30:00.000Z",
                "transcript": "transcripts/simple/85e377c1-298f-484b-9d70-92ae9a8015ee.tsv",
                "image": "http://ws.srf.ch/asset/image/audio/d2b6a17b-2db3-4a05-b3d4-772f9cf9c245/EPISODE_IMAGE/1407264675000.png"
            },
            {
                "id": "b1c5b6e3-8204-4f09-934d-3914527ded98",
                "title": "Tagesschau vom 04.08.2014, 19:30",
                "publishedDate": "2014-08-04T17:30:00.000Z",
                "transcript": "transcripts/simple/b1c5b6e3-8204-4f09-934d-3914527ded98.tsv",
                "image": "http://ws.srf.ch/asset/image/audio/f21b8a5b-0d00-4360-a5f1-cba08f9826fe/EPISODE_IMAGE/1407250224000.png"
            },
            {
                "id": "f175655c-54e3-4402-807b-a6946701cb14",
                "title": "Tagesschau vom 03.08.2014, 19:30",
                "publishedDate": "2014-08-03T17:30:00.000Z",
                "transcript": "transcripts/simple/f175655c-54e3-4402-807b-a6946701cb14.tsv",
                "image": "http://ws.srf.ch/asset/image/audio/778851e1-813e-416e-b2b6-fc5b89b41e1a/EPISODE_IMAGE/1407129790000.png"
            },
            {
                "id": "d824baf5-6a49-45de-99b2-927d65c9eeff",
                "title": "Tagesschau vom 02.08.2014, 19:30",
                "publishedDate": "2014-08-02T17:30:00.000Z",
                "transcript": "transcripts/simple/d824baf5-6a49-45de-99b2-927d65c9eeff.tsv",
                "image": "http://ws.srf.ch/asset/image/audio/4f66528f-400b-4395-bbb5-a25c1ef76317/EPISODE_IMAGE/1407040589000.png"
            },
            {
                "id": "3292d1c5-e0cb-4e93-840a-34921fbe4aac",
                "title": "Tagesschau vom 01.08.2014, 19:30",
                "publishedDate": "2014-08-01T17:30:00.000Z",
                "transcript": "transcripts/simple/3292d1c5-e0cb-4e93-840a-34921fbe4aac.tsv",
                "image": "http://ws.srf.ch/asset/image/audio/affd000c-927d-4c10-b8cb-8fc43db36d15/EPISODE_IMAGE/1406951339000.png"
            },
            {
                "id": "7c64d2e9-8318-4890-b87a-ed9bc262b0b8",
                "title": "Tagesschau vom 31.07.2014, 19:30",
                "publishedDate": "2014-07-31T17:30:00.000Z",
                "transcript": "transcripts/simple/7c64d2e9-8318-4890-b87a-ed9bc262b0b8.tsv",
                "image": "http://ws.srf.ch/asset/image/audio/2420cf8a-d0b9-40dd-a73c-dcf27904293a/EPISODE_IMAGE/1406868477000.png"
            },
            {
                "id": "93b57389-d5a3-43e0-9774-9e09c26589fc",
                "title": "Tagesschau vom 30.07.2014, 19:30",
                "publishedDate": "2014-07-30T17:30:00.000Z",
                "transcript": "transcripts/simple/93b57389-d5a3-43e0-9774-9e09c26589fc.tsv",
                "image": "http://ws.srf.ch/asset/image/audio/b7e8813d-4f61-401f-8a7c-584392211609/EPISODE_IMAGE/1406772594000.png"
            },
            {
                "id": "328aa3b0-bfac-45d2-ab54-7ba32b38a8f0",
                "title": "Tagesschau vom 29.07.2014, 19:30",
                "publishedDate": "2014-07-29T17:30:00.000Z",
                "transcript": "transcripts/simple/328aa3b0-bfac-45d2-ab54-7ba32b38a8f0.tsv",
                "image": "http://ws.srf.ch/asset/image/audio/1bf0a2e1-e5e8-45f7-a592-6997abd570a7/EPISODE_IMAGE/1406683091000.png"
            },
            {
                "id": "67e53910-5229-4f83-b1fd-c93be23ca111",
                "title": "Tagesschau vom 28.07.2014, 19:30",
                "publishedDate": "2014-07-28T17:30:00.000Z",
                "transcript": "transcripts/simple/67e53910-5229-4f83-b1fd-c93be23ca111.tsv",
                "image": "http://ws.srf.ch/asset/image/audio/9b727d80-61a4-4740-b29f-534b89dff18a/EPISODE_IMAGE/1406594203000.png"
            },
            {
                "id": "72e1c991-ccf1-4e8a-978a-4b4b560a8949",
                "title": "Tagesschau vom 27.07.2014, 19:30",
                "publishedDate": "2014-07-27T17:30:00.000Z",
                "transcript": "transcripts/simple/72e1c991-ccf1-4e8a-978a-4b4b560a8949.tsv",
                "image": "http://ws.srf.ch/asset/image/audio/0baceb93-4aae-43c5-8a3a-f3f88eb8ceaf/EPISODE_IMAGE/1406505076000.png"
            },
            {
                "id": "71a491a6-0dde-449e-b9c2-7570b2fbc77a",
                "title": "Tagesschau vom 26.07.2014, 19:30",
                "publishedDate": "2014-07-26T17:30:00.000Z",
                "transcript": "transcripts/simple/71a491a6-0dde-449e-b9c2-7570b2fbc77a.tsv",
                "image": "http://ws.srf.ch/asset/image/audio/5a0b8382-b8c0-4f5e-88fd-56a0a5cdb1ff/EPISODE_IMAGE/1406434552000.png"
            },
            {
                "id": "8a52b6f8-1dbf-491f-b857-a622a07f4198",
                "title": "Tagesschau vom 25.07.2014, 19:30",
                "publishedDate": "2014-07-25T17:30:00.000Z",
                "transcript": "transcripts/simple/8a52b6f8-1dbf-491f-b857-a622a07f4198.tsv",
                "image": "http://ws.srf.ch/asset/image/audio/7e16af23-ddb0-4406-b53c-c2814df2fa12/EPISODE_IMAGE/1406326600000.png"
            },
            {
                "id": "9e661327-a965-4698-8f3e-b9d7f5db97c1",
                "title": "Tagesschau vom 24.07.2014, 19:30",
                "publishedDate": "2014-07-24T17:30:00.000Z",
                "transcript": "transcripts/simple/9e661327-a965-4698-8f3e-b9d7f5db97c1.tsv",
                "image": "http://ws.srf.ch/asset/image/audio/6e86a93b-f8f8-406e-a0ae-9ea5c00206e3/EPISODE_IMAGE/1406237271000.png"
            },
            {
                "id": "65f17ccb-4af9-4b72-acdf-e648ce19f497",
                "title": "Tagesschau vom 23.07.2014, 19:30",
                "publishedDate": "2014-07-23T17:30:00.000Z",
                "transcript": "transcripts/simple/65f17ccb-4af9-4b72-acdf-e648ce19f497.tsv",
                "image": "http://ws.srf.ch/asset/image/audio/e475f3bd-0549-4db9-b82b-e95e1c44c736/EPISODE_IMAGE/1406147294000.png"
            },
            {
                "id": "0f3a3162-cc71-46de-a3f8-60c48ff6cef3",
                "title": "Tagesschau vom 22.07.2014, 19:30",
                "publishedDate": "2014-07-22T17:30:00.000Z",
                "transcript": "transcripts/simple/0f3a3162-cc71-46de-a3f8-60c48ff6cef3.tsv",
                "image": "http://ws.srf.ch/asset/image/audio/5d11fc87-c3de-45a3-8216-351cf506bcb8/EPISODE_IMAGE/1406089170000.png"
            },
            {
                "id": "d40d1ff3-4a4c-4fea-97db-42e0995995a0",
                "title": "Tagesschau vom 21.07.2014, 19:30",
                "publishedDate": "2014-07-21T17:30:00.000Z",
                "transcript": "transcripts/simple/d40d1ff3-4a4c-4fea-97db-42e0995995a0.tsv",
                "image": "http://ws.srf.ch/asset/image/audio/a26853b3-1201-470f-92fb-c7e14860105a/EPISODE_IMAGE/1406012893000.png"
            },
            {
                "id": "7cfc105d-65a6-4404-9009-3e9f53633aa3",
                "title": "Tagesschau vom 20.07.2014, 19:30",
                "publishedDate": "2014-07-20T17:30:00.000Z",
                "transcript": "transcripts/simple/7cfc105d-65a6-4404-9009-3e9f53633aa3.tsv",
                "image": "http://ws.srf.ch/asset/image/audio/9a32b248-4e18-4b5f-b88b-afa150860b01/EPISODE_IMAGE/1405906942000.png"
            },
            {
                "id": "fd933c48-fb8f-4a1b-8570-7f8bf4cc66e1",
                "title": "Tagesschau vom 19.07.2014, 19:30",
                "publishedDate": "2014-07-19T17:30:00.000Z",
                "transcript": "transcripts/simple/fd933c48-fb8f-4a1b-8570-7f8bf4cc66e1.tsv",
                "image": "http://ws.srf.ch/asset/image/audio/d6ee7f12-150b-42f3-8d39-79473b4d4bdc/EPISODE_IMAGE/1405839510000.png"
            },
            {
                "id": "a646cc35-36c5-4770-870f-03dec7fd296c",
                "title": "Tagesschau vom 18.07.2014, 19:30",
                "publishedDate": "2014-07-18T17:30:00.000Z",
                "transcript": "transcripts/simple/a646cc35-36c5-4770-870f-03dec7fd296c.tsv",
                "image": "http://ws.srf.ch/asset/image/audio/d02040f3-bd20-408e-87af-f77ca03fadcd/EPISODE_IMAGE/1405749368000.png"
            },
            {
                "id": "ba9cfdbf-a58b-46a0-b001-a4d3060773b3",
                "title": "Tagesschau vom 17.07.2014, 19:30",
                "publishedDate": "2014-07-17T17:30:00.000Z",
                "transcript": "transcripts/simple/ba9cfdbf-a58b-46a0-b001-a4d3060773b3.tsv",
                "image": "http://ws.srf.ch/asset/image/audio/f576c1a7-c90b-4282-8cad-a78c75e480a7/EPISODE_IMAGE/1405639099000.png"
            },
            {
                "id": "79511967-41b3-4716-84ef-33e98deeecc6",
                "title": "Tagesschau vom 16.07.2014, 19:30",
                "publishedDate": "2014-07-16T17:30:00.000Z",
                "transcript": "transcripts/simple/79511967-41b3-4716-84ef-33e98deeecc6.tsv",
                "image": "http://ws.srf.ch/asset/image/audio/61d2112a-489f-4ac1-9e01-2ae58a322747/EPISODE_IMAGE/1405579454000.png"
            },
            {
                "id": "b39acc3d-d670-4c49-b5c0-dba54ab6417c",
                "title": "Tagesschau vom 15.07.2014, 19:30",
                "publishedDate": "2014-07-15T17:30:00.000Z",
                "transcript": "transcripts/simple/b39acc3d-d670-4c49-b5c0-dba54ab6417c.tsv",
                "image": "http://ws.srf.ch/asset/image/audio/66e488ae-3a96-4cb9-897c-de57493f834e/EPISODE_IMAGE/1405485607000.png"
            },
            {
                "id": "4d6cb9be-02a8-431f-891b-54120b5380ec",
                "title": "Tagesschau vom 14.07.2014, 19:30",
                "publishedDate": "2014-07-14T17:30:00.000Z",
                "transcript": "transcripts/simple/4d6cb9be-02a8-431f-891b-54120b5380ec.tsv",
                "image": "http://ws.srf.ch/asset/image/audio/22e9e8bb-34db-489c-968a-80fa24e66998/EPISODE_IMAGE/1405389212000.png"
            },
            {
                "id": "7456937f-88c1-4541-9f1d-d2fa26d73ccb",
                "title": "Tagesschau vom 13.07.2014, 19:30",
                "publishedDate": "2014-07-13T17:30:00.000Z",
                "transcript": "transcripts/simple/7456937f-88c1-4541-9f1d-d2fa26d73ccb.tsv",
                "image": "http://ws.srf.ch/asset/image/audio/018321d6-9652-4bb9-81b3-b71b5b777aa0/EPISODE_IMAGE/1405300225000.png"
            },
            {
                "id": "b50ca379-0233-4fef-b538-f7ae1369d1b6",
                "title": "Tagesschau vom 12.07.2014, 19:30",
                "publishedDate": "2014-07-12T17:30:00.000Z",
                "transcript": "transcripts/simple/b50ca379-0233-4fef-b538-f7ae1369d1b6.tsv",
                "image": "http://ws.srf.ch/asset/image/audio/e510505b-54d6-45da-8a5f-582424081963/EPISODE_IMAGE/1405210828000.png"
            },
            {
                "id": "367d5544-3ccf-418c-9f8a-db6d57acaea0",
                "title": "Tagesschau vom 11.07.2014, 19:30",
                "publishedDate": "2014-07-11T17:30:00.000Z",
                "transcript": "transcripts/simple/367d5544-3ccf-418c-9f8a-db6d57acaea0.tsv",
                "image": "http://ws.srf.ch/asset/image/audio/d5ed18e4-73a4-4108-898c-f97a6671eb1b/EPISODE_IMAGE/1405121545000.png"
            },
            {
                "id": "86355882-b7ed-4128-86ab-859ce0ffbf8b",
                "title": "Tagesschau vom 10.07.2014, 19:30",
                "publishedDate": "2014-07-10T17:30:00.000Z",
                "transcript": "transcripts/simple/86355882-b7ed-4128-86ab-859ce0ffbf8b.tsv",
                "image": "http://ws.srf.ch/asset/image/audio/d5d408ca-70d4-4540-bb35-696f9587d03a/EPISODE_IMAGE/1405032314000.png"
            },
            {
                "id": "407b6c0b-d800-4cf0-aa05-748ba170b3c2",
                "title": "Tagesschau vom 09.07.2014, 19:30",
                "publishedDate": "2014-07-09T17:30:00.000Z",
                "transcript": "transcripts/simple/407b6c0b-d800-4cf0-aa05-748ba170b3c2.tsv",
                "image": "http://ws.srf.ch/asset/image/audio/dd9a0adb-f093-45c1-b803-e5d2cd8d3fe5/EPISODE_IMAGE/1404944112000.png"
            },
            {
                "id": "583b4f16-f28f-4fc5-b76a-e9ba8d32783b",
                "title": "Tagesschau vom 08.07.2014, 19:30",
                "publishedDate": "2014-07-08T17:30:00.000Z",
                "transcript": "transcripts/simple/583b4f16-f28f-4fc5-b76a-e9ba8d32783b.tsv",
                "image": "http://ws.srf.ch/asset/image/audio/a97fb2ec-be01-41dc-b476-c6574e3ce8f4/EPISODE_IMAGE/1404852960000.png"
            },
            {
                "id": "3875b226-c45b-422b-b457-edd3b5beb04c",
                "title": "Tagesschau vom 07.07.2014, 19:30",
                "publishedDate": "2014-07-07T17:30:00.000Z",
                "transcript": "transcripts/simple/3875b226-c45b-422b-b457-edd3b5beb04c.tsv",
                "image": "http://ws.srf.ch/asset/image/audio/dbc06a36-78cb-468e-9992-2d0af97abe01/EPISODE_IMAGE/1404778638000.png"
            },
            {
                "id": "f434ed71-a8db-4393-bca0-871c4d11f99c",
                "title": "Tagesschau vom 06.07.2014, 19:30",
                "publishedDate": "2014-07-06T17:30:00.000Z",
                "transcript": "transcripts/simple/f434ed71-a8db-4393-bca0-871c4d11f99c.tsv",
                "image": "http://ws.srf.ch/asset/image/audio/e819b195-c207-43b0-b6d3-f1e5195a8246/EPISODE_IMAGE/1404706824000.png"
            },
            {
                "id": "51186aee-46bb-4b7d-b1cf-5bb63e123a8b",
                "title": "Tagesschau vom 05.07.2014, 19:30",
                "publishedDate": "2014-07-05T17:30:00.000Z",
                "transcript": "transcripts/simple/51186aee-46bb-4b7d-b1cf-5bb63e123a8b.tsv",
                "image": "http://ws.srf.ch/asset/image/audio/b5117f41-d5aa-4ffa-8366-2a69d7d61d34/EPISODE_IMAGE/1404600740000.png"
            },
            {
                "id": "51b38937-f654-40e8-acd7-ff6680c02945",
                "title": "Tagesschau vom 04.07.2014, 19:30",
                "publishedDate": "2014-07-04T17:30:00.000Z",
                "transcript": "transcripts/simple/51b38937-f654-40e8-acd7-ff6680c02945.tsv",
                "image": "http://ws.srf.ch/asset/image/audio/49d8a359-046b-48af-9db4-5e90521c96ac/EPISODE_IMAGE/1404512066000.png"
            },
            {
                "id": "7b390aaf-5200-490e-a094-3b62fd88a370",
                "title": "Tagesschau vom 03.07.2014, 19:30",
                "publishedDate": "2014-07-03T17:30:00.000Z",
                "transcript": "transcripts/simple/7b390aaf-5200-490e-a094-3b62fd88a370.tsv",
                "image": "http://ws.srf.ch/asset/image/audio/47e082e5-c742-4577-9023-bcca830e4e8f/EPISODE_IMAGE/1404475757000.png"
            },
            {
                "id": "e651ed7f-3639-45dd-abb5-79eb74b0f67a",
                "title": "Tagesschau vom 02.07.2014, 19:30",
                "publishedDate": "2014-07-02T17:30:00.000Z",
                "transcript": "transcripts/simple/e651ed7f-3639-45dd-abb5-79eb74b0f67a.tsv",
                "image": "http://ws.srf.ch/asset/image/audio/76b74151-b234-4b32-bb6d-8f5c25f0b57b/EPISODE_IMAGE/1404334190000.png"
            },
            {
                "id": "ad999acc-78cf-4f21-a817-e0abce155e9c",
                "title": "Tagesschau vom 01.07.2014, 19:30",
                "publishedDate": "2014-07-01T17:30:00.000Z",
                "transcript": "transcripts/simple/ad999acc-78cf-4f21-a817-e0abce155e9c.tsv",
                "image": "http://ws.srf.ch/asset/image/audio/dba0c0e0-926f-42df-ab92-4802a0c33738/EPISODE_IMAGE/1404372025000.png"
            },
            {
                "id": "c00532d6-fd88-48e0-923f-b54a009f13be",
                "title": "Tagesschau vom 29.06.2014, 19:30",
                "publishedDate": "2014-06-29T17:30:00.000Z",
                "transcript": "transcripts/simple/c00532d6-fd88-48e0-923f-b54a009f13be.tsv",
                "image": "http://ws.srf.ch/asset/image/audio/808e4bc6-8c4c-47c6-a039-c0ee27520dac/EPISODE_IMAGE/1404076335000.png"
            },
            {
                "id": "8e6a3ff1-dde6-4b1f-8437-d5e152e850ef",
                "title": "Tagesschau vom 28.06.2014, 19:30",
                "publishedDate": "2014-06-28T17:30:00.000Z",
                "transcript": "transcripts/simple/8e6a3ff1-dde6-4b1f-8437-d5e152e850ef.tsv",
                "image": "http://ws.srf.ch/asset/image/audio/98a93c55-e2b9-4a0f-8db1-b556b99508db/EPISODE_IMAGE/1404019514000.png"
            },
            {
                "id": "90e36469-d76d-4db5-a6ba-bd3c50f8b08c",
                "title": "Tagesschau vom 27.06.2014, 19:30",
                "publishedDate": "2014-06-27T17:30:00.000Z",
                "transcript": "transcripts/simple/90e36469-d76d-4db5-a6ba-bd3c50f8b08c.tsv",
                "image": "http://ws.srf.ch/asset/image/audio/550d0d89-9cc0-46eb-89a8-1c2d826a7b60/EPISODE_IMAGE/1404371875000.png"
            },
            {
                "id": "8db36975-f625-455b-9faa-3baed1047085",
                "title": "Tagesschau vom 26.06.2014, 19:30",
                "publishedDate": "2014-06-26T17:30:00.000Z",
                "transcript": "transcripts/simple/8db36975-f625-455b-9faa-3baed1047085.tsv",
                "image": "http://ws.srf.ch/asset/image/audio/e79a1eee-1c34-4304-a168-d5024f01a5b6/EPISODE_IMAGE/1403808148000.png"
            },
            {
                "id": "669fd6a3-af4f-4909-a660-735ac106be62",
                "title": "Tagesschau vom 25.06.2014, 19:30",
                "publishedDate": "2014-06-25T17:30:00.000Z",
                "transcript": "transcripts/simple/669fd6a3-af4f-4909-a660-735ac106be62.tsv",
                "image": "http://ws.srf.ch/asset/image/audio/19746e3e-7573-4975-b66e-44741724b2ca/EPISODE_IMAGE/1404371893000.png"
            },
            {
                "id": "265d2b6f-0d7d-4e5e-ac6f-a15c56c00558",
                "title": "Tagesschau vom 24.06.2014, 19:30",
                "publishedDate": "2014-06-24T17:30:00.000Z",
                "transcript": "transcripts/simple/265d2b6f-0d7d-4e5e-ac6f-a15c56c00558.tsv",
                "image": "http://ws.srf.ch/asset/image/audio/3b5da40d-128d-43bb-afb8-b6fcd1a5a30d/EPISODE_IMAGE/1403682980000.png"
            },
            {
                "id": "603a356e-e2c3-4222-88ad-d9508142f4e5",
                "title": "Tagesschau vom 23.06.2014, 19:30",
                "publishedDate": "2014-06-23T17:30:00.000Z",
                "transcript": "transcripts/simple/603a356e-e2c3-4222-88ad-d9508142f4e5.tsv",
                "image": "http://ws.srf.ch/asset/image/audio/2f79f62d-848d-4276-a721-b10511845fd0/EPISODE_IMAGE/1403584270000.png"
            },
            {
                "id": "46d63ada-3467-4cd2-92fe-8c0b536f653e",
                "title": "Tagesschau vom 22.06.2014, 19:30",
                "publishedDate": "2014-06-22T17:30:00.000Z",
                "transcript": "transcripts/simple/46d63ada-3467-4cd2-92fe-8c0b536f653e.tsv",
                "image": "http://ws.srf.ch/asset/image/audio/019f7b76-b2a8-4d93-8b5f-38205808e119/EPISODE_IMAGE/1403494697000.png"
            },
            {
                "id": "992e874a-af68-477d-a678-92b33a06e421",
                "title": "Tagesschau vom 21.06.2014, 19:30",
                "publishedDate": "2014-06-21T17:30:00.000Z",
                "transcript": "transcripts/simple/992e874a-af68-477d-a678-92b33a06e421.tsv",
                "image": "http://ws.srf.ch/asset/image/audio/2bba9305-c71c-4181-94ff-fc96f5f5c38b/EPISODE_IMAGE/1403405763000.png"
            },
            {
                "id": "992af085-c711-4d9c-a04e-a898ce4e1ad5",
                "title": "Tagesschau vom 20.06.2014, 19:30",
                "publishedDate": "2014-06-20T17:30:00.000Z",
                "transcript": "transcripts/simple/992af085-c711-4d9c-a04e-a898ce4e1ad5.tsv",
                "image": "http://ws.srf.ch/asset/image/audio/ca70b578-ca63-4cbe-b0e0-bb56617838d8/EPISODE_IMAGE/1403316448000.png"
            },
            {
                "id": "5db91d9d-9263-45dc-a0af-f2c1de73803f",
                "title": "Tagesschau vom 19.06.2014, 19:30",
                "publishedDate": "2014-06-19T17:30:00.000Z",
                "transcript": "transcripts/simple/5db91d9d-9263-45dc-a0af-f2c1de73803f.tsv",
                "image": "http://ws.srf.ch/asset/image/audio/17a07095-249e-4fdf-845e-aecfe60d8d21/EPISODE_IMAGE/1403226600000.png"
            },
            {
                "id": "4a559a1d-97c9-4988-bf27-159601c4c249",
                "title": "Tagesschau vom 18.06.2014, 19:30",
                "publishedDate": "2014-06-18T17:30:00.000Z",
                "transcript": "transcripts/simple/4a559a1d-97c9-4988-bf27-159601c4c249.tsv",
                "image": "http://ws.srf.ch/asset/image/audio/447e49bc-d8ed-45a9-bf1a-912eb5b6945c/EPISODE_IMAGE/1403171172000.png"
            },
            {
                "id": "4938b3ef-8907-4c9a-82d8-93742e9922ef",
                "title": "Tagesschau vom 17.06.2014, 19:30",
                "publishedDate": "2014-06-17T17:30:00.000Z",
                "transcript": "transcripts/simple/4938b3ef-8907-4c9a-82d8-93742e9922ef.tsv",
                "image": "http://ws.srf.ch/asset/image/audio/07ca77f1-809c-4515-96f9-f2800d967a6e/EPISODE_IMAGE/1403047815000.png"
            },
            {
                "id": "d1ca38b8-e49b-4d43-a7ac-d900f2f70202",
                "title": "Tagesschau vom 16.06.2014, 19:30",
                "publishedDate": "2014-06-16T17:30:00.000Z",
                "transcript": "transcripts/simple/d1ca38b8-e49b-4d43-a7ac-d900f2f70202.tsv",
                "image": "http://ws.srf.ch/asset/image/audio/2c7d60e9-8f17-4709-8004-eb1bc0141f30/EPISODE_IMAGE/1403006175000.png"
            },
            {
                "id": "f17438dc-3140-44d6-9f85-35b58a276788",
                "title": "Tagesschau vom 15.06.2014, 19:30",
                "publishedDate": "2014-06-15T17:30:00.000Z",
                "transcript": "transcripts/simple/f17438dc-3140-44d6-9f85-35b58a276788.tsv",
                "image": "http://ws.srf.ch/asset/image/audio/7238611b-1166-4b42-b949-276d35602719/EPISODE_IMAGE/1402868402000.png"
            },
            {
                "id": "17679391-b02f-43bf-9c61-8e40908c12c8",
                "title": "Tagesschau vom 14.06.2014, 19:30",
                "publishedDate": "2014-06-14T17:30:00.000Z",
                "transcript": "transcripts/simple/17679391-b02f-43bf-9c61-8e40908c12c8.tsv",
                "image": "http://ws.srf.ch/asset/image/audio/fd7f25c7-cab9-4946-94a8-e72ab3e60348/EPISODE_IMAGE/1402779215000.png"
            },
            {
                "id": "1f95b51f-6e03-4db9-842f-83516fca7c86",
                "title": "Tagesschau vom 13.06.2014, 19:30",
                "publishedDate": "2014-06-13T17:30:00.000Z",
                "transcript": "transcripts/simple/1f95b51f-6e03-4db9-842f-83516fca7c86.tsv",
                "image": "http://ws.srf.ch/asset/image/audio/c2c5151d-316b-476e-adb7-4c0fa3174230/EPISODE_IMAGE/1402690187000.png"
            },
            {
                "id": "4a309bf7-daa9-4d47-b1b0-af0fd0d67f79",
                "title": "Tagesschau vom 12.06.2014, 19:30",
                "publishedDate": "2014-06-12T17:30:00.000Z",
                "transcript": "transcripts/simple/4a309bf7-daa9-4d47-b1b0-af0fd0d67f79.tsv",
                "image": "http://ws.srf.ch/asset/image/audio/f29163c2-a5a7-4364-b919-4b64510110c9/EPISODE_IMAGE/1402601007000.png"
            },
            {
                "id": "bdc4727e-f927-4cd4-83f8-575763ecb1e2",
                "title": "Tagesschau vom 11.06.2014, 19:30",
                "publishedDate": "2014-06-11T17:30:00.000Z",
                "transcript": "transcripts/simple/bdc4727e-f927-4cd4-83f8-575763ecb1e2.tsv",
                "image": "http://ws.srf.ch/asset/image/audio/be27e39e-9e82-4986-aeed-ff3aeb56fc04/EPISODE_IMAGE/1402556877000.png"
            },
            {
                "id": "278639aa-051b-459f-82ef-caa727afb05e",
                "title": "Tagesschau vom 10.06.2014, 19:30",
                "publishedDate": "2014-06-10T17:30:00.000Z",
                "transcript": "transcripts/simple/278639aa-051b-459f-82ef-caa727afb05e.tsv",
                "image": "http://ws.srf.ch/asset/image/audio/859bc607-a69d-4d58-9f7c-a78a9588e036/EPISODE_IMAGE/1402469318000.png"
            },
            {
                "id": "13e371e7-88e6-4f20-b12f-d1b06d1c8809",
                "title": "Tagesschau vom 09.06.2014, 19:30",
                "publishedDate": "2014-06-09T17:30:00.000Z",
                "transcript": "transcripts/simple/13e371e7-88e6-4f20-b12f-d1b06d1c8809.tsv",
                "image": "http://ws.srf.ch/asset/image/audio/771efc87-e5b8-4df6-acdd-65d942c719c1/EPISODE_IMAGE/1402339725000.png"
            },
            {
                "id": "29f27ad9-455c-4165-842a-0feec12a645d",
                "title": "Tagesschau vom 08.06.2014, 19:30",
                "publishedDate": "2014-06-08T17:30:00.000Z",
                "transcript": "transcripts/simple/29f27ad9-455c-4165-842a-0feec12a645d.tsv",
                "image": "http://ws.srf.ch/asset/image/audio/4182d7eb-53bc-4b29-8167-e494a66c7c06/EPISODE_IMAGE/1402289126000.png"
            },
            {
                "id": "ae114a3d-bfd6-4fdb-8648-a09f8ca719f2",
                "title": "Tagesschau vom 07.06.2014, 19:30",
                "publishedDate": "2014-06-07T17:30:00.000Z",
                "transcript": "transcripts/simple/ae114a3d-bfd6-4fdb-8648-a09f8ca719f2.tsv",
                "image": "http://ws.srf.ch/asset/image/audio/57a8e06b-42d1-4d87-8e10-426e904bac3e/EPISODE_IMAGE/1402200562000.png"
            },
            {
                "id": "595f23ae-eb84-4dbb-b198-feb60c89effb",
                "title": "Tagesschau vom 06.06.2014, 19:30",
                "publishedDate": "2014-06-06T17:30:00.000Z",
                "transcript": "transcripts/simple/595f23ae-eb84-4dbb-b198-feb60c89effb.tsv",
                "image": "http://ws.srf.ch/asset/image/audio/66e2d6fa-08b7-4404-9425-bd4947b022cd/EPISODE_IMAGE/1402111610000.png"
            },
            {
                "id": "9861d052-d148-4cc3-8fd0-e89240cf4efc",
                "title": "Tagesschau vom 05.06.2014, 19:30",
                "publishedDate": "2014-06-05T17:30:00.000Z",
                "transcript": "transcripts/simple/9861d052-d148-4cc3-8fd0-e89240cf4efc.tsv",
                "image": "http://ws.srf.ch/asset/image/audio/aa53baa4-e128-4497-bdcd-290f99889d60/EPISODE_IMAGE/1402022341000.png"
            },
            {
                "id": "6007896b-daad-4fa1-96cf-247f7ce4355c",
                "title": "Tagesschau vom 04.06.2014, 19:30",
                "publishedDate": "2014-06-04T17:30:00.000Z",
                "transcript": "transcripts/simple/6007896b-daad-4fa1-96cf-247f7ce4355c.tsv",
                "image": "http://ws.srf.ch/asset/image/audio/739a125f-bcc3-48af-8541-3de4a6a15576/EPISODE_IMAGE/1401932464000.png"
            },
            {
                "id": "ca5b80a9-1acc-4f11-9379-43b14352fcce",
                "title": "Tagesschau vom 03.06.2014, 19:30",
                "publishedDate": "2014-06-03T17:30:00.000Z",
                "transcript": "transcripts/simple/ca5b80a9-1acc-4f11-9379-43b14352fcce.tsv",
                "image": "http://ws.srf.ch/asset/image/audio/ca0aeeb0-bb1f-40e2-ba4b-9e1aa8565af5/EPISODE_IMAGE/1401852419000.png"
            },
            {
                "id": "6a0837e6-fe3d-49b9-ab07-8fba934211e9",
                "title": "Tagesschau vom 02.06.2014, 19:30",
                "publishedDate": "2014-06-02T17:30:00.000Z",
                "transcript": "transcripts/simple/6a0837e6-fe3d-49b9-ab07-8fba934211e9.tsv",
                "image": "http://ws.srf.ch/asset/image/audio/636fcbee-d145-4b1e-8076-b5c00b969435/EPISODE_IMAGE/1401810048000.png"
            },
            {
                "id": "856d8368-3769-41ab-8fb9-38b603de6e12",
                "title": "Tagesschau vom 01.06.2014, 19:30",
                "publishedDate": "2014-06-01T17:30:00.000Z",
                "transcript": "transcripts/simple/856d8368-3769-41ab-8fb9-38b603de6e12.tsv",
                "image": "http://ws.srf.ch/asset/image/audio/16690894-4498-461a-bfa7-483cbe5a02d6/EPISODE_IMAGE/1401674287000.png"
            },
            {
                "id": "395a4d8a-166b-4848-9363-5df318c6d378",
                "title": "Tagesschau vom 31.05.2014, 19:30",
                "publishedDate": "2014-05-31T17:30:00.000Z",
                "transcript": "transcripts/simple/395a4d8a-166b-4848-9363-5df318c6d378.tsv",
                "image": "http://ws.srf.ch/asset/image/audio/2c0f49a8-564b-450e-aa99-908b35044839/EPISODE_IMAGE/1401585292000.png"
            },
            {
                "id": "c1d8408d-02a4-4a0d-87e0-b04b356250f1",
                "title": "Tagesschau vom 30.05.2014, 19:30",
                "publishedDate": "2014-05-30T17:30:00.000Z",
                "transcript": "transcripts/simple/c1d8408d-02a4-4a0d-87e0-b04b356250f1.tsv",
                "image": "http://ws.srf.ch/asset/image/audio/2a8740c0-f616-4c5d-9344-82bf14d151f0/EPISODE_IMAGE/1401514627000.png"
            },
            {
                "id": "4a7b1ca9-5fa4-4bd5-a2fc-219efcab92e3",
                "title": "Tagesschau vom 29.05.2014, 19:30",
                "publishedDate": "2014-05-29T17:30:00.000Z",
                "transcript": "transcripts/simple/4a7b1ca9-5fa4-4bd5-a2fc-219efcab92e3.tsv",
                "image": "http://ws.srf.ch/asset/image/audio/0da687ea-113c-40bf-89e3-6634bfef2a19/EPISODE_IMAGE/1401407182000.png"
            },
            {
                "id": "c82b9491-633e-42f2-b492-eca5533687c3",
                "title": "Tagesschau vom 28.05.2014, 19:30",
                "publishedDate": "2014-05-28T17:30:00.000Z",
                "transcript": "transcripts/simple/c82b9491-633e-42f2-b492-eca5533687c3.tsv",
                "image": "http://ws.srf.ch/asset/image/audio/c08f91e6-166b-4c17-a040-dd2494f8eddb/EPISODE_IMAGE/1401318035000.png"
            },
            {
                "id": "a6f43a10-65ff-43a6-bd86-82c5cfaee13a",
                "title": "Tagesschau vom 27.05.2014, 19:30",
                "publishedDate": "2014-05-27T17:30:00.000Z",
                "transcript": "transcripts/simple/a6f43a10-65ff-43a6-bd86-82c5cfaee13a.tsv",
                "image": "http://ws.srf.ch/asset/image/audio/f7644b3f-3f5e-4066-80ee-ddb94214e4c4/EPISODE_IMAGE/1401228971000.png"
            },
            {
                "id": "3b928ff5-2bc1-430d-b960-f82c8fe59f45",
                "title": "Tagesschau vom 26.05.2014, 19:30",
                "publishedDate": "2014-05-26T17:30:00.000Z",
                "transcript": "transcripts/simple/3b928ff5-2bc1-430d-b960-f82c8fe59f45.tsv",
                "image": "http://ws.srf.ch/asset/image/audio/b586fbd0-d761-402c-96a7-1a4dddd82d0a/EPISODE_IMAGE/1401184018000.png"
            },
            {
                "id": "ba69053a-d3c7-4769-8a10-386f8f83c7d8",
                "title": "Tagesschau vom 25.05.2014, 19:30",
                "publishedDate": "2014-05-25T17:30:00.000Z",
                "transcript": "transcripts/simple/ba69053a-d3c7-4769-8a10-386f8f83c7d8.tsv",
                "image": "http://ws.srf.ch/asset/image/audio/321c3818-25ee-4eae-8868-d848c29bf55b/EPISODE_IMAGE/1401088156000.png"
            },
            {
                "id": "a3ec541a-d1b7-460c-b513-cc5a66b40950",
                "title": "Tagesschau vom 24.05.2014, 19:30",
                "publishedDate": "2014-05-24T17:30:00.000Z",
                "transcript": "transcripts/simple/a3ec541a-d1b7-460c-b513-cc5a66b40950.tsv",
                "image": "http://ws.srf.ch/asset/image/audio/0dc3953b-29a9-4495-8394-30f78cd45041/EPISODE_IMAGE/1400992193000.png"
            },
            {
                "id": "afff59b8-3c7f-4ba3-975f-65a52882dbeb",
                "title": "Tagesschau vom 23.05.2014, 19:30",
                "publishedDate": "2014-05-23T17:30:00.000Z",
                "transcript": "transcripts/simple/afff59b8-3c7f-4ba3-975f-65a52882dbeb.tsv",
                "image": "http://ws.srf.ch/asset/image/audio/5818e6ed-fca8-479a-9374-20a60059197a/EPISODE_IMAGE/1400910417000.png"
            },
            {
                "id": "af8c414a-2753-49a9-aed0-b4629603b7dd",
                "title": "Tagesschau vom 22.05.2014, 19:30",
                "publishedDate": "2014-05-22T17:30:00.000Z",
                "transcript": "transcripts/simple/af8c414a-2753-49a9-aed0-b4629603b7dd.tsv",
                "image": "http://ws.srf.ch/asset/image/audio/8a7d8faa-12fc-4808-8042-6b227cd67fda/EPISODE_IMAGE/1400833758000.png"
            },
            {
                "id": "e9ab8059-f5a3-4f08-81d9-9c3d254c52fe",
                "title": "Tagesschau vom 21.05.2014, 19:30",
                "publishedDate": "2014-05-21T17:30:00.000Z",
                "transcript": "transcripts/simple/e9ab8059-f5a3-4f08-81d9-9c3d254c52fe.tsv",
                "image": "http://ws.srf.ch/asset/image/audio/71b83a13-f647-4ab2-abfc-5bf06cc2d369/EPISODE_IMAGE/1400744074000.png"
            },
            {
                "id": "6530778c-4d2f-46cb-b2c7-70e842602f1b",
                "title": "Tagesschau vom 20.05.2014, 19:30",
                "publishedDate": "2014-05-20T17:30:00.000Z",
                "transcript": "transcripts/simple/6530778c-4d2f-46cb-b2c7-70e842602f1b.tsv",
                "image": "http://ws.srf.ch/asset/image/audio/ed308fd7-677e-4d01-bd9b-2028b8817f38/EPISODE_IMAGE/1400653703000.png"
            },
            {
                "id": "0fc10161-e270-431d-8c85-f79e55f304c7",
                "title": "Tagesschau vom 19.05.2014, 19:30",
                "publishedDate": "2014-05-19T17:30:00.000Z",
                "transcript": "transcripts/simple/0fc10161-e270-431d-8c85-f79e55f304c7.tsv",
                "image": "http://ws.srf.ch/asset/image/audio/55b5ee06-265b-423e-8e4b-1570c966f403/EPISODE_IMAGE/1400567183000.png"
            },
            {
                "id": "5754ee63-f32a-4925-a0e5-652e660ba42b",
                "title": "Tagesschau vom 18.05.2014, 19:30",
                "publishedDate": "2014-05-18T17:30:00.000Z",
                "transcript": "transcripts/simple/5754ee63-f32a-4925-a0e5-652e660ba42b.tsv",
                "image": "http://ws.srf.ch/asset/image/audio/2ce0b1f2-ff18-4b8f-a0be-1069fd026e88/EPISODE_IMAGE/1400474366000.png"
            },
            {
                "id": "c9d564b9-b7b3-4dd3-8080-4a805d001bad",
                "title": "Tagesschau vom 17.05.2014, 19:30",
                "publishedDate": "2014-05-17T17:30:00.000Z",
                "transcript": "transcripts/simple/c9d564b9-b7b3-4dd3-8080-4a805d001bad.tsv",
                "image": "http://ws.srf.ch/asset/image/audio/16e8ae81-b01b-4326-8afe-bebeadd07a75/EPISODE_IMAGE/1400385191000.png"
            },
            {
                "id": "cb57d112-6b13-4cd1-b46f-74862f0bdfee",
                "title": "Tagesschau vom 16.05.2014, 19:30",
                "publishedDate": "2014-05-16T17:30:00.000Z",
                "transcript": "transcripts/simple/cb57d112-6b13-4cd1-b46f-74862f0bdfee.tsv",
                "image": "http://ws.srf.ch/asset/image/audio/e48e061a-150c-44b3-89ca-d5dea3adec46/EPISODE_IMAGE/1400296062000.png"
            },
            {
                "id": "2421130b-8da8-4861-a26e-d561d31bb56c",
                "title": "Tagesschau vom 15.05.2014, 19:30",
                "publishedDate": "2014-05-15T17:30:00.000Z",
                "transcript": "transcripts/simple/2421130b-8da8-4861-a26e-d561d31bb56c.tsv",
                "image": "http://ws.srf.ch/asset/image/audio/9df306b2-2db6-4bc6-ac98-2d3d52f819e6/EPISODE_IMAGE/1400207058000.png"
            },
            {
                "id": "99524ec3-b711-4e06-ace4-759c6daaff2d",
                "title": "Tagesschau vom 14.05.2014, 19:30",
                "publishedDate": "2014-05-14T17:30:00.000Z",
                "transcript": "transcripts/simple/99524ec3-b711-4e06-ace4-759c6daaff2d.tsv",
                "image": "http://ws.srf.ch/asset/image/audio/33f9f636-2371-4a6c-a9db-683b153d71dc/EPISODE_IMAGE/1400137264000.png"
            },
            {
                "id": "421b23dd-c74e-4ae5-8555-be3dcb28b853",
                "title": "Tagesschau vom 13.05.2014, 19:30",
                "publishedDate": "2014-05-13T17:30:00.000Z",
                "transcript": "transcripts/simple/421b23dd-c74e-4ae5-8555-be3dcb28b853.tsv",
                "image": "http://ws.srf.ch/asset/image/audio/847d3a37-cfc0-4307-99fc-a33aa0835985/EPISODE_IMAGE/1400029338000.png"
            },
            {
                "id": "084d1398-38ff-40a0-b387-64fd1ad1c90f",
                "title": "Tagesschau vom 12.05.2014, 19:30",
                "publishedDate": "2014-05-12T17:30:00.000Z",
                "transcript": "transcripts/simple/084d1398-38ff-40a0-b387-64fd1ad1c90f.tsv",
                "image": "http://ws.srf.ch/asset/image/audio/494025aa-7533-46d8-9200-0642fe9d247c/EPISODE_IMAGE/1399940810000.png"
            },
            {
                "id": "e2bd239e-bbad-4696-a581-51696e5ba8d2",
                "title": "Tagesschau vom 11.05.2014, 19:30",
                "publishedDate": "2014-05-11T17:30:00.000Z",
                "transcript": "transcripts/simple/e2bd239e-bbad-4696-a581-51696e5ba8d2.tsv",
                "image": "http://ws.srf.ch/asset/image/audio/0589314b-6a06-4ccc-9540-62e959291a61/EPISODE_IMAGE/1399851589000.png"
            },
            {
                "id": "c1545f08-bb5a-4447-bae3-c79d93f62a26",
                "title": "Tagesschau vom 10.05.2014, 19:30",
                "publishedDate": "2014-05-10T17:30:00.000Z",
                "transcript": "transcripts/simple/c1545f08-bb5a-4447-bae3-c79d93f62a26.tsv",
                "image": "http://ws.srf.ch/asset/image/audio/fdeab6d1-df6c-4f60-812c-3e4d7bbf35f3/EPISODE_IMAGE/1399785662000.png"
            },
            {
                "id": "ecc5a953-6c1f-492f-994a-c0018040054c",
                "title": "Tagesschau vom 09.05.2014, 19:30",
                "publishedDate": "2014-05-09T17:30:00.000Z",
                "transcript": "transcripts/simple/ecc5a953-6c1f-492f-994a-c0018040054c.tsv",
                "image": "http://ws.srf.ch/asset/image/audio/37badbf3-e19b-4660-99d6-3cf343dc9d29/EPISODE_IMAGE/1399673700000.png"
            },
            {
                "id": "b56db0bd-c78b-449c-8b68-615553e8a437",
                "title": "Tagesschau vom 08.05.2014, 19:30",
                "publishedDate": "2014-05-08T17:30:00.000Z",
                "transcript": "transcripts/simple/b56db0bd-c78b-449c-8b68-615553e8a437.tsv",
                "image": "http://ws.srf.ch/asset/image/audio/a43b480d-5a51-44f1-b169-43a4e64ad273/EPISODE_IMAGE/1399584442000.png"
            },
            {
                "id": "ce1d6476-1ef3-4edb-99cf-1e0121926583",
                "title": "Tagesschau vom 07.05.2014, 19:30",
                "publishedDate": "2014-05-07T17:30:00.000Z",
                "transcript": "transcripts/simple/ce1d6476-1ef3-4edb-99cf-1e0121926583.tsv",
                "image": "http://ws.srf.ch/asset/image/audio/d182fc4d-5256-4528-8726-f9cd238b649f/EPISODE_IMAGE/1399495464000.png"
            },
            {
                "id": "b35c1a7c-d8f5-4f51-be3c-9bcf8682a64b",
                "title": "Tagesschau vom 06.05.2014, 19:30",
                "publishedDate": "2014-05-06T17:30:00.000Z",
                "transcript": "transcripts/simple/b35c1a7c-d8f5-4f51-be3c-9bcf8682a64b.tsv",
                "image": "http://ws.srf.ch/asset/image/audio/ba031570-1967-4a9c-98ce-71d136abf547/EPISODE_IMAGE/1399468635000.png"
            },
            {
                "id": "c0b1f367-66a3-4b9c-b91e-7d0ffcb74ce8",
                "title": "Tagesschau vom 05.05.2014, 19:30",
                "publishedDate": "2014-05-05T17:30:00.000Z",
                "transcript": "transcripts/simple/c0b1f367-66a3-4b9c-b91e-7d0ffcb74ce8.tsv",
                "image": "http://ws.srf.ch/asset/image/audio/573c9c70-78a4-45ea-842c-06261d99278a/EPISODE_IMAGE/1399356014000.png"
            },
            {
                "id": "1bd572a7-45ad-4e9a-a401-00921d5ac657",
                "title": "Tagesschau vom 04.05.2014, 19:30",
                "publishedDate": "2014-05-04T17:30:00.000Z",
                "transcript": "transcripts/simple/1bd572a7-45ad-4e9a-a401-00921d5ac657.tsv",
                "image": "http://ws.srf.ch/asset/image/audio/e941056a-3fd4-4e43-85dc-1b2a25a85f65/EPISODE_IMAGE/1399267299000.png"
            },
            {
                "id": "6faf7c84-1519-4574-a10b-65dd1b7bea4c",
                "title": "Tagesschau vom 03.05.2014, 19:30",
                "publishedDate": "2014-05-03T17:30:00.000Z",
                "transcript": "transcripts/simple/6faf7c84-1519-4574-a10b-65dd1b7bea4c.tsv",
                "image": "http://ws.srf.ch/asset/image/audio/448f42a7-647f-4a58-8094-bbf6895b1d40/EPISODE_IMAGE/1399178689000.png"
            },
            {
                "id": "c9272c8d-43ae-4079-8898-f181a0cc1a59",
                "title": "Tagesschau vom 02.05.2014, 19:30",
                "publishedDate": "2014-05-02T17:30:00.000Z",
                "transcript": "transcripts/simple/c9272c8d-43ae-4079-8898-f181a0cc1a59.tsv",
                "image": "http://ws.srf.ch/asset/image/audio/23a9702a-368a-4bdd-9b94-77881e1fc82f/EPISODE_IMAGE/1399090153000.png"
            },
            {
                "id": "6a144859-e1cc-4eb8-9daa-8f4b40a07147",
                "title": "Tagesschau vom 30.04.2014, 19:30",
                "publishedDate": "2014-04-30T17:30:00.000Z",
                "transcript": "transcripts/simple/6a144859-e1cc-4eb8-9daa-8f4b40a07147.tsv",
                "image": "http://ws.srf.ch/asset/image/audio/db17b61b-1516-4083-b3de-f2ed89752a49/EPISODE_IMAGE/1398912425000.png"
            },
            {
                "id": "16f2a980-782e-4f89-90e8-c791e7cf1c08",
                "title": "Tagesschau vom 29.04.2014, 19:30",
                "publishedDate": "2014-04-29T17:30:00.000Z",
                "transcript": "transcripts/simple/16f2a980-782e-4f89-90e8-c791e7cf1c08.tsv",
                "image": "http://ws.srf.ch/asset/image/audio/52b47496-86cc-4b8d-b64c-6ef82496ea0b/EPISODE_IMAGE/1398823549000.png"
            },
            {
                "id": "cba2eb1b-db00-4b4b-92d0-a13b0945e27b",
                "title": "Tagesschau vom 27.04.2014, 19:30",
                "publishedDate": "2014-04-27T17:30:00.000Z",
                "transcript": "transcripts/simple/cba2eb1b-db00-4b4b-92d0-a13b0945e27b.tsv",
                "image": "http://ws.srf.ch/asset/image/audio/fd2dd415-f0a0-4d66-9bd1-60d5e10936f0/EPISODE_IMAGE/1398645484000.png"
            },
            {
                "id": "38e2cf5a-7dce-4864-81d9-7e65d179f5b9",
                "title": "Tagesschau vom 26.04.2014, 19:30",
                "publishedDate": "2014-04-26T17:30:00.000Z",
                "transcript": "transcripts/simple/38e2cf5a-7dce-4864-81d9-7e65d179f5b9.tsv",
                "image": "http://ws.srf.ch/asset/image/audio/64ee76dc-3ab0-47a4-92c7-25c1a4abe0de/EPISODE_IMAGE/1398556503000.png"
            },
            {
                "id": "9748d12e-ee92-4cfc-b93a-acc7823a598a",
                "title": "Tagesschau vom 25.04.2014, 19:30",
                "publishedDate": "2014-04-25T17:30:00.000Z",
                "transcript": "transcripts/simple/9748d12e-ee92-4cfc-b93a-acc7823a598a.tsv",
                "image": "http://ws.srf.ch/asset/image/audio/8ccd052a-8b46-45b1-a1c4-a8a20e4bf0f0/EPISODE_IMAGE/1398467562000.png"
            },
            {
                "id": "d232c4b3-b5a3-44ec-87b5-442390856188",
                "title": "Tagesschau vom 24.04.2014, 19:30",
                "publishedDate": "2014-04-24T17:30:00.000Z",
                "transcript": "transcripts/simple/d232c4b3-b5a3-44ec-87b5-442390856188.tsv",
                "image": "http://ws.srf.ch/asset/image/audio/f248bd51-90f3-4a7a-a6c6-779da1147685/EPISODE_IMAGE/1398378167000.png"
            },
            {
                "id": "bf43149b-eb30-4ddd-ac3a-3b171bf5425c",
                "title": "Tagesschau vom 23.04.2014, 19:30",
                "publishedDate": "2014-04-23T17:30:00.000Z",
                "transcript": "transcripts/simple/bf43149b-eb30-4ddd-ac3a-3b171bf5425c.tsv",
                "image": "http://ws.srf.ch/asset/image/audio/a726485b-e30b-4e31-b707-74a0b190fb53/EPISODE_IMAGE/1398289776000.png"
            },
            {
                "id": "e9464863-49b5-4ff2-8057-0bfa806c1e6c",
                "title": "Tagesschau vom 22.04.2014, 19:30",
                "publishedDate": "2014-04-22T17:30:00.000Z",
                "transcript": "transcripts/simple/e9464863-49b5-4ff2-8057-0bfa806c1e6c.tsv",
                "image": "http://ws.srf.ch/asset/image/audio/4e8dec22-7dc7-48f8-8a3b-69e3490cc19e/EPISODE_IMAGE/1398199385000.png"
            },
            {
                "id": "a63922db-4ea6-4008-9780-3b59f230b5e7",
                "title": "Tagesschau vom 21.04.2014, 19:30",
                "publishedDate": "2014-04-21T17:30:00.000Z",
                "transcript": "transcripts/simple/a63922db-4ea6-4008-9780-3b59f230b5e7.tsv",
                "image": "http://ws.srf.ch/asset/image/audio/f33502cc-67b8-416d-a7e7-a2063f99c8cb/EPISODE_IMAGE/1398139724000.png"
            },
            {
                "id": "8b147a82-2779-4818-b197-36d48eba7a0d",
                "title": "Tagesschau vom 20.04.2014, 19:30",
                "publishedDate": "2014-04-20T17:30:00.000Z",
                "transcript": "transcripts/simple/8b147a82-2779-4818-b197-36d48eba7a0d.tsv",
                "image": "http://ws.srf.ch/asset/image/audio/e6ce3d57-d57c-4061-bbdf-e0e6fb1b7078/EPISODE_IMAGE/1398050675000.png"
            },
            {
                "id": "68f0e02a-fea7-4813-964e-4edc15bcccb4",
                "title": "Tagesschau vom 19.04.2014, 19:30",
                "publishedDate": "2014-04-19T17:30:00.000Z",
                "transcript": "transcripts/simple/68f0e02a-fea7-4813-964e-4edc15bcccb4.tsv",
                "image": "http://ws.srf.ch/asset/image/audio/a5a44ff9-345e-4bbb-ba3c-485faef94508/EPISODE_IMAGE/1397961814000.png"
            },
            {
                "id": "477c158d-2d42-467a-bd34-d5a0f854bb85",
                "title": "Tagesschau vom 18.04.2014, 19:30",
                "publishedDate": "2014-04-18T17:30:00.000Z",
                "transcript": "transcripts/simple/477c158d-2d42-467a-bd34-d5a0f854bb85.tsv",
                "image": "http://ws.srf.ch/asset/image/audio/d0ae2743-975a-4a79-8906-4334150410ee/EPISODE_IMAGE/1397872756000.png"
            },
            {
                "id": "b7a140f4-ede8-4348-b60a-924697a9206a",
                "title": "Tagesschau vom 17.04.2014, 19:30",
                "publishedDate": "2014-04-17T17:30:00.000Z",
                "transcript": "transcripts/simple/b7a140f4-ede8-4348-b60a-924697a9206a.tsv",
                "image": "http://ws.srf.ch/asset/image/audio/a85c2b3c-a55e-46d5-8761-6462bcc1d906/EPISODE_IMAGE/1397783847000.png"
            },
            {
                "id": "94253bff-e5d6-4c8a-98e8-c90c8fe6d9ff",
                "title": "Tagesschau vom 16.04.2014, 19:30",
                "publishedDate": "2014-04-16T17:30:00.000Z",
                "transcript": "transcripts/simple/94253bff-e5d6-4c8a-98e8-c90c8fe6d9ff.tsv",
                "image": "http://ws.srf.ch/asset/image/audio/fd9c9995-e98b-4bc0-b21c-e949fccd9eb3/EPISODE_IMAGE/1397695109000.png"
            },
            {
                "id": "d57190e0-7aa9-4976-90c1-78c4b9967dd4",
                "title": "Tagesschau vom 15.04.2014, 19:30",
                "publishedDate": "2014-04-15T17:30:00.000Z",
                "transcript": "transcripts/simple/d57190e0-7aa9-4976-90c1-78c4b9967dd4.tsv",
                "image": "http://ws.srf.ch/asset/image/audio/9bfb4482-1ff7-4560-9ca1-395fea5f0faf/EPISODE_IMAGE/1397605037000.png"
            },
            {
                "id": "10d5c32f-20c5-498d-901f-743f0987abe2",
                "title": "Tagesschau vom 14.04.2014, 19:30",
                "publishedDate": "2014-04-14T17:30:00.000Z",
                "transcript": "transcripts/simple/10d5c32f-20c5-498d-901f-743f0987abe2.tsv",
                "image": "http://ws.srf.ch/asset/image/audio/c69ba38a-af28-447e-a1d3-0722a3060f9a/EPISODE_IMAGE/1397516077000.png"
            },
            {
                "id": "f9525fd3-583b-440e-b5ef-31413b1bb514",
                "title": "Tagesschau vom 13.04.2014, 19:30",
                "publishedDate": "2014-04-13T17:30:00.000Z",
                "transcript": "transcripts/simple/f9525fd3-583b-440e-b5ef-31413b1bb514.tsv",
                "image": "http://ws.srf.ch/asset/image/audio/7aaaeb7c-d90b-4662-adcf-29ae01dd3e69/EPISODE_IMAGE/1397427205000.png"
            },
            {
                "id": "e89961c9-192e-496f-a179-dacd097ea9e7",
                "title": "Tagesschau vom 12.04.2014, 19:30",
                "publishedDate": "2014-04-12T17:30:00.000Z",
                "transcript": "transcripts/simple/e89961c9-192e-496f-a179-dacd097ea9e7.tsv",
                "image": "http://ws.srf.ch/asset/image/audio/6f7f26d3-ed1b-4665-9a27-54a439b153e6/EPISODE_IMAGE/1397338412000.png"
            },
            {
                "id": "b4f39a2d-c51d-4808-bd97-2eec0f67eb2e",
                "title": "Tagesschau vom 11.04.2014, 19:30",
                "publishedDate": "2014-04-11T17:30:00.000Z",
                "transcript": "transcripts/simple/b4f39a2d-c51d-4808-bd97-2eec0f67eb2e.tsv",
                "image": "http://ws.srf.ch/asset/image/audio/08f27f87-6a73-4cc5-bd1d-3e0f9aa328a5/EPISODE_IMAGE/1397249441000.png"
            },
            {
                "id": "0a5a6c50-1fdd-4f89-8a67-29d045558847",
                "title": "Tagesschau vom 10.04.2014, 19:30",
                "publishedDate": "2014-04-10T17:30:00.000Z",
                "transcript": "transcripts/simple/0a5a6c50-1fdd-4f89-8a67-29d045558847.tsv",
                "image": "http://ws.srf.ch/asset/image/audio/5ef243eb-f88a-4895-abd5-842cd0626dce/EPISODE_IMAGE/1397160319000.png"
            },
            {
                "id": "fb16bef3-8bd4-4ea7-91f0-77f2c07f1fb2",
                "title": "Tagesschau vom 09.04.2014, 19:30",
                "publishedDate": "2014-04-09T17:30:00.000Z",
                "transcript": "transcripts/simple/fb16bef3-8bd4-4ea7-91f0-77f2c07f1fb2.tsv",
                "image": "http://ws.srf.ch/asset/image/audio/0db0d0d1-6cc5-4f5b-9595-9229784a4cbb/EPISODE_IMAGE/1397068610000.png"
            },
            {
                "id": "18ef6fed-77c2-4c9d-a7ea-6c9bb4c991cb",
                "title": "Tagesschau vom 08.04.2014, 19:30",
                "publishedDate": "2014-04-08T17:30:00.000Z",
                "transcript": "transcripts/simple/18ef6fed-77c2-4c9d-a7ea-6c9bb4c991cb.tsv",
                "image": "http://ws.srf.ch/asset/image/audio/52ee5bf1-0700-493b-9f2b-3404db5a5c96/EPISODE_IMAGE/1397023133000.png"
            },
            {
                "id": "5dc414aa-fcf5-472d-a7d1-df951af9e173",
                "title": "Tagesschau vom 07.04.2014, 19:30",
                "publishedDate": "2014-04-07T17:30:00.000Z",
                "transcript": "transcripts/simple/5dc414aa-fcf5-472d-a7d1-df951af9e173.tsv",
                "image": "http://ws.srf.ch/asset/image/audio/462a61ed-478a-4c58-a0e3-fedcb099791d/EPISODE_IMAGE/1396933599000.png"
            },
            {
                "id": "3156b323-bda0-4ea5-848e-986d0ac4975d",
                "title": "Tagesschau vom 06.04.2014, 19:30",
                "publishedDate": "2014-04-06T17:30:00.000Z",
                "transcript": "transcripts/simple/3156b323-bda0-4ea5-848e-986d0ac4975d.tsv",
                "image": "http://ws.srf.ch/asset/image/audio/5edf3e50-9eb9-43e8-abe4-ad7085849ea6/EPISODE_IMAGE/1396875548000.png"
            },
            {
                "id": "b74507a2-7d54-4460-a011-98e0642913bf",
                "title": "Tagesschau vom 05.04.2014, 19:30",
                "publishedDate": "2014-04-05T17:30:00.000Z",
                "transcript": "transcripts/simple/b74507a2-7d54-4460-a011-98e0642913bf.tsv",
                "image": "http://ws.srf.ch/asset/image/audio/c6cb5f87-8559-4c5d-90b6-df82e6271b08/EPISODE_IMAGE/1396754196000.png"
            },
            {
                "id": "6492826d-4af0-47a0-b684-7df26ce44197",
                "title": "Tagesschau vom 04.04.2014, 19:30",
                "publishedDate": "2014-04-04T17:30:00.000Z",
                "transcript": "transcripts/simple/6492826d-4af0-47a0-b684-7df26ce44197.tsv",
                "image": "http://ws.srf.ch/asset/image/audio/f17024b6-132d-4972-838b-f29ef8dce7ab/EPISODE_IMAGE/1396665441000.png"
            },
            {
                "id": "556ee049-2033-4ab6-8374-90d2e5b70226",
                "title": "Tagesschau vom 03.04.2014, 19:30",
                "publishedDate": "2014-04-03T17:30:00.000Z",
                "transcript": "transcripts/simple/556ee049-2033-4ab6-8374-90d2e5b70226.tsv",
                "image": "http://ws.srf.ch/asset/image/audio/09aa8eea-d6df-48a8-a3d1-314e27edd6de/EPISODE_IMAGE/1396576418000.png"
            },
            {
                "id": "5af8289a-bdc0-4415-b00d-e13f32e2a780",
                "title": "Tagesschau vom 02.04.2014, 19:30",
                "publishedDate": "2014-04-02T17:30:00.000Z",
                "transcript": "transcripts/simple/5af8289a-bdc0-4415-b00d-e13f32e2a780.tsv",
                "image": "http://ws.srf.ch/asset/image/audio/fd1c7b2b-fd7b-4881-b43e-e27510379ed1/EPISODE_IMAGE/1396516769000.png"
            },
            {
                "id": "6e7832f9-6678-48f0-9131-bcf8582757c2",
                "title": "Tagesschau vom 01.04.2014, 19:30",
                "publishedDate": "2014-04-01T17:30:00.000Z",
                "transcript": "transcripts/simple/6e7832f9-6678-48f0-9131-bcf8582757c2.tsv",
                "image": "http://ws.srf.ch/asset/image/audio/970870ad-d26a-4991-bdb4-43d33a55438b/EPISODE_IMAGE/1396396919000.png"
            },
            {
                "id": "ebd49f71-0a0c-4571-a1c7-01bfabb546d0",
                "title": "Tagesschau vom 31.03.2014, 19:30",
                "publishedDate": "2014-03-31T17:30:00.000Z",
                "transcript": "transcripts/simple/ebd49f71-0a0c-4571-a1c7-01bfabb546d0.tsv",
                "image": "http://ws.srf.ch/asset/image/audio/900ff71b-8568-4188-80c0-0093e8baea4b/EPISODE_IMAGE/1396337472000.png"
            },
            {
                "id": "18f1aa41-84cc-4e8a-9234-2905fc34254c",
                "title": "Tagesschau vom 30.03.2014, 19:30",
                "publishedDate": "2014-03-30T17:30:00.000Z",
                "transcript": "transcripts/simple/18f1aa41-84cc-4e8a-9234-2905fc34254c.tsv",
                "image": "http://ws.srf.ch/asset/image/audio/93d5b4c2-7b51-4572-9cbd-e7a588c24c45/EPISODE_IMAGE/1396352641000.png"
            },
            {
                "id": "a959dccc-681b-4fdc-99b0-9e8062063e42",
                "title": "Tagesschau vom 29.03.2014, 19:30",
                "publishedDate": "2014-03-29T18:30:00.000Z",
                "transcript": "transcripts/simple/a959dccc-681b-4fdc-99b0-9e8062063e42.tsv",
                "image": "http://ws.srf.ch/asset/image/audio/f8ec3d5d-43a4-4cd7-84c9-e61167688057/EPISODE_IMAGE/1396128296000.png"
            },
            {
                "id": "a828ea8a-2549-4dcd-a8ac-9f25bfba5004",
                "title": "Tagesschau vom 28.03.2014, 19:30",
                "publishedDate": "2014-03-28T18:30:00.000Z",
                "transcript": "transcripts/simple/a828ea8a-2549-4dcd-a8ac-9f25bfba5004.tsv",
                "image": "http://ws.srf.ch/asset/image/audio/5cc44a38-110e-48db-8db0-e90451eaf30f/EPISODE_IMAGE/1396039205000.png"
            },
            {
                "id": "741b9824-0e13-4185-a41a-27cdff83877f",
                "title": "Tagesschau vom 27.03.2014, 19:30",
                "publishedDate": "2014-03-27T18:30:00.000Z",
                "transcript": "transcripts/simple/741b9824-0e13-4185-a41a-27cdff83877f.tsv",
                "image": "http://ws.srf.ch/asset/image/audio/44b492b8-aee1-4976-9e73-74a84300fa7d/EPISODE_IMAGE/1395950056000.png"
            },
            {
                "id": "dffe5597-8958-4ec4-9ec6-518d385ad271",
                "title": "Tagesschau vom 26.03.2014, 19:30",
                "publishedDate": "2014-03-26T18:30:00.000Z",
                "transcript": "transcripts/simple/dffe5597-8958-4ec4-9ec6-518d385ad271.tsv",
                "image": "http://ws.srf.ch/asset/image/audio/9812ea21-819d-4a5a-a343-26fa1238240c/EPISODE_IMAGE/1395905443000.png"
            },
            {
                "id": "032ce36f-cf8d-451e-89d2-07da5581abc2",
                "title": "Tagesschau vom 25.03.2014, 19:30",
                "publishedDate": "2014-03-25T18:30:00.000Z",
                "transcript": "transcripts/simple/032ce36f-cf8d-451e-89d2-07da5581abc2.tsv",
                "image": "http://ws.srf.ch/asset/image/audio/b6222117-10e1-432b-95fc-8c7ed2f8757e/EPISODE_IMAGE/1395821119000.png"
            },
            {
                "id": "73585ecd-0e98-4f8a-86d5-25a116fd6eee",
                "title": "Tagesschau vom 24.03.2014, 19:30",
                "publishedDate": "2014-03-24T18:30:00.000Z",
                "transcript": "transcripts/simple/73585ecd-0e98-4f8a-86d5-25a116fd6eee.tsv",
                "image": "http://ws.srf.ch/asset/image/audio/f64753b3-7e86-49c3-83ee-873e8d1c3030/EPISODE_IMAGE/1395727396000.png"
            },
            {
                "id": "c882ceea-7f5a-47d4-b6db-d4e0b98c7c6f",
                "title": "Tagesschau vom 23.03.2014, 19:30",
                "publishedDate": "2014-03-23T18:30:00.000Z",
                "transcript": "transcripts/simple/c882ceea-7f5a-47d4-b6db-d4e0b98c7c6f.tsv",
                "image": "http://ws.srf.ch/asset/image/audio/52bf17fc-181d-4faa-9c44-35fed96b8f45/EPISODE_IMAGE/1395638395000.png"
            },
            {
                "id": "2ce38229-e647-4e1b-861c-72d047fbcedc",
                "title": "Tagesschau vom 22.03.2014, 19:30",
                "publishedDate": "2014-03-22T18:30:00.000Z",
                "transcript": "transcripts/simple/2ce38229-e647-4e1b-861c-72d047fbcedc.tsv",
                "image": "http://ws.srf.ch/asset/image/audio/3c76f777-bccf-46d0-adfe-4180467ba519/EPISODE_IMAGE/1395549634000.png"
            },
            {
                "id": "04916004-7195-44b0-8b07-8d536b16c4b4",
                "title": "Tagesschau vom 21.03.2014, 19:30",
                "publishedDate": "2014-03-21T18:30:00.000Z",
                "transcript": "transcripts/simple/04916004-7195-44b0-8b07-8d536b16c4b4.tsv",
                "image": "http://ws.srf.ch/asset/image/audio/2770570b-bc72-42f0-9d6c-96c7bff9ed19/EPISODE_IMAGE/1395460699000.png"
            },
            {
                "id": "747e6dae-fe0f-429c-851f-a1225b08c781",
                "title": "Tagesschau vom 20.03.2014, 19:30",
                "publishedDate": "2014-03-20T18:30:00.000Z",
                "transcript": "transcripts/simple/747e6dae-fe0f-429c-851f-a1225b08c781.tsv",
                "image": "http://ws.srf.ch/asset/image/audio/40c2db34-0d80-46f5-b184-a1a09f562967/EPISODE_IMAGE/1395371777000.png"
            },
            {
                "id": "de8ae794-043f-4bf2-a2e6-c307d8b875f2",
                "title": "Tagesschau vom 19.03.2014, 19:30",
                "publishedDate": "2014-03-19T18:30:00.000Z",
                "transcript": "transcripts/simple/de8ae794-043f-4bf2-a2e6-c307d8b875f2.tsv",
                "image": "http://ws.srf.ch/asset/image/audio/e7f473ba-3637-4542-92ab-3b3335066138/EPISODE_IMAGE/1395282620000.png"
            },
            {
                "id": "ba5bbdb7-41b8-43ce-a559-055a47c33297",
                "title": "Tagesschau vom 18.03.2014, 19:30",
                "publishedDate": "2014-03-18T18:30:00.000Z",
                "transcript": "transcripts/simple/ba5bbdb7-41b8-43ce-a559-055a47c33297.tsv",
                "image": "http://ws.srf.ch/asset/image/audio/7d914fa4-3811-4664-8125-00179397cc45/EPISODE_IMAGE/1395193691000.png"
            },
            {
                "id": "8564549d-d73a-46c1-9645-deaa38c4ad1a",
                "title": "Tagesschau vom 17.03.2014, 19:30",
                "publishedDate": "2014-03-17T18:30:00.000Z",
                "transcript": "transcripts/simple/8564549d-d73a-46c1-9645-deaa38c4ad1a.tsv",
                "image": "http://ws.srf.ch/asset/image/audio/46b0b2b0-20a7-434f-98e9-67195eaa0bc6/EPISODE_IMAGE/1395133950000.png"
            },
            {
                "id": "d1bff586-1322-4966-ad3e-3f34b4219597",
                "title": "Tagesschau vom 16.03.2014, 19:30",
                "publishedDate": "2014-03-16T18:30:00.000Z",
                "transcript": "transcripts/simple/d1bff586-1322-4966-ad3e-3f34b4219597.tsv",
                "image": "http://ws.srf.ch/asset/image/audio/9f7089be-b5f9-48dd-b5f0-f490da83abb7/EPISODE_IMAGE/1395015674000.png"
            },
            {
                "id": "eb3d7bc3-24c1-43f0-aa0e-b991b7da4ef2",
                "title": "Tagesschau vom 15.03.2014, 19:30",
                "publishedDate": "2014-03-15T18:30:00.000Z",
                "transcript": "transcripts/simple/eb3d7bc3-24c1-43f0-aa0e-b991b7da4ef2.tsv",
                "image": "http://ws.srf.ch/asset/image/audio/850da432-fc48-4cff-88f8-f0ce8606f082/EPISODE_IMAGE/1394972145000.png"
            },
            {
                "id": "c1a7d480-823e-4c68-a157-96cbc96f7284",
                "title": "Tagesschau vom 14.03.2014, 19:30",
                "publishedDate": "2014-03-14T18:30:00.000Z",
                "transcript": "transcripts/simple/c1a7d480-823e-4c68-a157-96cbc96f7284.tsv",
                "image": "http://ws.srf.ch/asset/image/audio/c995004a-210f-43f7-bb12-27f8a697a215/EPISODE_IMAGE/1394838177000.png"
            },
            {
                "id": "000854e2-3406-49bd-92f6-46991fb2efa1",
                "title": "Tagesschau vom 13.03.2014, 19:30",
                "publishedDate": "2014-03-13T18:30:00.000Z",
                "transcript": "transcripts/simple/000854e2-3406-49bd-92f6-46991fb2efa1.tsv",
                "image": "http://ws.srf.ch/asset/image/audio/bee60ce1-6038-4704-afd0-9a5dd777514f/EPISODE_IMAGE/1394749351000.png"
            },
            {
                "id": "8fbd92a4-7c64-41d0-baa0-e23bafc52009",
                "title": "Tagesschau vom 12.03.2014, 19:30",
                "publishedDate": "2014-03-12T18:30:00.000Z",
                "transcript": "transcripts/simple/8fbd92a4-7c64-41d0-baa0-e23bafc52009.tsv",
                "image": "http://ws.srf.ch/asset/image/audio/4973d84b-8d41-4799-8449-096f9cda7269/EPISODE_IMAGE/1394660495000.png"
            },
            {
                "id": "b4ace512-d1b6-4a55-8610-1ef7e9931d4d",
                "title": "Tagesschau vom 11.03.2014, 19:30",
                "publishedDate": "2014-03-11T18:30:00.000Z",
                "transcript": "transcripts/simple/b4ace512-d1b6-4a55-8610-1ef7e9931d4d.tsv",
                "image": "http://ws.srf.ch/asset/image/audio/e202f196-891b-4d80-b412-c010bdcd46e8/EPISODE_IMAGE/1394571066000.png"
            },
            {
                "id": "89e74b5e-cc38-4904-86f5-b5b2ab08dc8d",
                "title": "Tagesschau vom 10.03.2014, 19:30",
                "publishedDate": "2014-03-10T18:30:00.000Z",
                "transcript": "transcripts/simple/89e74b5e-cc38-4904-86f5-b5b2ab08dc8d.tsv",
                "image": "http://ws.srf.ch/asset/image/audio/2d131b86-6629-4090-ba03-4c1927e22702/EPISODE_IMAGE/1394614463000.png"
            },
            {
                "id": "5995994c-b0e4-4501-bb09-9a0ea5977031",
                "title": "Tagesschau vom 09.03.2014, 19:30",
                "publishedDate": "2014-03-09T18:30:00.000Z",
                "transcript": "transcripts/simple/5995994c-b0e4-4501-bb09-9a0ea5977031.tsv",
                "image": "http://ws.srf.ch/asset/image/audio/435cfbed-9cf9-4007-869e-b4437f582da7/EPISODE_IMAGE/1394426996000.png"
            },
            {
                "id": "781de40d-995f-4fe1-a16c-d9d311ea0271",
                "title": "Tagesschau vom 08.03.2014, 19:30",
                "publishedDate": "2014-03-08T18:30:00.000Z",
                "transcript": "transcripts/simple/781de40d-995f-4fe1-a16c-d9d311ea0271.tsv",
                "image": "http://ws.srf.ch/asset/image/audio/99283d97-5cd3-4dcb-b141-69e1d2da99e3/EPISODE_IMAGE/1394338435000.png"
            },
            {
                "id": "c5c109a4-4589-42c8-99dc-8060b827928a",
                "title": "Tagesschau vom 07.03.2014, 19:30",
                "publishedDate": "2014-03-07T18:30:00.000Z",
                "transcript": "transcripts/simple/c5c109a4-4589-42c8-99dc-8060b827928a.tsv",
                "image": "http://ws.srf.ch/asset/image/audio/8b554f72-026a-4d71-bb60-74548574f928/EPISODE_IMAGE/1394261079000.png"
            },
            {
                "id": "5d011bbc-1af0-4cda-a1ee-9e2139995a57",
                "title": "Tagesschau vom 06.03.2014, 19:30",
                "publishedDate": "2014-03-06T18:30:00.000Z",
                "transcript": "transcripts/simple/5d011bbc-1af0-4cda-a1ee-9e2139995a57.tsv",
                "image": "http://ws.srf.ch/asset/image/audio/0e44ff99-9834-45dc-a391-204c7e102712/EPISODE_IMAGE/1394159991000.png"
            },
            {
                "id": "d6464360-d182-46ea-96dd-4a09e4df8b3e",
                "title": "Tagesschau vom 05.03.2014, 19:30",
                "publishedDate": "2014-03-05T18:30:00.000Z",
                "transcript": "transcripts/simple/d6464360-d182-46ea-96dd-4a09e4df8b3e.tsv",
                "image": "http://ws.srf.ch/asset/image/audio/297c3c63-a017-4a81-aca0-65c7bc725e22/EPISODE_IMAGE/1394095930000.png"
            },
            {
                "id": "d359b310-6f48-4146-9c51-7f3fbb669814",
                "title": "Tagesschau vom 04.03.2014, 19:30",
                "publishedDate": "2014-03-04T18:30:00.000Z",
                "transcript": "transcripts/simple/d359b310-6f48-4146-9c51-7f3fbb669814.tsv",
                "image": "http://ws.srf.ch/asset/image/audio/1dd86353-1bb6-4588-ad52-8755a6443a88/EPISODE_IMAGE/1393981453000.png"
            },
            {
                "id": "084e5d3b-c16c-4fe8-a85a-4b5b5555fae5",
                "title": "Tagesschau vom 03.03.2014, 19:30",
                "publishedDate": "2014-03-03T18:30:00.000Z",
                "transcript": "transcripts/simple/084e5d3b-c16c-4fe8-a85a-4b5b5555fae5.tsv",
                "image": "http://ws.srf.ch/asset/image/audio/52e45182-e06e-412d-b9c8-7578d337c941/EPISODE_IMAGE/1393891846000.png"
            },
            {
                "id": "e076f3f4-2c14-4281-bfba-8c71610d44d7",
                "title": "Tagesschau vom 02.03.2014, 19:30",
                "publishedDate": "2014-03-02T18:30:00.000Z",
                "transcript": "transcripts/simple/e076f3f4-2c14-4281-bfba-8c71610d44d7.tsv",
                "image": "http://ws.srf.ch/asset/image/audio/2ebf0192-9ee4-46e7-b4e5-e789f17ad342/EPISODE_IMAGE/1393802700000.png"
            },
            {
                "id": "84235775-ce3b-4f55-9ccb-9990fe57a668",
                "title": "Tagesschau vom 01.03.2014, 19:30",
                "publishedDate": "2014-03-01T18:30:00.000Z",
                "transcript": "transcripts/simple/84235775-ce3b-4f55-9ccb-9990fe57a668.tsv",
                "image": "http://ws.srf.ch/asset/image/audio/89779745-02b0-466c-8f2e-e30433b125a4/EPISODE_IMAGE/1393713647000.png"
            },
            {
                "id": "a669e4bb-4b66-49b9-92e8-5e9087ff5186",
                "title": "Tagesschau vom 28.02.2014, 19:30",
                "publishedDate": "2014-02-28T18:30:00.000Z",
                "transcript": "transcripts/simple/a669e4bb-4b66-49b9-92e8-5e9087ff5186.tsv",
                "image": "http://ws.srf.ch/asset/image/audio/4859c680-0203-42e0-8f36-a54fd3bb823c/EPISODE_IMAGE/1393624341000.png"
            },
            {
                "id": "b28ec5cf-dc3f-4c66-acb0-2371d63e8f40",
                "title": "Tagesschau vom 25.02.2014, 19:30",
                "publishedDate": "2014-02-25T18:30:00.000Z",
                "transcript": "transcripts/simple/b28ec5cf-dc3f-4c66-acb0-2371d63e8f40.tsv",
                "image": "http://ws.srf.ch/asset/image/audio/c5fe3d1a-2709-4dcd-be34-375a37aa8774/EPISODE_IMAGE/1393385100000.png"
            },
            {
                "id": "25c7b330-156d-4b19-a89a-7dc49b5dceda",
                "title": "Tagesschau vom 24.02.2014, 19:30",
                "publishedDate": "2014-02-24T18:30:00.000Z",
                "transcript": "transcripts/simple/25c7b330-156d-4b19-a89a-7dc49b5dceda.tsv",
                "image": "http://ws.srf.ch/asset/image/audio/c8f154a2-726f-40bc-a51a-ef0282337e94/EPISODE_IMAGE/1393274405000.png"
            },
            {
                "id": "df2b2ffe-4254-4f02-a29b-628c10a15a7c",
                "title": "Tagesschau vom 23.02.2014, 19:30",
                "publishedDate": "2014-02-23T18:30:00.000Z",
                "transcript": "transcripts/simple/df2b2ffe-4254-4f02-a29b-628c10a15a7c.tsv",
                "image": "http://ws.srf.ch/asset/image/audio/dad6228a-13f2-436b-aba0-c2f48c14223a/EPISODE_IMAGE/1393274373000.png"
            },
            {
                "id": "8c1656c3-a2be-4e38-832b-25ce3a2113d1",
                "title": "Tagesschau vom 22.02.2014, 19:30",
                "publishedDate": "2014-02-22T18:30:00.000Z",
                "transcript": "transcripts/simple/8c1656c3-a2be-4e38-832b-25ce3a2113d1.tsv",
                "image": "http://ws.srf.ch/asset/image/audio/d175bded-2c01-42a6-be45-0feed0688c12/EPISODE_IMAGE/1393123933000.png"
            },
            {
                "id": "61c850f6-274e-4206-9062-17e1c5024b23",
                "title": "Tagesschau vom 21.02.2014, 19:30",
                "publishedDate": "2014-02-21T18:30:00.000Z",
                "transcript": "transcripts/simple/61c850f6-274e-4206-9062-17e1c5024b23.tsv",
                "image": "http://ws.srf.ch/asset/image/audio/ddc3f485-c3d3-4bc8-9af1-39c833fdb02a/EPISODE_IMAGE/1393034872000.png"
            },
            {
                "id": "1cd4dc45-402e-461f-b0ae-7c2982867f4f",
                "title": "Tagesschau vom 20.02.2014, 19:30",
                "publishedDate": "2014-02-20T18:30:00.000Z",
                "transcript": "transcripts/simple/1cd4dc45-402e-461f-b0ae-7c2982867f4f.tsv",
                "image": "http://ws.srf.ch/asset/image/audio/388774b3-7534-415a-8b53-751d69feeefd/EPISODE_IMAGE/1392945477000.png"
            },
            {
                "id": "01a202e3-83ea-4f35-8b48-590f45fda593",
                "title": "Tagesschau vom 19.02.2014, 19:30",
                "publishedDate": "2014-02-19T18:30:00.000Z",
                "transcript": "transcripts/simple/01a202e3-83ea-4f35-8b48-590f45fda593.tsv",
                "image": "http://ws.srf.ch/asset/image/audio/6cd8acec-e929-4a06-829d-b8b6c0d48e02/EPISODE_IMAGE/1392856221000.png"
            },
            {
                "id": "642c121b-a254-4ec2-ab30-92fec7d791d3",
                "title": "Tagesschau vom 18.02.2014, 19:30",
                "publishedDate": "2014-02-18T18:30:00.000Z",
                "transcript": "transcripts/simple/642c121b-a254-4ec2-ab30-92fec7d791d3.tsv",
                "image": "http://ws.srf.ch/asset/image/audio/99f992d4-ac66-4e24-abb0-ddc29de13fe3/EPISODE_IMAGE/1392766982000.png"
            },
            {
                "id": "d1ce04a7-4a45-4397-92b8-5a545b427632",
                "title": "Tagesschau vom 17.02.2014, 19:30",
                "publishedDate": "2014-02-17T18:30:00.000Z",
                "transcript": "transcripts/simple/d1ce04a7-4a45-4397-92b8-5a545b427632.tsv",
                "image": "http://ws.srf.ch/asset/image/audio/de5f3353-2bc4-47e8-9f93-46f569a49e05/EPISODE_IMAGE/1392787792000.png"
            },
            {
                "id": "4384d328-4dd5-4bab-aa13-8e55df9473ae",
                "title": "Tagesschau vom 11.02.2014, 19:30",
                "publishedDate": "2014-02-11T18:30:00.000Z",
                "transcript": "transcripts/simple/4384d328-4dd5-4bab-aa13-8e55df9473ae.tsv",
                "image": "http://ws.srf.ch/asset/image/audio/c55311b0-0626-4749-8880-a1b3ccb95c46/EPISODE_IMAGE/1392156995000.png"
            },
            {
                "id": "54cf2d81-4d2f-4bfc-b036-3977e4d00e02",
                "title": "Tagesschau vom 10.02.2014, 19:30",
                "publishedDate": "2014-02-10T18:30:00.000Z",
                "transcript": "transcripts/simple/54cf2d81-4d2f-4bfc-b036-3977e4d00e02.tsv",
                "image": "http://ws.srf.ch/asset/image/audio/e8464683-d4de-4b4b-b635-3ccd1302db15/EPISODE_IMAGE/1392067516000.png"
            },
            {
                "id": "99bfd5f7-6fca-4c11-aaf3-222f70e7bdc7",
                "title": "Tagesschau vom 09.02.2014, 19:30",
                "publishedDate": "2014-02-09T18:30:00.000Z",
                "transcript": "transcripts/simple/99bfd5f7-6fca-4c11-aaf3-222f70e7bdc7.tsv",
                "image": "http://ws.srf.ch/asset/image/audio/11e1a51b-7c96-49d1-9e6d-1383746bc8a3/EPISODE_IMAGE/1391978512000.png"
            },
            {
                "id": "99398f46-6223-4614-b16e-05c0e6a67802",
                "title": "Tagesschau vom 08.02.2014, 19:30",
                "publishedDate": "2014-02-08T18:30:00.000Z",
                "transcript": "transcripts/simple/99398f46-6223-4614-b16e-05c0e6a67802.tsv",
                "image": "http://ws.srf.ch/asset/image/audio/0c85989f-d097-479d-8916-a5e0bfd588f3/EPISODE_IMAGE/1391889350000.png"
            },
            {
                "id": "2d9f4109-434d-4721-bb03-eaa8ad863a63",
                "title": "Tagesschau vom 07.02.2014, 19:30",
                "publishedDate": "2014-02-07T18:30:00.000Z",
                "transcript": "transcripts/simple/2d9f4109-434d-4721-bb03-eaa8ad863a63.tsv",
                "image": "http://ws.srf.ch/asset/image/audio/d00d9a80-dae7-4bac-ba0d-d917b616864d/EPISODE_IMAGE/1391844596000.png"
            },
            {
                "id": "3c28de63-bf72-44c8-94d8-4b4cfefd6076",
                "title": "Tagesschau vom 06.02.2014, 19:30",
                "publishedDate": "2014-02-06T18:30:00.000Z",
                "transcript": "transcripts/simple/3c28de63-bf72-44c8-94d8-4b4cfefd6076.tsv",
                "image": "http://ws.srf.ch/asset/image/audio/5dcaf490-25ae-4cc1-863f-e40245fb5c2c/EPISODE_IMAGE/1391755568000.png"
            },
            {
                "id": "9b9ad667-dd64-4ba8-90db-79e1b00695ae",
                "title": "Tagesschau vom 05.02.2014, 19:30",
                "publishedDate": "2014-02-05T18:30:00.000Z",
                "transcript": "transcripts/simple/9b9ad667-dd64-4ba8-90db-79e1b00695ae.tsv",
                "image": "http://ws.srf.ch/asset/image/audio/7a98f748-ef1c-490b-a016-3e7d1566f062/EPISODE_IMAGE/1391666209000.png"
            },
            {
                "id": "1e5e7e95-8d84-446f-a964-a2b0d175941c",
                "title": "Tagesschau vom 04.02.2014, 19:30",
                "publishedDate": "2014-02-04T18:30:00.000Z",
                "transcript": "transcripts/simple/1e5e7e95-8d84-446f-a964-a2b0d175941c.tsv",
                "image": "http://ws.srf.ch/asset/image/audio/ea14235e-23ad-4e22-a4ea-73b5ec1dc8d5/EPISODE_IMAGE/1391577321000.png"
            },
            {
                "id": "dcff8d5e-91bf-4694-819f-82d109e6800f",
                "title": "Tagesschau vom 03.02.2014, 19:30",
                "publishedDate": "2014-02-03T18:30:00.000Z",
                "transcript": "transcripts/simple/dcff8d5e-91bf-4694-819f-82d109e6800f.tsv",
                "image": "http://ws.srf.ch/asset/image/audio/a4dff7fb-168b-4e9d-8f6f-d00bf58b2cfb/EPISODE_IMAGE/1391488547000.png"
            },
            {
                "id": "ca9264ed-089d-431b-afa0-2dc10a8ad5e7",
                "title": "Tagesschau vom 02.02.2014, 19:30",
                "publishedDate": "2014-02-02T18:30:00.000Z",
                "transcript": "transcripts/simple/ca9264ed-089d-431b-afa0-2dc10a8ad5e7.tsv",
                "image": "http://ws.srf.ch/asset/image/audio/8e951aa3-b4d2-4bbf-969c-6c34e5584123/EPISODE_IMAGE/1391399830000.png"
            },
            {
                "id": "731b77df-c6ad-40d7-a249-8d5364f464da",
                "title": "Tagesschau vom 01.02.2014, 19:30",
                "publishedDate": "2014-02-01T18:30:00.000Z",
                "transcript": "transcripts/simple/731b77df-c6ad-40d7-a249-8d5364f464da.tsv",
                "image": "http://ws.srf.ch/asset/image/audio/7f4a0397-bd23-439c-b118-804d1e769425/EPISODE_IMAGE/1391310938000.png"
            },
            {
                "id": "e1fc6cef-bfff-4f31-a783-557ba58e6c76",
                "title": "Tagesschau vom 31.01.2014, 19:30",
                "publishedDate": "2014-01-31T18:30:00.000Z",
                "transcript": "transcripts/simple/e1fc6cef-bfff-4f31-a783-557ba58e6c76.tsv",
                "image": "http://ws.srf.ch/asset/image/audio/24f6f27f-bfc1-41ed-be37-fd1b386db25e/EPISODE_IMAGE/1391238030000.png"
            },
            {
                "id": "d47142bb-a35b-4108-b0e7-181ed79dadb5",
                "title": "Tagesschau vom 30.01.2014, 19:30",
                "publishedDate": "2014-01-30T18:30:00.000Z",
                "transcript": "transcripts/simple/d47142bb-a35b-4108-b0e7-181ed79dadb5.tsv",
                "image": "http://ws.srf.ch/asset/image/audio/5eb19529-ac03-499d-a7ed-cf68a034beb9/EPISODE_IMAGE/1391132244000.png"
            },
            {
                "id": "e6cd4244-49e5-485c-96dd-6313b4297c9e",
                "title": "Tagesschau vom 29.01.2014, 19:30",
                "publishedDate": "2014-01-29T18:30:00.000Z",
                "transcript": "transcripts/simple/e6cd4244-49e5-485c-96dd-6313b4297c9e.tsv",
                "image": "http://ws.srf.ch/asset/image/audio/7dcf6d52-9b19-4048-a371-3ed3ae2818ea/EPISODE_IMAGE/1391043311000.png"
            },
            {
                "id": "81e7f2b4-8dad-4011-b218-8f91581c9475",
                "title": "Tagesschau vom 28.01.2014, 19:30",
                "publishedDate": "2014-01-28T18:30:00.000Z",
                "transcript": "transcripts/simple/81e7f2b4-8dad-4011-b218-8f91581c9475.tsv",
                "image": "http://ws.srf.ch/asset/image/audio/086c64b0-ecdb-4066-83c0-7da4bef3bfae/EPISODE_IMAGE/1390954310000.png"
            },
            {
                "id": "e8ca079a-ff4c-4439-84c7-eb004d38a24a",
                "title": "Tagesschau vom 27.01.2014, 19:30",
                "publishedDate": "2014-01-27T18:30:00.000Z",
                "transcript": "transcripts/simple/e8ca079a-ff4c-4439-84c7-eb004d38a24a.tsv",
                "image": "http://ws.srf.ch/asset/image/audio/535e57f5-a91f-4448-857f-9ed6b0b6030a/EPISODE_IMAGE/1390865899000.png"
            },
            {
                "id": "2ea7e8bf-543f-4f7a-96f5-b825dfc411c6",
                "title": "Tagesschau vom 26.01.2014, 19:30",
                "publishedDate": "2014-01-26T18:30:00.000Z",
                "transcript": "transcripts/simple/2ea7e8bf-543f-4f7a-96f5-b825dfc411c6.tsv",
                "image": "http://ws.srf.ch/asset/image/audio/33d9848f-9bcd-4fe1-bc3a-cfb11692b404/EPISODE_IMAGE/1390777429000.png"
            },
            {
                "id": "2f34a0d3-2244-475d-a213-4dadf7608a53",
                "title": "Tagesschau vom 25.01.2014, 19:30",
                "publishedDate": "2014-01-25T18:30:00.000Z",
                "transcript": "transcripts/simple/2f34a0d3-2244-475d-a213-4dadf7608a53.tsv",
                "image": "http://ws.srf.ch/asset/image/audio/614e33d9-dda0-4b65-9eae-86ceca394fd5/EPISODE_IMAGE/1390688596000.png"
            },
            {
                "id": "cec0a574-13df-40e2-9a1f-3d9c6034bf6b",
                "title": "Tagesschau vom 24.01.2014, 19:30",
                "publishedDate": "2014-01-24T18:30:00.000Z",
                "transcript": "transcripts/simple/cec0a574-13df-40e2-9a1f-3d9c6034bf6b.tsv",
                "image": "http://ws.srf.ch/asset/image/audio/e81bfb3f-c52b-4589-92d1-4186d128e9d4/EPISODE_IMAGE/1390600139000.png"
            },
            {
                "id": "c3dcf44b-c275-4a36-a422-9b859c7524a0",
                "title": "Tagesschau vom 23.01.2014, 19:30",
                "publishedDate": "2014-01-23T18:30:00.000Z",
                "transcript": "transcripts/simple/c3dcf44b-c275-4a36-a422-9b859c7524a0.tsv",
                "image": "http://ws.srf.ch/asset/image/audio/c894a442-32f0-4c8c-a9d8-b6ff1b4d001d/EPISODE_IMAGE/1390511458000.png"
            },
            {
                "id": "90a8e653-f25d-4e46-9664-685a1ae14894",
                "title": "Tagesschau vom 22.01.2014, 19:30",
                "publishedDate": "2014-01-22T18:30:00.000Z",
                "transcript": "transcripts/simple/90a8e653-f25d-4e46-9664-685a1ae14894.tsv",
                "image": "http://ws.srf.ch/asset/image/audio/9b5d307b-bca0-4e39-a85e-4054a66ca70d/EPISODE_IMAGE/1390423077000.png"
            },
            {
                "id": "b5055ff2-4a47-4c49-9cb8-f0b43e53e451",
                "title": "Tagesschau vom 21.01.2014, 19:30",
                "publishedDate": "2014-01-21T18:30:00.000Z",
                "transcript": "transcripts/simple/b5055ff2-4a47-4c49-9cb8-f0b43e53e451.tsv",
                "image": "http://ws.srf.ch/asset/image/audio/f82e0424-5ebd-4f77-aca6-9a8b38f901c8/EPISODE_IMAGE/1390333624000.png"
            },
            {
                "id": "5c29ed30-52ac-453e-a8fe-641c8097ae85",
                "title": "Tagesschau vom 20.01.2014, 19:30",
                "publishedDate": "2014-01-20T18:30:00.000Z",
                "transcript": "transcripts/simple/5c29ed30-52ac-453e-a8fe-641c8097ae85.tsv",
                "image": "http://ws.srf.ch/asset/image/audio/cf834ffb-5fe0-4416-ac6d-1b3672a764e9/EPISODE_IMAGE/1390288871000.png"
            },
            {
                "id": "0681e11d-9bff-4223-b272-cc43b1db8d7c",
                "title": "Tagesschau vom 18.01.2014, 19:30",
                "publishedDate": "2014-01-18T18:30:00.000Z",
                "transcript": "transcripts/simple/0681e11d-9bff-4223-b272-cc43b1db8d7c.tsv",
                "image": "http://ws.srf.ch/asset/image/audio/f1c1863a-dc8e-4836-b601-6dceb02b92f7/EPISODE_IMAGE/1390111266000.png"
            },
            {
                "id": "809efecf-0be8-45db-a4d6-99e3de343967",
                "title": "Tagesschau vom 17.01.2014, 19:30",
                "publishedDate": "2014-01-17T18:30:50.000Z",
                "transcript": "transcripts/simple/809efecf-0be8-45db-a4d6-99e3de343967.tsv",
                "image": "http://ws.srf.ch/asset/image/audio/072cc178-9b6c-4e41-9080-5cee6d5577a5/EPISODE_IMAGE/1390022496000.png"
            },
            {
                "id": "9e5d317b-7721-4d3d-b2e2-1604f483c77d",
                "title": "Tagesschau vom 16.01.2014, 19:30",
                "publishedDate": "2014-01-16T18:30:00.000Z",
                "transcript": "transcripts/simple/9e5d317b-7721-4d3d-b2e2-1604f483c77d.tsv",
                "image": "http://ws.srf.ch/asset/image/audio/5c6a367a-eb84-465c-8705-be0c439082cd/EPISODE_IMAGE/1390041544000.png"
            },
            {
                "id": "ea708db5-7fa4-4dc1-a301-9b376916aaf8",
                "title": "Tagesschau vom 15.01.2014, 19:30",
                "publishedDate": "2014-01-15T18:30:00.000Z",
                "transcript": "transcripts/simple/ea708db5-7fa4-4dc1-a301-9b376916aaf8.tsv",
                "image": "http://ws.srf.ch/asset/image/audio/2b33c5a2-1db3-4683-aad2-0ccfbee88dcf/EPISODE_IMAGE/1390041568000.png"
            },
            {
