start	end	duration	text
1282220	1288770	6550	Auch Vanessa, die ihre Zukunft selbst gestalten will.
1288860	1291810	2950	Der Häuptling ist derweil in Rage.
1291970	1298210	6240	Wir Indianer müssen hier im Schlamm leben - ohne Rechte.
1298330	1300210	1880	Wir haben keine politischen Rechte.
1300370	1303250	2880	Wir werden ausgeschlossen, verstossen - an den Rand gedrängt.
1303380	1306450	3070	Hier im Dreck müssen wir leben - am Stadtrand.
1306630	1312450	5820	Die Regierung tut nichts für uns. Die Fussball-WM geht an uns vorbei.
1312580	1316450	3870	Die Regierung zwingt uns, hier in diesem dreckigen Slum zu wohnen.
1316620	1326290	9670	Der reichlich fliessende Alkohol mag seinen Ausbruch befeuert haben,
1326300	1329530	3230	doch die Missstände sind real.
1329640	1331090	1450	Ein anderer Dorfchef
1331220	1333890	2670	weist uns auf die grösste Sorge der Gemeinschaft hin.
1334050	1340570	6520	Wir haben ein Problem mit dem Wasser.
1340720	1346130	5410	Man kann im Leben auf vieles verzichten,
1346340	1350460	4120	aber ohne sauberes Wasser hat man ein Problem.
1350550	1358540	7990	Um unsere Wasserversorgung kümmert sich niemand.
1358710	1361300	2590	Die Regierung weiss von diesem Missstand.
1361450	1368740	7290	Die Indianerbehörde weiss es. Alle sagen, wir sollen uns gedulden.
1368940	1375820	6880	Aber 3 Jahre lang ist nichts passiert. Das ist traurig.
1375900	1379460	3560	Der Mann führt uns zur einzigen Wasserpumpe des Dorfes.
1379590	1383020	3430	Sie muss 180 Familien versorgen.
1383220	1385420	2200	Wegen Überlastung steigt sie dauernd aus.
1385650	1387540	1890	Die Menschen müssen dreckiges Wasser trinken.
1387720	1391900	4180	Vanessa scheint über all dem irgendwie zu schweben -
1391980	1394500	2520	ihrer eigenen Zukunft entgegen.
1394600	1401180	6580	Verschiedene Stämme besetzen dieses Land zusammen
1401340	1403540	2200	und leben hier weitgehend friedlich.
1403780	1410580	6800	Und am Tag der Indigenen wird um die Wette getanzt.
1410730	1418820	8090	Auch der vorher so wütende Häuptling macht sich locker.
1418980	1427140	8160	Vanessa Monteiro geniesst mit Nichte Bia den Abend.
1427290	1430940	3650	Als plötzlich Schwester Bruna aus der Nacht auftaucht.
1431120	1435100	3980	Sie hat bis jetzt am Fischmarkt gearbeitet
1435180	1440420	5240	und ist froh, ihre Töchter wiederzusehen.
1440660	1446900	6240	Oh das war ein harter Tag. Ich bin müde.
1447100	1449660	2560	Ich habe alles für morgen vorbereitet.
1449770	1456860	7090	Morgen ist ein neuer harter Tag - und ein neuer harter Kampf.
1457020	1463180	6160	Ein Kampf dafür, dass es die nächste Monteiro-Generation
1463300	1465580	2280	einmal besser haben wird.
1466730	1470260	3530	Robrik WM: In der Schweiz beginnt Ottmar Hitzfeld
1470450	1472940	2490	mit dem taktischen Feintuning für Brasilien -
1473170	1475140	1970	beim 2. Testspiel vor der Abreise nach Brasilien
1475330	1477500	2170	trifft die Schweizer Fussballnationalmannschaft
1477580	1479980	2400	im Moment in Luzern auf Peru.
1480130	1483340	3210	Zurzeit steht es 1:0 für die Schweiz.
1483450	1487020	3570	Lange mussten die Schweizer warten -
1494690	1496500	1810	Es steht 2:0, Shaqiri traf diesem zweiten Tor.
1503820	1506260	2440	Lichtsteiner schiesst nach einer Flanke von Rodriguez das 1:0.
1507720	1511260	3540	Das erste Spiel an der WM bestreiten die Schweizer dann am 15. Juni.
1512130	1514380	2250	Eine Volksinitiative will Sexualkunde im Kindergarten verbieten.
1514520	1516380	1860	"Gleich nach ""Meteo"" geht der ""Club"" der Frage nach,"
1516510	1519500	2990	ob Sexualerziehung den Kindern nützt oder schadet.
1519620	1522380	2760	Danke fürs Zuschauen und einen schönen Abend.
1522570	1526180	3610	SWISS TXT / UT-Zürich Daniel McMinn, Andri Rauch, Dana Widmer