start	end	duration	text
1327700	1330550	2850	Man muss mit dem und nicht gegen das Meer leben, sagen die Fischer.
1332080	1334270	2190	Eine Abendmeldung: bei den Swiss Music Awards
1334400	1336790	2390	im Zürcher Hallenstadion erhält Bligg für seinen Song
1336930	1339910	2980	"""Mundart"" die Auszeichnung Bester Hit National."
1340120	1342710	2590	Die Veranstaltung dauert noch an. Weitere Meldungen des Tages:
1345780	1348230	2450	Die Vorbereitungs- und Ausschaffungshaft von Asylsuchenden
1348480	1352510	4030	in der Schweiz wird von heute 18 auf neu maximal 7 1/2 Monate verkürzt.
1352600	1354990	2390	Das hat der Bundesrat beschlossen.
1355120	1357270	2150	Dieser Entscheid wurde nötig in Folge
1357390	1361330	3940	der sog. Dublin-III-Verordnung der EU.
1361470	1365370	3900	Der türkische Ministerpräsident Recep Tayyip Erdogan hat angedroht,
1365470	1368650	3180	Facebook und YouTube in der Türkei sperren zu lassen.
1368750	1371250	2500	Erdogan sieht sich zur Zeit fast täglich mit
1371410	1374530	3120	belastendem Material konfrontiert, das über Facebook oder YouTube
1374640	1378100	3460	verbreitet wird.
1378350	1381580	3230	Die Europäische Volkspartei hat in Dublin Jean-Claude Juncker
1381670	1385380	3710	zum Spitzenkandidat für die Europawahl Ende Mai gewählt.
1385470	1387900	2430	Das EU-Urgestein setzt sich damit gegen
1388030	1390380	2350	den Franzosen Michel Barnier durch.
1390520	1396100	5580	Jean-Claude Junker kündigt an, an die Spitze der EU-Kommission zu kommen.
1400270	1402980	2710	Und nun wollen wir sie für einen Ausflug nach Lausanne gewinnen.
1403160	1406140	2980	Das Foto-Museum Elysee zeigt bis zum 11. Mai Bilder von Philippe Halsman.
1406320	1408820	2500	Der Starfotograf hat nach dem 2. Weltkrieg praktisch alle
1408930	1411220	2290	mit Rang und Namen abgelichtet:
1411390	1414100	2710	Von Albert Einstein bis zu Marilyn Monroe.
1414180	1417620	3440	Wobei ablichten schon fast despek- tierlich ist für Halsmans Bilder:
1417830	1420220	2390	Halsmans Fotos sind oft Bildergeschichten
1420410	1423980	3570	und äusserst witzige dazu. Erwin Schmid zeigt uns mehr:
1426260	1428460	2200	Die Fotografien gehen um die Welt:
1428560	1430540	1980	Albert Einstein 1947,
1430640	1433420	2780	Audrey Hepburn 1955,
1433520	1436140	2620	Mohammed Ali 1963
1436270	1440540	4270	und Angelica Huston 1968.
1440760	1443260	2500	Die Echtheit und die Ausdrucksstärke seiner Portraits
1443460	1445740	2280	machen Philippe Halsman zum gefragtesten Fotografen
1445960	1449060	3100	im Amerika der Nachkriegszeit.
1449160	1451380	2220	Halsman, hier in einem Selbstportrait,
1451590	1455780	4190	kommt 1940 nach New York.
1455980	1458260	2280	Von seinem Aufstieg in die High Society
1458380	1460620	2240	zeugen über 100 Titelblätter
1460840	1468180	7340	des damals populärsten People-Magazins der USA.
1468270	1470860	2590	Man spürt förmlich die Kraft des Magazins.
1470950	1472860	1910	Und das Aufkommen des Fernsehens.
1473040	1476100	3060	Es verlangt vom Fotografen mehr Kreativität ab.
1476190	1478580	2390	Halsmann erzählt Geschichten.
1478740	1481740	3000	Um die verschiedenen Facetten einer Persönlichkeit festzuhalten,
1481900	1484700	2800	arbeitet er nicht mehr mit einzelnen Aufnahmen.
1484800	1490860	6060	Er arbeitet mit ganzen Foto-Serien.
1491080	1493380	2300	Halsmans Talent, aber auch sein Humor,
1493570	1498020	4450	machen ihn zum wichtigsten Star-Fotografen seiner Zeit.
1498200	1503020	4820	Marilyn Monroe nutzt sein Können, um ihre eigene Karriere voranzutreiben.
1503280	1505620	2340	Eine seiner Serien mit ihr zeigt scherzhaft,
1505880	1511580	5700	wie berechnend das Jahrhundertmodel bei Jobinterviews vorging.
1511700	1515140	3440	Legendär ist auch die Zusammenarbeit mit Salvador Dali.
1515210	1518260	3050	Halsman bringt den Surrealismus in die Fotografie,
1518470	1523980	5510	lange vor der Erfindung digitaler Bildbearbeitung.
1524200	1527580	3380	Mein Vater zählte auf 3.
1527780	1530900	3120	Dann warfen 4 Assistenten einen Eimer voll Wasser
1531000	1534140	3140	und 3 Katzen ins Bild.
1534320	1537540	3220	Und als mein Vater 4 sagte, sprang Dali auf.
1537690	1541220	3530	Natürlich ging dauernd etwas schief, wenn 5 Personen gleichzeitig werfen
1541330	1545860	4530	und springen müssen.
1546030	1550620	4590	Die Archivaufnahmen zeigen: 26 Versuche brauchte es,
1550780	1554380	3600	bis der Starfotograf die perfekte Aufnahme schliesslich gefunden hat.
1557460	1560500	3040	Die Schweiz lockert die Regeln für den Waffenexport in Länder,
1560620	1562460	1840	die Menschenrechte verletzten.
1562650	1564460	1810	"Dies gibt zu reden, jetzt gleich in der ""Arena""."
1564550	1566340	1790	Schönes Wochenende und auf Wiedersehen.
1566460	1569180	2720	SWISS TXT / UT-Redaktion Zürich Eva Graber, Evelyne Iyer, Mirela Muminovic
1569200	1570740	1540	.